id,text,label
115,"Tempat indah yang tesembunyi berikutnyo yang punyo kadar oksigen terbaek adalah pulau Gili Ilyang yang tempatnyo diujung pulau maduro. Mpuklah tepisah, tempat ini merupoke bagian dari Pulau Maduro dan secaro administratif masok ke dalam Kecamatan Dungkek, Kabupaten Sumenep. Dikotep dari Indonesia.go.id, Gili Iyang merupoke tempat dengan kadar oksigen tebaek Indonesia dan terbek kedua di dunio abes Laut Mati, Yordania. Mako dak salah amen pulau ini disebot denganPulau Oksigen. Men uji bahaso disano gili artinyo pulau. Gili Iyang punyo luas sebesak 9,15 km2 dihuni samo 7.832 uwong yang nempati duo dusun, yaitu Bancamara dan Banraas. Di taon 2006, Lembaga Penelitian Antariksa Nasional (LAPAN) ngelakuke penelitian samo kualitas udara di pulau ini. Dari 17 titik yang diuji, Lapan nyebitke kadar oksigen Gili Iyang sebesak 20,9 persen. Artinyo, dalem volume 1 liter udaro bebas tekandung 0,209 liter oksigen. ",argumentative
94,"Banyak yang ngomong ujinyo makanan seafeed tuh mengandung kolesterol tinggi. Dan untuk uwong yang punyo penyakit kolesterol di saranke bahkan dilarang buat makan olahan seafood. Tapi sebenernyo jangan kelewat takut makan seafood karno beberapo seafood amen dimasak dengen bener, dan dikonsusmi secukupnyo bae sebenernyo seafood masih boleh dimakan samo uwong yang punyo penyakit kolestrol. Contohnyo Kerang, Kerang merupoke makanan laut yang dak pulo tinggi kolestrolnyo. Dan jugo kolestrol yang tekandung dinkerang dak biso dengan gampang diserap samo tubuh kito, jadi bakal dikeluarke samo tai. Tapi zat lain yang tekandung dikerang bagus buat tubuh kito mecak kalaium, fosfor, zat besi, Vitamin B12 kandungan yang bagus buat pertumbuhan tumang samo saraf kito, asal jangan belebih bae makannyo. ",argumentative
971,"Emir budak disabilitas yang mampu nyiptake robot sederhano cuma dengan batuan pelatih lewat daring. Namo lengkapnyo Ahmad Emirsyach Junaedi, umurnyo 11 tahun. Emir memang telahir dengan gangguan denger, tapi emir memang lah senng dan ngegeluti ilmo robotik dari dio umur 8 taun. Dari kelas duo SD emir memang sudah nunjuke ketertarikannyo samo dunio robot. Waktu itu emir seneng ngerancang mainan kubus, trus tuh dia seneng ngerakit lego dijadikenyo robot. Sejak itu uwong tuo emir beinisiatip nyarike guru buat ngebimbing Emir untuk nekuni hobi robotiknyo. Berhunubung lagi ado pandemi corona, susah buat cari tempat kursus yang buka offline. Akhernyo Emir dapet pelatih lewat daring, meski lewat daring bae ternyato emir mampu bikin beberapo robot sederhano mecak kincir dengan oenggerak dinamo, samo beberapo robkt kendaraan yang meluncor. ",narrative
1022,"Pernah denger trypophobia? itu merupoke pobia atau ganguan kecemasan terhadap bentuk lubang lubang kecik yang banyak. Penderito trypophobia biasonyo bakal ngeraso cemas, mual bahkan ketakutan yang dka biso dikendalike amen njingok bentuk lobang lobang banyak mecak sarang lebah, bekas komed9o dan laen sebagainyo. Untuk penyebaba ngapo wong biso keno trypophobia masih belom tau, tapi diperkirake kerno pola pikir si penderitanyo yang akan ngingat bentuk lubang lubang keciknitu hal yang menjijikan tau hal yang bikin takut. Untuk nyembuhke kecemasan ini sebnernyo sederhana bae, tapi memang buatuh niat samo komitmen dan jugo dukungan dari uwong uwong tedeket disekitar. Caronyo biso dengan terapi pola pikir yang biso ngubah pandangan wong yang trypophobia ini biar dak ngeraso takut lagi.",descriptive
1091,"Dulu sebagai syarat lulus kukiah aku pernah ngejalani praktek ngajar disekolah. Aku nemuke budka yang sellau tejingok sedih terus disekolah, padahal budak ini temasuk budak yang pinter disekolahnyo. Bahkan dak pernah ado masalah samo sekali pas disekolah. Akhernyo aku ceritoke ini ke guru BP disekolah aku. Setelah dicari tau ternyato budak ini punyo masalah dirumah. Dio lunyo bapak yang sering marah marah, dio cerito amen bapaknyo ini nuntut dio untuk jadi anak yang baik dan sempurno. Seriap dio ngelakuke kesalahn sekecik apopun dio pasti langsung digebuk samo bapaknyo. Keajdian ini ternyato sering dio alami daei dio masih kecik umur limo tahun. Budak ini emmang dak ngatek umak, kerno umaknyo lah lamo mati. Jadi dio tinggal beduo abe samo bapaknyo. Akhernyo pihak sekolah lewat guru BP nak ngedatengi bapaknyo budak ini dnegan maksud ngasih teguran dan ngasih informasi ke bapaknyo amen apo yang dilakuke bapak itu selamo ini melanggar hukum negaro kito. Tapi budak ini mohon samo guru BP untuk dak ngomong ke bapaknyo kerno dio takuf bapaknyo gek marah besak ke dio.",narrative
889,"Tau dak kamu ternyato olahraga rutin buakn bae ngejago kesehatan tubuh kito, melaenke mentalnkito jugo biso sehat amen kito rajin dan rutin olahraga. Disaat kito beolahraga, badan kito bakal mmeproduksi zat serotonin samo zat endorfin. Yang mano zat ini bakal bikin suasano hatinkito jadi seneng. Alhasil stres yang kito rasoke pun biso hilang untuk sementaro waktu. Makonyo banyak saran beberapo uwong untuk ngehadepi stress disaranke untuk kito beolahrago yang kito senengi.  Selaen itu jugo manfaat dari olahraga yang bikin kebugaran badan jadi baik bahkan biso punyo bonus badan ideal jugo biso bikin uwong ngeraso percayo diri dan mentalnyo jadi sehat. Nah ayo muali sekarang rutin beolahrago untuk kesehatan mental samo jasmani kito. ",persuasive
1432,"Nyium bau amis seringkalo nimbulke perasaan jijik yang dialami hamper samo sebagian uwong. Bau amis seringkalo dikaetke dengan bau yang busuk dna bau yang dak sedap, yang ngebikin wong yang nyiuk bau ini ngeraso mual dan ngeraso nak muntah. Walaupun mungkin dak segalo uwong ngerasoke ini, tapi kemungkinan hamper sebagian besak uwong pasti jijik dan nak muntah amen tecium bau amis.Perasan jijik ini mungkin disebabke samo sinyal yang dikirim ke otak oleh indra pembau kito inis etelah mencium bau bau yang kotor dan menjijikan. Bahkan dibudayo masyarakat kito jugo nganggep amen bau amis adalah hal yang menjijikan dan biso bikin mual yang akhernyo mjntah.",descriptive
1359,"Banjir sekarang banyak nian ngelando dihanpir banyak temlat di Indonesia. Padahal curah hujan belom terllau tinggi tapi banyak tempat di Indonesia yang sering keno banjir. Banjir yang tejadi sebenernyo nandoke amen masyarakat sudha dak peduli samo lingkungan. Sejatinyo air hujan itu jatuh ke tanah buat diserap lagi ke tanah dan jatuh ke sungai trus dialorke lagi ke laut. Tapi masalahnyo kali kali banyak tesumbat oleh sampah sampah wargo, belom lagi tanah serapan yang bekurang kerno wargo yang banyak ngedirike bangunan tanpo njingok ado serapan atau idak dibangunanyo. Nah ayo jangan lah buang sampah sembarangan, dan setiap bangun tempat kalo biso dipikirke untuk serapan aernyo. Selain itu banyak nanam pohon kerno pohon biso nyerap air dengan cepat lewat akar akarnyo. ",persuasive
1295,"Banyak netijen yang sekarang ini demi jadi viral akhernyo bikin konten konten palsu. Menurut aku pribadi, setelah aku punyo akun tiktok dan jingok apo bae hang ado didalam aplikasi itu, ternyato banyak nian akun yang komtenyo dak sopan, curhat tentang keburukan wong alen bahkan akher akher ini ado komedi komedi yang sebenrernyo dak luci dibuat konten. Sebegitunyo nian wong pengen jadi terkenal, sampek akher akher ini ado yang bikin konten mandi lumpur pari wong tuo yang tejingok lah kedinginan. Mereka ngelakuke itu cuma demi duit. Astagfirullah, menurut aku wong jaman seakrang ni dak biso ngebedakew mano yang boleh dilakuke samo yang dak boleh dilakuke. Dan mirisnyo itu dilakuke samo generasi penerus bangso kito yang mudo mudo. Cuma memang pemerintah masih belom terllau ketat untuk aturan pemakaian sosial media mak ini",argumentative
1105,"Semenjak diberlakukenyo wajib suntik vaksin buat wargo indonesia oleh pemerintah.m, banyak kito temuke di beberapo wilayah kejadian wargo takut divaksin bukan kerno takut smao vaksinyo melaenke takut samo jarum suntiknyo. Tapi hal itu dak biso dijadike alasan untuk wargo idak vaksin covid 19. Banyak dari mereka harus tetep vaksin dan ngehadepi pobia jarum suntik. Nah ngapo sih masih banyak wong dewasa yang takut samo jarum suntik?  Menurut ahli psikologi sebenenryo memnag dak biso dipastike ngapo wong takut jarum suntik, tapi diperkiroke mereka punyo pikiran belebihan samo sakitnyo jarum suntik ketiko nembus ke kulit. PIkiran yang belebihan ini yang akhirnyo nimbulke phobia ke uwong uwong, selaen itu biso jugo beberapo ngalami trauma ps maso anak anaknyo dengan jarum suntik. Yang apsti pengalaman yang dak ngenake samo jarum suntik yang akhirnyo bikin wong takut pas dimaso dewasanyo.",argumentative
1160,"Dulu pas kuliah aku kan ngekos dideket kampus. Kosan aku memang galak diomongke horor samo kawan kawan aku yang pernah mampir, memang bangunan lamo trus tuh kamarnyo ado 25 kamar. Kamar nyo tuh teisi galo memang, tapi amen lagi liburan sabtu minggu banyak kamar yang kosong kerno banyak yang balek ke rumahnyo masing masing. Tapi mecak mahasiswa yang dari luar pulau kan dak balek. Jadi masih adolah beberapo yang nempati kamar, Nah pernah pas malem taun baru aku kebetulan kagi ngerjoke skripsi jadi memang dka kepikiran buat jalan jalan. Dari pagi nyampe malem jam 7 aku tuh dikamar bae ngegarap skripsi. Pas jam 7 malam aku keluar nak mandi, kaget aku lorong lorong dikosan aku gelep nian. Ternyato ngatek uwong samo sekali kecuali aku dewekan. Aku nak mandi laku takut, akhernyo aku telpon kawan aku yang laen retinyo mereka lagi jalan samo cowoknyo. Memang nasib jomblo mak ini, akhernyo aku dka jd mansi trus pegi teduk bae dikamar trus ku kunci.  ",narrative
833,"Olahraga buat betino sangat penting bukan cuma ngejagonkesehatan tetapi untuk ngejagonpenampilan biar tejingok fit dan bugar. Nah permasalahan betino biasonyo di kulit yang kendor apolagi sehabis ngelaherke. Nah untuk ngebantu kulit biar dak kendur kito harus banyak olahrago ngangkat beban, misalnyo nak ngencengke kulit tangan biso olahrago ngangkat dumbell. Selaen mudah dilakuke dan lebih hemat, kareno kamu dak perlu pegi ke tempat pusat kebugaran. Adopun banyak variasi caro make dumbell, diantaranyo overhead press. Caro ngelakukeno cukup bediri tegak sambil keduo tangan megang dumbell dengan berat yang samo,  renganggke kaki selebar bahu sambil angat tangan kepucuk lurus trus turun kebawah, dilakuke beulang ulang.",descriptive
1272,"Beli lipstik wardah ini kerno disaranke smao tasya farasya. Dijelaske pulo amen lipstik wardah ini tebuat dari bahan bahan yang halal pastinyo. Warno warnonyang tesedio jugo banyak nian, bagus bagus memang. Lipstiknyo jugo ado banyak amcem tipe ado yang glossy dna ado jugo yang mate, biso kito sesuaike samo kebutuhan makeup kito. Lisptik wardah idak tebuat daei bahan bebahayo, lipstik wardah jugo dak bikin bibir kering. Aku cocok nian amke lipstik ini, sampe sering beli dan sudha banyak shade warno yang aku punyo. Kemasannyo jugo dak terlalu besak ajdi biso amsuknkedalam tas yang ekcik sekalipun. Selain itu bentuk kemasan jugo trendy buka mecka lipstik jadul.",descriptive
844,"Banyaka macam kegiatan ekskul disekolah yang biso kito meloki. Mulai dari ekskul olahrago, seni, pecinta alam dan hobi laennyo. Nah dulu aku pernah melok ekskul olahrago basket disekolah aku, aku bukan uwong yang biso maen basket atau punyo keahlian di basket. Aku melok ekskul itu kerno ado cowok yang aku incer dari awal maso orientasi siswa pas di SMA. Aku melok ekskul basket kareno aku tau dio masuk ekskul basket, jadi biar aku sering ketemu kareno kebetulan aku memang dak sekelas samo dio. Tapi keputusan aku melok ekskul basket keputusan yang salah, kareno bukannyo jd pacak maen basket tapi malah aku sering diketawoi samo kawan dan senior senior yang ado di ekskul basket. Kareno aku dak biso nyeimbangi keahlian murid yang laen, pelatih basket aku sampek mintak langsung ke aku secaro prinadi but melok ekskul yang kiro kiro sesuai samo hobi dna keahlian aku. Intinyo menurut aku walaupun ekskul itu idka bepengaruh banyak ke nilai sekolah tapi setidaknyo kito memang harus biso milih ekskul sesuai smao minat dan kemampuan kito. Apo yang aku buat dulu itu perbuatan yang dak boelh diconyoh kareno sembarangan nian malah mempermaluke diri dewek menurut aku. Tapi dak papo itulah yang penting ado kenang kennagannyo, walau kenangan yang bikin malu. ",argumentative
892,"Nonton pertandingan sepak bola langsung di stadion memang seru smao bikin tegang. Apolagi amen yang maen merupoke tim keseenengan kito, bakal makin seru dan melok tegang. Suasano distadion memnagvajdi rame samo suatonterikan penonton, yel yel yang dinyanyike penonton, tepok tangan dan teriakan bahagia amen ado salah dikok yang biso nyetak gol. Bahkan kito ngerasoke ketegangan langsung amen tim paporit kito lagi diserang abis abisan, apolagi sampe kebobolan kecewa nian rasonyo. Adrenalin kito melok tepicu dan emosi kito jugo turun naik meloki perjalanan pertandingannyo. Perasaan seneng, marah, gugup, kecewa kito rasoke nian di stadion itu. Apolagi momen tendangan pinalti jantung kito bedebar mecak naem roolcoaster bae . ",descriptive
406,"Puaso pas bulan Romadon dilakuke amper samo seluruh umat muslim di seluruh dunio. Kami bepuaso selamo 30 hari berturut -turut. Puaso artinyo bukan dak makn bae tapi jugo dak minum samo dak bebuat jahat selamo kami puaso. Dan ternyato ado fakta menyehatke dibalik kegiatan puaso ini. Ternyato puaso ini biso bikin sembuh uwong yang punyo masalah lambung alias magh. Amen kamu punyo magh malah disaranke melok puaso, kareno terapi puaso yang dilakuke umat Islam inj bagus buat proses penyembuhan penyakit asam lambung, GERD ataupun magh. Pernyataan ini memang lah banyak diomongke samo beberapo dokter, dan lah terbukti memang biso nyembuhke penyakit GERD, Asam lambung samo Magh .",expository
956,"Perbedaan kamera iphone samo kamera android kiro kiro mano yang lebih bagus? Nah untuk android, prosesor yang dipake untuk kamera android bukan bikinan android dewek jadinyo android cumak terbatas untuk ngembangke fitur kameranyo. Sedangkan untuk Iphone, prosesornyo merupoke hasil buatan apple dewek, jadi setiap tahunnyo apple selalu ngasih fitur fitur baru buat untuk kamera buat pemakai produk apple. Selain  itu perbedaan laennyo ado di sensor kamera. Sensor kamera perangkat iphone lebih besak dari pado sesnsor kamera di hp android. Sehinggo objek poto yang diambek make kamera iphone samo android jelas beda hasilnyo. Dan hasil jepretan make iphone samo make android jelas lebih bagus yang makek iphone",expository
382,"Amen uwong nak mintak cerai pasti ado alesan yang bikin mintak cerai. Biasonyo pasti kareno ado kebencian yang mendalam samo pasangannyo akhernyo dak tebendung lagi, terjadilah perceraian. Tapi cerito perceraian pasien aku ini agak bedo. Dio Istri yang baek nian, dan sayang nian samo lakinyo. Tapi aku jugo kaget ternyato lakinyo mintak cerai dari dio. Dan preoses perceraiannyo lah selesai, tapi betino inj masih punyo raso sakit diatinyo, makonyo dio mutuske ke psikiater. Menurut cerito dio, Suaminyo jugo ternyato sayang nian samo dio, cumak suaminyo ternyato diponis dokter punyo penyakit Bipolar. Penderito penyakit ini biasonyo punyo emosi yang gampang berubah-rubah. Betino ini sebenernyo idka masalah samo penyakit lakinyo ini, tapi lakinyo yang dak kuat harus njingok bininyo ngadepi emosi si lakinyo ini. Si laki mintak ke bininyo untuk cerai bae dan nyuruh bininyo nyari lanang laen biar macak bahagia. Tapi masalahnyo bininyo dak biso ninggalke lakinyo. Tapi mecak dilema si bininyo ini tepakso harus setuju samo keputusan lakinyo ini, walau naympe sekarang bininyo jugo jadi melok tepukul samo perceraian ini.",descriptive
1326,"Nah sebagaimano kito tau amen sumber energi yang kito biaso pake mecak minyak bumi, oil dan gas, batu bara dan laen sebagainyo itu perlahan memang ketersediaanyo bekurang dna jugo memnag dikurangi pemakaiannyo kerno nimbulke dampak negatip buat lingkungan. Nah ternyato ado energi terbaru yang sebenrnyo biso dipake dalam jangko waktu yang sangat lamo dan idka nimbulke dampak negatip buat lingkungan kito. Contohnyo Energi Matahari yang sudah mulai dipake banyak uwong untuk ngasilke listrik. Bukn cuma di pake buat keperluan industri abe tapi ado beberapo rumah rumah pribadi yang sudah manfaatke energi sinar matahari ini sebagai pembangkit listrik di rumah rumah pribadi. ",expository
549,"siapo yang pernah belibur sampek ke papua. Atau mungkin ado dari kamu yang punyo rencano belibur ke papua. Papua memnag tekenal dengan pemandangan yang luar biaao indahnyo. Selaen pemandangannyo, suku suku di papua yang masih belom keno pengaruh modern memang jadi dayo tarik dewek but wisatawan lokal maupun manco negaro. Nah disano suku yang paling terkenal adolah suku asmat, suku ini mengingatke kito dengan suku suku dijaman prasejarah. Nah buat kamu yang memang tertarik untuk belibur ke papua, kamu jangan lupo untuk baw aoleh oleh senjatontradisional suku asmat. Senjato tradisional suku asmat ini memang unik nian tebuat daei batu dan tulang belilang hewan. Cocok memang untuk dijadike sopenir olehboleh kareno keunikanyo. ",persuasive
715,"Akher akher ini banyak wong yang gampang nian ngehino fisik uwong lain. Walau idak secaro langsung tapi banyak yang galak komen di akun akun media sosial pribadi uwong lain. Ngejelek jeleke bentuk tubuh, bahkan ngehino bentuk muko lewat komen komen jugo nyakitke. Menurut aku justru kareno ado komen di setiap sosial media makonyo wong lebih banyak yang berani ngehino dengan kato kato buruk. Menghino fisik uwong lain kayaknyo idak serto merto bikin kamu bahagia ataupu meraso puas. Yang ado malah bikin wong yang kalian hino biso jadi stress atau marah. Menurut aku mungkin memang lebih baek komen di ig atu di sosial media laennyo di matike bae.",argumentative
21,"Soto tu makanan tradisional asli dari Indonesia. Banyak nian macam macam soto yang ado di indonesia ini. Soto rato-rato ado kuahnyo, dan dimasak makek rempah rempah. Banyak jenis soto yang ado di indonesia ni. Di palembang kami punyo namonyo MiSo ( Mie Soto ). Mie soto palembang isiannyo ado mie kuning, tempe goreng yg dipotong, ayam suwir, daun bawang, daun sledri, bawang goreng, yang disiram kuah soto. Idak lupo dikasih peresan jeruk nipis, kecap manis, samo sambel cabe. mungkin beda lagi samo soto asal lamongan yang isiannyo bihun, tauge, kobis, ayam suwir, daun bawang, daun sledri, koya trus disiram kuah soto.",narrative
624,"Amen kito ngedenger berita kawan, keluargo atau uwong diaekitar kito yang tekeno kanker pastilah kito jugo melok ngerasoke tepukul. Nah ini pernah kejadian samo aku, kawan deket aku dikosan yang sekamar samo aku divonis keno kanker servik. Kebetulan pulo pas itu aku yang nganter dio cek, jadi aku denger langsung dari keterangan dokter. Aku jingok dio langsung kaget dna masih dak percayo amen dio ngidap penyakit kanker servik. Sebagai kawannyo aku melok sedih ado perasaan kaget jugo, tapi aku tau kawan aku ini butuh dukungan mental bukan malah melok melok dio untuk dak percayo omongan dokter. Memang penyakit itu asalnyo dari pikiran, tapi untuk penyakit kanker menurut aku semakin ceept kedeteksi dna cepet pulo diambek tindakan untuk sel kankernyo mako peluang untuk sembuhnyo jugo besak. Jadi sebagai kawan yang aku lakuke saat itu ngajak dio ke dokter lain yang khusus specialis kanker , setelah itu ngelakuke cek up lewat scrinning untuk tahu lebih pasti. Sebagai kawan kito memang harus ngebantu dan ngedukung kawan kito yang menderito kanker.",argumentative
957,"Kamera dimasa sekarang memang banyak dibutuhke, walaupun hargo kamera banyak yang mahal tapi tetep bae uwong banyak yang beli kamera untuk keperluan pribadi mislanyo untuk ngedokumentasike momen di keluargo. Nah buat yang punyo kamera untuk dipake dewek, kadang nemuke masalah di kamera tesebut mecak lensa bejamur, eror di shutternyo, kesalahan di softwarenyo, di baterainyo, dan laen laen sebagainyo. Nah amen kamu nemuke beberapo masalah ini jangan buru buru beneri kamera kamu ke jasa serpis. Kerno ado beberapo masalah yang sebenrnyo biso dibeneri dewek dirumah. Mecak kerusakan di shutter block, pastike dulu lensa kamera bersih. Amen adonkotoran coba bersihke dulu permukaan lensa samo sikat khusus lensa samo compreesed air clean. Nah biasoyo trik ini biso mbakeke hasil jepretan jadi terang lagi.",expository
101,"Coban rondo adalah aer terjun yang ado didaerah batu malang. Dulu pa jaman kuliah di malang, aku sering maen kesano amen ado libur kuliah. Cumak untuk represing, ngirup udaro seger sekalian maen aer. Dari namonyo coban rondo, aer terjun ini punyo legenda yang becerito tentang penganten baru yang namonyo Dewi Anjarwati dari Gunung Kawi samo lakinyo Raden Baron Kisuma dari Gunung Anjasmoro. Setelah 36 hari pernikahan mereka si Dewi Anjarwati ngajak lakinyo pegi ke gunung anjasmaoro. Di tengah jalan mereka ketemu samo alnang yang namonyo Joko Lelono. Joko Lelono yang tepikt samo kecantikan Dewi Anjarwati laju dio nak ngerebut Raden Anjarwati dari Raden Baron. Raden Baron dak terimo laju belagolah mereka, Si Dewi Anjarwati disuruh nyumput di deket aer terjun. Sampe 3 hari 3 malam akhernyo mereko selesi bekelahi, tapi ngatek yang menang melainke mati duo duonya. Nah semnejak itu Dewi Anjarwati menjadi rando dna masih nunggu suaminyo di aer terjun itu. Akhernyo dikasih namolah coban rondo aer terjunnyo. ",narrative
803,"Jaman kecikan aku dulu sering maen bola kaki samo kawan kawan aku di lapangan deket rumah. Bola kaki emang olahraga yang paling kami sennegi akreno seru dimaenke. Kami maen bola kaki dulu idak make aturan yang penteng ado duo tim samo duo penjago gawang. Kami bemaen kadang dak nyampe 11 uwong per tim kareno memang lapangannyo dak pulo besak. Biasonyo kami maen tiap hari amen lah sore sore. Agek menjelang maghrib kami berenti maen kareno wkatunyo ke mushola. Biasonyo amen lah ngumpul sore sore itu masih smabil nungguke kawan kami yang laen yang belom datang kami bejajan banyak jajanan budak kecik dipinggir lapangn itu. Mecak pentol, gulali, sempol ayam, pempek, somay dan laen laen.",descriptive
121,"Sikok lagi tempat wisato terkenal di indonesia yaitu, Danau toba. Danau toba jugo banyak peminatnyo dari toris dalem negri maupun manconegaro. Ado legenda dibalek tejadinyo danau toba . Jadi dulu ado bujang yang namonyo Toba, Dio hobi mancing amen ado waktu luang. Pas suatu ari dio pegi mancing, tibo-tibo dio dapet ikan emas cantik nian, sakeng cantek yo ikan itu idak dibunuh samo toba, tapi dipeliharo. Suatu saat pas toba pegi ke ladang, ikan cantek itu berubah jadi betino cantek nian, dia masak buat toba dan beberes rumah pulo. Sampe pas toba balek dari ladang, kaget toba ngapo ado makanan dirumha dio. siapo yang masak? sampe akhernyo toba ngintip cuma kareno penasaran, akhernyo ketauanlah amen ternyato yag ngelakuke itu galo si ikan emas itu. akhernyo toba jatuh cinto samo ikan emas itu dan minta dio jadi bininyo. Setelah nikah mereka dinjuki anak lanang namonyo samosir. Bininyo toba minta tiba bejanji semarah apopun toba agek samo anaknyo, jangan sampe toba ngomong amen anak ini anak ikan. Akhernyo si samosir mulai agak besak dan mulai seneng maen. suatu saat smaosir disimuruh mamaknyo ngante rmakanan ke ladang buat si toba, tapi ditengah jalan samosir malah ketemu kawannyo trus maen dak kenal waktu. Toba yang nunggu diladang , marah besak samo samosiri. Ps samosir teinget amen dio harus nganterke makanan ke ladang, samosir langsung cepet-cepet pegi ke ladang. Dan teenyato pas nyampek ladnag dio jingok bapaknyo lah marah nian, akhernyo teucaplah "" Dasar, kau anak ikan"" laju tibo-tibo gempa trus samosir belari kerumah ngadu ke mamaknyo trus mamaknyo nyuruh samosir pegi ke gunung kareno agek tempat ini bakal tenggelam samo aer ujan. ",narrative
185,"Menurut aku amen nonton pilm horor yang diangkat dari kisah nyato lebih teraso ngerinyo dibanding pilm horor yang dibuat buat. Mungkin kareno memang bener-bener kejadian, jadinyo takut nian amen teulang dikito yang nonton. Sebenernyo epek dari nonton pilm horor tuh dak bagus, bisonyi aku jadi takut nak ke kamar mandi, takut amen jalan dewekan malem-malem. Pokoknyo laju jadi penakut, trus tedok dewekan jugo takut nian jadi malah teganggu jam tedok aku. Bahkan kadang tebawak ke mimpi. Tapi ado jugo uwong yang hobi nonton pilm horor justru kareno nyari adegan adegan yang bikin kaget, ujinyo buat uji jantung. Tapi amen aku dak berani kecuali ado kawan tedok pas abes nonton horor.",argumentative
86,"Wortel merupoke salah sikok sayuran yang paleng terkenal di dunio. Wortel sering dipake untuk madem-macem masakan mecak sop ayam atau salad. Wortel mengandung sekitar 88% air, 7% gulo, 1% protein, 1% serat, 1% abu, dan 0,2% lemak. Wortel kayo akan antioksidan, mineral, dan sejumlah nutrisi lainnyo yang baek untuk kesehatan tubuh. Sayuran wortel ini ternyato juga nikmat nian amen dibuat jadi jus. Manfaat jus wortel untuk kesehatan badan diantaranyo ngejago kesehatan mato, nyegah rabon senjo, nyegah penyakit kanker, dan ngilangke racun dalam badan. Selaen dibuat jadi jus, wortel jugo berguno  untuk obat tradisional, adopun manfaatnyo yaitu pacak ngobati demem yang diderito budak kecik, ngilangke nyeri haid, dan nyembuhke luko bakar.",expository
810,"Besepeda sekarang ini memang lah jadi gayo hidupnyo wargo di Indonesia. Olahraga yang sikok ini memang sangat disenengi samo berbagai umur, mulai dari anak-anak nyampek lansio. Idak tekecuali aku samo keluargo aku seneng besepeda. Biasonyo kami sekeluargo besepeda di acara "" Car free day "" setiap hari minggu. Kegiatan ini kami lakuke untuk ngisi hari libur kami, sekalian biso olahraga kareno 5 hari waktu kami dipake untuk sekolah, dan begawe. Kareno dak sempet beolahraga jadi kami manfaatke naik sepeda pas di acara ""car free day"". Kami biaosnyo bangun subuh untuk siap siap ke car free day, kami jugo nyiapke bekal makanan sehat untuk dimakan pas abes selesai besepeda. Kaminmemang dak jajan makanan kareno memang niat kami pengen sehat, jadi lebih milih bawa bekel dewek dari rumah. ",narrative
