id,text,label
5338,"Bilal bin Rabbah nyaeta salah saorang sahabat Nabi Muhammad SAW nu mimiti ngumandangkeun adzan. Anjeunna dilahirkeun di Mekkah, Hijaz, 43 taun sameh hijrah Nabi. Bapakna mangrupakeun budak Arab ti Bani Jumah. Ibuna ngagaduhan nami Hamamah, mantan putri Abyssina, salah sahiji karajaan di Afrika Timur Laut. Hamamah ditangkap pas peristiwa taun gajah, tuluy dijadikeun budak. Bilal bin Rabbah dilahirkeun jadi saorang budakUmayyah bin Khalaf. Anjeunna terkenal patuh jeung taat ka dununganna. Hiji waktu, anjeunna ningali dakwah Rasulullah, tuluy tertarik jang lebet Islam. Saprak lebet Islam, anjeunna disiksa ku dunungan nana. Teu lami, Abu Bakar As-Sidiq meuli anjeunna ka Umayyah bin Khalaf. Berkat eta anjeunna dibebaskeun tina perbudakan.",religion
4191,"Rumah Gadang sabagé tempat cicing babarengan, boga bekelna sorangan. Jumlah kamar gumantung kana jumlah awéwé nu hirup di aranjeunna. Unggal awéwé di clan anu nikah meunang kamar. Sedengkeun awéwé heubeul jeung barudak meunang tempat di kamar deukeut dapur. katresna rumaja meunang kamar dibagikeun di tungtung séjén. Sakabéh bagian tina Rumah Gadang téh kamar misah iwal kamar tidur. Jero dibagi kana tapering sarta spasi ditandaan ku kutub. Tihang-tiang manjang ti beungeut ka tukang jeung ti kénca ka katuhu. Kutub anu ngajajar ti hareup ka tukang nandaan bujur, sedengkeun kolom ti kénca ka katuhu nandaan spasi. Jumlah lanjar gumantung kana ukuran imah, bisa dua, tilu jeung opat. Kamar diwangun ku jumlah ganjil antara tilu jeung sabelas. Rumah Gadang biasana diwangun dina lahan milik kulawarga utama suku/marga sacara turun-temurun[2] sarta ngan ukur dipiboga jeung diwariskeun ti jeung ka awéwé dina éta marga.[3] Di buruan hareup Rumah Gadang biasana aya dua wangunan Rangkiang, dipaké pikeun neundeun béas. Imah Gadang di beulah katuhu jeung kenca gedongna miboga anjung (Basa Minang: anjuang) minangka tempat pameutingan pangantén atawa tempat penobatan kepala adat, ku lantaran kitu imah Gadang ogé disebut imah Baanjuang. Anjung di kelarasan Koto-Piliang ngagunakeun tongkat, sedengkeun dina kelarasan Bodi-Chaniago henteu ngagunakeun tongkat handapeunana. Hal ieu luyu jeung béda falsafah nu dianut ku dua golongan ieu, golongan kahiji nganut prinsip pamaréntahan hirarkis maké anjung nu maké tongkat, dina golongan kadua anjuang siga nu ngambang di awang-awang. Teu jauh ti komplek Rumah Gadang biasana diwangun surau rahayat anu fungsina minangka tempat ibadah, tempat atikan sarta ogé minangka tempat cicing lalaki dewasa ieu jalma anu can kawin.",culture & heritage
8810,"Waktu harita kuring jeung babaturan sakelas dititah squat jump ku guru olah raga di sakola kuring. Squat jump mangrupikeun latihan anu ringan pikeun kuring, kuring ogé sering ngalakukeun éta unggal isuk saatos hudang. Urang ngalakukeun babarengan jeung urang kudu kompak, sabab lamun urang teu ngahiji, ngitungna bakal dimimitian deui ti awal. Ieu oge katilu kalina urang ngamimitian ngitung ti awal deui kusabab babaturan kuring ngabodor, janten teu tiasa babarengan. Basa keur squat jump, babaturan kuring ujug-ujug humandeuar yén suku na keram teu bisa gerak, jadi urang eureun heula sakeudeung. Ku guru olahraga, babaturan kuring dibawa ka sisi lapang jeung dipariksa sukuna, bari arurang anu jagjag mah terus squat jump nepi ka rengse.",sports
5336,"Nabi Adam AS sareng Siti Hawa diturunkeun ka bumi dengan posisi tempat nu beda. Sakitu lilana Nabi Adam AS milarian Siti Hawa kaditu kadieu tapi teu kapendak. Tuluy Nabi Adam AS sujud taubat ka Gusti Allah SWT ngadoa supaya ditepangkeun deui sareng Siti Hawa. Tos opat puluh taun lamina nembe we ditepangkeun sareng Siti Hawa di Jabal Rohmah, tempat nu penuh ku kasih sayang. Tuluy Nabi Adam AS sareng Sti Hawa ngarumpuyuk deui tabat ka Gusti Allah SWT atas kasalahan nana. Gusti Allah nurunkeun sababaraha hewan ka bumi jang nyukupan kabutuhan Nabi Adam AS sareng Siti Hawa. Gusti Allah SWT oge nurunkeun 29 huruf hijaiyah nu jadi pedoman umat manusia dina neang elmu. Tuluy Nabi Adam AS sareng Siti Hawa ngajalani kahirupan seperti biasa dugi ka dikaruniaan katurunan.",religion
7432,"ASUS mangrupakeun salah sahiji pausahaan anu ngadamel alat-alat elektronik sapertos laptop jeung hape. Taun 2018 ASUS tos mulai ngaluarkeun hape jenis ROG anu mangrupakeu singketan ti Republic of Gaming. Sasuai jeung namina, hape ieu dijieun kanggo saha wae anu sapopoe na ulin gim. Komo lamun mineng ulin gim dina hape, ASUS ROG Phone gaduh batu batre anu langkung awet lantaran dibekelan ku batre anu kapasitasna 6000 mAh. Hape ieu oge dibekelan ku layar 165 Hz anu bakal ngajadikeun urang leuwih nyaman pas ningal layarna, komo pas ulin gim anu seeur warnana. Lain eta hungkul, hape ieu oge dilengkepan ku speaker anu badag di bagian hareup. ",technology
503,"Upacara adat oge aya di Kabupaten Kuningan nu ngaranna Babarit. Upacara Adat Babarit dilakukeun jang ngungkapkeun rasa sukur masarakat ka Allah SWT. Upacara ieu biasana dilaksanakeun pas bulan Suro ku masarakan Desa Sagarahiang. Upacara Adat Babarit dilaksanakeun di kabeh masarakat Desa Sagarahiang, boh nu tempat cicing di desa Sagaraahiang atawa oge di daerah nu deukeut jeung Desa Sagarahiang. Upacara Adat Babarit dimimitian ku doa babarengan tuluy dteraskeun ku meuncit domba. Hal ieu diyakinan masarakat nu sabudureun bisa nolak bala. Ngan domba nu dipeuncit teh kudu jenis domba kendit nu sacara kasat mata euweuh bedana jeung domba sejenna. Ngan domba kendit ieu mibogaan warna hideung jeung garis bodas nu muter dibagian beuteungna.",culture & heritage
7190,"Aceh kasohor ku tarian daerah na anu seeur. Aya Tari Saman, Tari Bungong Jeumpa, aya oge Tari Seudati. Sanajan duanana asalna sami ti Aceh, tari Saman jeung tari Seudati benten dina gerak dasar tari. Tari Saman dilaksanakeun dina posisi diuk. Sedengkeun tari Seudati dilaksanakeun dina posisi nangtung. Tari Seudati nyaeta tarian has Aceh anu kasohor di Indonesia jeung mancanagara. Tari ieu mawa tema jeung harti anu patali jeung tekad, sumanget sarta jiwa kapahlawanan hiji lalaki Aceh. Dina awal kamekaran tari ieu, baheula ngan ukur dijadikeun sarana nyebarkeun dakwah Islam anu dilaksanakeun di tanah rencong. Hal ieu tiasa dibuktikeun ku puisi dina tari Seudati anu nyaritakeun ngeunaan ajaran jeung nilai-nilai Islam.",culture & heritage
5394,"Ngangge jilbab janten salah sahiji kawajiban umat muslimah. Tapi, dina pelaksanaanna teu jarang jilbab teh kapangaruhan ku budaya luar. Dina Islam, jilbab teh kedah nutupan aurat, aurat didieu nyaeta ti ujung rabut dugika ujung kuku sampean, kecuali raray jeung telapak tangan. Zaman ayeuna mah seueur nu ngangge jilbab tapi teu nutupan dada jeung ngangge pakean nu ketat. Tah hal ieu teh kedah dilereskeun deui pamahaman na kana jilbab sabab sapatutna jilbab teh nutupan dada jeung nutupan lekuk tubuh. Pami ngangge keneh acuk ketat mah berarti kedah dipasihan deui pamahaman ngeunaan jilbab. Ku kituna, yuk ah urang perbaiki deui cara berjilbab urang, sasuaikeun eung ajaran Islam nu sahih.",religion
7076,"Kitab suci agama Hindu nyaeta Weda, buku ieu lumaku sapanjang umur. Dimimitian ti jaman manusa prasejarah nepi ka jaman modern. Weda ngandung katerangan ngeunaan Gusti sareng alam semesta anu saluyu sareng kamampuan pikiran manusa. Numutkeun Drs. I Wayan Midastra, dkk. dina buku Widya Dharma Hindu Religion for Middle School, Weda disebut Apourucyam. Sabab, kitab suci ieu lain disusun ku manusa biasa, tapi ditarima ku jalma anu suci. Weda asalna tina kecap vid anu hartina ""diajar uninga"". Upami diinterpretasi sacara umum, Vedas mangrupikeun kitab suci pikeun diajar sadayana, ti anu biasa dugi ka anu sesah diuningakeun. Kitab ieu gaduh opat samhita.",religion
2391,"Dodol mangrupikeun kadaharan anu dalit ku seueur urang Indonésia. Réa wewengkon di Indonésia malah nyieun dodol kadaharan husus sorangan. Dodol garut mangrupikeun salah sahiji jinis anu pang populerna. Dina awalna, dodol garut mindeng dipaké salaku piring dina upacara adat, kitu ogé dina acara badag tangtu. Saterusna dodol Garut dihasilkeun pikeun kaperluan dagang sangkan kadaharanana dipikawanoh ku masarakat di loba wewengkon. Cara nyieun dodol garut Campur tipung ketan jeung gula beureum irisan Tuang santan cair jeung uyah secukupnya Kulub bahanna bari diaduk Tuang santan kandel jeung gula pasir, tuluy asak jeung aduk salila 4 jam Sanggeus kentel, tuang adonan kana wadah. baskom anu geus dialasi kertas minyak Lapiskeun adonan ku minyak goreng nepi ka rata Dodol Garut siap dihidangkan.",culture & heritage
7479,"Tesla gaduh teknologi unik dina nyiptakeun mobil listrik. Kusabab batre anu dipake nyaeta rebuan sel batre litium-ion silinder leutik sarupa jeung batre anu dipake dina alat elektronik kayaning laptop. Batre ieu gaduh beurat anu cukup hampang sareng biaya produksina rendah. Basa Tesla mimiti nyieun mobil listrik, konsep gambar mobil Tesla mimiti diwanohkeun ka publik dina bulan Juli 2006. Mobil Tesla kahiji ieu dingaranan Tesla Roadster, nu  meunang sambutan positif. Ti mimiti keneh 100 unit Tesla Roadster parantos kaical ngan ukur 3 minggu ti saprak dikenalkeun. Teras dina sasih Oktober 2007, Tesla nyatet yen pesenan Roadster parantos ngahontal 200 unit. Saterusna dina bulan Mei 2008 pesenan ngaronjat jadi 600 unit.",technology
8126,Mesin cuci hiji tabung leuwih praktis dibandingkeun mesin cuci dua tabung. Saleresna seueur review nu nyebatkeun upami mesin cuci hiji tabung teh leuwih seueur make listrik. Nanging nganggo listrikna saluyu sareng kualitas tur kabersihan acuk nu diseseh. Mesin cuci hiji tabung ge tiasa nyeseh baju leuwih seueur kusabab kapasitasna nu leuwih ageung dibandingkeun mesin cuci dua tabung. Tingkat garing bajuna ge nikakuen 90% kusabab pengeringanna nganggo kecepatan tinggi. Upami nganggo mesin cuci hiji tabung urang teu kudu cape-cape mindahkeun acuk ka tabung nu sejen kusabab kabeh proses ti mimiti nyeseh sareng pengeringan dilakukeun di hiji tabung sakaligus. Mesin cuci hiji tabung cocog oge pikeun jalmi nu teu resep proses nu lila kusabab ieu mesin peryogi waktos nu leuwih singkat.,technology
5903,"Di zaman nu serba canggih ieu, teknologi teh saolah hirup berdampingan jeung kahirupan manusa. Pasalna, teknologi teh ngalami perkembangan nu kabilang pesat dina sagala aspek kahirupan. Hadirna teknologi baru teh bisa ngamudahkeun sagala hal nu berkenaan jeung pagawean hirup. Teknologi ge bisa ngarinankeun beban pagawean. Ku kituna, urang ulah nepi ka tinggaleun zaman, kedah bisa nuturkeun perkembanganna, salah sahijina dina aspek perkembangan teknologi. Mun geus tinggaleun mah bakal gagapteknologi, bakal rada kasusahan nyasuakeun nana. Jadi, yuk lalaunan ngikuti perkembangan teknologi nu aya! Ulah nepi ka tinggaleun teuing! Sabab bakal penting pisan jang kahirupan urang, komo dina fasilitas umum masyarakat mah.",technology
5797,"Badan anu sok olahraga mah beda da katingali na ge. Biasana sok katingali seger, kenceng, jeung katingali leuwih sehat. Beda jeung nu tara olahraga, sok rada bergelambir jeung teu kenceng. Mun sering olahraga mah berat badan ge teratur jeung cenderung stabil. Biasana kulitna leuwih beresih, raray na leuwih seger, awakna katingali keker jeung teu aya nu ngagelambir. Tina cara leumpang na ge sok beda, nu sering olahraga mah sok ajeg jeung tegap, jiga nu keuwih semangat dina ngajalani sagala aktivitasna teh. Kulit na oge kenceng, jeung leuwih seger, teu aya kariput berlebih dina raray atawa awakna teh. Raray na oge cenderung beresih, tara aya jerawat atawa tanda penuaan.",sports
5879,"Salah sahiji barang elektronik anu keur loba dibutuhkeun ayeuna nyaeta air fyer. Alat ieu teh loba digunakeun jang gaganti penggorengan. Mun biasana bahan masakan teh digoreng ku minyak jadi lunyu, tah air fyer mah ngagoreng makanan tapi teu lunyi, jadi hasilna jiga dipanggang kitu. Jadi, air fyer teh loba digunakeun ku nu program diet atawa nu ngamulai ngajalani pola hidup sehat. Nu biasana makanan teh sok digoreng wae, tah ieu jadi alternatif sehatna tina proses gogoreng. Air fryer teh loba pisan dipake ngolah makanan nu sehat. Geus kitu, sumber panas na teh dihasilkeun tina listrik, jadi bisa bari ditinggalkeun jiga penggunaan oven. ",technology
8843,"Mangsa keur di sakola dasar, kuring kacida resepna mun geus diajak ku babaturan nongton nu tanding maen bola di lapangan desa. Wanci sore sabada solat ashar, babaturan geus nampeu di buruan. Dina saku calananamerekis ku kulub kacang jang engke didahar bari nongton. Kuring jeung manehna laju muru lapangan bola nu jarakna teu pati jauh ti imah kuring. Tepi ka nu dituju kuring jeung manehna neangan tempat nu merenah pikeun diuk. Nu jadi pilihan nyaeta handapeun tangkal jeungjing nu kawilang geus aya umuran da akarna geus muncul ka luhur jadi bisa dijadikeun tempat keur dariuk. Bari panon manco ka nu keur maen di lapang, teu poho leungeun kuring jeung babaturan anteng mesekan kacang tuluy am dihuapkeun. Saking ku anteng, teu karasa pertandingan geus lekasan. Kuring jeung babaturan carengkat rek mulang ka imah sewing-sewangan, ngabring jeung panongton nu sejen. ",sports
567,"Aya tilu teknik jang maenkeun alat musik kacapi. Tilu teknik ieu bisa ngahasilkeun sora nu beda-beda. Nu kahiji teknik dijambret, teknik ieu dilakukeun ku cara ngagerakkeun ramo sabeulah katuhu, nyaeta jempol, jajangkung, jeung curuk dina luhur tilu senar nada jeung disadakeun babarengan. Nu kadua teknik sintreuk toel, teknik ieu dilakukeun ku cara mipit senar kacapi, carana ramo dina senar kacapi ngagunakeun tungtung curuk ngalengkung dina handap senar kacapi, tuluy kari noel senarna ku curuk nepikeun ka ngahasilkeun sora nu dipikahayang. Nu katilu teknik dijeungkalan, teknik ieu posisi awak pamaen alat musik leuwih condong ka hareup jeung posisi ramona ampir mirip jeung teknik dijambret.",culture & heritage
2671,"Janten pikeun anjeun anu hoyong nyobian ténis, ieu mangrupikeun 5 pedoman sederhana upami anjeun hoyong mésér rakét. Dengekeun nepi ka tungtungna!
1. Milih hiji rakét kalawan beurat sarta aréa permukaan nurutkeun abilities Anjeun
Sacara umum, hiji rakét ténis beuratna kira-kira 300 gram. Tapi ayeuna, sanggeus ngembangkeun teknologi, beurat rakét ténis bisa diréduksi jadi 270 gram ngagunakeun bahan béda. Janten, upami anjeun pemula, tangtos anjeun disarankan ngagunakeun rékét anu beurat supados anjeun tiasa adaptasi sareng nguatkeun otot leungeun anjeun.
2. Pariksa ketebalan pigura atawa pigura dina raket
Saatos beurat sareng aréa permukaan rakét, hiji deui anu kedah dipertimbangkeun nyaéta ketebalan pigura atanapi pigura rakét. Kandel pigura rakét ténis sorangan dibagi jadi tilu, nya éta kandel, sedeng jeung ipis, nu masing-masing boga kaunggulan sorangan.
Pigura ipis boga kaunggulan ngadalikeun bal, sedengkeun pigura sedeng nu paling stabil sarta saimbang lamun dipaké, sarta pigura kandel boga kakuatan nganiaya kuat. Tangtu, pikeun beginners dewasa, pigura ketebalan sedeng bisa jadi pilihan kahiji saméméh meuli pigura kandel ku kituna otot leungeun bisa adaptasi leres.",sports
7464,"Mesin cuci dua tabung, sapertos namina, gaduh dua tabung anu bentukna sabeulahan. Tabung nu hiji dipake kanggo nyeseuh jeung ngelabkeun acuk, tabung hiji deui dipake kanggo ngararingkeun acuk. Mesin ieu tiasa disebut mesin semi otomatis lantaran urang masih keneh kedah mindahkeun acuk anu bade digaringkeun kana tabung hiji deui make lengeun sorangan. Teu sapertos mesin cuci hiji tabung anu teu kedah dipundah-pindahkeun. Tapi ku kituna, pangaos mesin cuci jenis dua tabung ieu leuwih mirah tibatan mesin cuci hiji tabung. Mesin cuci hiji tabung oge biasana gaduh fungsi anu leuwih seeur, matak teu heran lamun leuwih seeur meakeun listrik, tapi hal eta balik deui ka pamakean urang. ",technology
2359,"Abdi hoyong mimitian ku musik pop Sunda, anu dina jaman pra-kamerdekaan ngagunakeun alat musik Malayu anu kuat, contona lagu Panon Hideung anu diadaptasi ku Ismail Marzuki tina lagu Rusia, Óči čjórnye, sakumaha The Tielman nutupan salaku Panon Hideung dina batu. 'n roll genre. Sakabeh judul sacara harfiah hartina panon hideung.
Waktu éta orkestra Malayu keur naék, utamana mimiti taun 70-an. Henteu ngan ukur ngagunakeun alat-alat tradisional sapertos tabla, rebana sareng suling, tapi ogé nganut alat musik Barat sapertos gitar, keyboard, akordion sareng biola. Malah Orkes Melayu (OM) jadi istilah pikeun ngarujuk kana grup musik pop Malayu waktu harita.
Saha nu teu nyaho OM Soneta dipingpin ku flamboyan Tasikmalaya, Rhoma Irama. Henteu ngan ukur Raja Dangdut, malah Ratu Dangdut, Elvy Sukaesih anu asalna ti Sumedang, ogé geus ngalalakon karir nyanyi anu dipirig ku orkestra Melayu, saperti., OM. Purnama, dugi ka OM. Sonnet sorangan",culture & heritage
2311,"Saméméh milih ingon-ingon mana nu rék dipésér, aya alusna urang apal tiheula syarat-syarat pikeun sasatoan qurban anu kudu diperhatikeun saperti ieu di handap: Sato-sato kurban téh aya dina wangun ingon-ingon, nyaéta onta, sapi jeung embé, boh. domba atawa embé biasa.
Geus nepi ka umur anu diwajibkeun syari’at dina bentuk jaza’ah (satengah taun) ti domba atawa tsaniyyah (penuh taun) ti nu lian.
Ats-Tsaniy onta nya eta anu geus sampurna umur 5-6 taun
AtsTsaniy sapi téh nu geus sampurna umur 2 taun
Ats-Tsaniy embe nya eta anu geus sampurna umur 1-2 taun
Al-Jadza'ah domba nyaeta anu umurna 6 bulan
Bébas tina aib (cacat) anu ngahalangan kaabsahanna, nyaéta naon anu geus dijelaskeun dina hadits Nabi shallallahu 'alaihi wa sallam.",religion
5802,"Kagiatan olahraga teh boga salusin mangpaat lain wae jang kasehatan fisik, tapi oge boga mangpaat jang kasehatan mental atawa psikologis. Nu kahiji nyaeta ngaredakeun kacemasan sabab olahraga teh bisa micu energi positif dina tubuh. Nu kadua nyaeta mangpaat jang ningkatkeun konsentrasi jeung fokus. Mun sering olahraga mah bakal leuwih terlatih dina fokus jeung konsentrasi dina suatu hal. Nu katilu nyaeta ngahindari stress jeung depresi, sabab olahraga teh bisa ngaproduksi hormon nu mawa hawa positif dina tubuh. Nu kaopat nyaeta leuwih optimis jeung leuwih percaya diri. Olahraga teh bisa ningkatkeun rasa optimis jeung percaya diri sabab efek tina olahraga nu bisa numbuhkeun energi positif dina tubuh.",sports
5504,"Kampung adat Banceuy nyaeta kampung adat nu aya di daerah kabupaten Subang. Masyarakatna masih megang teguh tradisi adatna. Pupuhu adat di kampung ieu ge kabilang masih lengkap. Jadi, informasi ngeunaan kampung adat Banceuy teh masih bisa digali ti pupuhu nu bersangkutan langsung ti mimiti dibentukna ieu kampung adat. Sagala tradisi jeung aturan adatna wajib dipatuhi ku sakabeh masyarakat adat, termasuk wisatawan nu kunjungan ka ieu kampung adat. Jadi, ka wisatawan nu ngabutuhkeun informasi ieu kampung adat teh bisa langsung nanya atawa wawancara ka pupuhu nu bersangkutan langsung supaya informasina leuwih akurat. Mun saukur kunjungan wisata ge teu nanaon, itung-itung urang ngabantu ngalestarikeun ieu kampung adat.",culture & heritage
5353,"Abdi gaduh pangalaman nu berharga pisan dugi ka ayeuna. Harita abdi bade daftar ka perguruan tinggi negeri. Abdi tekun diajar soal-soal tes na. Pas tempo pengumuman, abdi dinyatakeun teu lolos. Abdi sedih pisan, abdi nyobian ngalenyepan penyebabna, apakah karena dosa abdi nu masih ngajalin bobogohan. Teras tanpa mikir panjang abdi mutuskeun teu bobogohan deui terus fokus kana tes selanjutna di kapus lain. Alhamdulillah abdi katarima. Abdi bungah kacida ngadangu katampi di kampus eta. Tah tidinya abdi nyimpulkeun yen bobogohan teh leres ngahambat pisan kana sagala hal nu kuduna bisa diraih ku urang. Yuk ah urang jahan zina, supaya sagala urusan urusan dipaparin kalancaran.",religion
8832,"Ti saprak kuring sok diajak jogging isuk-isuk ku adi kuring, kuring ngarasakeun mangpaat anu kacida gedena. Mimitina mah hoream, isuk-suk sabada rengse sholat subuh kudu titirisan diluar, tapi lila-lila mah kuring jadi resep oge, sabab karasa aya mangpaatna. Mangpaatna, nu tadinya awak sk nyareri bae jeung sirah rieut lamun hudang sare teh, ti saprak ngalakukeun jogging unggal isuk teh laun-laun jadi leungit nyareuri sirahna. Awak anu tadina bareurat, ku sabab gendut alatan kirang gerak, ayeuna mah karasa rada ngahampangan. Singhoreng teh bener geuningan ceuk beja, yen jogging the mere mangpaat anu gede keur kasehatan urang. Kuring ngarasakeun pisan mangpaatna, ayeuna mah jadi hobi, teu kudu diajak deui ku pun adi jeung teu kudu dihudangkeun deui unggal isuk.    ",sports
5448,"Hiji carita rakyat nu pasti dipikawawuh ku sarerea nyaeta kisah bawang putih jeung bawang merah.Carita ieu teh ngisahkeun dua duduluran nu ngabogaan sifat patotonggong, nu hiji bageur kacida, nu hiji judes kacida. Dina kisah ieu, nu gaduh sipat bageur kacida nyaeta bawang putih, nu oga sipat judes jeung goreng hate nyaeta bawang merah. Dina ngajalani kahirupan nana, ieu dua duduluran teh diurus ku hiji indung nu mihak wae ka bawang merah. Sagala nu aya dina kaberuntungan bawang putih teh dipake kasirik ku dulurna, bawang merah. Nepi ka hiji poe bawang merah jeung indungna meunang babales tina kalakuanna. Bawang putih manggih kaberuntungan nyaeta dibawa ka kerajaan jeung dijadikeun istri pangeran.",culture & heritage
4166,"Upacara poean Tumpek Landep nyaéta perayaan anu diayakeun umat Hindu di Bali pikeun nyuhunkeun kasalametan Gusti dina wujud-Na salaku Sang Hyang Pasupati. Salian ti éta, hajatan ogé mangrupa rasa sukur kana karunia tina sagala kacerdasan jeung kaparigelan pikiran, sangkan bisa nyiptakeun hiji hal dina wangun barang-barang anu ngabantu kahirupan masarakat sapopoé, saperti motor, mobil, komputer, mesin, pacul. , péso, jeung sajabana. Kacerdasan jeung seukeutna akal pikiran dilambangkeun ku keris anu panonna seukeut tur mancung. Pusaka keris ieu kacida pentingna jeung ngandung harti. Ku alatan éta, upacara keris dilaksanakeun nalika Tumpek Landep lumangsung. Tumpek Landep biasanya diadakan setiap 6 bulan sekali pada saat Saniscara Kliwon wuku Landep. Dina prak-prakanana, barang-barang anu diciptakeun ku manusa anu mantuan dina kagiatan sapopoé bakal dipuja minangka wujud rasa sukur ka Gusti dina wujudna salaku Sang Hyang Pasupati.",religion
2343,"Upacara ngaben butuh artos anu ageung, Rata-rata waragadna 15-20 juta, komo deui, utamana pikeun anu jadi pamingpin agama. Jumlah duit diperlukeun ngajadikeun sababaraha kulawarga milih pikeun ngalaksanakeun kremasi massal. Ngaben masal nyaéta ngaben anu dilaksanakeun babarengan dina jangka waktu anu tangtu, contona unggal lima taun, di hiji désa. Biasana nalika upacara ngaben, jalan-jalan di sabudeureunana bakal ditutup samentawis, dugi ka arak-arakan réngsé. Warga satempat anu naek motor bakal eureun sakedapan pikeun ngaliwat ieu konvoi. Ieu mangrupikeun wujud kasabaran anu sifatna alami sabab spontan. Anjog ka makam, baris dilaksanakeun runtuyan upacara, ti mimiti ngadoa nepi ka ngaduruk. Ngaduruk ieu mangrupa simbol mulangkeun unsur kahirupan manusa. Contona, manusa asalna tina taneuh bakal balik deui ka taneuh, hawa balik deui ka hawa, jeung saterusna",culture & heritage
4259,Tokoh adat nyaeta jelema anu di anggap pamingpin anu ngabogaan kawasa jeung pangaruh dina hiji daerah. Tohoh adat biasana jelema anu di saja di kolotkeun keur ngajaga wibawa ku sabagean warga anu tugasna ngamumule suku asal daerahna. Biasana tokoh adat nyaeta jelema asli tina suku anu cicing jeung hirup keur ngabdi di daerah eta keur kamajuan sukuna. Biasana tokoh adat anu jadi tokoh adat ayeuna turunan ti tokoh adat samemehna.  Tokoh adat aya anu di pilih ku warga sorangan aya anu emang geus turunan jadi warga geus teu bisa ngusik  kapamingpinan nana. Tokoh adat di daerah pasti boga ciri khas masing masing gumantung di suku mana hirupna. ,culture & heritage
528,"Lagu daerah diciptakeun teu ngan saukur dinyanyikeun hungkul, tapi oge fungsina salaku identitas daerah. Aya sababaraha fungsi lagu daerah. Lagu daerah salaku identitas daerah, ieu ku sabab hiji daerah jeung daerah sejen biasana beda-beda, boh dina bahasana nepikeun ka alat musik nu dipakena ge sok beda. Lagu daerah salaku pengiring dina pelaksanaan upacara adat atawa tradisi, ieu sok mindeng dipanggihan oge, contona di adat Sunda sok aya Upacara adat pas dikawinan. Lagu daerah oge salaku pengiring tari jeung pintonan. Lamun tari geus pastina kudu maenkeun lagu daerah. Lagu daerah salaku sarana komunikasi. Lagu daerah salaku media nu mere pesan. Jeung lagu daerah salaku media ulin.",culture & heritage
8825,"Jaman kuring keur budak, paling resep lamun  pas jam pelajaran olahraga. Sababna pelajaran olahraga mah teu pati kudu mikir  beurat cara pelajaran matematika atawa IPA. Cukup ku daek gerak sakumaha anu dicontokeun ku guru. Harita olahraga nu pangdipikaresep ku kuring nyaeta bola voli. Sok sanajan teu pati bisa da serpen oge tara nyampe, kuring resep we milu rame-rame nepak bola bari silih sorak jeung babaturan. Jiga basa poe harita, pas pelajaran olahraga, kuring jeung babaturan dititah praktek maen voli. Anu mimiti serpen teh batur kuring si Ani, manehna mah sanajan awaknya leutik tapi teunggeulana tarik. Atuh bola labas asup ka lapang lawan bari teu bisa katahan. Meunang sababaraha poin si Ani terus-terusan ngasupkeun bola ka lawan. Pas giliran kuring neunggeul bola, si bola teh lain laju ka daerah lawan, tapi kalah mantul ka luhur. Atuuuh Kuring pada ngekeak disebut pamaeh. Kuring teu nyeri hate disebut kitu teh, tibatan nyeri hate kalahka milu seuri bari malik ngekeak ka babaturan. ",sports
