id,text,label
273,"Pas Malem malem waktu itu aku lagi galau tapi nak ke mall ngatek duit. Akhernyo aku pegi bae ke monas naek busway dari halte deket kosan aku. Kebetulan wkatu itu sekitar jam 8 malem busway lah mulai longgar, dak terlalu padet. Aku naek dari halte pemuda nyampe ke halte Monumen Nasional. Aku transit duo kali dari busway, malem itu kebetulan jumat malem sabtu, jadi agak rame ku jingok disekitaran monas. Trus aku beli kopi di mamang yang jualan keliling, trus kareno aku ngatek kawan ku ajak bae becerito mamangnyo. Tapu mamangnyo ngomong nak legi kearah Timur Monas kareno disano lagi ado uwkng shoiting pilm. Kutanyo ke mamangnya siapo yang shoiting pilm? Ujinyo Dimas Anggara, astaga ngapo pas nian aku ngefans nian samo Dimas Anggara. Laju aku melok samo mamang penjual kopi tadi, trus nungguke dimas anggar nongol. Ternyato nianan ado dimas Anggara, seneng bian aku akhernyo pacak jingok langsung. Tapi dak sempet bepoto bareng kerno lamo nian nungguke sutingnyo kelar. Jadi akh balek duluan, tapi ajdilah lah tejingok aslinyo idola aku.",descriptive
374,"Menurut banyak uwong penyesalan dalam hidup itu adalah tantangan paling berat dalam hidup, yo aku setuju sih samo pendapat itu. Tapi menurut aku pribadi penyesalan itu sebuah emosi yang muncul saat sesuatu terjadi idak sesuai samo yang kito harepke. Terlebih sdo kaitannyo samo waktu yang berlalu. Saat kito menyesal pasti ado raso sakit, sedih di hati bahkan kecewa dan lengen segalo diulang lagi. Bahkan ado beberapo uwong yang dak kuat samo hal yang ditanggungyo dan penyesalannyo terllau dalam smapek akhirnyo pengen ngakhiri hidupnyo. Jadinmemang sdo benernyo amen penyesalan tuh biasonyo berkaitan samo maslah berat. Jadi penyesaln dalma hidup menurut aku saat dimano hal yang idak kito harepke datang di hidup kito jadi maslah berat dan kito dak biso ngulang dengan waktu yang tebuang.",argumentative
490,"Masjid merupoke tempat ibadah buat umat islam. Masjid merupoke tempat yang suci yang memang dikhususke untuk uwong besembahyang atau nunaike sholat. Masjid tertuo yang ado di pulau jawo adolah Masjid Agung Demak yang dibangun samo wali songo. Masjid ini menyimpan banyak cerito tentang sejarah islam pertamo dipulau jawo. Masjid ini merupoke simbol kerjaan pertamo Islam yang ado di pulau jawo saat itu, yaitu Kerajaan Demak. Masjid ini dibangun sebagai pusat pembelajaran umat Islam waktu itu di kerajaan demak. Masjid agung Demak ini tegak bediri kokoh menyaksike pergantian jaman sampe akhirnyo Islam merupoke agama yang hampir dipeluk samo mayoritas penduduk di Indonesia ini. ",narrative
614,"Kejutan untuk uwong yang kito sayangi untuk sekedar ngerayoke hal hal kecik itu perlu dilakuke buat pasangan biar makin punyo hubungan intim. Menurut aku, kejutan kejutan yang dikasih lasangana kito ke kito tanpo kito tahu itu buat aku ngeraso jadi uwong yang spesial diahtinyo dio. Misalnyo dio inget hari ulang tahun aku dan bikin pesta kejutan walaupun kecik kecikan itu berarti nian buat aku. Yang namonyo kejutan pati memang kito dak tau, tapi kareno kito dak tau itu justru buat aku spesial. Aku bukan temasuk uwong yang ngasih tau pasangan hari hari spesial aku, trus mintak mintak hadiah. Aku lebih senneg kalo pasangan aku inget dewek dan jugo bikin pesta atau ngasih hadiah dak perlu ngomong ngomong ke aku sebelomnyo.",argumentative
911,"Pertamo kali akunmake handphone pas aku masuk kuliah tahun 2005. Hp pertamo aku merk nokia yang bunyinyo masih poliponik. Aku dibelike hp kareno aku nak kuliah merantau keluar kota, jadi bapak aku kasih hadiah hp biar sekalian biso jadi alat komunikasi buat ngabari wong tuo dikampung. Tapi memang nasib aku, kuliah di jakarta banyak nian copetnyo, baru duo bulan dijakarta aku sudah keno copet. Akhernyo aku dak make hp nyampek setahun lebih. Bapak aku amen nak ngubungi aku lewat hp kawan aku. Sampek akhernyo aku dibelike hp lagi masih dengan merk yang samo nokia. Dulu Hp nokia memang laris nian dipasar indonesia. ",narrative
1104,"Suntik vaksin covid-19 memang diwajibke samo pemerintah. Ternyato banyak uwong yang takut disuntik vaksin, bukan takut smao vaksinnyo melaenke takut samo jarum suntiknyo. Banyak uwong yang dak galak vaksin kerno ngaku pobia samo jarum suntik. Tapi menurut beberapo paskr kesehatan, wargo dak boleh nolak suntik vaksin cuma kerno takut samonjarum suntik. Wong yang diperbolehke dak vaksin adalah wong yang punyo gangguan kesehatan mecak alergi samo obat obatan tertentu, ibu hamil samo ibu menyusui, mengalami gejala ISPA mecak batuk, pilek samo sesak napas dalam 7 hari terakher. Amen uwong yang dka punyo ciri tesebut diwajibke untuk disuntik vaksin covid 19 di puskesmas tedekat. ",argumentative
178,"Waktu luang seharusnyo diisi samo hal hal yang bemanpaat. Nak waktu yang pas amen buat beberes rumah secaro detail ini pas nian di waktu luang. Apolagi buat uwong yang selalu sibuk samo urusan gaweannyo, dan dak katek sempet waktu untuk beberes rumah. Mangkonyo amen ado waktu luang digunoke untuk beberes rumah, biar rumahnyo bersih, nyaman ditempati, alhasil biso bikin betah uwong yang nempatinyo. Rumah yang bersih jugo biso mendukung kesehatan penghuninyo, menjauhke dari bakteri, virus dan kuman yang biso nimbulke penyakit. Ayo bersihke rumah dan beberes rumah pas ado waktu luang. Mulailah dari ngelap-ngelap debu dipermukaan barang-barang yang ado dirumah. Ngeganti sprei, gordeng, nyapu samo ngepel. Ngejago kebersihan rumah akan bedampak baik buat kesehatan. ",persuasive
1153,"Sudah sebulan ini ado wargo baru yang tinggal dikomplek kami. Dio sepasang duo laki bini dnegan anak sikok, tinggalnyo 4 rumah dari kami. Aku dak begitu kenal kareno memang wongnyo antisosila. Cuma setiap hari amen aku pegi ke sekolah aku lewat depan rumahnyo terus. Nahbaku sering jingok lakinyo duduk ditera depan rumahnyo. Dak lernah tejingok bini atau anaknyo,. Nah paa ado duo mingguan mak itu, aku ngeraso bapak ini balak meloki aku pegi ke sekolah, trus jugo pas aku balek sekolah aku dipeloki sampe aku masuk rumah. Aku takut sebenrnyo, tapi untuk mastikenyo aku galak ngintip dari jendelo. Memang dio tejingok kokar kilir depan rumah aku sambil make sarung, aku yakin dio memang meloki aku. Aku takut, sampe akhirnyo pas aku lagi nongkrong dio manggil aku dan ngomong "" neng, galak ajdi cewek om dak?"" Astaghfirullah yang tadinyo aku takut trus aku langsung marah. Sambil kuteriaki kuomongke "" gilo kau ni, awak lah tuo galak dengan budak sekolahan"" ",descriptive
28,"idup sehat adalah impian segalo manusio didunio ini. pola hidup sehat harus didukung samo konsumsi makanan yang sehat. Nah makanan yg sehat lebih mudah didapet amen kito buat dewek dirumah. Kareno kito yang buat,  kito biso mastike proses pembuatan makanan yang bersih dan sehat. aku punyo resep makanan sehat yang gampang dibuat yaitu "" salad kentang telok "". Resep makanan ini aku pastike sehat dan gampang dibuatnyo, cocok untuk menu sarapan. Bahanyo sederhana bae cuma kentang, telok, bawang putih, bawang bombay, timun , garem, samo mayonaise. pertamo rebus telok samo kentang , trus amen lah matang biso diiris kecik kecik telok samo kentangnyo. abis itu cincang setengah siung bawang putih samo sikok bawang bombay, trus masukke ke dalam plastik. potong pulo timun campurke ke dalam plastik bawang tadi, trus diremes2 sampe keluar aernyo. Abes itu campurke ke telok samo kentang, jangan lupo njuki sedikit garem samo mayonaise. Siap disantap untuk sarapan. Gampang kan buatnyo? Silahkan dicubo resep gampang, sehat dan cepat ini dirumah.",persuasive
36,"Dalam kesempatan hari ulang tahun bapak Presiden Joko Widodo, Tri supriharjo sebagai juru masaknyo di Istana kepresidenan ngungkapke 10 menu makanan paporitnyo bapak presiden Jokowi. yang pertamo ado Soto ayam , Campuran kobis, toge soun yang disiram kuah rempah kuning. trus yang keduo Sayur bening, sayur bayem yang dimasak kuah bening jadi salah sikok menu paporitnyo pak presiden. lalu yang ketigo orek tempe, yang biaso dimakan pak presiden dengan menu laennyo. Yang keempat Oseng pepayo mudo, olahan sederhano yang lezat dan menyehatkan. Yang kelimo lento, makanan khas jawa timur yang dibuat dari ubi kayu yg diparut dicampur samo kelapo trus digoreng. yang keenam bakwan jagung, trus selanjutnyo ketuju tempe bacem , lalu yang kedelapan cemilan tradisional mecak ubi kayu goreng, jagung rebus. yang kesembilan samo yang kesepoloh ado jamu minuman tradisional indonesia samo jus buah. Itu dio 10 makanan paporit uwong no 1 di Indonesia.",expository
895,"Piala dunio memang momen yang paling di tunggu tunggu nian samo pecinto bola kaki. Piala dunio yang belangsung di Qatar 2022 ini mmenag banyak kontroversinyo. Mulai dari pemain timnas Jerman kemaren pas pertandingan belangsung sengajo make bendera pelangi khusus buat ngedukung rombkngn LGBT. Hal ini menurut aku dak sopan, kareno dka ngehormati tuan rumahnyo. Selain itu selamo meloki nonton pertandingannyo menurut aku Argentina mecak selalu dapet keberuntungan tapi terlalu tejingok dibuat buatnyo. Salah sikoknyo timnas argentina yang menurut aku banyak dapet kesempatan ngelakuke tendangan pinalti. Bahkan jugo ado kejadian hampir seluruh pemain timnas argentina pernah galo dapet kartu kuning, tanpo tekecuali messi. Tapi pas Messi ngelakuke hand ball ke gawang  langsung dicueki bae samo wasitnyo. ",argumentative
145,"Ado rencano pemerintah thailand nak ngeganti tuk tuk yang make mesin darinmobil bekas jadi tuk tuk yang bertenago listrik. Aku setuju dengan ini, kareno emang tuktuk di thailand asep yang dihasilke tebel nian dan bikin polusi di bangkok. sudah saatnyo kito bebenah dan berubah lebih peduli samo lingkungan bukan? Amen sekironyo tuk tuk dak ramah lingkungan , masih biso terep pakek tuk tuk tapi dengan bahan bakar listrik. Bukan transportasinyo yang diganti, melaenke mesin dan bahan bakarnyo. Langkah pemerintah Thailand lah bener, dan aku setuju. Kareno tuk tuk jugo lah jadi icon negri Gajah ini. Jadi Idak mungkin nak ngilangke tuk tuk mak itu bae. Jadi yang diganti mesin samo bahan bakarnyo bae, tuk tuk nyo masih dioperasike untuk alat transportasi wisatawan di kota bangkok. Kareno makmanopun tuk tuk tuh menarik wisatawan untuk dicubo. ",argumentative
1245,"Sistem dropship yang sudha dijelaske itu memang punyo kelemahan jugo. Bejualan tanpo nyetok barang memang ngurnagi resiko kito rugi. Tapi kekurangannyo menurut aku kito dak biso update jumlah barang yang tesedio. Kerno kan kito dak punyo barangnya dna dak tau stocknyo berapo, jadi tekadnag amen ado konsumen yang beli trus kito teruske ke supplier, kadang tibo tibo dapet kabar dari supplier amen barang yang nak dibeli itu suah abes alias dak ngatek stok lagi. Nah amne mak ini kito harus ngejelaske samo pembeli kito. Dan biasonyo banyak pembeli yang dak seneng amen sampe kejadian mak ini. Jadi menurut aku amen kamu lh lamo make susutem dropship, kamu pasti sudah tau barang mano yang penjualannyo bagus. Dan jugo psti kamu punyo duit hasil untung itu biso kamu jadike modal untuk beli barang yang memang banyak peminatnyo, jadike stock buat kamu. Biar dak kejadian barang tibo tibo kosong.",argumentative
485,"Siapo yang pernah liburan ke bali pas hari nyepi? Menurut aku liburan di bali pas wargo bali lagi ngerayoke nyepi, ngasih pengalaman yang berbeda buat kito. Soalnyo kondisi bali yang sepi, listrik mati, wifi mati, dak katek uwong yang bekegiatan diluar rumah kecuali turis. Tapi turis samo wisatawna pun dihimbau untuk idak banyak bekatifitas diluar rumah amen idka kepepet nian. Menurut aku memang susah yo amen tebiaso make internet tiap hari, susah tinggal dibali pas nyepi. Tapi menurut aku ado positipnyo yaitu amen malem nyepi pulau balo cantik nin, kareno lampu dak katek yang nyalo jadi bintang bintang bersinar terang, trus tu hal positip laennyo adalah dengan menghemar energi seharian kareno hari rayo nyepi. Ngebantu nian melindungi bumi kito dari perubahan iklim dan pemanasan global, serto biso ngebantu kito untuk hemat energy demi kelangsungan hidup di bumi.",argumentative
1332,"Percobaan tranplantasi jantung babi yang dipake ke manusio yang punyo penyakit jantung parah berhasil hidup dan biso bertahan hidup nyampe duo bulan. Penemuan ini ditemuke oleh ahli bedah Bartley.P Grifith yang nyobake ini ke pasien jantungnyo David Benetth yang jantungyo lah rusak parah. Sebagai harapan hidup bagi uwong yang sakit jantung. Mereka hidup tebareng teros dibantu samo alat buat hidup samo bae mecak wong mati. Tapi dnegan penemuan transplantasi jantung babi ini diharapke biso meanmbah umur si penderito jantung tanpo harus tebareng dengan alat pacu jantung. Tapi resiko transplantasi ini jugo biso bebahayo, dan akhernyo setelah dilakuke transplantasi ternyato Beneth biso bertahan hidup selamo duo bulan bae. ",descriptive
835,"Olahraga itu oentung buat kesehatan tubuh kito, tapi tekadang banyan uwong yang dak semoet beolahrgo kareno waktu dak ngatek atau kurang konsisten buat ngelakuke olahrag tiap hari. Nah makmano kiro kiro ngakalinyo biar kito tetep galak olahraga? Menurut aku kito biso jadi emmeber ditempat pusat kebugaran, disano banyak alat alat olahraga yang biso ngebentuk badan kito jadi lebih ideal. Trus disano jugo jadi biso nyari banyak kawan yang bikin kito semangat olahraga. Dak perlu beli alat olahraga kareno lah tesedio lengkap di sano. Nah tapi amen memnag bagi yang dak ngatek waktu samo sekali buat pegi ke tempat gym atau pusat kebugaran mak itu. Mungkin biso beli alat alat olahraga yang sederhano mecak dumbell, tali skipping, karpet yoga, dan laen sebagainyo.",argumentative
754,"Marah sebenenryi hal alami yang dilakuke manusio amen lagi meraso kesel. Setiap manusio pasti pernah marah, dan ngelampiaske raso keselnyo dengan marah marah. Tapi amen ado uwong yang keseringan marah marah tanpo sebab menurut aku biso jadi ado gangguan dimentalnyo. Kareno menurut beberapo penelitian yang aku tau, kemarahan yang dak tekontrol dan dilakuke keseringan biso beakibat buruk smao kesehatan mental kito. Penyebabnyo sebenernyo macem macem, biso jadi kareno depresi, banyak pikiran, kecanduan alkohol, atau biso jadi keno penyakit mental. Nah menurut aku amen kamu sering nian cepet marah, apolagi tanpo seban lebih baik kamu perikso ke diri ke psikolog bae. ",argumentative
1283,"Instagarm yang dulunyo merupoke apliaksi ekslusif yang cumak dipunyo sako hp keluaran apple, sekarnag sudha biso diraoke samo pengguno hp android jugo. Instagram dulu dibangun samo perusahaan Burbn, Inc. Pemilihan namo instagram awalnyo diawai dari kato instan samo telegram. Instan yang maksudnyi hasil poto dari instagram ini mecak hasil kamera polaroid yang instan. Sedangkan telegram maksudnyo ngasih info ke banyak uwong dengan cepat. Akhernyo dipilihlah kato Instagram yang artinyo poto instan yang biso dibagike dnegan cepat. Ditur yang pertamo kali ado di instagram yaitu follower atau pengikut. Jadi kito hiso ngikuti wong yang kito kontemnyo menarik buat kito, dna ado uwong jugo yang bakal ajdi pengikut kito kerno mereka seneng samo konten kito. Berkembang lagi akhirnyo ado fitur video jugo di Instagram. Jadi bukan cumak bebagi foto tapi jugo biso bebagi video ke pengikut kito. Terus bekembang smape ado fitur story yang cuma betahan selamo sehari bae. ",descriptive
1208,"Tambak udang vaname merupoke usaho yang sangat menjanjikan. Penjualan udang vaname bukan cuma ado untuk dalam negeri melainke ekspor besak besakan ke banyak negaro di dunio ini mecak jepang, korea, chino, amerika bahkan eropa. Ditambah lagi kondisi geograpis negaro kita yang banyak garis pantai memang cocok nian untuk bikin usaho budidayo udang vaname. Banyak sudah memang tambak tambak tradisional yang sudah beoperasi diselanjang pantai indonesia. Nah buat kamu yang nak lunyo duit sampingan biso melok gabung jadi investor perusahana Baba Raffi di bidnag udnag vaname ini. Pembagian hasil yang transparan, hasil yang melimpah setiap tahunnyo biso bikin investor cepet balek modal. Kalo kamu bingung nak buka bisnis untuk nyari duit tambahan dak usah bingung, investasike bae duit kamu di perusahaan tambak udang vaname punyo baba rafi. Kamu bakal dapet bagi hasil yang transparan selamo limontahun tanpo ngerjoke apo appo. Ayok gabung sekarnag jugo. ",persuasive
680,"Setiap uwong pasti betambah usio disetiap pergantian taon. Tanggal kelahirannyo biaso dirayoke dan ditandoi sebagai hari betambahnyo umur atau hari ulang tahun. Ngerayoke hari ulang tahun tegantung samo uwong masing masing, ado yang ngerayoke dengan makan samo samo keluarga, ado jugo yang ngerayoke samo kawan kawan bae, bahkan ado yang idak dirayoke samo sekali. Ado lagi uwong yang idak ngeryaoke ulang tahun, tapi dikasih kejutan di hari ulang tahunnuo samo uwong yang perhatian samo dio. Nah hal ini lah yang kadang kito harepke dari uwong yang deket samo kito, untuk selalu ingat hari ulang tahun kito dan ngasih kejutan walupun cumak sederhano bae. Biasonyo yang kito harepke ngasih kejutan ulang tahun uwong yang kito sayang, biso cowok atau cewek kito, biso uwong tuo kito, biso sohib deket kito. Pokoknyonkalo ulang tahun kito dirayoke walupun kecik kecikan dengan surprise sederhano tetep bemakna amen ado uwong yang kito sayang disekeliling kito. ",narrative
1061,"Kasus KDRT yang dialami smao Venna Melinda bininyo Ferry irawan bermula memang sudah dari awal mereka nikah. Dulu setiap ado masalah memang ferrily sering ngancem venna melinda untuk ninggalke atau nyerai si venna melinda. Dulu venna sellau takut amen diancem untuk ditinggalke, kernokan malu smao anak anaknyo kerno ini kawinnyo yang keduo kali. Tapi hari disaat dio ngalami KDRT pas dihotel daerah kediri itu, dio dak takut lagi smao ancamannyo ferry irawan. Kejadian itu bemulo saat venna melinda ado tugas dari dapilmdi kabupaten kediri, feri melok untuk ngerewangi bininyo itu. Baru nyampe hotel mereka beduo ini ceckcok urusan ranjang, ujinyo vena dak biso ngelayani lakinyo kerno kondisi dio yang lagi capek. Akhernyo ferry ngancem nak ninggalke venna, kareno meraso selalu diancem si venna pun kesukut emosi akhirnyo cekcok dan berakhir dengan kejadian KDRT tesebut.",narrative
561,"Alat musik tradisional di indonesia dipengaruhi samo beerbagai sejarah jaman kerajaan yang pernah berjayo di nusantara ini. Gamelan contohnyo yang memang hampir ado bukan di jawo bae tapi mecak lombok, bali dan maduro punyo alat musik yang mirip samo gamelan. Sejarah musik gamelan memang dipengaruhi samo kerajaan kerajaan yang lernah bejayo di tanah jawo, bali, madura dan bebrapo bagian sumatera. Bukan di dalma negeri bae, mecak jaman kerajaan majapahit yang hampir nguasoi seluruh nusantara indinesia dna ebberapo bagian wilayah negaro tetanngo, mako alat musik gamelan ini pun pernah dutemuke dibeberapo tempat yang pernah dikuasoi smao kerajaan majapahit. Sedangke dipulau jawo gamelan tetep dipake walupun kerajana hindu budho sudha idak jadi kerajaan yang bekuaso lagi di jawo. Gamelan di jawo dipake oleh paro wali untuk menyebarke agama islam, sedangkan di bali kareno agama yang masih banyak beperan disano hindu, mako gamelan jugo masih di jadike alat musik tradisional disano. ",narrative
472,"Agam Islam merupoke agama tauhid, apo yang dimaksud samo agama tauhid tu yaitu agamo yang cuma nyembah sikok tuhan, dan itu cumak Allah SWT. Ketauhidan itu dibarengi samo keyakinan kito amen Allah SWT merupoke tuhan yang maha Esa artinyo sikok tuhan bae yang ado didunio ini. Diolah Allah SWT yang nyiptake, meliharo dan menentuke sagalo hal yang ado di kehidupan ini. Keyakinan inilah yang diterapke samo umat muslim yaitu "" laillahaillallah "" yang artinyo "" tiado tuhan selaen Allah SWT "". Dalam Islam keesaan Allah SWT bukan masalh jumlahnyo tapi melenke Allah yang maha esa yang punyo 99 sifat yanag dak ado duonyo, dak biso disekutuke, atau dka katek yang biso menyamoi ke 99 sifat Allah SWT. ",descriptive
989,"Direktur kerjosamo ekonomi ASEAN kementrian luar negeri Ina Hangniningtyas Krisnamurthi ngomong amen pesaingan dalam ekonomi ngadepi pasar global penting ningkatke sumber dayo manusio sengan dukungan teknologi digital. Untuk biso bertahan dalam era MEA ( Masyarakat Ekonomi Asean ), untuk paro pengusaho mikro, kecik dan menengah (UMKM) harus punyo kreatipitas, Inopasi, dan yang paling penting nguasoi teknologi digital terkini. Tigo faltor tesebut harus nian dikuasoi samo pengusaho lokal amen memang nak besaing dengan seluruh pengusaho di ASEAN ini. Nah untuk paro penggiat usaho UMKM ayo jangan mudah menyerah, di era globalisasi mak ini, kito harus biso bertahan dnegam strategi bisnis yang bagus dna jugo teknologi digital harus kito kuasai. Semakin kito nguasoi teknologi semkain mudah bisnis kito bekembang, ayo bekali diri kito dengan kemampuan teknologi digital dalam menghadapi ekonomi global.",persuasive
1421,"Mungkin hamper seluruh uwong pernah punyo pengalaman teinjak tai kucing. Apolagi pas masih kecik dulu, aku sering maen dipasir samo kawan kawan aku dulu. Kito tau pastinamen kucing memang seneng nian amen meseng di tempay tempat bepasir. Dak jarnag dulu itu tiap kami maen, pastilah sikok uwong tepijak tai kucing. Lemak amen make sandal, paling sandalnyo yang kotor. Tapi tekadang ado budak yang midang idak makek sandal, akhernyo amen tepijak tai kucing langsung keno kakinyo. Jijik nian rasonyo amen tepijak tai kucing, amen aku biaosnyo langsung cepet cepet nyari rumput buat bersihke tainyo. Trus balek kerumah cuci kaki, tapi amen midangnyo jauh dari rumah aku cuma kunersihke bae dak dicuci. Tapi baunyo nyengat nian dan bikin jijik, akhernyo aku buang sandalnyo biasonyo. ",narrative
712,"Siapo sih yang dak meraso sedih, marah dan tesinggung amen dikato katoi jelek. Dihino secaro fisik itu ninggalke trauma yang dalam buat siapo bae. Bukan kito yang mintak fisik kito diciptoke mak ini, ini murni dikasih tuhan. Standar kecantikan di Indonesia ini memang yang punyo kulit putih, langsing kecik, rambutnyo lurus ikel ikel. Nah amen cewek yang punyo kulit idak putih, rambut keriting, idung pesek pastilah dikato katoke jelek. Kadang jugo susah nyari gawe, kalh smao yang punyo penampilan menarik. Punyo penampilan ala kadarnyo cak aku mak ini memang harus ngandalke otak untuk besaing smao cewek yang lain. Walaupun wong ngehino fisik kito seidaknyo mereka bakal tediam amen tau isi otak kito. Amen dak punyo otak pulo, seidkanyo punyo duit buat ngelkauke operasi plastik biar biso tejingok cantik. Memang keras hidup ini buat uwong uwong yang punyonpenampilan standar bahkan dibawah standar kecantikan di indonesia ini. ",descriptive
359,"Banyak kejadian betino yang taaruf tapi dapetnyo ternyato pasangannyo gay. Gay di indonesia emang masih tabu nian, banyak uwong yang nutup nutupi amen dirinyo tuh gay. Mecak ayuk sepupu aku yang dak tau amen lakinyo gay, Dio nikah lah setahun tapi belom pernah behubungan badan ujinyo. Kami sekeluargo dak tau amen dio belom pernah behubungan badan selo setahun, ceritonyo dio memang lah curiga amen lakinyo gay tapi dio tahan dak cerito ke keluargo takut keluargonyo kecewa. Dio jugo dak biso cerai amen ngatek bukti, akhernyo selamo setahun itu ayuk sepupu aku nyari bukti dan memang tebukti amen lakinyl punyo cowok lain. Dan akhernyo cerai mereka, nah aku denger keluargo cowok malu dan kecewa nian samo si lanang ini. Nah buat kaum gay, janganlah kamu mak nipu nipu cewek, apolagi cewek baek baek kami jebak dio didalam hubungan suci pernikahan. Lagian jugo jadi gay tuh lah salah beduso, apolagi nipu wong lain. Betobatlah kami sebelum ajal datang ngejemput!",persuasive
1365,"Menurut beberapo sumber yang aku baco, ternyato untuk penderito penyakit diabetes pantangan nian untuk makan ansi putih. Menurut ahli kesehatan, Nasi putih mengandung karbohidrat yang terllau tinggi dan jugo Indeks glikemiksnyo tinggi. Pado penderita diabetes mereka dak biso ngelola glukosa kedalam darah, jadi amen mereka makan nasi yang  berlebihan mako bakal terjadi penumpukan gilo darah dalam tubuh yang akhernyo biso merusak jaringan tubuh yang laennyo. Makonyo menurut pakar kesehatan wong yang punyo penyakit diabetes memnag dak disaranken untuk ngonsumsi nasi putih. Makonyo banyak dari penderio  diabetes yang akhernyo bealeh untuk ngonsumsi nasi jagung sebagai makanan sehari-harinyo kerno karbohidratnyo lebih rendah daripado nasi putih. ",argumentative
1116,"Tekadang banyak uwong yang ngeraos bersalah atas sebuah kejadian yang diluar kendali dio, misalnyo mereka ngeraso bersalah kernonmereka dak biso ngelakuke sesuatu hal untuk ngehindari sebuah kejadian yang bikin bahayo. Hal ini kan memang diluar kemampuanyo, tapi ado uwong yang malah ngeraos bersalah. Hal ini sudah dak wajar untik uwong yang ngeraos bersalah kerno hal hal yang diluar kendalinyo. Wong yang punyo sipat mak ini kemungkinan ngidap penyakit mental yang disebut enosimania. Penyesalan mereka dengan raso bersalah yang mereka tanggung biso ngebahayoke kesehatan mental mereka. Mako dari itu diperluke beberapo langkah penanganan untuk wong itu biso ngelepaske raso bersalahnyo, kerno memang hal itu bukan salahnyo dio.",expository
