id,text,label
emot-test-180,"Abdhina ongguen, manabi pak [USERNAME] degghi' kala, abdhina ango'an kala sareng yusril daripada sareng prabowo Tape kan lok mungkin kalah ye...hahaha [URL]",happy
emot-train-1871,enga' sittong bhektoh sengko' bhekal adeddiaghinah ba'an tempat sampah nga' ba'an adeddiaghi sengko' tempat sampah!,anger
emot-train-131,kadhang engko' arassa parkara. tako'. tako' bhakal ta' ngaolle se ekaterro. tako' bhakal kaelangan se engko' bada. tako' bhakal sakabbhinna aoba sakeddhepbha mata.,fear
emot-train-3124,"Sejuk ben anteng ajheling ru-bhirunah sabe akadik lama'. Deri dinnak kita bisa ajher jhek hasel se becce' bhuto perhatien se becce' jhughen. Dhisah Wonotirto, Samboja, Kalimantan",happy
emot-train-2015,"korang lebbih nga`ruwalah essena sorat adipati karna ghebey binina tercintana, dewi surtikanti. pajhet ta` saterkenal se laenna tape ye adipati karna ben dewi surtikanti se adipati karna katerroe sampe` matena dateng.",love
emot-validation-374,"tak taoh arapah engkok mak takok mbik tasek se rajeh se e ngah tengah deiyeh ngetelak rajeh sarah aingah bein nakoin sarah taoh lah ariah phobia pa enjek, keng engkok tak trauma bik tasek se rajeh. aneh keng nakoin, aslilah.",fear
emot-train-3157,"Rencana ta' mole aghereppeh proyek, nyatanah ta' ngerjaaghi sama sekaleh. .  Tao dha'yeh, mole Deri Minggu beri'. . hmmm, hikmanah romadhon: mungkin lakar parloh alebedhi ryah, yeh ghebey ajher beih",sadness
emot-train-2489,neka bonbin lakar ampon lok ka urus! paya! -_- tabrak paghar zebra neng kb sorbajha mate,anger
emot-train-2805,"[USERNAME] [USERNAME] Daddhi mayoritas epon jughan hasel paksaan , benne atas pangaterroan dhibi'. Lakar bendher bannyak se epaksah sopajha eketarah mayoritas. manabi lok gellem daddhi mayoritas. melannah bhakkal epemelarat [URL]",sadness
emot-train-1007,"reya Bhuru pamekkeran Professor, magghi Ghi junior etembhang Professor cebong anu, se reya lebbi bhaghus Ban andi' pangabdhiyan [URL]",happy
emot-train-799,"Engak engak!! Jhek nyemma'en zina ben jhek ngelakonen zina. mandher para supir truk ben kek-lakek se ampo ""ajhejhen"" sadar #Supir Truk Kiah Taoh #dhulih Atobhet",fear
emot-test-22,"[USERNAME] [USERNAME] [USERNAME] [USERNAME] Betul kak. Engkok kiah kecewa, polanah Rahtawu ajiah sala sittong objek alam se dheddhih keleburennah masyarakat Kudus.",sadness
emot-train-1042,Lendhu e Lombok ghita' ambu. Paleng enja' la duwa' atosan lebbi bada lendhu sosolan sajjhek lagghu bari'. Pas engko' abayang da'remma rassana dhaadhi reng-oreng se bada edissa setiya. Pasti ta' ngeddha tedung polana kobater.,fear
emot-train-1255,Ta' nemmoh (otabeh mungkin ta'kerah nemmoh) oreng se bisa nyambhung-acaca-ka bere'- ka temor sambih ju'-toju'-ta' ngalle-tempat dheri pokol 15-22 otabeh pokol 7-21 tanpa terganggu bi' hp kerrong Sarah.,sadness
emot-train-3083,ARAPAH [USERNAME] ta' ekenning WO pak? La jellas pelanggarnah Mak kabbhi oreng taoh:) bubar aghi beih bal-bal an indonesia mon mafia nah ghita' mateh:) [USERNAME] [USERNAME] [USERNAME] [USERNAME],anger
emot-train-1491,Bhender sakale otamana nyebrang e Jhalan Margonda. Dari kelapa duwa' - pertigaan Juanda paleng pera` bede 3-5 zebra cross. Motor-mobil kabbhi ngebut sampe` tako' mun nyebrang. Sakalena nyebrang malah dhaddhi kabater kendaraan ngerem dadakan ,fear
emot-train-2132,"[USERNAME] Ai, serrem ban eman sara... Mon tang tatangga, tabra'an nongghal e daerah pulogebang, koca'en polana lesso da'iya, e bhilughan ghagghar, kabada'an bada beddhi ban bada trek, lokana sampe' ekatela' dhaghingnga... Terros rowa etolongi maso kancana se pada ngangghuy honda... Tengate d",fear
emot-test-343,Deddhih engkok lok bengal masok deri gerbang roma rapah jiah nako'en sarah e jhelingin ajem jagonah cek rajenah,fear
emot-validation-305,Romantis ghebey engkok kiah ngelakonen apah se kodhu e lakonen ghebey sebuah hubungan ben bedeh bektoh pasangan ongghuen bhuto.,love
emot-train-3377,Ampon a jutah kaleh bong eberri' oneng.. Pak Harto coman kejjem : Pki bandit rampok sampeyan katoronan kalompok kemmah bong??? Hahahahaha,anger
emot-train-1535,"reya kolom etunda pole, paleng enja' bhibbhas visa etunda pole. Lakar ya reya naghara PHP tingkat tengghi. [USERNAME] [USERNAME] [USERNAME] [USERNAME]",anger
emot-validation-123,"[USERNAME] [USERNAME] Nyo'on jha' ngibeh nyamah nak kanak ngodeh bro, manabi ghi' a debat sareng pak [USERNAME] lok ngaghem data napahpole nyenyer. arassah generasi milenial korang literatur.",anger
emot-train-3443,Lakar tabiat maleng.. La epekot ghi' salam metal.. maleng pagghun maleng,anger
emot-train-1713,tape pastena secara riya bekasi bede hal-hal se sayangnga ta' taelakaghi. 1. bekasi ruwa panas. sara. 2. Bekasi mun akhir minggu sore/malem ruwa macet. sara. tape hal nga'ruwa bisa epamare ra. mun panas ye angghuy ac. majhauh macet bi' rencanaaghi jadwal kaluar bengko.,anger
emot-train-3433,"{mu} kalian mandheng oreng se ajherebek'en deemmah seh? engkok mareh beberempah kaleh tes univ selalu berakhir lok ngobrol bik pa-sapah, polanah engkok takok mereka lok nyaman bik tang jherebek.engkok terro andik kancah tapeh tang pekkeran sellau deiyyeh. tolong sarannah bhein yeh",fear
emot-validation-87,"engko' maste dentek pas lagghu edimma manossa ruwa ngerem pesan singkat se essena maste pade ""are riya bede PR apa?"" pas ra-kera kol 07.30. bi' banggana engko' arassa setting-settongnga bebini' kepercayaanna e sakola'an, lebbih pole jeriya ampo careta masalah keluargana. ",happy
emot-train-2281,"sekelangkong gebey ca kanca  basis [USERNAME] se la aseddia nyempataghy bektoh deddi panitia. ghe mogeh Allah SWT teros maringin rezekkeh se halal ben barokah kannguy kauleh ben ajunan sadejeh, aamiin",happy
emot-train-3408,dedi etremah engkok gik tak eberik nomer hp. Mon tang kancah pas aberikah nomer hpalah ke suspen permanen dedi engkok pas deremah?takok kiyah dadinah,fear
emot-train-2369,"berik sore olle pelanggan se mesen grabcar [USERNAME] , orengah mentah gebei ngateraaghi nasek kotak kaangguy rengseponah e roma, ben alhamdulilah engkok eberrik nasek kotak kiyah gebei abukah. gemogeh rejekenah epelancar ye /cak.Cc : [USERNAMe] [URL]",happy
emot-test-208,"Pacar se sae engghi paneka se nasehatin smpeyan lok toman a benthak, tape sareng lemah lembhut & kaseh sayng sambih a sennyom & natep matannah sampeyan",love
emot-train-361,"tak usa e aminin . duenah been tak kera mandih, . padenah oreng se entar umroh kelaben niat ""politik"" tak kera etremah. been ngira kampanye bik acerreng takbir, se kabesah bekal norok nyoblos # Mikir",anger
emot-train-1480,"Arekkep ale'. ""Sayang pasabbhar ya. Ale' teppa'en ngandung kan. Jha' emosi terros, bahaya la ka kandunganna ale'. Kan Vian la ngoca' keya, ya?"" Nyeom daina ale'.",love
emot-validation-350,"nyo'on sapora, banne terro dhaddhiya karja manco', coma reya fakultas eseddhi'en jhalan rektorat ghi' bannya' se anyaba HTI. tolong peggha' ghallu bu. sakalangkong. [URL]",sadness
emot-train-115,[USERNAME] [USERNAME] Halaaahh e kritik diddi' langsong ciduk... napahpole atemmoh... noh reng-prengah sampeyan bengallah lakar neng medsos tok giliren diskusi ka bukka' plangaplongo.. ngalor ngidul buruuuuuhh,anger
emot-train-1557,"Kabbhinah akadik ancor seketika keng bik sittong foto . . . . . . . . . . . . . . . . . .Ben neng akhirreh, eengkok se lok bisa mahamaghi artenah foto ajiah",sadness
emot-train-3115,teros dosennah se nyaman riyah eyajek abenta... terharu enjek pas mong omongan tesis e soroh dung tedungan kadek :') ajiah malaikat se toron pas dedih dosen yeh. subhanallah [URL],happy
emot-train-3198,"[USERNAME] [USERNAME] edentos drama selanjutteh, mon parloh ngangguy jasa na'-keni' se ghi' polos, reng la towah, faker misken, ben adegan gellu' ben tangisen..",sadness
emot-train-1864,"Napak 2019 jokowi kala le e pasteaghi : HTI bangsat bangkit, teroris bangsat bangkit, Radikal bangsat bangkit. Kabbhi politik beles dendam bangkit. Se minoritas e teken.. mending mesaen abek deri NKRI.. ghebey jiah kodhu 2019tetepjokowi..",anger
emot-test-350,"benni engko` majheuh otabe ta` bijak dalem nyikape masalah, tape pera` bhai terro nenangaghi pekkeran sakejjhek ben ta` terro mentengaghi ego dhibi`~",sadness
emot-train-591,"Raeh se terkaseh e pojha pole. Pepe se semmoh teros eosap pole. Matah se meddhem neka e ciom pole. Neka bendherraghin oreng manabi, ""Cinta neka butah.""",love
emot-train-1286,"la ta' sabbhar dentek parhelatan #festivalgamelaninternasional2018 . solo ashiap narema kadatangan lebbih dari 50 kelompok gamelan dari dalem ben luar negeri, dalem pergelaran IGF 2018 se epabede 9-16 Agustus 2018",happy
emot-train-1478,mon mele pamimpin banni petahana dagghi' dhaddhinna gub ta' tao & sengka alako enga' reya [URL],anger
emot-train-32,SUNDA KELAPA Alhamdulillah lastarennah trawe e Masjid Agung Sunda Kelapa. Nekmat sekaleh. 23 roka'at tape nekmat amargha bacaan imammah mantap. Neka masjid parsembahannah Gubernur Ali Sadikin ghabay masyarakat Jakarta. Yok nyoba trawe e ka'dhinto Pak Gub [USERNAME] ban Pak Wagub [USERNAME] [ URL],happy
emot-test-199,reng taneh dieng rogi sobab bun upas - paleng ampon molae koduh e petandhes kongrokong BMKG sareng Dinas Pertanian abadhi wilayah-wilayah khosos akadhi dieng sopaja badha peringadhan kenne'an bun upas - apah mongkenaghin? [USERNAME],sadness
emot-test-374,"Selamet aolang taon tang idola,tang mas sekalean tang ebes tercinta makeh jarang atemmoh tetep asellep duweg ghabay sampeyan ghe-moghe sentiasa e berri' kasesadhan,rejekeh & karendha'an ate",love
emot-train-1998,oreng se gagal e masa lambe`na artena oreng ruwa paleng ekabejhi`i Allah ruwa pera` prabhucor polana otegka kiya bhucor bhucor bhucor pengikutta apa pole otegka ter-moter [USERNAME] [USERNAME] [USERNAME],anger
emot-train-250,"Engkok ghellek neng sekolaan cek-ngocek matah kan yeh. Marenah jiah bennyak bulu matah se rontok. Langsung panik reh, takok mon ghondol selajeh. Nah, bulu matah jeh bisa tombu pole njek seh?:(",fear
emot-train-3375,Intelektual Ngodeh buruh bein reh badha kasos oreng naek pesawat tape neka a careta ngibeh bom sampe' akherrah ghabay reng-oreng panik #FiestaMaksimum,fear
emot-train-333,"Dhujen tegghiren sareng fans sek sok-soken ngantor, sok-sok en se paleng taoh segalannah. Hey sampeyan Ibu Neeghara benne, cenayang benne, ampon lebbhi sae mangeteg male dunnyah neka berse dhari seghala macem cacannah sampeyan",anger
emot-train-512,"sebben George alier minta ngenom, mesti engak ka kededdien e Thailand ma (USERNAME).kauleh sedejenah ngangguy motor dissak, ( robenah engak honda new supra) ben tak taoh ariyah eyesseknah bensin ngak apah, ben beremmpah pesse gebei seliterrah. mon pas eyesseh nyak gas kan pas budduh..",fear
emot-train-3453,"Engkok selalu korang sepakat bik caranah reng-oreng ngereduksi kapitalisme sebetes penciptaan lagu cinta. Kapitalisme neng dhunnyah musik benne keng ajiah, tapeh ghik bennyak se jheu lebi luas kadik eksploitasi, lok setaranah gender, kesenjangan produksi dll.",sadness
emot-test-375,"[USERNAME] [USERNAME] [USERNAME] Reng-oreng PSI jiah termasok kiah si [USERNAME]  ajiah ""anak anyar"" neng dhunnyah poliitk se terro leghis populer bik cara manceng reng-oreng se le populer ghebey interaksi bik mereka. Neser rapah .....",sadness
emot-train-3,"dhaddhi samalem, engko' rekap, eh intina se engko' usahaaghi lako nyatana nol sakale.. presentasi kol 16.00, engko' bhuru kabhuru kol 13.23. jiaaaaaaahh",fear
emot-train-1682,"Parcaja oca'en reng lake' rowa, otamana bakto engko' terro mateya polana eseksa jhaman. Tape polana kamateyan ta' ghellem tebha, engko' adhinaaghi-Rowa. Tuhan majhau, ban engko' keya ajhaui. Engko' ta' tao, apa iya ghi' parlo sajjhak engko' loppa.",sadness
emot-test-7,"Benni engko' se ta' ende' noro' bhuka bhareng, tape dompet se protes ""bhuka malolo ba'na engko' ta' e esse-esse, dompet palempo, bhadhan ba'na pakoros jhe' kabhalik"" oke sip lagghuna engko' lembur enga' jharan",sadness
emot-train-1464,"ba`na gi` ta` lahir otabe sakolah cong engko` rassa.... otabe bapak ba`na pki cong bandit , rampok otabe samacemma se aganggu oreng bannya`? pak soeharto ekoca` kejam pera` ben reng-oreng Pki bandit rampok cong cong congakkk [URL]",anger
emot-train-2644,oreng pesimis aserro soal angin,sadness
emot-train-917,"ritual mun tedunga anyanyi lagu sayang kakak Ani, sayang ebok, sayang bapak, sayang lek, sayang mbah lake' gio, sayang mbah bini' (nybbhutaghi kabbhi anggota keluarga raja) nyamana ba'na maste ghelluan esebbhut dek ",love
emot-train-1559,"/rlt/ engkok cek tako'eng ghebey dheddhih engkok dhibik... Benne berarti setiah engkok dheddhih oreng laen, tapeh lebi nahan abek. engkok terronah ngelakonen A tapeh engkok takok dheddhih ngelakonen B. Engkok takok reng-oreng ngejheu 'pole' keng polanah engkok dheddhih engkok dhibik... Engkok kodhu deemmah?",fear
emot-train-1837,"Mareh Ngakan e Bumen, Ngakan sosis padahal Aliando ngoca' la kenyang Ben jiyah messen sosis terro se okoran XL ontongah kosong Ben akherah se L. Gileeeeeh ba'an [USERNAME]",happy
emot-test-286,"Terro careta dhaddhi ghella' sabellun magrib sempet kalowar roma kaangghuy ngater ale' bhukbhar, la e jhalan mole katemmo maso ni'-bini' akodung tape obu'en ekatela' ebudina:) Mereka agunceng 3:) Ban jhalanna etengnga:) Padahal jhalan ramme:) E Esalep katellona nyacam :(",anger
emot-train-3406,"hah ! Nekah bendher ghi?? Manabih bendher, Astaghfirullah..Masya Allah...Naudzubillahiminzaliq !!! Partai Islam...Partai Allah. Kalakoannah...SETAAAN !!! [URL]",anger
emot-train-2326,"Be'eri' nyepper ngopi ben nyoba' toko khusussa , marena nyaman kiya gitarra. . . . #gitarghebeyodi'  @ Pondok Labu [URL]",happy
emot-train-1787,"benni keng tak adukung otabeh tak aduaaaghi, keng nyikapi se la remareh, ajiah peleknah been ben usahaaghi gebei pertahanaghi... edinnak engkok deri jeu kodunah seneng keng ngabesin been seddi tang kesenangan bujer... engak pas bekto juah nerema undangan kabinnah been.",sadness
emot-train-1117,Momen istimewa pada benne coma abhareng so rowa tape kadhang keya akompol sederhana bhareng kanca ama'na keya #temankobong #lagghungopi,happy
emot-train-2467,"Manorot neka tindakannah neka benne pelecean sekseal? bendher kan dhabunnah kulah, elmonnah padha lok olle. Daddhi lok ngartedeh napah bein se temasok pelecean seksual [URL]",sadness
emot-train-3163,"Adek ghunanah pit alaben reng binek laen, terutama se mareh olle perlakuen lok nyaman. Pola lambek nek-binek lok andik ateh ben empati riyah kiah e lecehaghi, tapeh benne e laben, mala e angghep nyaman. Dus-nodusin!",anger
emot-train-840,"neka anapah kaula lebbhi senneng  internet friends. mereka se lebbhi peduli, sampe'an mereka se selalu semangat pas kaula teppak bedhe babha. keteghan mereka se mabadhi mood kaula ongghe. mereka se bisa mabadhi kaula agelle' coma lebhat kacah hp. Kaula lok panthes ghabay mereka tapeh kaula cek tresna na ka mereka kabbhi.",love
emot-train-258,ben bektoh bik hedeh adalah hal se paleng berharga begi engkok ben selalu bedeh rasa takok begi engkok lok kerah bisa pole kadik riyah e masa se bekal deteng bik hedeh,fear
emot-train-1655,"Teppa' kaula a dhabu ""Bhu mek tang kepelengan lok dik lang elang ghi?"" Jawabhan Ebhu singkat padat reng-ngeres ate: ""Ghi neka amargha kagundudhen, mangkannah kepelengan"". Kabbhi panyaket se badha dalam badhan neka selalu ebhu hubungangin amargha efek ""ghendut/motok kaponjulen"" Termasok kecetit, ghatel""",sadness
emot-validation-307,Ahoker PDIP neka anapah ghi pak lok Toman obyektif nganilai prestasi? Anapah Ahok selaloh ngeklaim paleng berprestasi? Kasesadhan opini publik engghi paneka jahat manorot kaula seh [URL],anger
emot-train-3049,"[USERNAME] [USERNAME] ngetek ajiah padeh mon pas romoro Mak ngocak "" Kak totop taperwerah Mak bede dimmah ye? Benni gellek been se ngangguy? "" jeng jengggg :(((((((",fear
emot-train-3218,"Engko' asokko bakto nyongngo' FM Olle arekkam ngangghuy hp... se ta' olle kamera professional malolo wkwkwkkw sakalangkong mecima Bando2 keya esoro ngocol kabbhi, se mellisi ya coma oreng se arekkam ta' ngangghuy ate bhai, ta'osa arekkam lebat tengghina cethakgha kak pola... arkat sara",anger
emot-validation-344,"Sekelangkong tang tretan/tretani... Kalian le nyadaraghi kami jhek molenah deri persinggahan riyah lok mele e dimmah kennengngah ben bileh bektonah, akadik aeng matah se lok toman mele kennengan ghegghereh. . . . [URL]",sadness
emot-train-501,"Halo Sayang, aben yeee... semnagat lakonah, jek kaloppaen ngakan kakanan se la egibeaghi ben seengkok, mon lessoh ngasho kadek sekejjek pas buru lanjut alakoh pole. engkok cek sayanggah ka been!",love
emot-train-418,mandher ba`na ye noro` arassaaghi menghayati ben ngabes lanngi` malem riya ma` le ba`na bede pornama edissa` bede bintang-bintang edissa` se maste ngancani ben ngabessaghi cinta abe` pas abe` nyeddha.,love
emot-train-914,"[USERNAME] Wkwkwkwk padhal dhalem 7 taon ampon pansaponapan kaleh ka Bandung tape lok perna atemmoh. Tape akherrah atemmoh wkwkwk b bein loh cil, jha' baylebbay ghi",happy
emot-train-2078,"[USERNAME] Ghabay sakean kalennah,lok sepaham sareng akun anonim neka Ampon molae kabablasen dhalam kabebasan nga argumen Bannyak hal se e kritisi namong lok ngangghuy nalar ban ate nurani Awallah kaula tertarik sareng tweet tah,sajhen kannak sajhen lok ghaduwan kontrol..ah",anger
emot-test-123,"benyyak mahasiswa anayar e kampus, ajuah kabbi tak taoh mon akuliah riyah tak engak e lem film se gun ngersengeran kabbi. Deggik akuliah olleh sebulen longset muanah.",sadness
emot-train-2057,"Sakalangkong da' sadhajana, kaula neser ka sampeyan ongghu. Kaula ta' toman kasta 1 dettek bhai bisa apangghi sampeyan. Se bada kaula asokkor, sampeyan ongghu-ongghu kadhi sonar neng odi' kaula, sakalangkong sayang",love
emot-train-1893,Dung-tedungngah bik se andik rassah..akadik rassah nyaman neng foto riyah.. Otabeh rassah sayangnyah engkok dek hedeh.. Eeaaaa #SeporanahEfekSetres #EfekLDR #EfekLaparKiah [URL],love
emot-train-1815,"Teros ngabatin, ""E sae ghi sareng se ghaduwan  anyarrah sampeyan. Eh. Massah ghanteng. Ghaduwan cafe pole. Mangken sampeyan e angguy maen neng cafe kadhi' se kaula jhanjiin 4 taon sabelunnah.""",sadness
emot-test-267,otabaaa kaula se lok toman kaloar roma para'  tellasen saengannah kaula lok olle kabiasaan reng-oreng para' tellasen alakoh napah bein? duh pencerahen sarah mentin gelle' neka.,happy
emot-train-2999,[USERNAME] Engkok ngetelak rp binek benne deri chara&pengikutteh tapeh deri kepribadiannah deemmah ajiah ngibeh chara nah ajiah ben jiah se bis angebey engkok jatuh cinta bik ajiah.,love
emot-train-2992,"[USERNAME] bagooosssss, pecatttt.!!! Demi neser ka buduk kabbi elakonin, Demi kebutoan dere katoronan apa bein kodu e korbanagi, !! neser buduk neser buduk",anger
emot-validation-196,"Spontan ngodi'i sonarra hp ban nyare tisu kaangghuy ellap. Ta' loppa sabellunna engko' nyenter bagiyan attas kamar loros maso kennengngan dhrisdhisan, tada' pa-apa. Terro nyongngo'a hasel ellap e tisu pun tako', bakto babgal nyongngo', ontong ya coma aeng biyasa, polana teppa'en klesma, parcoma keya terro nyeoma bauna",fear
emot-train-174,"gebei bur leburen, macah jiah pas macah twit lucuh e#OldMoneyGakNgerasain . nyatanah tang odik tak lebih deri remekan nang ginang. engak menungsah se ngakan e kiefsi bein lah e gebei pamer e story hahaha . engkok todus [USERNAME] [USERNAME] [URL]",happy
emot-train-2515,"mase been ngilangagi ngontalagi engkok aganteh tang cinta kebih tak kerah bisa ilangagi cinta se mareh been begi~ mase been maleh, engkok pegun e selanjengah tang waktoh dinah engkok seneng ke been bik tang cara",love
emot-train-3390,"[USERNAME] Engkok iri dek hedeh, se bisa nonjhukaghi rassa sayangngah bik kelakoan. Apah mon engkok se cuma bisa neng=enneng tapeh lok taoh alakoah apah ghebey nonjhukaghi tang rassa sayang dek mereka hehe :)",sadness
emot-train-982,Drama berik sore : seareh saareh apasah maloloh pas teppen mandih takerjet polannah kerabuen tamoy tak eyundang cak passah woi pas tepaen adzan Magrib teros posang saareh eyanggep sah pasanah apa enjek-_-,fear
emot-train-3103,e been!! mander mogeh engkok bik been ejeuagi deri kepotosan buduh segellek selamet angalakonin apasah kiyah budirrr@olfi_opi,anger
emot-validation-37,"[USERNAME] Selamat Siang Sahabat Pos, Kereman anekah lastareh e teremah ghi sahabat. Mator salakangkong lastareh percajeh ben ngangghuy layanan kami :) ^FD [URL]",happy
emot-train-1437,[USERNAME] [USERNAME] .... Hedeh riyah ngocak apah....?? Keng reng-oreng melleng se ngocak deiyyeh..... Lembaga terhormat dheddhih kenneng jhubek polanah e masoken oreng se kom hedeh... [USERNAME],anger
emot-test-246,"saongghuna tade` maksod jhube`, pera` senneng ben pencapaian potrena kanca, se epasakolah desain komunikasi visual, secara jhaman sateya oreng pade enger soal sakolah negeri ben zonasi... apa bisana e angghap gi` ta` bisa ngalle ben kabbhi kanca lambe`... dhaddhi terpaksa ta` noro` sejeriya...",sadness
emot-train-2320,"[USERNAME] [USERNAME] tade` se ende` engko` ungkapaghi . jeriya bisa gebey nyaman . engko` nganu apa bhei jeriya kiya iyeiye bhei , baghusse talebet , manissa talebet , gemessa talebet , ngambhulle kiya talebet wmwkwkwk. ce` sayang dika",love
emot-train-3342,[USERNAME] mun engko` ye bhuka abhareng polana engko` pera` e Indonesia sampe` akhir bulan ben bhuru abeli ka indonesia marena 14bulan dhaddhi engko` kodhu bhuka abhareng malah maksa. Mun ba`na endi` kanca se enga` engko` apa ba`na pagghun ta` ende` norok? :) kanca semmak ta` katemu 14bulan,sadness
emot-train-12,Romants neka MANES lebbhi manes pole manabi e lakoneh oreng se kita SAYANG. sadhajannah bhakkal arassah senneng anga-bhunga wkwk. Akadhi badha ebuen pu-kupu ngabber se badha neng tabhu' manabi badhi pole se ngaromantisen kadhi' neka.,love
emot-train-2343,cek mirisah ngabes oreng seroneroh apa pole settong oreng se ngajer agemah tapeh tak perna tepak ngangkui atoran bahasa se nyinggung oreng lebet media sosial.,sadness
emot-train-744,"Ta' enga' ba'an perna ajenjih mabahagia sengko' saterrosseh. Tade' Artenah cinta kita se lambe', sampe' ba'an abhereng jiyeh. #recehkantwitter [URL]",sadness
emot-validation-243,"[USERNAME] Akhirreh engkok atemmoh pole, reng lakek se berempah taon lambek gagal engkok semma'en. E bektoh taon riyah terro merjuangaghi cinta pole ternyata hedeh le bedeh calon ghebey e pekabinah",sadness
emot-train-223,Mon bada loka tabukka' keya lebbi raja key palowang nolarra.. conto loka tabukka' polana ecokor.. la pakakas cokorra kan ta' toman e steril .. ma serrem ya #DeteksiDiniHepatitis [USERNAME],fear
emot-train-3098,korang pengertian bisa cinta bisa kiya bejhi` tape ta` pernah ende` kenal,sadness
emot-train-2396,"hahaha du nad rowa bisa bhai ya kake dhala etompo fans 'kemmena bhai ta' loros  ta' tao apa rowa bi' kake kalowar dari jhaman Ngenynyi' abu-ebu episode rowa, jhaman ghi' ghenna'",happy
emot-train-3148,Abagi Kalaban Pada Manossa Samogha Amanfaat,happy
emot-train-362,"La reya, se nantos ana' tegghu kalaban kasabbharan salebar saghara pas eppa'en teng-datengnga manangis ana'. Hmmm terro ngamokgha alampiyasaghina",anger
emot-train-1028,"Hahaha... be ajriyah tak abenta kiyah riyah, pas bede oreng menta foto polanah wes wes ajriyah manossah apa patung, engkok sempat andik pengetero mecek elongngah hahaha... keng keteggien",happy
emot-validation-437,HAHAHA BODO AMAT RAPAAHHH SE PENTING NENG VIDEO riyah SITTONG FRAME BIK DANIELSAYANG SARAAH RAPAHH DEK AJIAAAH BEN MEREKA [USERNAME],love
emot-train-467,"Pembukaan ta' perna e AMANDEMEN DHEBE' BUCCO' ATAS BERKAT RAHMAT ALLAH SE MAHA KOASAH... BA'AN BECAH PEMBUKAAN UUD1945, EJIYEH KABBI DHESAR NAGEREH R.I BE'20O LAKAR BHUDUH",anger
emot-train-2796,enja' la engko' reya banne cewe' gendeng se daniel cowo' bule terro ngampongnga odi' e Jakarta maso cewe' se bisa aberri' rowa kaghampangan odi' edinna' enja' ra saporana magghi jhuba' towa engko' ta' enda' emanfaatdhi bhai,anger
emot-train-485,"kaom kampret tettep mekkerrah kebhalig akadhi kampret neng pohon, kemmah badha WTP ghabay 2018? Se badha WTP 2017, GOBLOG mek epetaoh.",anger
emot-train-1674,"senneng ye sareng kancah se ngetweet konten-konten se ""berwawasan"" , napa pole e dunnya nyata bisa abhagi elmo... daddhi kondoan & kritikan bisa lebbi bermanfaat & napa pole manabi nyambhung dhabuannah... tak coma bahas lamtur & lipen tok",happy
emot-test-224,[USERNAME] Obhang se badha neng Dompet kaula ampon 2 bhulan lo bia e sareaghin ragara e beku aghin kabbho pertanyaan Pihak Bukalapak soal jhualan se a masalah ampon e jhawab kabbhi sampe' te-bukte nah epon sakabbinnah kaula kerem tape sampe' samangken dompet kaulah ghi' di,anger
emot-train-1700,Sala sara la salagghuwan amaen jham paser. Yaampun bhakalan seddhi sareyan. Terro Settong! Engko' lesso misken tape Mon mekkeren apesa maso kalian rowa ewhh.,sadness
emot-test-390,"[USERNAME] engkok kiyah dekyeh ke kabbi oreng apapole rengseppo. tambe areh tambe seppo ben engkok ye tak taoh mon mereka sadar apa enjek mon engkok beles ke mereka. patek paya sarah enjek mon engkok bide mon ke Cacak otabeh pacar (mon tepaen andik), ekspresinnah lebbi gempang",love
emot-train-2519,"Ghebey Mbak Erning, engkok riyah mon e telusurin ghik bedeh bhala bik hedeh, tolong engaken engkok lok ghileh ben apah se engkok lakonen neng romanah hedeh engkok engak kabbhi.",anger
emot-train-397,"Ariyah arapah dheddhih kesannah dheddhih Via Vallen vs Persija seh?? Ariyah oreng binek vs pelecehan seksual oii. Jhek mala ngebey kesannah Persija adukung pelecehan seksual. Simic lakar ngawor ben pantes olle ghenjheren, tapeh engkok yekin karir ballah tak kerah kenneng ganggu. Uno bhein pagghun dheddhih Wagub kan?",anger
emot-train-1595,"Hallo [USERNAME] Minta tolong bhentoagi yeh sengko' la nyerah bi' tang laporan e kantor cabang Sabang Jakarta pusat. . sengko' lapor tangghel 2 Mei 2018, masalanah ryah ketika narek pesse rekening akorang tapeh pesse ta' kalowar. can 14 areh kerja tape sampe' sateya tade' apah",sadness
