id,text,label
532,"Bawang merah samo bawang pitih merupoke cerito rakyat yang sering kito denger ceritonyo. Cerito bawnag merah smak bawang putih ini merupoke cerito yang asalnyo darj jawo tengah. Cerito ini bekisab tentang budak gades yang benak bawang putih yang punyo hati baik. Si Bawang putih ini punyo Mamak Tiri dan sodaro tiri yang punyo sipat jahat. Bawang putih tunggal besamo dengan mamak tiri dan sodaro tirinyo, sedangke balaknyk merantau untuk begawe kareno bapaknyo saudagar yang bejualan di negeri laen. Suatu ketiko bawang putih pegi ke suangi untuk nyuci pakaian ternyato disano dio nemuke labu yang ternyato beisi emas. Dio balek dan nyeritoke hal ini ke mamak tiri smao sodaro tirinyo. Kareno keserakahan si mamak tiri dan sodaro tirinyo ini, mereka buka labu itu tanpo bawang putihnyo tahu. Tapi ternyato pas labu itu dibuka isinyo malah bukan emas melainke ular bebiso. ",descriptive
871,"Atlet renang dari Italia Flavia Zoccari harus ngeraso malu dan amper nangis dikernoke kejadian baju rennagnyo yang sjbek aps dio lagi tanding renang di olimpiade mediterania 2018. Kecelakaan ini tejadi pas lerekan baju Flavia Zoccari tibo tibo rusak, nyampek bagian pantatnyo tebuka. Waktu itu Zoccari lagi melok lomba olimpiade meditearnia, di Pescara Italia. Kejadian ini tejadi pas persis sebelum lomba dimulai. Zoccari yang tibo tibo lerekan bajunyo ngebuka ngeraso mali dan mundur dari lomba kareno dak punyo cukup waktu buat ganti baju. Dio tepakso mundur dari kolam dengan tangan nutupi bagian pantatnyo, sambil nahan malu dio keluar dari kolam dan nangis.",narrative
1435,"Kalo kito biaso masak apsti lah tebiaos dnegan bau bau makanan. Pernah aku duli belom biaso masak makanan, tapi kerno ngekos aku belajar masak dewek dikosan. Jadi setiap hari aku belanjondi tukang sayur depan komplek perumahan tempay aku ngekos. Nah pernah aku beli cumi cumi, memang baunyo lah anyir nian. Tapi aku idka paham amen bau itu nandoke amen cuminyonlah busuk dak bagus buat dikonsumsi. Tetep kibersihke bae cuminyo trus aku masak. Selesai masak pas nak makan aku baru teraso aneh samo raso cuminyo. Bau amisnyo jugo dka ilang padahal sudah kubumbui smao banyak bumbu dapur. Ternyato ps aku cubo makan rasonyo aneh nian dna kuminthkan. Akuernyo aku tau amen ternuato cumi yang aku amsak itu lah dak seger lagi tapi lah busuk. Nah menurut aku buat kamu yang nak masak makananlaut apstikelah ikan atau cumi atau udang yang nak kamu masak itu seger. Biasonyo bau amisnyo dak begiti menyengat bedo amen dio lah busuk baunyo dka ilang ilang.",argumentative
1251,"Postingan di twitter yang judulnyo "" Married for 12 days "" yang merupoke pengalaman pribadi dari akun @Naimamaheswari. Dio cerito amen dio baru bae nikah selamo 12 hari dan hari eknduo belas itu dio ditalak cerai samo lakinyo. Awal mulo hubungan Nay samonlakinyk sebenenryo baek baek bae, ngatek yang aneh bahakan sebelom menjelang pernikahan mereka dak ngatek masalah. Dio kenal smaonlakinyk sudha cukup lamo, dulu mereka dikenalke samo kawan mereka. Samepk akhernyonkeputusna nikah jugo awalnyo dari yang lanang ngajaki nay buat nikah. Kerno meraso baek baek bae, nay setuju untuk dinikahi. Proses persiapan jugo dak ngatek yang aneh, segalo bejalan lancar. Memang ado sedikit masalah sehati sebelum nikah semet cekcok duo duonyo tapi baekan lagi. Sampek hari pertamo sampek hari ke-5 baek baek bae. Cuma pas dihari ke limo lakinyo mutuske but pegi begawe padahal masih cuti seharusnyo. Dari hari itu lakinyo dka ngatek ngomong samo sekali ke dio. Dan akhernyo nay sakit dna minta dijemput uwong tuonyo kerumah, soalnyo dio dicueki dirumah mertuonyo. Akhernyo bejalan 12 haru bukannyo dicarii tapi lakinyo malah nalak cerai dio lewat telpon. ",narrative
1404,"Ngejingok muntahan merupoke hal yang menjijikan buat beberapo sebagian uwong. Ini dikernoke oleh bentuk munthan yang campur aduk dak bebentuk, banyak lendir mecak tai teksturnyo, belom lagi bau asemnyo yang menyengat kerno isnyo makanan yang sudah tecerno oleh lambung. Selaen itu pulo muntahan itu biso jadi alasan penyebaran penyakit, dan hal itu bikin uwong makin jijik samo muntah. Ngeraso jijik smao muntahan sebenrnyo normal bae dialami samo tubuh kito .Hal itu jugo gunonyo untuk ngehindari paparan zat zat bebahayo yang mungkin biso nyebabke penyakit. Oleh kerno itu amen ado wong jijik jingok munthana biso jadi itu pertahanan alami dari tubuh kito. Tapi menurut aku, perasaan jijik idak boleh ajdi bikin kito dak galak ngebantu uwong yang mungkin lagi susah kerno lagi muntah. Kito biso ngebantu uwong yang lagi muntah dna ngebantu ngebersihke muntahan, biso jugo manggil petugas kesehatan.",argumentative
1398,"Aku dulu pernah praktek nanem biji bijian pas diekolah. Jadi kami disuruh naem biji kacang ijo di kapas yang ditaroh diwadah trus diisi aer. Bijinyo cuman disebarke bae trus agek tumbuh dewek besemi. Waktu itu kami disuruh untuk ngamati perbedaan tumbuhnyo biji yang keno matahari langsung samo yang idak keno matahari langsung. Nah deri praktek itu aku ajdi tau amen matahari memang bagus buat pertimbuhan tanaman biar tanaman sehat, tapi untuk dapetke ukuran tanaman yang tinggi jugo dak boleh terlalu banyak keno matahari kerno cahayo matahari biso merusak hormon auksin jadinyo tanaman dak biso tumbuh tinggi. Nah ilmu itu sekarnag aku terapke untuk mulai becocoo tanam dirumah, aku dirumah punyo tanaman kangkun yang aku tanam dari bijinyo dan aku pake caro ini. Ayo ngisi waktu dengan bercocok tanam, lumayan hasilnyo biso kito nikmati dan waktu dka tebuang sa sia bae . ",persuasive
822,"Siapo atlet yang paling kamu senengi? Amen aku ditanyo, aku pasti jawab christiano ronaldo. Christiano ronaldo merupoke pemain bola yang memang terkenal di dunio. Skill maen bola yang luar biso, penampilan yang memukau, rai mukonyo ganteng. Itulah dayo tarik christiano ronaldo di lapangan maupun diluar lapangan. Dio lagir tanggal 5 Februari tahun 1995, di Funchal, Maderia Portugal. Dio pertamo kali bekarier secaro profesional di klub bola lokal "" Nacional da Liha da Maderia "". Umur dio pertamo kali gabung di klub ini sekitar 10 tahun. Dio jugo pernah gabung di klub bola Lisbon Portugal sebelum dio gabung ke Manchaster United.",descriptive
1356,"Jakarta merupoke salah siko kota besak di indknesia yang merupoke jadi pusat pertumbuhan ekonomi tertinggi di Indonesia. Aktipitas yang dilakuke masyaraakt jakarta memang selalu sibuk dari pagi sampe fajar, bahkan kota ini hampir dinyatoke kota yang terus hidup. Nah dengan tingginyo aktipitas disini mako emisi karbon yang dihasilke di kota jakarta sangat tinggi. Bahkan kualitas udara bersih di jakarat dak mungkin kamu dapetke karen memnag terllau kotor akibt dari hasil emisi karbkn kendaraan bemotor yang mebludak di jakarta pas jam pegi begawe samo jam balek begawe. Polusi udara di jakarta termasuk tertinggi di dunio smaoan dengen ebberapo negara aktif laennyo.",expository
812,"Akhir akhir ini banyak macam macam penyakit yang muncul. Alu agak khawatir samo lerkembangan lenyakit akher akher ini, jadi mulai setahun yang lalu aku mulai gayo hidup sehat untuk bikin badan aku lebih sehat dna kuat samo serangan oenyakit. Setiap pagi aku selalu bangun pagi untuk sholat subuh, abis sholat subuh biasonyonaku langsung ganti baju dan maek sepatu siap siap untuk lari keliling komplek perumahan aku. Aku lari pagi sekitar sejam, trus balek ke rumah untuk siap siap pegi ke kantor. Sebelum pegi ke kantor aku jugo biasonyo sarapan sehat dulu buatan aku dewek. Untum buat sarapan aku dak perlu waktu lamo kareno makanan yang aku makan jugo gampang dibuat. Sarapan pagi aku biaso makan salad samo roti gandum dan susu. Itu lah rutinitas pagi aku dalam usaha memulai gayo hidup sehat.",descriptive
402,"Buat yang agamo Islam pasti pas masih kecik kito disuruh pegi belajar ngaji samo guru ngaji. Balajar ngaji merupoke kegiatan belajar untuk ngebaco Al-quran dan jugo mengerti isi kandungannyo. Al-quran itu Kitab suci buat wong yang agamanyo Islam. Kitab suci Al-quran ini merupoke pedoman hidup yang biso negbimbing manusio biar biso hidup bener selamo di dunio. Makonyo tiap yang agama islam, pasti dari kecik lah diajari buat belajar ngaji, biar tau apo yang sebenernyo ado di dalem alquran, dan jugo biso ngerti apo bae yang diajarke samo alquran dnegan harapan gek kito tumbuh dewaso dengan memegang aturan aturan islam yang lah dijelaske di Al-Quran. ",descriptive
331,"Ado kawan aku pinyo cerito masonkecik dio yang sedih nian katonyo. Jadi dio punyo bapak galak ngebuki, bukan dio bae yang digebuki, mamaknyo samoa dek adeknyo jugo galak jadi korban kemarahan bapaknyo. Dio cerito pas masih kecik dio serimg nian njingok bapaknyo marah marah, padahal kadangan cumak hal sepele bae bapaknyo biso marah mecak monster. hal itu lah yang bikin kawan aku ini dak pulo percayo samo lanang. Ngomong ngomkng kawan aku ni betino yamg dak pernah punyo pacar, seumur idup dio jomblo terus, padahal mukomyo cantik. Tapi amen ditanyo ngapo dak nyari cowok, pasti dio jawab takut kejadian dio kecik geumang lagi.",narrative
1209,"Jadi cantik memang impian tiap betino didunio ini. Mangkonyo banyak bisnis dibidanv kecantikan sekarang ini banyak yang maju, kerno betino berani ngeluarke biayo mahal biar biso tejingok cantik dan awet mudo. Ms Glow merupoke produk kecantikan asli indonesia yang digagahi samo sandy dan maharani. Produk ini merupoke produk terjangkau dengan hasil yang memuaske untuk kulit betino. Nah kamu nak cubo jadi reseller barang kecantikan dari Ms Glow, kamu biso langusng hubungi store tedeket dikota kalian. Banyak keuntungan yang bakal kamu dapet sebagai reseller produk kecantian Ms Glow ini. Selain kamu biso ajdi cantik, kamu jugo biso dalet untung dari hasil penjualan produknyo. Ayo pengen cantik trus biso dapet sampingan, cepetlah daptar jadi resellernyo Ms Glow.",persuasive
217,"Ujian Nasional sering jadi momok buat budak yang nak lolos dari sekolahnyo. Aku alhamdulillah selalu lolos ujian Nasional, Dak pernah nyampek melok paket C. Nah sebenenryo jangan takut samo ujian nasional, yang penting kito memang harus banyak persiapan belajar smao ngerjoke soal soal. Fokus bae kesano, jagan sampe ado ketakutan yang malah ganggu pikiran kito. Trus jugo walaupun harus banyak belajar tapi kito jugo harus punyo waktu untuk Istirahat, tedok samo maen sebentar biar idka terlalu stress. Nah amen sekironyo kito lah maksimal usahanyo percayo diri bae, inshallah kito biso ngelewati Ujian Nasional. Selbuhnyo jugo jangan lupo bedoa samo Allah biar dikasih kelancaran. ",expository
546,"Suku Asmat merupoke salah sikok suku di Indonesia yang beraso di pulau papua. Suku Asmat terkenal samo seni ukirnyo, tapi ternyato selain seni ukir suku asamt jugo banyak menyimpan kekayoan senjato tradisional yang luar biaso banyaknyo. Kehidupan di jaman dulu sebelum manusio mengenal logam, ternyato suku asmat sudah lebih dulu ounyo senjato tradisional yang dibuat dari batu. Ngingetke kito dnegan kehidupan jaman prasejarah dimano manusio banyak make batu batuan untuk ngebuat gerbah bahkan senjato. Hal uniknyo adolah suku asamta yang sebagian besak menempatibdaerah pesisir tapi senjato tajam mereka malah tebuat dsri batu yang mano batu batu itu susah didapat didaerah pesisir. Teenyato mereka bejalan kearah legunungan untuk nyari batu dan dibuat untuk dijadike senjato tajam.",expository
1159,"Idup dikota besak mecak jakarta emang sering bae ketemu samo uwong uwong dak jelas. Sering nian aku ngeraso dikuntit samo wong yang dak kenal. Padahal aku jugo sudha dak bepakaian yang mengundnag syahwat, tapi masih bae ado wong yang galaka meloki aku. Kadang nak mikir positip mungkin bae niatnyo dak jahat, tapi kebanyakan wong yang meloki secaro diem diem mecak tukang kuntit biasonyo punyo niat yang dak baek. Nah buat kawan kawan betino yang tepakso harus pegi dan balek begawe dewekan, atau balek begawenyo terlalu malem mesti hati hati. ayo jago diri kito dengan ngebawa semprotan mato, atau semprotan cabe untuk jago jago amen ngalami hal hal mak ini.",persuasive
1045,"Pernah denger dak amen ado betino yang dihamili samo genderuwo? atau budak bayi yang baru lahir diganggui samo kuntilanak? Kepercayoan mak itu memang masih ado yang percayo, aku jugo kadnag masih takut denger cerito mak itu walaupun aku masih dak begitu percayo. Apolagi amen aku abes nonton pilm horor, makin menjadi jadi takut aku samo hantu. Yang biasonyo berani ke kamar mandi malam, jadi dak berani. Biasonyo teduk dengan lampu dimatike laju tedok dengan lampu nyalo. Sebenernyo bukan kareno percayo hantu, tapi menurut aku kebanyakan nonton pilm horor bikin pikiran kito jadi takut samo hantu. Pikiran kito pasti tebayang bayang terus samo hantu yang baru bae kito tonton, akhernyo secaro dak sadar kito jadi takut nianan. ",argumentative
133,"Hotel buat kito nginep selamo liburan biaosnyo dibedake menurut fasilitasnyo pertamo Hotel, hotel biasonyo punyo banyak kamar , dan punyo fasilitas mecak kokam renang, restauran, ruang rapat, tempat spa dan gym. Dan hotel pulo biasonyo dikasih kelas lagi ditandoi dengan bintangnyo dari 1 nyampe 5. trus ado yang namonyo budget hotel alias hotel murah meriah, biasonyo cumak nyedioke kamar dengan fasilitas seadonyo bae. trus ado Butik hotel, standar fasilitas biasonyo samo dengan hotel cuma lebih sedikit kamarnyo, nah yang bikin beda mereka biasonyo punyo bangunan unik punyo tema dewek. Ado jugo Hostel samo Guesthouse, Hostel biasonyo punyo kamar yang biso disi banyak uwong trus amen Guest house biasonyo rumah pribadi yang dijadike penginapan. ",descriptive
1147,"Banyak uwong yang punyo pengalaman dikejer samo anjing entah itu pas masih kecik ataupun pas lah dewaso. Pengalaman dikejer anjing atau bahkan sampe digigit bikin uwong takut samo binatang peliharana sikok ini. Tapi sebenernyo anjing idak bakal ngejer atau sampek nyerang amen meraso dak teganggu. Anjing punyo naluri nyerang amen dio ngeraso dalam kondisi bahayo, misalnyo kito ngelewati atau bahkan masuknke area yang menuurt anjing dak boleh dimasuki. Dio pasti mengginggong bahakn mengejar kito. Trus ado beberapo anjing yang nalurinyo mmenag nyerang amen kito tejingok takut, gugup dan cemas. Mungkin naluri kito itu tebaco oleh anjing dan menurut anjing naluri itu jugo membahayakan but si anjing. ",expository
970,"Pekawenan antara manusio samo robot memang sudah pernah tejadi dibeberapo negaro. Yang bikin heboh ado betino dari Prancis yang nikahi robot buatanyo dewek. Lily memang sudah tetarek samo robot dari mulai umurnyo 19 tahun. Lily memang jarang beinteraksi samo manusio biaso dari dio kecik dan selamo proses perkembangannyo. Lily memnag lebih sering beinteraksi samo robot robot dari dio kecik. Laju si lily keikiran untuk ngebuat robot dan berhasil. Robot buatanyo dikasih namo InMoovator. Lily sudah 4 tahun cumak hidup samo robotnyo bae, dan hal mengejutke dio ngasih oernyataan amen dio jatuh cinta samo robot buatannyo dewek dan lah betunangan. Dio jugo meraso hiduobyo bahagia beaamo InMoovator. Dio berencano nikah samo robotnyo amen pernikahan antar manusio samo robot dilegalke di Prancis.",narrative
83,"Tumbuhan pakis banyak kito tmeui di hutan-hutan. Tumbuhan ini punyo racun, tapi tumbuhan ini lemak amen dimasak trus dimakan samo nasi. Cuma akreno dio mengandung racun, mako ado trik dan tips amen nak masak pakis. Yang pertamo idak segalo tumbuhan pakis biso dimakan, jadi yang biso dimakan cuma pakis sayur kareno dio yang punyo paleng dikit racun daripado pakis yang laen. Racun yang ado dipakis sayur sebenernyo cepet rusak amen keno panas, Jadi untuk ngilangke racunnyu, pakis biasonyo dicuci samo aer panas dulu, atau dak direbus dulu diaer panas. Nah kalo milih pakis buat dimakan pilihlah yang masih pucuk daun yang masih mudo, kareno teksturnyo masih lembut. Kareno kalo lah tuo dia batangnya keras dak biso dimakan.",descriptive
1192,"Kecelakaan bus yang ngebawa mahasiswa Unibersitas ruau tejadi di Padang. Di beritake amen ngatek yang jadi korban kecelakaan tesebut, walaupun bus ngalami kecelakaan. Rencanonyo memnag bus itu pegi dari Riau nak menuju ke padang, pas nyampek di daerah Siliang Bawah bus memang tedetekso dak biso ngerem alias remnyo blong. Sopir bus yang namonyo Amri sudah ngeraso ado yang dak beres samo busnyo, laju sebelum busnyo nyampe ke kawasan tikungan tajam yang jalannyo turunan dan pinggirnyo jurang, sopir bua beinisiatif banting setir duluan ke arah hutan. Jadi memang akhernyo bus idak jadi masuk ke jurang walaupun remnyo blong. Dan penumpang bus pun selamat galo ngatek yang jadi korban.",descriptive
667,"PT BPR Bank Boyolali (Perseroda) ngadoke undian behadiah buat paro nasabah beberapo waktu yang lalu. Salah sikok yang ngedapetke undian tesebut merupoke wargo Kecamatan Juwangi yaitu Ibu Redatiningsih yang mennagke undian sikok unit mobil. Melalui perwakilan anaknyo, hadiah itu diserahke samo pegawai Bank Boyolali. Anak dari Ibu Redatiningsih sempat ngasih tau amen dio smao ibknyo kaget bukan maen biso menangke undian mobil mak ini, kareno ternyato tabungan yang dipunyo samo bu redatiningsih cumak sebesak 170 ribu Rupiah bae, itulun duit siso di tabungan yang dak pernah di isi selamo betahun tahun mungkin. Hal itu lah yang bikin ibu Redatiningsih samo anaknyo dak percayo pas dikasih tau amen dio pemenang undian mobil dari Bank Boyolali.",expository
1133,"Gempa bekekuatan 5,6 Magnitudo ngegunncang kabupaten cianjur Jawo Barat di hari Sabtu siang ( 21 November 2022) jam 13.21 wib. Gempa diperkiroke besumber di kedalaman 11 kilometer, gempa ini besumber dari akibat aktipitas sesar cugenang. pusat gempa berpusat di koordinat 6,84 LS - 107,05. Sampe tanggal 28 November tecatat sudah ado 297 gempa susulan dengan 4,2 Magnitudo tebesak. Dilaporke wargo masih takut untuk masuk kerumah mereko, tenda pengungsian pulo sudah mulai dibangun buat nampung wargo yang bangunanyo keno dmapak gempa. Wargo banyak yang milih tedok ditendo penampungan kareno takut kalo kalo gempa susulan dateng lagi. Walaupun ado dari beberapo wargo yang balek ke rumahnyo, tapi petugas ngatahke wargo untuk lebih baik tedok ditempat aman.",descriptive
953,"Seneng samo potograpi dan baru nuat belajar, jangan beli kamera yang mahal mahal dulu. Beli abe kamera DSLR bekas keluaran lamo yang speknyi masih cocok buat dipake di tahun 2022 ini. Nah aku rekomendasike Kera DSLR Canon EOS 7D. Kamera EOS ini keluaran lamo yang dikeluarke tahun 2009 yang lalu. Bodi kamera ini tebuat dari bahan magnesium alloy. Mpuklah kamera ini keluaran series yang lamo, kamera ini masih cukup handal untuk ukuran kamera sekelasnyo. Kamera ini dilengkapi samo sensor ASPC dengan resolusi 18 MP. Untuk hasil jepretannyo masihbsesuailah disandingke dengan hasilnkamera tahun 2022. Kamera DSLR Canon EOS 7D ini biso jugo dihubungke ke perangkat laen lewat sambungan wifi samo bluetooth, Jadinyo biso ngontrol hasil jepretan dari jarak yang jaoh. ",descriptive
1082,"Ngejalanke prosedur pembedahan medis atau biaso disebut samo operasi kerno ngidap suatu penyakit pastinyo jadi pengalaman yang kurang enak buat pasien. Pembedahan adalah caro penyembuhan yang sebenrernyo ninggalke raso trauma ke pasiennyo apolagi sampe tejadi pendarahan, nyeri, perih, resiko morbiditas bahkan biso menyebabkan kematian. Hal inilah yang akhernyo ngebuat banyak uwonv untuk ngehindari pengibatan dengan caro operasi. Banyak uwong yang seharusnyo punyo penyakit dalam dan harus diambek tindakan operasi tapi mereka dak galak. Mereka lebih ngutoke pengobatan aalternatif untuk nyembuhke penyakit penyakit dalam. Mereka ngeraso takut untuk dioperasi, pasien mak ini memang ngeraso takut dna cemas untuk dioperasi. Bahkan denger saat diagnosa harus diambek tindakan operasi mereka langsung daka berani.",descriptive
1232,"Ngejalanke bisnis memang idak semudah yang dianganke tiap uwong. Namonyo untung dna rugi tuh lah jadi hal biaso dalam bisnis. Nah apolagi di jaman datengnyo pandemi kemaren, banyaka nian bisnis yang harus gulung tikar. Pas pandemi covid 19 kemaren, diberlakuke kebujakan PPKM yang ngeharuske setiap uwong trus berado dirumah. Kerno pandemi kemaren inj memnag bahayo buat uwong beaktipitas diluar rumah. Alhasil perekonomian dbanyak negaro harus ngalami kemunduran. Dak tekecuali di Indonesia, banyak pebisnis yang merugi disaat adonyo pandemi. Dengan banyaknyo bisnis yang merugi mako banyak dari pelaku bisnis yang nutup usahanyo. Akhernyo tejadilah PHK besak besakan dibanyak sektor. PDengan tutupnyo banyak pabrik, swalayan, sekolah nom formal akhernyo roda perekonomian di Indonesia semet tepuruk. ",descriptive
1317,"Sering ndenger tumbuhan organik smao tumbuhan non organik? Amen kamu belanjo di supermarket kadang kamu nemuke berbagai macam sayuran yang dikasih keterangan sayuran organik. Nah sayuran organik ini merupoke tumbuhan organik yang ditanam tanpa ado pemakaian bahan bahan kimianyo samo sekali mecak pestisida, pupuk kimia, dan bahan kimia yang laen. Sayuran dna buah buahan organik di tanam dengan proses organik dengan manfaatke sumber dari alam, termasuk pupuk, dan pengusir hamanyo tebuat dari bahan bahan alami. Nah tumbuhan organik ini memang diakui lebih sehat buat dikonsumsi kerno dak adonyo campuran bahan kimia yang kemungkinan biso ngasih efek samping samo kesehatan badan kito. ",expository
838,"Tenis sekarang ini lagi banyak disenengi samo uwong. Olahraga sikok ini tekesan berkelas memang, dan banyak jugo akhir akhir ini klub tenis yang diisi paro artis dna influencer. Bahkan pertandingan tenis artis sudah mulai dibikin untuk menarik minat penionton. Nah demam untuk main tenis ini sudah mulai nyebar ke wargo wargo biaso. Nah but kamu yang butuh raket tenis biso dateng ke toko Sudirman Sport yang belaamat di Jl Lintas Sumatera No 124 H, 17 ilir , Kec Ilir I, kota Palembang. Bukan cumak raket tenis bae tali jugo menyedioke alat olahraga lengkap dan tesdio jugo baju baju olahraga. Yang dak biso dateng ke toko kami jugo punyo oflline toko di market place, dan ado jasa anter jugo amen dak biso keluar kareno PPKM ini. Ayo cepetlah belanjo di Sudirman sport, olaharaga seriap hari bagus but kesehatan.",persuasive
219,"Untuk nyiapke ujian SNMPTN aku melok bimbingan belajar yang lumayan bagus di jogja. Namonyo Ganesha, aku melok itu buat persiapan melok ujian seleksi SNMPTN. Aku ngambek paket 3 bulan, jadi selamo disano kito diaksih materi pelajaran umum smao pelaran IPA/IPS sesuai samo jurusan yang nak kito amebk agek. Trus tu kito ado kelas amper tiap hari, setelah ngupas materi, kito jugo bakal ngebahas soal soal uang pernah diujike di SNMPTN taun-taun sebelomnyo. Nah kito jugo bakal sering try out alias uji cubo ngerjoke soal soal tes untuk latihan. Pokoknyo bimbel di ganesha bemanfaat nian buat aku. Terbukti memang aku lah dinyatoke lulus SNMPTN taun ini dan biso jadi mahasiswo baru di Universitas Gajah Mada. Buat yang len meok SNMPTN biso cubo melok bimbel di Ganesha jogja.",persuasive
1434,"Memang bau amis meripoke pertando untuk makanan makanan busuk yang sudha dak seger lagi, dan bahayonamen dikonsumsi untuk makanan kito. Tapi ado beberapo makana yang baunyo amis tapi ternyato itu merupoke makanan segar yamg biso dikonsumsi, contohnyo mecak olahan susu sapi kayak keju. Menurut aku bau keju itu amis nian sampe kadang aku meraso jijik samo baunyo. Tapi ternyato keju yang baunyo amis nian malah merupoke keju yang punyo kualitas bagus. Tapi menurut aku probadi sebagus bagusnyo kualitas keju, amen baunyo terlalu amis yang menyengat aku dak mungkin biso ketelen buat ku makan. Kerno aku lebih meraso jijik daripado merasoke manfaat yang abek dari keju.",argumentative
738,"Budak budak sekarnag kalo buat salah trus digebuki wonv tuonyo bukannyo takut tapi malah marah marah ke uwong tuonyo. Mereka lah ngerti amen mukul itu perbuatan yang ngelanggar hukum, kareno termasuk ke kerasan dalam rumah tangga. Dak peduli apo makaud dan tujuan wong tuonyo itu sebenernyo baik dan pengen ngedisiplinke anak itu biar dak tejerumus ke hal hal yang dka baek. Ketegangan antara wong tuo smao anaknyo ni memang banyak tejadi ampir disetiap keluargo. Nah sebenernyo amen kito nak meloki caro islam inshaallah anak kito biso jadi tumbuh sebagai anak yang sholeh. Dalam islam kito sebagai uwong tuo diajak buat ngedidik anak kito dengan raso kasih sayang yang disesuaike samo umurnyo dan jaman. Idak lupo pulo tanamke karakter islam di diri anak anak kito, dan selebihnyo berdoa samo Allah SWT untuk ngejago anak anak kito biar hidupnyo selLu dilindungi Allah dari perbuatan perbuatan yang dak baek.",persuasive
916,"Samaung galaxy z flip yang baru baru ini dirilis samo samsung sebagai hp lipat yang beda dari yang laen ternyato dinikai konsumen idak layak beli. Beberapo konten kreator yang ngereview hp ini mmenag nyarankenkonsumen untuk mikir amen beli hp tipe ini. Walaupun pas diawal awal peluncurannyo hp ini banyak menarik minat lembeli kerno biso di lipat dan lunyo spek yang bagus, tapi setelah pemakaian ternyato banyak ditemuke masalah. Permasalahannyo ternyato ado di layar hp ini, hp dengan layar lipat ini ternyato banyak dikeluhke pemakainyonkerno bagian lipatan ho di layarnyo tejingok tebelah duo dan retak. Itu ngapo hp ini dikategorike ho yang dak layak buat di beli",expository
666,"Kakek yang menangke undian sikok unit mobil Daihatsu Ayla warnonperak dari Bank Jogja pas perayoan peringatan ulang tahun bank jogja tesebut merupoke wargo dari Perumahan Nogotirto Trihanggo Sleman Yogyakarta. Kakek itu merupoke pensiunan pegawai negeri sipil Dinas pendidikan Pemuda dan Olahrga Daerah Istimewa Yogyakarta. Hadiah yang dio dapet dari mennag undian itu ternyato bikin dio kaget, kareno awalnyo dio cumak mikir menang kulkas bae, ternyato pas dikasih tau dio pemenang utamonyo dengan hadiah mobil, dio kaget bukan maen. Dan ternyato hadiah mobil itu dikasihke ke bininyo sebagai hadiah pensiunan, supayo bininyo biso nganter jemput cucung cucung nyo. Mak itulah menurut pengakuan Kakek Wahyu Kirto Laksono pemenang undian mobil dari bank Jogja.",expository
