id,text,label
emot-train-3363,"Jhelen Jatibaru,begien deri wilayah Tn Abang.Pengaturen wilayah tanggung jeweb ben wewenang gubernur.Tana Abang soal rumit,ghen gubernur2 , se lambek.Setiah teppak e pabeccek,male amanfaat kabbhi pihak.Mohon se andik otek,mekker se wajar,kecuali otakkeh butek.Yeh hedeh. [URL]",anger
emot-train-582,"Deddih bhektoh lambe' badha tembeh aberri' taoh ka orengah mon kita senneng ka jiyah Ben usaha ngomporaghi sopajeh jiyah je' sampe' senneng ka kita. Duhh padahal mon kita terro malesseh mah jiyah la masok penjara paleng, sebagai otek se ngeco' hp kancanah dhibi' e choir",anger
emot-train-2269,duhpolanah se radin dedi been bisa anilai korangnah oreng sekarepah dibik deiyeh ye jek angkoh yu radinah been aruah ndien pengeran,anger
emot-train-1796,"[USERNAME] neser FH jhagha lagghu. tade` kalakoan ( ka kantorra PKS, ta` etarema( tade` info2 dari ca-kanca e PKS ( ende` ka kanca laen bedah partai. ( ka pamarentah . la ta` eakkoi dari partai dimma berri` kiya ye. mole kampong bhai",sadness
emot-train-1094,"Polanah cinta ta' bhutoh alessen, ta' parloh penjelasan, selamet areh jadi ka 8th ghebey cintana sengko' [USERNAME] [USERNAME] [USERNAME] [USERNAME] [USERNAME] [USERNAME] sengko' ghi' setia SENGKO CINTA SARAH KA BA'AN",love
emot-test-424,"Alhamdulillah rabbil 'alamin.. Mator sekelangkong atas segenap dukungan ben dhuweh keluarga sadhejeh ben bhala, lastareh lahir potrah kami dhinah nekah 9 juli 2018 pokol 9.28 sareng berrek 3,55Kg @ Compok [URL]",happy
emot-train-861,"Segghut kadhaddhi yan! Pasa banni bhadhan sajan koross mala sajan lebar ban aherra bakto tellasan bannya' se atanya ""Setiya sajan lempo ya"":",sadness
emot-validation-248,"sesarah aryah kaula tak ngerteh manabi badha fitur sms banking ban i-banking. okey kaula paham~ ca'ocaen ye mator sakalangkong ampon dhaddhi se paleng sabbhar ngadhepaghin kaula se  gaptek neka tak katolongan, ghemogha alam semesta ngaminaghin pessennah sampeyan ghi!",sadness
emot-train-2012,se paleng ngennes pas sampe' parkir stasiun terros KRL arah se engko' tojjhu dateng tape polana jarak parkir stasiun ka KRL parlo bakto 3 menit hasilla edhinaaghi seppor ,sadness
emot-train-645,Gha-mogha sajhen ngarte ban sajhen takok dha' ALLAAH SWT. Kaula a lendhung ka ALLAAH SWT. dhari panggudhaan setan se terkutuk. [URL],fear
emot-train-425,"Apah bhidhenah abe'eng hedeh se selalu neng-enneng abit, mangkat jheu, ben lok ngemodhin e bektoh permasalahan deteng. Bik tang pernyataan se ngakkheren. #mekkermonhedehandikotak",sadness
emot-train-1917,"[USERNAME] [USERNAME] moso dalem sapo'.tengate.Panghianat.Sampe' dhunnya kiyamat, pagghun panghianat.Jahat. [USERNAME] [USERNAME] [USERNAME] [URL]",anger
emot-train-2510,"La Epaddhek, mas. E Kabupaten Sidrap, Sulawesi daja. Abak lambat bila ebhangghaaghi kalaban naghara laen. Tape, ta' jhuba' la. [URL]",happy
emot-validation-111,"kaila termasok oreng se lok adha' pekkerannah sareng oreng se ngangghep wajar hal kasebbhut ban justru nyalaaghin Via Vallen amargha e angghap lebay, nyamannah pelecahan dhalem bentuk napah bein neka paste nyake'en. Lok peduli robannah pelecehan napa neka.",anger
emot-train-711,"Kulah bhakto neka mukka' Kulkas , nah kulah nengale ren-oren kulah nyangghu jerruk eh tenyatah neka tomat anjir rassannah:))) ango'an manabi kulah dhujen sayur lah neka ngakan tomat e ghadu lastarennah kulah leppe'en",sadness
emot-train-3323,Taoah sampeyan manabih teppa'bhakto nekah Ramah ngarassa gagal abadhi potrennah a sennyum? Teppa' sampeyan e wisuda daddhi oreng sarjana Ramah engghi neka oreng pertama se naddeg ban aberri' tepuk tangan ghabay sampeyan. ,love
emot-train-3029,"kodhunah engkok paham, engkok keng sekedar e ijinaghi namoy ben aceretah. benne ghebey noles hal anyar deri dhlubeng se bedeh, engkok keng sekedar ghebey nyeretaen deri buku se le engkok ghibeh teppak buku ajiah depak dek halaman paleng beccek yeh le adek tang bektoh ben kodhu amet.",sadness
emot-validation-427,"Alhamdulillah Prof, marenah ngocak semalem neng [USERNAME] adem rassanah, mandher ngibeh beroka. Aamiin Yaa Rabbal 'Aalamiin.",happy
emot-train-2778,dari ade' arassa #zonakanca tape la mekker pade sayang ta' parlo nembak apapole la omor sariya intina la pacaran ra ye #kancabennipacarbenni tao apa bhai haha,love
emot-test-185,"Lakar bhender ya ""Oreng pelak paste maso se pelak "" Jahat ya maso se jahat ""Tokang amadu ya maso se tokang amadu keya, pas akabin pada e madu"" Jhudhu rowa kacana aba', mangkana pabannya' ngaca",anger
emot-train-2501,kaso`on homo haha iye salamet ulang taon ayu heheh la tua bhai ye hehe,happy
emot-train-3472,"badha e dimah kita selalu agellek, edimmah selalu bel-combellan online, ban edimmah kaula ongghu ngarassaen sayang sareng sacarah bungkol makeh kaula lok bisa nyedding sampeyan. tape nyatannah separoh kaula ce' terronnah aberrik nekahi. [URL]",love
emot-train-220,"Sabenderreh bheden riyah korang sehat eghibeh ngakan sossa, ojheng cellep deri ghu-laghuh tapeh eghibeh sehat ghebey d'bawel apapole badha acha. polanah Jenjih ka Abit. La ka wc 5x etahan mon ta' etahan bhekal lebbhi, hmmm.",sadness
emot-train-1322,"Mon mole ka Jember, sateyah mcD la badha, perdonaten la badha,  perkopien la badha, Mala nelongso jank jank, mi setan kiyah. Ce' cepeddeh tang kottah keni' berkembang Ben tade' artenah pole pas toron ka kampong kecuali katemmoh so kancah lawas so keluarga. ",happy
emot-train-1306,kan engko' ghellu' ba'na ret-serret sampe' tade' oreng kiya se bisa arebbhu' ba'na dari rangkolanna engko' salamet are dhaddhi sayang #6nov  #31bulan,love
emot-train-657,"Sebaghai dokter kulah ghaduwan kelegghe'en kadhibi' manabi pasien, tarotamah se manengnga ka babha, ghaduwan BPJS. Amargha neka artennah saandaiyah mereka kodhu e rrujuk, misallah, kuleh lok parlo stress sareng partembhangan kauangan.",happy
emot-train-453,"Terpa'en sibuk ngedit konten e ruang tunggu tapeh ma' sakompolnah ba-emba e ade'en sengko' seru sarah yeh. Mereka terpa'en san-rasanan ternyata. Riyah nunjuk aghi je' bile'eh beih ben edimma'ah beih, san-rasanan jih asyik",happy
emot-train-2316,"Ya Allah Tuhanna engko', engko' ta' kuat maca komentar soal Via Vallen e akun pacar bi' gosip2 IG. Rassana nangisa bhai rassana, nengghu akun2 lalake' pade ghampang sara ngangghep masalahna, se bini' bisa sategha ruwa nyin-nginyina.",sadness
emot-train-868,"Sapa ra se e parcaje FZ polisi se mare alako bi' bakto ben teppa', pagghun ta' e parcajei, paleng pera' e sateya berka' ka arab ruwa bhai se e parcaje, beremma rakyat ende' parcaje FZ bi' FH se maste nyinyir tade' bhuktena",anger
emot-train-2965,Oddhi tanya [USERNAME] apa pasar bisa nebbhak kabada'an ekonomi kaada' dari Kabada'an politik bakto juwa. bhar-kabha paste la bada. Enja' sapa bhai.,fear
emot-validation-86,"Sayang, tapeh lakar Holmes kiyah bhekal lebbhi Olle menit e Suns. Kalebbinah Muscala shooting e luar deddih pembeda edinna'.",happy
emot-train-1083,"patek serem kadibik. gellek pas mole kantor polannah jarak kantor ka roma nompak sapeda motor korang lebbi 50 menit. etembheng ketondu senengnah abenta kadibik'en demahede ngak se abenta bik sapah dekyeh ( jek ngocak ngkok gile, obetah ketondu pas nyetir). Nah tema areh riyah abelih ka ftisland",fear
emot-test-273,[USERNAME] Pagghun bhai pajabat ngalakone korupsi.. aberri' conto se jhuba' da' magharsare ..Mayu KPK... patao tarengnga.. Bannya' daerah laen se ghita' kake seddhing..,anger
emot-train-721,"lok oneng anapah, neng kennengan neka kulah arassah semmak sarah sareng sang penceptah. ghabay neka kulah selalo terro ngajunjhung wukir mahendraku. [URL]",love
emot-train-2966,"Terro ambuwa tape engko' tako' dagghi' ta' lebbi bhaghus, aromasa nyaman tape engko' krettek... engko' ta' ngarte se sala bada e aba' dhibi' otaba sapa ka",fear
emot-train-931,"Wozniacki kaluar! Daria Kasatkina yak..mainnah ghileh, ce' cepeddeh Ben Leng nampeleng. Hebattt. samoge'eh pojhur!",happy
emot-train-272,"been, kopi, bik semangatak alakonah been, majuh aktifitasah!",love
emot-train-867,"kaula seh daddhi oreng sante, manabi e ca'ocae'en a sampe z asal ale bannyak ngakan, lok ngerekke, bere'eng naek ampon bhunga. Masalah napaepon daddhi kadhi' lok badha panapa. Bhu-ebhu sarah seh samangken",happy
emot-train-353,[UserNAme] aslinah 2 golongan padhe bein. dujen apolitisir agemah. apalole keluarganah Wiro Sableng. sarah . dekye nasibbah bengsah-negereh se tak ngelebhetin abad pencerahan. tak bisa apindah deri agemah,anger
emot-test-51,Riyah pas Sarah! sengko'  mareh macah buku badha bule PDKT ngoca' nyareh Roma so mobil. esareaghi mobil so Roma se mewah si bule OK Ben aniat ngerem pesse sekitar $100 jutah tapeh lebet pos. ngoca' so hadiah se laen. Taoh ta' masok akal ngerem sabenya' jiyah ngangguy Pos [URL],fear
emot-train-1999,"ye enjek lah ahahahaha iye mon usaha kadibik bek mlarat, kadeng olle, kadeng kelpes, mangkanah koduh cek ngastetenah,keng ontong oreng e sekitar utamanah tang binih hebat onggu, tak bedak ajuel durin, parak telasan deddi ajuel jejen. Se penting",happy
emot-train-1889,Engko` ta` tao tape arapa akhir` riya bannyak akun aneh se noro`e.. Tako`2 pole.. Engko` kodhu apa?? Apa Kodhu gante ta`usah nyama? Hapus acc terros ghebey anyar?,fear
emot-test-290,"Ka dokter kandungan bhai beb mon tako' apa-rapa"" sebellun tellat bhai polana bhan oreng bhidha"" panyebbabbha, bada se polana hormon, bada se laen.",fear
emot-train-1390,[USERNAME] tasek kiyah. been taoah kancanah hiu megalodon nyatannah gik benyak se odik bik robeh se lebbi kinnik atembeng setan emodel apa bein. ngetter engkok ngabes gemberrah maloloh:(,fear
emot-train-1375,"[USERNAME] Paleng sarah seh lok bisa sama sakaleh ngoladhi se long-bullong, tol-tottol(?), tik-bintik, polkadot-polkadot semacemmah nekah lah. Bisa nanges sampe kapelengan amargha nga'enga'an teros neng cetak ban gelliyek bein takok pokok eng Lok poron nengale",fear
emot-train-1510,"panponapah se terjadi, kita adheppin, demi ngawujudhaghin mempennah ateh ~ Pa yaken Allah ngarestoen, cinta kita bhakal abadi ~ Selama dunnyah ghi' apoter, tresna neka lok toman lontor ~ tadha' toman aoba, abadi salanjhangngah bhaktoooooo ~ Aahhseeeek",love
emot-train-699,"ra gara bilekna ngopi maloloh pas ngedingagi nyanyian nyanyian jeman lambek SD engak Tangga, ello, andien, audy,teros setiyah agebey daftar nyanyien pole se golongnah 2004-2005",happy
emot-train-3201,Nyareh menu sahur sampe' nyasar. Ontong beih e bhentoh emba gugel #KulinerTradisional #kulinerBanyuwangi #BakulKuliner #WarungLya,happy
emot-train-1308,"[USERNAME] Tambeh yeh? -raddhin nga' ajhelling malaikat -ta' andhi' kalemahan, sampornah sarah odhi'en -bhegus arenah ben ta' sombong -rajin nabung -paleng bahagia",happy
emot-train-659,"sedhukah neka jhau dhari se der-bendher sayang sareng kita. Kaula e pindaaghin pole neng kelas baba lantai 1. ban kadhibi' tanpa kancah sossa manabi teppa' dhukah, ghi' senneng, careta bein lok bisa.",sadness
emot-train-1376,"Masok e bulan de'-ade' ulang taon daddhina engko' bi' jhiya paggun beres2 bhai, tade' masalah dalam sakonni' bhei, salaenna lebur, ramah, perhatian, jhiya ye orengnga se pangarte ben ta' bannya` nuntut riya ruwa ka engko'. ruwa se gebey engko' sayang ka jhiya",love
emot-train-469,[USERNAME] lagguh kiyah Cacak'en. Duh deddi tak nyaman olle Ocak Met lagguh deri rengoreng Twitter. Wkwk o iyeh deri kejuen berempa kilo been riyah? alias deri dimmah kota kenengnah been? Wkwk,happy
emot-test-59,"neng,Tresna abang ka neng ye sa konco'na koko..kene' tape maste tombu ben are.",love
emot-train-2918,"Manossa tama' emma', menteri la advokat erampok kiyah, bennya' taoh rahasia naghereh bhektoh e istana so orba, maleng sarah",anger
emot-train-2624,ghelle` pas ngegym engko` kaluar atembenga soalla tembengan tanitana e luar pas bede ibu2 ye atanya engko` e koca` instruktur polana bhadhanna engko` cucok eh jeriya langsung la member terro bhadhan enga` engko` .. kwkwkwkww senneng la daddhi inspirasi reng-oreng,happy
emot-train-505,"nyaman ruwa endi` kenalan se tao soal sejarah sejarah otabe ta` bahas filsafat filsafat, bahas malaikat gheggher pokokna teori konspirasi ben senneng drama endi` dara senni terro re endi` kanca soghi ruwa!!!! bhakal engko` lindungi pokokna lol.",happy
emot-train-968,"klikbca ampokiya sossah emaksod termasuk sateya. Mun e jawab internet engko' amasalah, engko' bhakal ngoca' ruwa tade' catoranna polana engko' tade' masalah mukka' website laen.",anger
emot-train-2475,"[USERNAME] yeh berarti engkok dhusah dong? masalanah tang ebok mon ro-nyoro engkokk melleh kopi lok e tanyaen sosokeng, yella engkok inisiatif bhein nabungin(;",fear
emot-train-1573,"Tang bhadhan, saongghunna tada' niatdhan kaangghuy ma 'ancemman sakone' ana' kaangghuy kabin' tape polana hal reya la dhaddhi hal se 'lomra' da' sabagiyan magharsare tartanto, hal reya ta' ta' kera toman bada tada'an kaangghuy ekarembhak. Ampon.",sadness
emot-train-2353,"Baca pesan e whatsapp pas mekker.. Engko' ro kadhang segghut talalu pelak ka oreng. Tape pas engko' sadar. Ta' kadhang ya, lakar malolo. Ma'lom, angelic.",sadness
emot-train-3511,ngocak kerrong ka engkok kabele mon cinta ka engkokMon pajet gik bede perasaan ajiah bekal esambuttah bik engkok kalaben gelluk se mesra  kaangguy been  mon been gelem abelih deddi tang kasih,love
emot-train-1967,"[USERNAME] Sampeyan mending akadi [USERNAME] Bein... kampanye nah 4 masalah bein INTOLERAN, ANTI KEBHINEKAAN, ORMAS RADIKAL ban KAULA PANCASILA... wes jhek nyak bannyak cem macemmah sobab Tamba eketarah GOBLOK sampeyan bro.. [URL]",anger
emot-train-2125,"Otomatis kaula ngamok sarah, kaula jellasin jughan ka kanca kaula manabi kaula sobung sediddhi' epon niat ghabay nagrebbu' pacarrah kancah kaua dhibi'. Kadhi' adha' reng lake' laen bein, hih.",anger
emot-train-236,"ajiah arapah sabbhen nolesseh cak inggris ghik ngecek kamus keadek. Tapeh make mareh a pereksah, ampo ghik e hapus pole bik engkok takok sala grammar",fear
emot-train-2415,Tang Jenni se cek raddhinah ben lucu kom bhejik engkok cek sayangngah dek hedehhh (cateten: lucuan bhejik'eng kita degghik) [URL],love
emot-validation-327,"Taon riyah kiah terro maksaen. Berik terro mateah marghenah cecelan arean 150/hari (cecelan tellasen 10ebuh/areh, ollenah 3jt, engkok norok 15 bigghi'). Berrek'eng polanah engkok ben tang bineh usaha bhereng, nyamanah usaha, bedeh pasang surutteh, dheddhih ghilok mapan. megap-megap ben",sadness
emot-train-3457,Tao rowa e masake' engko' ngoca' lekkas baras mas(oiya engko' talodus chat maso reng lake' se lebbi towa). 10 are mare jiya olle kabhar jha' se emmas maso' ICCU. Engko' abak takerjhat tao kabhar bertana se ngadhadhak sara da'iya..,sadness
emot-train-2506,"Terro ngeremma salam ka [USERNAME] se jan are sajan acantol e ate,, salam keya ka nom Andre Taulani se enda' dhaddhi member ka-8 en #BTS \ [USERNAME] #ReyaSaorTIKETCOMAreKa20",happy
emot-train-2573,"Terleppas dhari pangalaman se korang nyennegaghin neng stadio, kami kodhu asakalangkong se jhe-rajhennah ka warga Bantul &amp",happy
emot-train-1153,[USERNAME] PSI talalu segghut aghabay plengngen aslina reya ta' bhaghus sbg sabuwa Parpol anyar se bhuto sokongan rakyat dari sakabbhinna lapesan magharsare tamaso' panyokong kal. Mantan Presiden Soeharto.,anger
emot-train-2251,"Ta' ""Essep"". Engko' lamba' pangaghum [USERNAME] . Setiya TA'' praten",anger
emot-train-2067,"Abg se dhujan arasanan, mon ta' Ngenynyi' ya aghabay rasan tada' fakta. Korban rasananna aher partemmowan Prabowo-Amien-HRS, noro' dateng e Mekka keya enja' e sara abg reya se sibo' aghabay kasempolan 'gatot'.",anger
emot-train-376,"Teppak tellasen engkok kerrong sosok oreng binek se cek penterrah nyabek rahasia, e tatah rapi rengginang krispi e delem kaleng tenggo se e beddhein akadik kado.",sadness
emot-train-1734,bannya' oreng se berjuang ghebey menggapai cita-cita ruwa bhender2 manetes dara+pello. tape bede kiya oreng se sossah e sadiyei karpet merah gi' nyia-nyiaaghi kesempatan.. kadhang engko' senneng pegghel ben terro engko' tokol oreng se nga'ruwa..,anger
emot-train-1312,lok toman sekaleh ngabetessin neka ghabay chatan otaba amaen sareng sapah bein tersera neka. Amargha..... Sajhen kita larang sajen kasempadhen oreng ngomong dha' kita neh rajeh. Daddhi tersera lah yehneng-senneng bein ngajhalane gubungan nelah,love
emot-train-764,=+ sengko' ta' setuju jokowi epapadeh so umar bin khatab sabab Umar bin khatab : - ta' ngontal aghi hadiah ka umat - becaan al qur'an nah fasih - taoh bileh koduh kerras ben taoh bileh koduh berlemah lembut - masittong benni ma ancor Jokowi jeu,anger
emot-train-885,"cc:[USERNAME] [USERNAME] ka [USERNAME] neng neng gun e bektoh 2 Minggu 2 Bupati PDIP Kening OTT KPK, TAMBAH JUARA KORUPSI !!! [URL]",anger
emot-train-3338,"[USERNAME] lagghuh min. Kan engkok le mare tes, teros bedeh tolesen mare, tapeh bedeh let-bulet loading teros neng kacer attas. Jiah deemmah yeh min? Apah le e sempen tang hasel tes? Sekelangkong seghilok'eng [USERNAME]",fear
emot-train-1872,"mangkana engko' ngarte arapa emba' via vallen ngamok sara bakto olle dm da'iya, ban arapa mala ecokoco ??? we'-cewe' pole se congoco, apa mereka min olle dm enga' jiya eyangghep settong pojhiyan pola ya soalla mon rowa eghudha artena rowa kadaruy ? ew.",anger
emot-train-2548,"[USERNAME] Korang jelas polanah engkok molor, paman, Tapeh kadi'eng ajiah pas ter-poteran abelih ben motorrah langsung maosk jalur busway. Jhek norok'en deiyyeh yehh... Pelisss engkok takok se nyeling.",fear
emot-train-2721,Engkok teppa' strest marghenah engkok andik ghighih susu 1 ghik buruh gel-ogel 2 areh lalu. Engkok takok mon pongkak degghik lok bisa otmbu pole HUHUHUHUHU TOLONG,fear
emot-train-3271,Yuhuuu bi' tang panodhen [USERNAME] andra_photo seneng Sarah katemoh pole e Laen acara,happy
emot-train-349,"ikhlas ye?? ""iyee buk"" jawabhan ruwa se kaluwar dari colo`na abe` pas aruwa. Maseh samar, tape gi` ngeding. Abe` abeli ka kamarra abe` ghebey samarena ne-ngenneng dalem pekkeran beng-sebeng.",sadness
emot-validation-130,[USERNAME] #abelenjhejiahlokribet ternyata keng slogan tok mare e komplen ternyata e pebatal sittong pihak. Ben nyamah se rajeh jiah lok ajamin profesionalan yeh..teros medepa' dek pihak toko resminah jhek engkok se ngebatalin..padahal sama sekaleh lok e batalin bik engkok.deddhih setiah engkok le taoh jhek,anger
emot-train-398,[USERNAME] Lok kerah. Pagghun bein presiden se ngatur. Manabi lakar dukungan pribadi. Jha' acaca neng media. Apapole kasebbhar video jyah ngaapresiasi islam nusantara.,anger
emot-train-3035,"Senneng bisa nembha ilmo dhari ghuru rajeh, gemogeh sabbhan are bisa akadhi mereka, mator sakalangkog prof. Benny sareng prof. Teddy",happy
emot-train-3344,begh telat rammi na ye dok... alhamdulillah la paham molae abit sara dhaddhi emok bhai bhuru pade rammi sateya hehehe... [URL],happy
emot-train-1192,[USERNAME] [USERNAME] [USERNAME] [USERNAME] [USERNAME] [USERNAME] reya paleceya tada' bhukte.. Pancasilais mayu alako :) Bhukteyaghi pancasilana! [USERNAME] bada se percaja kapolisian bisa nangkep oreng reya?,anger
emot-train-106,"paleng bhunga mon asuntek neng bandung. bik dokterrah bisa aceretah, aghejek. lah mon neng bali ngetelak dokterrah keng bisa nonduk sambih mesem lok nyaman",happy
emot-train-150,"Mak ajiah somberre beles, ngeromat ben aberrik tadek betessah. Asli Mak se maloloh atangngih .se maloloh ngancaen, ben ngaraghi gei berjuang",love
emot-train-2823,"Padahal ramah cek terronah nanges kadhi ebhu ban nyanampel sampeyan bhi' kuatdha. Se ramah ngalakone coman ngapose diddhik aeng matah neng sodhut matannah, ban nepok bhaunnah adhau ""jhaga badhanna bhi sae ghi sayang"" ramah ngalakone neka sadhajana sopajha sampeyan KOAT. Koat ghabay daddhi dewasa.",love
emot-validation-104,"marena mual2 polana tellat bhukaaa puasaa, akhirra depa`bengko kiya, la mare para` 2 jham alengleng bi` bang grab moter kampong polana jeriya ta`ende` lebat tol",sadness
emot-validation-378,Yeh mon keng cokop bik aseporah ghebey apah bedeh polisi ben jaksa??? Ben mon e patorot lok kerah bedeh efek jhereh ben pelajheren ghebey laennah,anger
emot-train-1393,"Kita ngacocok aghin jadwal salastarennah. 'Degguk ujian kol 2, menta soallah ke mba yyun ghi' kocaeng beliau. Alhamdulillah ya Allah legghannah. Lok parlo reschedule :') Bhakto pon fix, kita kaloar teros sallem tanang ka Ramah. Asalakangkong sarahlah neka.",happy
emot-test-79,"oreng se ta' dewasa iye riya oreng se bajhi' ka mantanna (mantan pacar/lake) kabbhi jeriya se bajhi' ka mantan iye riya se ta' ngarte artena cinta ben kasih sayang. malah ta' jarang bede oreng se ca'-ngoca' mantanna setan, pate', babi, ben laenna. buset, lambe' arapa ende' pacaran ben setan ?",anger
emot-train-535,"hei dengodeh,Tangngeh!!! Dunnyah nekah benne tenttang cinta,harga diri otabanapa epon katenaran.Tape amargha kadhinapah kita a karya,berinovasi,ban ngabangon neghara neka.",happy
emot-train-2044,"Masala anyar : tero norok Reuni SMA, KEng tak tero agebei semajeh kiyah, tapeh keng mon nengneng bein, sanggunin tak kerrong ka kancah se lambek,keng mon ongguen tak bisa deteng asli beni tang pengetero, asli deggik engkok bekal ecakcocaen ben sesebut tokang PHP",sadness
emot-train-2632,"ragara a jawab indfess daddhi enga' masa masa kelam SD ban SMP (kellas settong) se kammah guru bhasa Inggris sekola kadhik lok senneng sareng kulah amargha neng pelajharan mereka kulah oon sarah, ampon amargha dasarrah kulah lakar lemmah neng bhasa Inggris tamba gurunnah kadhi lok senneng daddhi sajhen males ngebey ajhar bhasa inggris alhasel ujian selaloh jhubek",sadness
emot-train-1761,"[USERNAME] tapeh engkok seneng :( inya aruah celep orengah, keng sayang bender sebujurnah lawanah ina :( lah hiih kening ina aruah labenah buhan agembel genteng aruah bein na wkwk",sadness
emot-train-3095,"Bhunganah engkok bik hedeh, neng saben detik engkok mesteh engak dek hedeh, lok taoh arapah neng tang bayangan mesteh bedeh muwah raddhinah hedeh sayang, engkok kerrong dek hedeh sayang engkok cinta dek hedeh hadad sayang malam hadang sayang",love
emot-train-1670,"Empa' naghara tersisa di perhelatan turnamen akbar memiliki taktik kunci masing-masing. Jamak yang berharap ada juara baru di FIFA World Cup 2018, terutama Belgia yang dianggap sebagai tim percontohan bonus demografi. Dan, saya hanya ingin ucapkan selamat pada Pep, itu saja.",happy
emot-train-1451,"YaAllah mrenges sarah  gellek se bruen sawa okoran pipa pralaok deiyeh, mangkannah kulah totopin la-sellannah labhang takok bhadannah elastis bisa masok e-la selannah [URL]",fear
emot-train-1205,"nga`riya ye, maske pelacur sakalena tade` kawenangan ghebey lalake` malecehaghi jeriya. oreng pelacur melacur kiya ta` gratisan ben bede kesepakatan dari kaduwa oreng. ariya arapa mosoh nako`e dari bebini` ye babini` ruwa dhibi`.",anger
emot-train-2601,[USERNAME] [USERNAME] rowa bini' esake'e da'iya bhai ghi' narema ban ta' alaban apa pole alaporaghi. Talalu cinta ya? Postinganna Bhai da'iya. [URL],sadness
emot-train-2861,"Ngabes la ce` bannya` [USERNAME] proyek se gheggher malah daddhi panepuan bi` penipuan, asli engko` terro nyoba wa sambi kabbhi jeriya bi` se agebey agebey kabbhi se la nyambi minggat pesse bannyak oreng (termasuk engko`) ka ranah hukum Indonesia.",anger
emot-train-2956,"wuih ghali. kanca kantor Oreng Esare are sateya, la tabhibhas dari dhindha eketdhan dinas 5 taonna. poko' sara  kita kodhu nantos taon dateng",happy
emot-train-1562,"Bda engko', se terro mokka' pole atena kake. Ngosok traumana. Ghumbhira abhareng kake. Pola ghi' bada drama, tanges ban aeng mata, pola keya dhuka. Tape Parcaja'a, sakabbhinna rowa coma sakejjha'. Kotak reya siyap tabukka'. Kotak aesse ghella' ban ghaja' dari macemma careta. [URL]",love
emot-train-2810,Abdhina tresna ka panjhennengngan sanget tresna~ Anapah kodhu abdhina arasa Sepenting nekah tresna sampeyan Kita molae amarga tresna Ampon tresna se nge akhere,love
emot-train-1851,"kejadian malam riyah, mole kol 00.25 langsung asalen klambih teros abesso muah pas ghik bhuruh mareh messo muah neng jeddeng pa ghik anduken tiba-tiba bedeh suarah ""tolong"" neng tang budih persis. riyah wes kejadian deiyyeh berempah kaleh cek seringngah kira-kira bedeh apah ye cek seremmah bit-abitteh keganggu kiah",fear
emot-train-1068,"la 2 taon lebbih riya lipenna wardah, ce' awetta. sampa' kaodi'an percintaanna engko' bhai ta' pernah bede se saawet riya",happy
emot-train-1258,"pas nengghu DBA 1, bede lagu ruwa. Ya Allah mas. nangisa engko` e kamar. e tanya ebok, "" mbak arapa nangis?"" "" Nengghu film arema bok"" Ebok malah aghelle` wa kanak",sadness
emot-test-169,"sayangah engkok gun menungsah biasah se tak bisah nolakan detengah cinta, gun bisa mendemah tak ngocaah, bik nyongokah seri jeuh",sadness
emot-validation-160,Deri matanah hedeh.. Matanah hedeh.. Engkok molaen jauh cinta. Engkok ngetelak... ngetelak.. Bedeh jeng-bejeng... Deri matah hedeh ngebey engkok labu... labu teros labu dek ateh.,love
emot-validation-333,Astaghfirullah ghik kol 10 engkok le istighfar bhein terro mok-ngamok dek oreng 'tolong meles dek tang e-mail se di-budih' alias CONG ENGKOK GHIK BHURUH NGOCAK DEIYYEH ARAPAH HEDEH ATANYAH POLE,anger
emot-train-1675,"Kadheng jiyah bhektoh tiba-tiba esapah oreng. Tako', mon ba'an sadar ka 'penyamarnah' satiyah.",fear
emot-validation-308,"se toman otabeh se tepaen ngelakonin usaha pasteh taoh ka kuliku keuniknah konsumen. Tang prinsip, selama engkok kabesah norotin pernyoonnah, engkok bekal ngelakonin permentaknah, engkok bekal ngelakonin. maseh aneh begi engkok",happy
emot-test-425,#SalamSaum #SobaTani Ekspor Komoditas kebhunah kita naek 26.5 % deri Taon 2016 sampe 2017. Keren ghebey #OrengTanehKita,happy
emot-train-1409,"Wahai se Maha Cinta, sandhingaghin kaula sareng jiwa pelan Pajhennengngan, se amargha kabecce'an kaula - becce'agin jughan neka, tape manabi neka lebbhi bhagus - becce'aghin kaulah.",love
