id,text,label
indolem-test-322,2. Dinamika Internal Partai Demokrat (PD) adalh sabaik yang paliang mandasar timbuanyo gejolak hinggo barujuang pado kasus hukum Anas Urbaninggrum,negative
indolem-train-1871,Kaba kader PDIP Dukuang Interpelasi Dinilai Rugikan Partai: Kader PDIP dimintak mandukuang kaputusan Presiden Jo... http://bit.ly/1LpwiLI,negative
indolem-test-602,"Dipikia Jenazah, Keluarga Serbu Oto Pambaok  Barang Milik Korban: Ratusan warga masih bakarumun di posko. S... http://bit.ly/1AXy9pz ",negative
indolem-train-42,"Sambahlah Ar rahman, siarkan salam, dan agiahlah makan urang lain, mako kalian akan masuak sarugo."""" [HR Tirmidzi]",positive
indolem-train-1942,Aden telpon tampeknyo hp ndak ado jawaban aden datangi kasinan jam 12 siang tanyato paga takunci.... dan aden ndak bisa manginap disinan.... akhirnyo ambo cari hotel liak.... ambo kecewa karano alah bao keluarga....,negative
indolem-test-738,raso ditingga nan paliang sadiah dan emosi tu ado duo: 1. Ditingga pai 2. Ditingga lalok,negative
indolem-train-1475,"Hal nan paliang ditakuikan #Taurus adolah jiko urang nan mereka sayang, pai maninggaan mereka",negative
indolem-train-1989,Aleh kasua nyo kasa dan babulu.ac nyo mamakak,negative
indolem-train-2356,"wifinyo indak jalan, sangaik disayangan. Ruangan talalu galok jo indak ado jendela",negative
indolem-test-624,"kalau malam hotelnyo kalam, lampu kamarnyo kurang tarang lo, kamar mandinyo baun, kunci kamarnyo agak rusak",negative
indolem-train-3626,shower mati eh receptionis kurang senyum,negative
indolem-train-1486,Syahrini Sangajo Ndak Minta Izin Buek Karamiaan di Tampek Umum http://dlvr.it/8g1tyq,negative
indolem-train-824,"Manginap di airy room salalu bakasan. Staff ramah. palayanan prima dan kolam ranang nyo nan mambuek anak-anak betah balamo-lamo disiko. Untuak ruangan barasiah, nyaman, ndak terlalu lueh tapi ndak terlalu sampik karno masih bisa space ekstra tampek tidur. Kamar mandi lueh, cuman agak saketek baun ndak lamak. Wifi ruangan ok bana. Kasaluruahan ok bana airy room",positive
indolem-validation-169,Sidang Makamah Partai Golkar. Minggu muko nio diambiak putuihan,negative
indolem-train-3364,nyaman lataknyo di tangah kota cuman wifinyo pakai wifiid,negative
indolem-train-1134,"listrik sempat mati, kasua baun",negative
indolem-test-781,ACnyo mode lamo.. Mamakak parahh buek payah lalok dan kurang dingin.. Ditambah lo aia angeknyo cuma bafungsi,negative
indolem-train-1388,"Jago pagi- masih ngantuak- fokus cari hp - caliak sosmed, sms, bbm dll- baharok ado kato kato manih dari urang nan disayang",negative
indolem-test-555,"bilo masuak form 5 ndak saba sudah sakola, pas sadang ujian ndak saba abis salasai ujian dan kini takuik jo sahalai karateh sajo?",negative
indolem-train-3208,"Banyak bana yang nanyo casing aipon ka toko, rato-rato pado pacah layar nyo. atuh hp maha-maha kok capek rusak,mandiang? ? https://path.com/p/3ZmHTp ",negative
indolem-test-283,"biliak cukuik laweh, tajangkau, sarapan banyak macam nyo, ado kulto jo teko aia angek, aia angek, ac dingin, lokasi strategis, lift minusnyo channel tv saketek, ado liek kapuyuak ketek ciek, hari 1-2 ndak dapek snack, hari ka 4 ndak di barasiah jo ndak dapek minum jo snack, kalau di imbau housekeeping nyo lamoooooo bana tapi ancak lah, awak ka manginap di siko liak dek biliah nyo gadang, barasiah, murah, sarapan lamak",positive
indolem-train-3360,"Hotelnyo rancak si, cuma mandapek kamar nan AC-nyo angek bana, ndak dingin. ",negative
indolem-train-480,Syahrini Janji Akan Tibo Jiko Kembali Dipanggia Mabes Polri http://goo.gl/fb/dzCHoi,positive
indolem-train-1926,"tolong untuak aleh kasuanyo ganti, karano banyak lubang-lubang bakeh rokok, samo sadiokan kastok baju jo patunjuak arah kiblat nyo",negative
indolem-train-843,"Raffiah: RAFFI AHMAD TU NDAK TABATEH, ISTIMEWA, GANTENG, GALETEK, ELOK HATI, INDAK SOMBONG, RAJIN MANABUANG Bhaaqqq:3",positive
indolem-train-232,"Nah makonyo kalau Sakolah nan batua yo! Baraja nan batua, kalau kuliah ijan di lao-lamoan! Lulus maksimal 4 tahun. Sayang pitihnyo dan sayang umuanyo.",positive
indolem-test-548,Ado bara nan harus ditingkekan lai takah TV. Hanyo bisa manonton bara chanel rancak dan,negative
indolem-test-214,"TOLAK HAMAS, Langkah Pemerintah Disanjuang PDIP http://bit.ly/1KwhWtq Ricciardo samantaro tacapek pado uji pramus... http://bit.ly/1vPkARi ",positive
indolem-train-1271,Alah kaamprk kali dan yakin ka baliak tapi sayang nyo fasilitas aie angek indak bafungsi dan semprot di kamar mandi iyo lo.,negative
indolem-test-277,Pap foto nan manuruik ang paliang ancak? ? Ndak nan paliang ancak tapi adonyo di hp cuma iko:3 http://ask.fm/a/c0874fi8,positive
indolem-train-3512,standarlah nyamannyo... cuma keset kaki di wc ndak ado... jadi kumuah kamar,negative
indolem-validation-143,ancak sih wifi lamban anduak baun itu se nan di pelokan salabiah nyo nyaman se,negative
indolem-train-3238,"Efesiensi Anggaran, Pemkab Majalengka apuih 158 sekolah http://bitly.com/1au8xEX ",negative
indolem-test-319,"Sagalo kakurangan , sado kelemahan ang jadikan cinta.. ? Kamu Yang Ku Tunggu (jo Afgan) oleh Rossa (w/ Andika) ? https://path.com/p/3Y8hBL ",negative
indolem-train-3619,Wifi ndak bisa dipakai dalam biliak & ac dalam biliak kurang dingin. mokasi,negative
indolem-train-418,"Maleh bergaul, maleh nyapo urang, maleh pakai baju ancak, sadoe lai konsekuensinyo. Tarimo dengan dewasa.",positive
indolem-train-290,"Ketentuannyo masih samo, 3 panjawek paliang capek akan berkesempatan untuak mandapekan masiang-masiang 1 buah powerbank gratis dari HP :)",positive
indolem-train-1489,"Ado babarapo Resepsionis dan Satpam nan kurang RAMAH ka Tamu Lokal mode  ambo dan keluarga. Mambuek kurang nyaman bana, babeda jo Bertender nan di Rooftop Bar RAMAH dan ELOK bana, bantuak tu lo bapak satpam di hari terakhir ambo check out baliau manolong ambo di parkiran.",negative
indolem-train-41,Poros Mudo Golkar Nilai Jokowi Bisa Mangandalian Situasi Saat Iko http://brt.st/4toF,positive
indolem-train-574,"Lamak kan jadi resellernyo Amadeus.. Alah dapek baju hrates, dapek lo pitih! Rasakinyo si Jojol. =)))))",positive
indolem-train-81,Gathering kantua mami tacinto ????? (jo keluarga di @puncakpass) ? https://path.com/p/1sc0qs,positive
indolem-test-830,"Zaman kini tu mustahil bana kalau ndak macik hp dalam 3 jam. Jadi kalau ang ndak dibalehnyo, yo itu sangajo diabaian.",negative
indolem-test-249,"Di Belanda, Urang nan baru lulus sikola, akan dicarian karajo dek pemerintah satampaik sasuai jo bidangnyo.",positive
indolem-train-388,Tarimokasih Cinto Untuak Sagalonyo... Kau Agiahan Baliak Kasempatan itu~ Afgan,positive
indolem-test-536,Tando tando ndak diapelan. ndak baa kok ndak baa?? ? Klise dari Afgan ? https://path.com/p/1nyYWe,negative
indolem-train-1454,"INFO LALU LINTEH: Oto Mogok dan Truk Balangga Maakibatkan Kemacetan, Iko Rinciannyo http://bitly.com/1Dh8KVl ",negative
indolem-train-2631,"lokasi rancak tangah kota.. kamar barasiah hanyo se kamar mandi baun busuak, makanan biaso se staf recepsionis indak ramah, akses internet indak ado dan kamar lt 3 indak ado lift",negative
indolem-validation-280,Palayanannyo indak disadioan anduak untuak mandi,negative
indolem-train-854,"Jon Bon Jovi mamiliki restoran banamo 'Soul Kitchen', di mano sado urang buliah makan apo se dan hanyo mambayianyo jiko inyo nio.",positive
indolem-train-1518,palayanan manajemen hotelnyo sangaik buruak dan hancua,negative
indolem-train-1369,"Aden indak manyukoi kabarasiahan kamar mandi dikaranoan pado saaik aden masuak ka dalamnyo, tadapek kapuyuak mati di toilet dan di bawah shower, kabarasiahan seprai juo paralu diparatian",negative
indolem-train-1351,"Mohamed Morsi saurang muslim demokrat, presiden Mesir 2012-2013, dipanjaroan dek tentara Mesir katiko coup de tat sahinggo kini #Tribulasi",negative
indolem-test-653,Tawacana 2015: iduik anti makanan capek saji & anti makan malam labiah dari jam 7 pm. (at @mcd14045) ? https://path.com/p/3joWP9,negative
indolem-validation-289,"Tas Hermes Rp1,5 Miliar Balanjo Sayua dek Syahrini http://m.log.viva.co.id/news/read/592733-tas-hermes-rp1-5-miliar-dipakai-belanja-sayur-oleh-syahrini ? via VIVAnews taanjiang",negative
indolem-train-261,#DPR #Terkini Charles Honoris Siap Pajuangkan Kabebasan Beragamo http://bit.ly/1KwfyTv  #beritaApple hiring big ... http://bit.ly/188uFUt,positive
indolem-train-1200,Untuak koneksi wifi labiah di tingkekan lai ...,negative
indolem-train-2099,"Ambo mamparhatian, kau cuek se, ambo paduli, kau nyo ndak acuah, beko kalau tibo-tibo ambo pai jan manyasa, ndak. Sia nan manyuruah manyio-nyioan :)",negative
indolem-validation-271,"amno manginap untuak 4 malam di airy eco sleman jambatan merah, kasan partamo katiko masuak kadalam kamar adolah kecewa kamar indak talalu lueh padohal ambo pasan untuak ruang kaluarga, kamar mandi baun, room mate/aleh kaki baun bana, satiok hari ambo minta dibarasiahan, tapi toilet tatap dalam kadaan kumuah/baun, sadonyo sangaik mangacewakan.",negative
indolem-train-829,"palayanan kurang ramah, sadoalah oke kamar barasiah, wifi mantap, lokasi strategis sajauah ko ok",positive
indolem-validation-18,Kariawan nan malatakan tanaman diruang kantue mangalami paningkekan kreativitas sabanyak 45% dan produktivitas sabanyak 38%. [NatGeo],positive
indolem-train-2968,Iko Tigo Kategori Oto Bakeh Nan Ndak Ditarimo Showroom http://bitly.com/1DDuwD6,negative
indolem-train-2716,Bantuak kotak amal RT @falla_adinda: ... RT @detikcom: Kacomato Futuristik Syahrini http://tinyurl.com/qy9xth4,negative
indolem-train-1441,Ancak sih sacaro kasaluruhan. Mungkin wifi nyo nan kurang soalnyo alun sampai ka kamar dan kapatang mungkin sadang ndak baruntuang dapek kamarnyo nan tv nyo kurang janiah,negative
indolem-test-265,"palayanan nyo ramag bana, kamar pun rapi jo barasiah tapi ado saketek kakurangan di bagian handuak jo salimuik nyo sarancaknyo yang alah cabiak di ganti yoo.. thx",positive
indolem-train-985,bagos jempol untuak jokowi *manteep* @rofandri: Demokrat Protes Pimpinan KPK Agiah saran SBY Ndak Dipiliah Jokowi http://kom.ps/AFploc,positive
indolem-train-2252,"Indak ado yang batulisan Airy di ruang 107, remot TV indak bisa di pakai(rusak ), remot AC indk ado(maiduikkan AC manual), perlengkapan kamar mandi cuman ado handuak. Kami kecewa bana nan di ruangan 107 Ruangan 103 pueh bana perlengkapan ruangan ado sadonyo",negative
indolem-train-1346,"Manyangan, lokasi dakek ka babarapo resto dan tampek makan (KFC, Richeese, Pizza Hut, dll) dakek indomaret, parkiran oke, sayang tarakhir ka situ, wifi sadang bamasalah...",negative
indolem-test-345,"Ndeeh ambomah nonton afgan se, sadang baper disuruah saba -_- ? Sabar oleh Afgan ? https://path.com/p/3Q7X25",negative
indolem-test-186,Rancak kau mangalahan sadoe??? ? Kamulah Takdirku by Raffi Ahmad & Nagita Slavina ? https://path.com/p/1fECEN,positive
indolem-train-1986,Ndak bisa lalok.. Kasue dan selimuik baun..,negative
indolem-train-2123,16.52: RT @cep_rafy: Blok M arah prapatan Prapanca macetnyo sampai Bundaran muko Kantor Walikota Jaksel.,negative
indolem-test-752,"shower rusak, tampek gantuang baju di kakuih rancaknyo jan di sampiang wc. salimuik banyak bakeh noda. salabiahnyo oke lah",negative
indolem-train-144,"palayanan mamuehan, makanan lamak, cuman kamar mandi agak baun. overall ok",positive
indolem-test-727,"Labiah ditingkekan kabarasiahan kamar,",negative
indolem-train-1814,"Batal lantik Komjen BG, Politisi Golkar: Jokowi kayak buruang kalilawa http://bit.ly/1vS9pYj ",negative
indolem-test-768,AC indak dingin.... indak tasadio salimuik,negative
indolem-train-1678,"Makan pagi nyo paralu di ganti ka prasmanan, wifi nyo ndak iduik ,,tampeknyo tannag jauah dari karamaian kota",negative
indolem-test-217,Kamantiakan bana kok 1 kantua tuka-tuka coklat #palentain,positive
indolem-train-1220,biliak nyo kurang dingin karano AC nyo rusak. pananganan pindah biliak lamo,negative
indolem-validation-74,"Pak Abu bahkan ndak paduli warna baju ko apo. Nan jaleh, ang harus tau mambedaan warna-warna tampek sarok daur ulang. ",positive
indolem-train-971,Legislator PDIP: Aturan Delay Maskapai harus Dipatageh http://ift.tt/17CUzOV,positive
indolem-validation-275,"Ndak saba nio coret2 baju kalian kawan ,agiah senyuman sabuah perpisahan kawan :'(",negative
indolem-train-206,"Kabarasiahan tiok biliak hotel paralu diparatian lai, kanyamanan biliak alah rancak, layanan, makanan dan tampek juo cukuik mamuehan",positive
indolem-train-3110,"Pelayananyo kurang elok,  fasilitas kamar mandi ndak lengkap",negative
indolem-train-171,@PDemokrat: SBY Doaan Pamimpin Bangsa Ambiak Pilihan Tapek Atasi Kamaluik Politik http://bit.ly/1ED65oq,positive
indolem-train-1702,"Tolong kabarasiahan diparatian, bukan hanyo kabarasiahan nan tampak di awal tapi manyaluruah takaik bantuak nyamuak jo kapuyuak. Mokasih.",negative
indolem-validation-364,Ummmp .. lalok di kantua. RT @Nurreyzaputri wak tadi malam lalok dima? Indak pulang kamari :|,negative
indolem-train-1100,AIE ANGEK KALERAAAAA,negative
indolem-train-415,"Suasana hotel jadul manyanangan, kayak di china town dima bitu: dakek samo stasiun Gambir. Para staff hotel elok. Makan pagi lamaaaaaak. Paragaik biliak bafungsi elok. wifi indak talalu kuek (karano kamar di lantai5). satimpal lah samo untuak nan suko nuansa jaman dulu. tarimo kasi airy rooms!",positive
indolem-test-524,"Kasan: Baiak , ka jadi palanggan. Pabaikan : Babarapo biliak sinyal internet kurang ancak tarutamo di babarapo biliak lantai 1.",negative
indolem-train-3352,"ac nyo lumayan dingin dan aia ac nyo bocot jadi basah lantainyo, wifi nyo ndak ado alasan nyo dalam perbaikan. menu makan nyo dari sekalian banyak cuma 2 se yang tasadio, untuak kamar rancak dan gadang. Tarimokasih",negative
indolem-test-863,"jiko taruih konflik, golkar bisa kahilangan kader potensial di pilkada - Metro TV News http://dlvr.it/8k1Vsn ",negative
indolem-train-2403,"Ang tibo jo pai taruih, tanpa pernah tau kalau aden labiah nio dijadian tujuan daripado pasinggahan.",negative
indolem-train-1320,Hari ko!! Ndeh ndeh ali main hp taruih yooo ><,negative
indolem-validation-215,Kelompok Begal Lampung Taungkap dek Rampok Oto http://republika.co.id/r/nkfc6c,negative
indolem-train-1230,lumayan lah tapi lantai agak kumuah. yu ndak di agiah handuak. parkirnyo kurang tampek. sacaro keseluruhan lumayan..,negative
indolem-train-2398,Mahkamah Partai Golkar Tolak Intervensi Akbar Tandjung Cs http://tinyurl.com/ltkz6m2,negative
indolem-validation-385,BURUAK BANA ! biliak nyo jorok bana.. banyak sarang laba-laba..kamar mandi ndak diagiah tissue toilet ndak ado keset. chek,negative
indolem-train-3140,Baiu ilang ndak tangguang jawab.. sariah tapi ado pancilok nyo palayanan buruak,negative
indolem-train-1569,"Proses check-in lamo, menu makanan cuma 1 varian. ndak ado makanan ketek",negative
indolem-train-2363,agak baun rokok :),negative
indolem-test-487,"Bilo Hatta Mamimpin, PAN Salalu di Bawah Bayang2 Partai Demokrat [?] Part By @SangPemburu99 http://dlvr.it/8dYF1w   ",negative
indolem-train-557,Dompet Dhuafa Sulsel Babagi Palengkapan Sakolah http://www.dompetdhuafa.org/post/detail/749/dompet-dhuafa-sulsel-berbagi-perlengkapan-sekolah ?,positive
indolem-train-3155,mantap.... hanyo ambo untuak kadinginan AC paralu diparhatian karano patang kurang dingin,negative
indolem-train-1299,"Shower untuak aie angeknyo ndak jalan,jadi mandi aie dingin.. Ado kecoak, samuik n mancik. Jadi, mamakak",negative
indolem-validation-12,"Manolak HAMAS, Langkah Pemerintah Dipuji PDIP http://bit.ly/1KwhWtq  Film """"40 days in europe"""" cari bintang http://bit.ly/1F79hJ9 ",positive
indolem-train-3387,Kamar lumayan. sayang wifi payah koneksinyo,negative
indolem-train-1244,"Syuting Video Klip di Pasar Glodok, Syahrini Buek Heboh: Satalah angek-angekan di Pelabuhan Sunda Kelapa, Sya... http://bit.ly/1vRhXi0 ",negative
indolem-test-549,"Kamar kyrang barasiah, dindiang kamar puda sahinggo ado raso ndak nyaman. Tampeknyo strategis dek talatak di pusat kota dakek jo pusat kuliner",negative
indolem-test-590,"ambo manginap di kamar 117, reviewnyo: 1. banta kareh 2. biasonyo diagiah banta airy, tapi iko ndak ado. diagiah 2 banta tambahan sih tapi ndak diagiah saruang bantanyo 3. ndak ado thermos untuak buek aia angek 4. shower bocor 5. remote tv indak bafungsi 6. kenop pintu kamar mandi macet, jd ndak bisa ditutuik rapek 7. kamar hanyo sakali dibarasiahan",negative
indolem-validation-257,buruak indak ado makanan airy,negative
indolem-train-3559,Parabotan dalam biliak salah lapuak jo ampia rubuah. parabotan kumuah bantuak takanai sunduik rokok. lantai bakabuik bantuak ndak di sapu. seprai ndak tatata rapi. welcoming snack ndak lengkap. handuak baun dan ndak diganti.,negative
indolem-train-1778,"Kok vulgar...? RT """"@berita_politik: [TribunNews] Demokrat Usul Jokowi Piliah Calon Pimpinan KPK Usulan SBY  http://bit.ly/180xNSg  #berita",negative
indolem-train-3302,"kebiasaan padusi modern mancukua katiak inyo di mulai katiko ado model iklan manggunoan baju ndak balangan, di maso Perang Dunia 1.",negative
indolem-train-890,"kamaarnyo barasiah, harum, fasilitasnyo lengkap. mbak nyo ramah, hanyo sajo untuak maliek TV antena nyo kurang sip. samoga kadepannyo labiah baiak",positive
indolem-validation-283,Banyak makanan nan lamak di satiok perayaan nan dapek manggoda salero makan waang. #MailanganLemak,negative
indolem-validation-300,"nyaman, barasiah, oke.. tapi sayang ndak dapek kotak makanan ketek nyo.. pasan 2 kamar, duo-duonyo ndak diagiah kotak makanan keteknyo.. padohal alah konfirmasi ka pihak cs hotel.. tapi cuma disuruah tunggu se, sampai pulang ndak datang-datang..",negative
indolem-train-426,F- Demokrat : Kaputusan Presiden Bari Kepastian http://bit.ly/1z2n9jq,positive
indolem-train-943,Mokasih yooo Afganisme yang alah nonton KonserDariHati Afgan :) Aden sayang sadonyo kawan! [pic] ? https://path.com/p/4uarpJ,positive
indolem-train-107,#DetikCom Anggota Komisi I Dewan Perwakilan Rakyat RI Meutya Hafid mandukuang langkah Kementerian Luar Negeri m... http://bit.ly/1LnkE1V,positive
indolem-test-509,PDIP Dinilai Aneh kalau Tarimo Badrodin Kapolri http://bit.ly/1B0gBaC,negative
indolem-test-147,"Panyaluran Beasiswa untuak anak juara RZ Cilegon wilayah Cibeber, bantu biaya sakolah yatim dhuafa #BabagiSanyum",positive
indolem-train-3258,"anduak ndak di agiah, aie angek ndak jalan, tolong di tingkekan palayanan dan fasilitas nyo",negative
indolem-validation-172,"Lumayan rancak, Tapi pas kito takaja nio ka bandara pagi-pagi eh ternyato paganyo takunci dan pemiliknyo ndak ado di di sakitaran lorong. Mangkolah kito makiak-makiak manokok biliak ciek-ciek untuak nanyoan nan punyo dima. fiuh.",negative
indolem-train-1385,"Tuka Tambah nan manarik ? RT @korantempo: Dimintak Sabuikan Bandarnyo, Pacandu Sabu Mintak Oto http://bit.ly/1C31Sgt ",negative
indolem-validation-240,"tivi jo pandingin ruangan nyo ndak bafungsi elok, sahinggo mangurangi raso nyaman pelanggan katiko manginap. semoga kamuko nyo bisa labiah elok",negative
indolem-test-948,tv nyo bamasalah,negative
indolem-train-2197,"Syahrini ndak tibo ka Bareskrim Mabes Polri dek sakik, tapi Sibuk Konser http://j.mp/1vROCnr #sib",negative
indolem-train-1760,banyak kapuyuak samo kutu dan aienyo baun,negative
indolem-train-1689,"Saluran aie di wastafel buntu, Anduk kasa Jaringan wifi ndak sampai dek dapek biliak paliang ujuang Untuak air d showernyo agak bamasalah jo aie angek dan dinginnyo sahinggo nan bafungsi hanyo aie angeknyo. Nio komplain nangguang dek hanyo sabanta disiko dan harus jalan kaki kamuko jauah bana dek dapek biliak paliang ujuang :/ ",negative
indolem-train-2537,"nio bisa konsen ba a lah ko, tangan ciek macik pena tangan ciek lai macik hp.",negative
indolem-train-964,"Satiok kali HP ambo bunyi, ambo taruih baharok itu dari sanak. :)",positive
indolem-train-1300,fasilitas tv yang kurang baiak ditambah resepsionis yang kurang baiak masa den talalok sampai pas wakatu check out nyo ditalepon taruih ka kamar,negative
indolem-train-2564,LAYANAN MANGECEWAKAN!!!,negative
indolem-train-785,"jan acok pai ka ka masa lalu, agar saat masa depan mangatuak pintu. kau hadir disinan untuak manyabutnyo",positive
indolem-train-161,"#B kalau alah sayang samo urang inyo bakal sayang bana, ndak nio urang yang inyo sayang pai, di rabuik, atau barubah. -upit",positive
indolem-validation-359,"tampek kurang barasiah, ribuik tadanga suaro dari lua kamar, ayia kamar mandi yang angek acok macet,",negative
indolem-train-2129,Aie angeknyo indak bafungsi dan kamar mandi baunnyo indak lamak,negative
indolem-train-1953,"Ndak ado tisu, wifi harus dimintak dulu, tangan malam tajago karano token listrik biliak abis, dan harus di agiah tau dulu baru sadar. Ndak ado camin.",negative
indolem-validation-76,Aden baru danga sakali iko tapi keren bana afgan nyo mintak di jadian suami ? ? Knock Me Out dari Afgan? https://path.com/p/3RNg6O,positive
indolem-train-1375,kamar mandi ndak barasiah kabel tv ndak punyo power point electricity nyo down harus manunggu lamo untuak on baliak,negative
indolem-train-883,Hasil spm selasa ka rabu muko? Nio buek surek izin ndak masuak kelas ko untuak kawan adiak. Aden kiro bantuak pananang lah ?,positive
indolem-train-3588,Aia angek kamar mandi indak aktif,negative
indolem-train-1404,Kamar mandi nyo kumuah bana. Mati lampu 2 kali dan lumayan lamoo.,negative
indolem-test-897,"Jan biaan emosi mambuek cinto pai, karna meski akhirnyo maaf awak tarimo, cinto mungkin ndak kan baliak.",negative
indolem-train-979,Selamaik pagi ambo sanang maliek iko @RaffiAhmadLagi @Lady6igi @ruben_onsu @sarwendah29 samog lancar parsalinannyo beko,positive
indolem-train-1260,Golkar Ndak Nio Sewakan Kendaraan Politik di Pilkada - Republika Online http://dlvr.it/8g8jhh,negative
indolem-train-2851,"Tampek tiduanyo gadang tapi salimuiknyo kumuah agak bakarak. Pas nio cek out, nio mandi, eh aia angeknyo ndka bisa. Pasan nasi putiah, teksturnyo kayak bareh subsidi (pacah-pacah) dan canderung kareh",negative
indolem-train-1189,Wangi Kamar Paralu Ditingkekan Lai,negative
indolem-test-823,"Tembok kamar tadanga mamakak di kamar sabalah harusnyo hotel antaro kamar ndak buliah tadanga, di wc ndak do tisu, tampek sarok dikamar kumuah tu tapaso pakai plastik sarok",negative
indolem-test-499,Kurang barasiah se.,negative
indolem-train-978,Afgan Basyukur Pernah Jadi Korban Bully http://tinyurl.com/n8gyxjj,positive
indolem-train-133,"TULUS itu apo sih qaqa?manunggu idolanyo sampai pagi?bali baju resmi? Tulus kok ngecek-ngecek disosmed,tulus tuh dari hati qaqa :3",positive
indolem-test-379,"Indak sasuai gambar, biliak sampik, salimuik baun, biliak baun ndak lamak,",negative
indolem-test-378,wifi kurang kuaik,negative
indolem-train-3509,"hal manyebalan tu abih pulsa, hp lowbat, ndak ado colokan lo (???)",negative
indolem-train-1890,"guru sibuk manjalehan, murid sibuk main HP.",negative
indolem-validation-265,aia angek. cuma itu se nan kurang,negative
indolem-train-1355,"alah tatakok cuma carito akhir e kayak iko """"@JANJUSUCI_TTV: @Lady6igi coo maniih banaa nyuokan @RaffiAhmadLiak =??",negative
indolem-train-672,Bantu den manamukan caro tuak mandapekan inyooooo.? Afgan gagah banaaaaa yo? ? Pesan Cinta oleh Afgan (w/ andrine) ? https://path.com/p/49fHWf,positive
indolem-train-1644,"08.08: DPK Jakpus, Pak Makmul : Kabakaran ruman di balakang Pasa Paseban, Senen dakek Sakola Trisula, Jakpus. Patugas sadang maarah ka lokasi",negative
indolem-train-187,Akan labiah bijak apobilo Presiden Jokowi mampatimbangan duo namo yang alah diusulan dek Presiden SBY... http://bit.ly/17XWoY3,positive
indolem-train-1841,Makanan Gratis + sabun / sampo airy indak ado... AC nyo juo bocor aia nyo kalua di dalam ruangan... senoga di pelokan tampek samo kinerjanyo dima hak buek konsumen...,negative
indolem-train-1604,Penampakan Ribuan Urang 'Keroyok' Kantua Mentri Susi http://tinyurl.com/qayw22d,negative
indolem-train-2579,indak ado wifi di kamar kamar indak kedap suaro parkir payah akses dari jalan raya talalu masuak k,negative
indolem-train-153,"walaupun hotelnyo dipindahan karano alasan renovasi (dan kamar ambo bantuaknyo di downgrade), tp kaluarga tatap maraso nyaman. ac dingin, kasua empuk, aia angek ado, tp langik-langik banyak sawangnyo, kamar mandi iyo pulo, tp kasaluruhan okelah",positive
indolem-train-2276,tv nyo lain kali dipelokan yo,negative
indolem-train-1531,kurang siap untuak kabutuhan mandinyo paangek aianyo ndak bisa di stel tapi lumayanlah masih dapek sarapan,negative
indolem-test-198,"Ko dunia lah bro . Urang tibo dan pai . Ang alah tau itu . Kalau ndak nio urang pai, ang harus ado usaho . Jan capek manyerah .",positive
indolem-validation-20,Demokrat nilai kaputusan presiden maagiah kapastian - http://www.itoday.co.id/uncategorized/demokrat-nilai-keputusan-presiden-beri-kepastian ?,positive
indolem-train-2990,"indak ado nan bakasan. siaran TVnyo indak rancak, wifi mangalami gangguan,",negative
indolem-test-736,"tampek nyaman, cuma indak ado keset dimuko kamar mandi dan AC nyo bisiang",negative
indolem-train-991,"@suwito08: PDIP Pede Tanpo Efek Jokowi di Pilkada Sarantak http://bit.ly/19PXNk5  @PintarPolitik""""efek bareh maha PD ndak ?",positive
indolem-train-1098,Tampeknyo ok dan unik....hanyo se aia angeknyo ndak ado...,negative
indolem-train-1069,"Kalau packing, pakaiannyo diguluang agar manghemat tampek dan baju jadi ndak kusuik.",positive
indolem-train-820,kamar nyo oke rancak rapi.ac dingin. ramah.tapi wifinyo parah ndak bisa dipakai..,positive
indolem-test-303,"saran aden untuak padusi, jan buek pdkt tu mudah, pasulik, kok iyo inyo manyarah bararti rancak, jan manyasa. Daripada alah jadi ditingga pai.",negative
indolem-test-593,saat Shakira  kelas 2 SD inyo di tolak masuak paduan suaro sakolah karano gurunyo manilai suaro Shakira mirip suaro kambiang,negative
indolem-train-2561,"Fasilitas TV ndak ado chanelnyo, ndak ado salimuik, lalok ndak lamak dek banyak nyamuak. Tolong pelok an fasilitaih nyo, tarimokasih",negative
indolem-train-1827,palayanannyo tolong di pahaluih paragaiknyo acnak..,negative
