id,text,label
indolem-train-2485,"Allah pun paring kesempatan mlebu sekolah agama, entuk elmu, entuk kanca-kanca sing apik, ning ora dijupuk & pilih nggo nggawe dusa tanpa gela",negative
indolem-train-3201,"Tombo isin """" @NKRIndonesia79: Aneh bin ajaib :) >> PDIP Dianggep Aneh Manowo Nompo Badrodin Kapolri http://ln.is/nasional.inilah.com/T4Bdw ? ||@PintarPolitik",negative
indolem-train-3253,Nggon pelayanane isih kurang lan nek isa luwih ditambah meneh nggon fasilitase,negative
indolem-test-138,Montor Ramah Lingkungan UMM Siap Tandhing ing Manila http://republika.co.id/r/nk7wil,positive
indolem-train-3001,Saiaran tipi ora majas jajanane ora ana,negative
indolem-validation-232,elek. kasur lan sprei ana bekas sperma air mambu teyeng per kasure rusak sabun entek password wifi ra reti,negative
indolem-train-2657,"Jokowi 'Pegatan' Karo PDIP, Demokrat Nglamar http://dlvr.it/8fp9RV ",negative
indolem-validation-10,Sekolah nag Norwegia ora nguwei PR kanggo murite ben duweni waktu luweh bareng ambek keluarga.,positive
indolem-train-2250,Suami Istri Kader PDIP Tegas Maju Pilkada - http://JPNN.com http://goo.gl/fb/p2vlVB #KotawaringinTimur,negative
indolem-test-819,"Raffi ahmad kuwatir banget, durung tau de wots pie lak lelangan :(",negative
indolem-train-220,Wong wedok iki nag mangan nag kantin panggonan lungguhi pancet. 5 tahun sekolah kat iku 5 tahun mangan nag panggonan lungguh sing podo,positive
indolem-train-1507,Petinggi PDIP Kota Tarakan digrebek nalika Sabung Ayam - Indopos http://goo.gl/fb/QVre0D  #tarakan,negative
indolem-train-1398,"PDIP Dianggep Aneh yen Nampa Badrodin Kapolri: INILAHCOM, Jakarta - Anggota Komisi III DPR Fraksi Golkar, Bam... http://bit.ly/1Lp7289",negative
indolem-test-52,"pelayane apik lan ramah, kamare resik lan nyaman ning ACne ora adem.....",positive
indolem-train-3546,Syahrini pisan maneh ora nekani celukaning Mabes Polri: Syahrini maneh ora nekani celukaning  Bareskri.. http://tinyurl.com/l6hdqcn,negative
indolem-validation-66,Wong kang mangan kanthi syukur iku padha karo wong pasa kang sabar.” (HR Bukhari),positive
indolem-train-391,"Menyang pasar anyar, tuku klambi bathik. Senajan status dudu anyar, preian mesti tetep adhem.? https://instagram.com/p/zeNbqQqV4s/",positive
indolem-train-2953,Biasane aku entuk panganan neng kamar iki blas ra ana AC-ne mambu cuka (mbuh kaya cuka ning wagu banget),negative
indolem-train-3349,Politikus PDIP Nyebut Megawati Uwis http://Dikriminalisasi-JPNN.com : JAKARTA - Politikus PDI Perjuangan Sukur Nababan... http://bit.ly/19MJ0GD,negative
indolem-train-1038,Jumlahe penumpang sing balikno tiket nag kantor Lion Air kalong: Penumpang-penumpang sing terlantar polahe mundur par...  http://bit.ly/1LpceZU,positive
indolem-test-440,"Nek Ora Kenal, Piye Carane Syahrini Isa Foto Bareng Feriyani Lim? http://dlvr.it/8fvMgc ",negative
indolem-validation-255,"Nag itinerary nang seputaran Seminyak, panggonane OK ambek rodok carek karo endi-endi. Jeding perlu ditingkatno kebersihane, sak liyane iku uwes ",negative
indolem-train-1072,wifi ora kenek digawe. akeh reget nag sprei. akeh lamok,negative
indolem-train-3130,Hotele dadi siji karo kos. Rada reged lan brisik. Karesikan perlu diundhakne.,negative
indolem-test-652,"sing paling nyebai iku pulsa entek, hp batune meh entek, ra ana colokan barang (???)",negative
indolem-train-141,Yen lunga mantai mesti rasa tenang kan. Mesti sejuk je. Iku sing palinh apik lak pasal pantai ?,positive
indolem-train-240,kabehane apik ruangane resik. mung 1 sing kurang. Wi-Fine kurang nkeno neng kabeh kamar,positive
indolem-train-838,"?Nalika urip nduwe satus alesan nggo nangis, awakmu teka nggawa sewu alesan nggo ngguyu? >> http://bit.ly/1zkUE2p ",positive
indolem-train-2687,Lumayan.. tapi spreine ambu pesing.. kurang resik,negative
indolem-train-2929,"Penjualan Mobil Lemes, Laba Ridean Merosot http://bit.ly/1BqSKTi",negative
indolem-train-3476,"Panggonane nyaman, mok pelayanane kurang, jaluk pasword wifi ora dike'i. alasan",negative
indolem-test-11,"?Pas hidup menehi aku satus alesan kanggo nangis, awakmu teka nggawa sewu alesan kanggo mesem? >> http://bit.ly/1zkUE2p ",positive
indolem-test-396,"kamar kurang resik, ono tikus neng jero kamar sempet dicokot jempol sikilku",negative
indolem-train-1655,Sampek saiki aku isek mikir kenopo si ottong gelem dikongkon gawe klambi wedok? kan aku dadi kalah ayu?? http://instagram.com/p/zXOfhGp5XI/,negative
indolem-test-754,"Ana istilah sing kapisah kanggo wedi mlebu sekolah, yaiku 'Didaskaleinophobia'.",negative
indolem-train-779,Bar gela ra nonton langsung konser afgan. Paling ora Trans 7 nayangke? (neng Gang Bidan Yati) ? https://path.com/p/eY7ek,positive
indolem-train-75,Aja fokus ning apa sing wis lunga. Fokus ning apa sing isa mok lakoni kanggo nggawe uripmu luwih apik.,positive
indolem-train-3637,Ambene penak jedhing kurang resik,negative
indolem-train-2388,"ora jumbuh ekspektasi kamar ciut,  reged, lemari klambi ora ana, jeding reged,  banyu lirih, banyu panas mati... satpam grapyak... *nb: perlu mbenakne fasilitas.. ",negative
indolem-train-3118,"Kamar rada cilik karo TV cilik banget. Kamar mandi ora resik rada reged. Kemul lan sprei wis reregetan nanging dina sabanjuré sawise complaint padha diganti karo rodo resik. banyu blumbang iku reged lan wis suwe ora disiram. Senajan rada nguciwani, nanging rada diobati karo cemilan adem lan set adus. Ing kabeh iku oke",negative
indolem-train-455,"Aku bersyukur masa cilikku dihiasi imajinasi lan luka mergo dolan neng jobo omah, dudu dihiasi beberapa sukai/twit balik neng aplikasi-aplikasi HP?anonim",positive
indolem-train-2960,2:42:09 Sore Dalan Hayam Wuruk ono wit tibo lan nibani mobil: BPBD DPS,negative
indolem-train-2156,"#tinkling_music > Gawe Video Klip, Syahrini Nganggo Konsep Ora Masuk Akal http://goo.gl/fb/lNVF1Z ",negative
indolem-train-1997,"Sesuk, menawa dudu aku sing mbok pingini. Cepakke wae awakmu dirangkul eling-eling sing kadhemen. Merga, nek wis lunga, aku lali carane bali.",negative
indolem-test-949,"jan-jan nguciwakne, wifi mati, rame, ora diwehi slimut ",negative
indolem-train-3005,"sepurane aku lan kaluwarga kuciwa nginep nang kene. Mung merga kemul kena wutahan susu anak, aku kena dhendha 150ewu. Padahal aku nginep 2 bengi lan njupuk 2 kamar. Amargo iku aku kapok nginep kene maneh. Suwun ",negative
indolem-test-544,"Lumayanlah.. terjangkau banget, ning kudu ono sing dibenahi bab keresikan kasure. Wingi aku nemu kasure jijiki, akeh helai rambut, koyoke durung diresike durung disalin seprei bekas pengunjung sadurunge.",negative
indolem-train-782,"Among tamu hotel grapyak banget, kamare uga resik, jembar lan diwenehi jajanan entheng saben dina. Mung wingi banyu panas ing jeding raiso dienggo",positive
indolem-train-1603,"Kamar cukup amba lan nyaman kanggo regane sing terjangkau nanging petugas kebersihan kurang mesthikne aroma ing kamar, mambu rokok. Karesikan ing lorong-lorong uga kudu digatekake.",negative
indolem-train-3237,"MediPutra ; PDIP Dipunarani Wagu menawa Nampi Badrodin Kapolri: INILAHCOM, Jakarta - Anggot... http://bit.ly/1Lp6W0d  http://fb.me/mediputra.sh ",negative
indolem-test-918,"Jadwale Padat Sampek Ora Kober Ngasoh, Syahrini: Aku Jadi Wanita Udara: Sosok Syahrini iso dibilan... http://bit.ly/1AWvZ9H  #Kabari",negative
indolem-test-1004,Ojo nyalahke cah wedok yen suk nalikaning dheweke ninggal mergo kesel karo sifatmu sing ora preduli lan ora tau ngregani perjuangane :'),negative
indolem-test-790,Karyawane kurang ramah ambek apik,negative
indolem-validation-292,RT @KabarRakyat_Co: Dualisme Kapemimpinan Golkar Nulahi Pilkada Kabupaten http://kr-c.tk/1AX7gSv,negative
indolem-train-1020,"Kamare penak.. AC adhem pancuran kulah ana banyu panase, resik, TV LCD, ana klethikane.. mung neng ngisor dipan ora disapu dadi ana bleduge.. tur kabehane apik lan nyaman, petugas grapyak tenan..",positive
indolem-test-219,"Ragam_Jakarta: Syahrini kudu gelem panas-panasan nalika proses nggawe video musike sing paling anyar, Seperti It... http://bit.ly/1LlJ6km ",positive
indolem-train-568,repath - foto karo syahrink surabaya ???? (karo Poppy) [pic] ? https://path.com/p/3ZVOVz,positive
indolem-train-2826,"Sadurnge duwe anak, kondangan ra seribet iki. *beberapa make up, mompo susu, nyusuin, nganggo klambi*",negative
indolem-train-2626,"Pelayanane kurang apik, kasure kurang empuk, kemule tipis, anduke tipis, cemilan ora ono.",negative
indolem-train-1345,"Pesen kamar turone dobel, anduke endut, cemilan njaluk disek lagek dikei, kamar nag tingkat 3 tapi gak ono sing ngewangi ngangkat koper sampek kamar. gak ono lift",negative
indolem-validation-41,"#Seneng iku prasaja, pas hp kebeg pemberitahuan saka dee sing isine tansah nggarai mesem-mesem dewe<3 -upit",positive
indolem-validation-25,#KonserDariHati kakang ganteng @afgansyah_reza??? ? Terima Kasih Cinta dening Afgan ? Https://path.com/p/6zN6L,positive
indolem-train-2818,"rungane ombo mun TVne kanale mung sitik sing ono, flush toilet karo wastafele yo mati, lobine ora resik",negative
indolem-train-3393,"Ambu banyune kurang wangi, ambek jedinge kurang keramut.. perlu didandani padahal wes apik temp",negative
indolem-train-595,"Syahrini nganggo emas-masan regane 5M, keren yaaak :3 #kayangonokuwi #sesuatu",positive
indolem-train-697,Kulah keran lan gawangane teyengen. Kabehane ya cukup. Sarapan ayam pedhese enak tenan eman mau turah sithik,positive
indolem-train-1743,Seko aku umur 12 taun tekan 17 taun Conan isi ra gedhe-gedhe. Wes lah gowo sial wae opo maneh dheweke ora ono ono wae sing modyar.,negative
indolem-test-693,"jedhinge kurang apik, banyune cilik... ora ana wifi, ana tikuse akeh...",negative
indolem-train-1598,"Sprei, kemul lan bantal mampu apek, untung nggawa kemul lan bantal dhewe dadi ora sesek pas turu",negative
indolem-train-2056,Kualitas furniture ambek kebersihane perlu ditingkatno,negative
indolem-test-311,"Yen dheweke uwong Indonesia, HP si Penny mesthi uwis dirazia karo Leonard lan dikongkon hapus kontak sing lanang, ora oleh ketemu.",negative
indolem-train-741,"Konser musik """"dari hati"""" afgan, bakal tayang neng trans 7 dhilit jam 19:00 wib. Nggo sing ra sempet nonton langsung wingi, mangga ditonton :)",positive
indolem-train-2470,"Bangku ora iso dienggo, malah didadadeke ganjelan mejo. Kamar mburi necek, AC ribut, kolong kasur reged akeh sampeh.",negative
indolem-train-1042,Anggota Komisi I Dewan Perwakilan Rakyat RI Meutya Hafid ndhukung upaya Kementerian Manca Nagari narik duta... http://bit.ly/18d63Kc,positive
indolem-train-3418,"Cukup penak, ning jubin lan kaca kulah, pas kula nginep kurang resik.",negative
indolem-train-868,"Ati-ati Aa Raffi mulihE, Slamet malem minggon karo bojone sing ditresnani? cc @RaffiAhmadLagi @Lady6igi",positive
indolem-train-972,"? lan sak langkah liyane bakal ditulis minangka kabecikan kanggo dheweke, ing dalan nalika lunga lan mulihe.?  (HR. Ahmad)",positive
indolem-train-2290,"Aja dedonga udan mdun ya, mblo RT @dellyellie:mangga mangaa, supaya kuat ngadepi sedhihing malam minggu iki :)",negative
indolem-train-1927,Resik seh kamare tapi sepurane  jedinge kurang resik ono bekas rambut nag pembuangane banyu wastafele ambek endut ono rambute,negative
indolem-validation-208,tulung dibenaki : 1. banyu anget cilik 2. deposit sing dibalikke cocok karo sing disetorke padhal ora gawe kerusakan.,negative
indolem-train-2739,"AKu nginep ora genep sak dina merga pirang-pirang kahanan : 1. Bantal sing disediani ora layak (atos,  werna bantal soklat, ukurane cilik) 2. AC perlu dicek maneh merga unine banter ning njero ruwangan lan suhu uwis 18 ora kerasa ademe. 3. cat tembok ning jeding perlu dibenakne eneh merga akeh sing nglontok 4. banyu panas suwi metune kira selbh lagek metu. ",negative
indolem-train-3534,Wegah adus... kentekan klambi..rung dha garing...rung njupuk sing neng laundry... #baladhabocahkosan (neng Kostan malabar) ? https://path.com/p/2XZb8X,negative
indolem-test-202,Yihaaiiiiii Bu Ibu  ayu isih enom entok hadiah koyo ngene ki neng kumpulan kaluargo kantor? (karo Ocky) [pic] ? https://path.com/p/41MgDX,positive
indolem-train-2713,"Ndelok TV nyebabake manungsa mangane dadi tambah akeh. Tambah apik acarane, tambah akeh mangane.",negative
indolem-train-551,Manuk-manuk prenjak weneh bebungah kanggo bocah sing kerep ngewenehi dhewekke mangan ,positive
indolem-train-3100,Bambang : PDI-P ngamuk Jokowi milih BH : http://rakyatsulsel.com/bambang-pdip-marah-besar-saat-jokowi-pilih-bh.html ?,negative
indolem-train-2437,"Yen kanggo backpacker utawa sing ora pati mentingake barang kahanan penginapan, hotele apik-apik wae. Nanging aku ora disaranke kanggo sing nggawa bayi, anak cilik, utawa uwong tuwa amarga jedhinge ora resik, andhuk uwis werna coklat, seprei lan liya-liyane uga ora ketara resik. Hair dryer mung 1 kanggo 1 hotel, dadi nyilih sinilih. Ora disedyakake kanggo masak banyu panas, dadi yen arep banyu panas kudu menyang restoran. Wifi kudu neng restorane.",negative
indolem-test-688,cc: @vegas_organizer RT @ivonurdioputra: Min electric run tike-e thok ora entuk apa-apa..klambi karo stik ora entuk tiket kertas thok.,negative
indolem-train-2728,"lagi seneng HP Pavilion x360 mergo wernone sing seksi, ning ngopo mesthi kandel lan abot sih? http://www.bhinneka.com/mob_products/sku01414004/hp_pavilion_x360_-_red.aspx ? ",negative
indolem-test-73,Mangan seblak kui gawe sante.. Opo meneh garapan neng kantor sing nguras utek & pikiran ^_^,positive
indolem-train-2596,"Ora ana Internet Ning njero kamar dene adewe teka ning jero rangka ana kerja, dadi tulung pastikna fasilitase bener bener ada. ",negative
indolem-train-2610,"Biasa ae, kamare ora terlalu ombo. Kebersihane kurang, nag sorokan ono tegesan ambek awune rokok.",negative
indolem-train-4,Durung tau secerak iki wawancara karo Afgan Syahreza. #UpdateBlog @UpdateBlog http://shar.es/1WAN1b  lewat @sharethis,positive
indolem-test-717,"aku pesen 2 kamar dina sebtu, banyu mati saingga ora bisa gawe adus. Njedhing reged banget. Ranjang apik, karesikan kamar lumayan. pencahayaan ruangan kurang mapu.",negative
indolem-train-1634,"sarapane bioso wae , keresikan kirang",negative
indolem-test-238,"kasur penak, kamar resik, ana banyu panas. pelayane grapyak. kulah resik. 2 bengi penak tenan. ning eman tv antenene ra apik. murup ning tvne akeh semute",positive
indolem-train-3249,"kamare lumayan nyaman  lan rapi mathuk karo regane, sayange ora ana adhah sampah, tisu lan andhuk, keset katon reged kaya wis dinggo tamu sakdurunge (ora diganti) kolahe ya reged",negative
indolem-train-777,"#otomatisNgikuti Pilkada Sesarengan, PDIP ora Gelem Ngandelke Jokowi - http://JPNN.com  http://dlvr.it/8gBT6C  #pilkada",positive
indolem-test-663,"Cukup nyaman, nanging prelu diunggahake maneh karesikaning jeding, minimal ora mambu",negative
indolem-train-1214,ora ono kemul. mungkin luwih pake nek disiapke selimut,negative
indolem-train-164,Tangi turu iku sing digoleki mesti HP lan HP langsung wesss ngrungokne lagu kesayangan Fall in love ? @PrillyBie ???,positive
indolem-test-920,Ojo ninggalno barang sing berhargamu nag njero montor masio mok sediluk. Waspada nang pelaku pencurian karo modus mecah koco #NETwaze,negative
indolem-train-772,RT @DeyanaIdhamR: Sinau ning alam iku isa nyugehne pengetahuan sing ora awakdewe isa saka bangku sekolah.. Ciremai. http://twitter.com/DeyanaIdhamR/status/571216757366480897/photo/1pic.twitter.com/qtZ7434RDK,positive
indolem-train-3566,"Politisi Golkar Disangka Ana ""Kesepakatan"" Jokowi karo PDIP Babagan Badrodin: Politisi Partai Golkar Bambang Dadi... http://bit.ly/19OfeBw",negative
indolem-train-888,"Haloo. Wengi iki malem munggu alias malem minggu yo dadi wis adus, wangi nganggu klambi kebangsaan, langsung mangkat? http://instagram.com/p/zXMKb3iM3k/ ",positive
indolem-train-1333,"Jaman saiki ki ra mungkin tenan nek uwong ra nyekel hp 3 jam. Dadi nek kowe ra dibales-bales, ya iku sih sengaja dibenke.",negative
indolem-train-1111,Baju Thrsher Sk8goat mesthi nganggo gelang leher lonte kui kahkah bodo tenan anak wadon melayu iki,negative
indolem-train-2393,"Ora layak pol, lawas, bleduken, panas, gawe kipas angin,, getune pol",negative
indolem-train-720,"sajroning wong teka marani uripmu amerga ana alesan, lan yen dheweke ora lunga, iku amerga sajroning alesan kang luwih becik.",positive
indolem-train-356,Mantan aku neng kene:(?@infowatir: Karunya @detikcom: Afgan Bersyukur Taud FDadi Korban Begal http://tinyurl.com/qxwlmvz  ?,positive
indolem-train-494,Blazer sing digabungake karo kathok putih jebule cocok nggo menyang kantor iki :D,positive
indolem-train-293,"Pelayanan Apik... rego terjangkau.... emane keran shower patah, dadi ra ono banyu angete. nanging secara sakabahe oke",positive
indolem-train-1410,"06.20: Kecelakaan Montor Box B 9233 KU ngguling nag Bunderan Air Mancur BSD, Serpong Tangsel, ati-ati sing lewat kono. | (P. Wahyudin)",negative
indolem-train-2939,"#Pilhsijiwae ?? RT @dendi5150: Uwis wae motore puguh, loro-lorone ora nggawe helm, klambi apung-apungan..eee..ngalang-ngalangi dalan.",negative
indolem-test-936,Petinggi PDIP Kota Tarakan Digerebek Pas Sabung Ayam - Indopos http://goo.gl/fb/xTwRdI  #tarakan,negative
indolem-train-1295,Kamare pancen ya bener amba. Nanging bab kolah adhuh ambune ora nguati. Embuh mergane salurane utawa merga apa. Tapi pancen ambune kebangeten. Nganti mbelani tuku stella. Merga sak kolah sing mambu kolah liyane dadi mambu kabeh. Banyu panas ya ora guna. Kaping 2 nginep nang kana nggo kamar sing beda tapu padha wae kolahe tetep mambu.,negative
indolem-train-385,Ono wong pas nag sekolah deke ora apik. Nag Universitas deke dadi pelajar cemerlang. Deke gunakno peluang keloro sak apik-apike,positive
indolem-train-432,Tibake .. awakmu sing tak enteni :3 ? Kamu Yang Kutunggu (karo Afgan) teko Rossa ? https://path.com/p/fo9th,positive
indolem-train-1690,Kepala Sekolah Dituduh Cabuli Loro Siswi Pas Kesurupan http://regional.kompas.com/read/2015/02/23/14554601/Kepala.Sekolah.Dituduh.Cabuli.Dua.Siswi.Saat.Kesurupan ?,negative
indolem-train-3136,"#TEAMFOLLOWBACK #JFB Jadwal Padhet Nganti Ora Isa Leren, Syahrini: Aku Dadi? http://dlvr.it/8fpYRn  #F4F #TFB #FOLLOW @zhyfaniaaaa",negative
indolem-train-2794,"NGANGGO REGO NENG DUWUR 200 EWU AKU ROSO KERESIKAN LAN MENU SARAPANE ISIH KURANG, PELAYANANE SAE,",negative
indolem-train-1453,AC-ne kurang adhem lan saluran TV padha ilang,negative
indolem-train-224,Syahrini Kagumi Desa Singaraja - http://Tempo.co  http://goo.gl/fb/SRKGv3  #singaraja #bali,positive
indolem-test-702,Kim Kardashian lan North West Ngalemi Kacilakaan Mobil http://tinyurl.com/osjx8fo,negative
indolem-train-1554,"Keluwihan = kamar jembar, rega murah, ana kolkas, dipan apik, kurange = WiFi ora bisa dianggo pas ning jero kamar, saluran tipi ora apik, remote ora ana batre. biji 7/10",negative
indolem-train-1135,"Karo rega sing murah, bisa enthuk sarapan/sahur pas pasa. Panggone strategis persis ing sebrange gerbang Stasiun Cirebon. Sing prelu didandani yaiku jangkauane WiFi sing isih lemot, sawangan saka kamar cupet, kasur sing penak brubah bentuk, lan channel TV sing kewates ",negative
indolem-test-23,Dolanan neng meja kantor sing makin akeh wae.. #KantorAku http://instagram.com/p/zW91YWxMgs/,positive
indolem-train-1344,"kamare resik, nanging sayange wifine ora sampek nyang kamar lan tayangan tipine burek (gambare ora genah meh kabeh chanel)",negative
indolem-train-757,Sugeng Jumat barokah NaBil @RealSyahnazS @bangbily RaGa @RaffiAhmadLagi @OlgaSyahputra82 mugi-mugi awakdewe tansah dilindungi Allah,positive
indolem-train-2904,"detikcom Jadwal Padat sampek ora kober ngasoh, Syahrini: Aku dadi wong wedok angin: Sosok Syahrini iso dibila... http://bit.ly/1vQMNqQ ",negative
indolem-train-505,Klambi-klambi sing dinggo Britney Spears ing video klip 'Baby One More Time' rega sijine ora luwih seka Rp 150 ribu.,positive
indolem-train-995,Nggo opolah angel golek Rono rene wis neng ngareo mata? ? Kamulah Takdirku saking Raffi Ahmad & Nagita Slavina ? https://path.com/p/sxmRd,positive
indolem-train-832,"Menungso jatuh cinta iku ora nggumun, jaran mangan suket iku ora aneh, bedes iso metek petekane Hp 'hebat!! isek metek eneh? luar biasa!",positive
indolem-test-279,Panganan sing Halal lan Thayyib ya HC'ers :),positive
indolem-train-3289,"Kebersihan teras ruangane rodok endut bleduken, lampu interior akeh sing mati",negative
indolem-train-2899,Pegawe ora pedulian,negative
indolem-train-540,Yuhuiiii rejeki anak soleha...ono montor BMW nangkring apik nag ngarepe lawang omah.... #PhotoGrid? http://instagram.com/p/zWsP5XFeLB/,positive
indolem-train-2264,"Resik..nyenengke kanggo leren sedhela..mung banyu panas rada suwe, mbok menawa akeh sing ngenggo..Sakabehe wis apik",negative
indolem-validation-7,"Mendikbud: Sekolah sing saiki dike'i kepercayaan gawe nentukno kelulusane, dikarepno nyekel kepercayaan iku",positive
indolem-test-322,2. Dinamika internal Partai Demokrat (PD) minangka jalaran kang paling dhasar anane geger nganti ujunge nang kasus hukum Anas Urbaningrum.,negative
indolem-train-1871,Kabar Kader PDIP Dukung Interplasi dinilai Rugike Partai: Kader PDIP dijaluk dukung keputisan Presiden Jo... http://bit.ly/1LpwiLI,negative
indolem-test-602,"Dikira Jenazah, Kulawarga Nyerang Montor Panggawa Barang Korban: Atusan warga ijik ngruntel ing posko. S... http://bit.ly/1AXy9pz ",negative
indolem-train-42,"Nyembah Ar Rahman, nyebarake salam, lan menehi pangan marang wong liya, banjur sampeyan bakal mlebu suwarga."""" [HR Tirmidzi]",positive
indolem-train-1942,Aku telfon panggone nanging ora ana wangsulane aku nekani mrono jam 12 awan jebule tenan pagere gembokan...lan aku ora bisa nginep neng kono....akhire aku golek hotel maneh...aku kuciwa mergo uwis nggawa kaluwarga,negative
indolem-test-738,rasa ditinggal sing paling sedih lan nganyelne iku ana loro: 1.ditinggal lunga 2.ditinggal turu.,negative
indolem-train-1475,"Apa sing paling diwedeni #Taurus yaiku nalika wong sing disayang, lunga ninggalke",negative
indolem-train-1989,"Sprayx kasar lan dhuwe wulu, AC ne rame",negative
indolem-train-2356,"Wi-Fine ra mlaku, eman banget. Ruangan peteng banget lan ora ono jendelo",negative
indolem-test-624,"lak bengi hotele peteng,  lampune kamar uga kurang padang,  jedinge mambu,  kunci kamare radak rusak",negative
indolem-train-3626,"Shower mati wis, among tamune kurang mesem",negative
indolem-train-1486,Syahrini Sengaja Ora Jaluk Ijin Gawe Rame-rame Ning Panggon Umum http://dlvr.it/8g1tyq,negative
indolem-train-824,"Ngenip neng Airy Room mesthi berkesan. Pegawe ramah, pelayanan prima lan kolam renang sing gawe anak-anak kerasaan suwe-suwe neng kene. Nggo ruangan resik, nyaman, ora jembarning ora kesempiten mergo isih iso ruang go kasur tambahan. Kamar mburi jembar, mung rodo setitik mambu ora enak. Wi-Fi raugan ok banget. Kabehane oke banget Airy Room.",positive
indolem-validation-169,"Sidang Mahkamah Partai GOlkar, Minggu ngarep meh jikuk putusan",negative
indolem-train-3364,Nyaman panggone ing tengah kutha munf wifine nganggi wifiid,negative
indolem-train-1134,"listrik sempet mati, kasur mambu",negative
indolem-test-781,ACne model lawas.. Brebeggg tenann marakke angel turu lan ora adhem.. Tambah banyu panase mung isa dinggo,negative
indolem-train-1388,"Tangi esuk - isih ngantuk - fokus golek hp - ndhelok media sosial, sms, BBM lsp - ngarep-arep tembung manis saka wong sing ditresnani.",negative
indolem-test-555,"Nag mlebu form 5 ora sabar mari sekolah, seumpomo nag tengah ulangan gak sabar mari ulangan ambek saiki wedi karo sak lembar kertas ae?",negative
indolem-train-3208,"Akeh banget sih takon sarung iPhone neng toko, roto-roto pecah layare .kui hp larang-larang kok cepet rusak ,mending? ? https://path.com/p/3ZmHTp",negative
indolem-test-283,"+kamare lumayan amba, murah, sarapane maneka warna, ana kulkas, teko banyu panas, pancuran panas, AC adhem, panggone strategis, lift - channel tv sithik, ana coro cilik 1, dina 1-2 ora entuk snack, dina 4 ora diresiki tur ora entuk ngombe+snack, yen nyeluk petugas hotel suweeeeeee tapi kurang luwih apik, aku arep nginep meneh ana kene merga kamare gedhe, resik, murah, sarapane enak",positive
indolem-train-3360,"Hotele apik sih, gur ndilalah entuk kamar sing AC-ne panas banget, ora adhem.",negative
indolem-train-480,Syahrini Janji Bakal Teko Yen Diundang Mabes Polri Meneh http://goo.gl/fb/dzCHoi,positive
indolem-train-1926,"tulung spreine dianti, akeh bolong-bolong bekas slomotan udud, lan sediakne kastok klambi uga penunjuk arah kiblat",negative
indolem-train-843,"Raffiah : RAFFI AHMAD IKUI ORA ONO WATES,ISTIMEWA,GANTENG,PECICILAN,APIKAN,ORA SOMBONG,RAJIN MENABUNG Bhaaqqq:3",positive
indolem-train-232,"Lah mangkane nag sekolah sing bener ya! sinau sing temen, nag kulia ojo di suwe-suwene! lulus notok 4 tahun. Eman duwete ambek umure",positive
indolem-test-548,Ana pirang-pirang sing kudu diduwurne maneh kaya TV. Mung isa nonton pirang-pirang channel apik lan,negative
indolem-test-214,"Nolak HAMAS, Putusan Pemerintah Dialem PDIP http://bit.ly/1KwhWtq  Ricciardo sawetara paling cepet nalika uji pramus... http://bit.ly/1vPkARi ",positive
indolem-train-1271,wes ping papat lan yakin bakal balik nanging sayange fasilitas banyu anget ora berfungsi lan ugo semprotan neng kamar mburi,negative
indolem-test-277,Pap foto sing menurutmu paling apik? ? Ora paling ayu tapi onone nang hp mok iki :3 http://ask.fm/a/c0874fi8,positive
indolem-train-3512,nyamane standar... gur keset sikil nang wc ora ana... kamare dadi reged,negative
indolem-validation-143,apik resik wifi suwe andhuk mambu kuwi wae sing didandani nek liyane wis nyaman wae,negative
indolem-train-3238,"Efisiensi Anggaran, Pemkab Majalengka Ngilangi 158 Sekolah http://bitly.com/1au8xEX ",negative
indolem-test-319,"Kabeh kurangane , kabeh kelemahan awakmu dadikne tresna.. ? Kamu Yang Ku Tunggu (karo Afgan) dening Rossa (karo Andika) ? https://path.com/p/3Y8hBL ",negative
indolem-train-3619,"WiFi ora bisa dienggo neng jero jeding & AC njero kamar kurang adem, suwun",negative
