id,text,label
5324,"Di lembur abdi mah aya kagiatan Festival Anak Sholeh. Kagiatan ieu teh rutin diayakeun dina raraga meriahkeun taun baru Islam. Kagiatan ieu dilaksanakeun unggal taun. Pelaksanaan nana nyaeta mangrupa lomba-loba keagamaan jiga lomba MTQ, kaligrafi, pidato, jeung hafalan Qur'an. Peserta lombana ti tingkat SD dugi ka SMA di sakacamatan. Panutupan kagiatanna teh sok diayakeun pawei obor ngurilingan desa. Kagiatan ieu teh diayakeun ku remaja masjid kerjasama sareng karang taruna. Kagiatan ieu teh jadi salah sahiji kagiatan rutin nu bermanfaat pisan jang masyarakat, khususna murangkalih jeung remaja sabab bisa jadi media pengembangan elmu agama jeung kamampuan kaagamaan. Cocok pisan kagiatan ieu kangge diikutsertaan ku murangkalih ti sagala usia. Yuk ah urang ramekeun ieu kagiatan!",religion
5772,"Dina event Porprov mah upacara pengalungan medali teh dilaksanakeunna unggal beres pertandingan di sapoekeun. Misalna dina poe mimiti pertandingan sok digelar pertandingan nomor sprint. Beres pertandingan sprint teh tuluy diumumkeun hasil pertandinganna sajam saberes pertandingan. Samunculna hasil pertandingan, dibere waktu sapuluh menit jang protes sasuai prosedur. Mun tercantum jadi peraih medali berarti kedah siap-siap jang upacara pengalungan medali. Mun henteu tercantum mah berarti pertandingan poe harita dianggap beres. Biasana pertandingan beres samemeh lohor, terus upacara pengalungan medali na dilaksanakeun jam dua atawa paling telat teh beres ashar. Beres upacara pengalungan medali teh tuluy bubar kangge persiapan pertandingan di hari selanjutna.",sports
451,"Idul adha nyaeta salah sahiji poe dina agama Islam. Dina poe ieu sok loba nu meuncit hewan peliharaanna, bisa embe, sapi, jeung sajabana. Matak dina poe ieu teh urang sok kabagi loba daging kurban. Daging kurban ieu mindeng ku urang sate pas peutingna teh jeung kulawarga anu sejen. Tapi mindeng oge pas poean idul adha urang mantuan anu meuncitna, sakapeung mah sok mesetan kulitna ngameh misah jeung dagingna, atawa misahkeun daging jadi sababaraha bagian make bedog ngarah bisa dibagi-bagi ka tatangga nu aya di sabudureun. Urang oge sok mantuan mungkusna jeung nganteurkeun bungkusan nu eusi daging eta ka imah-imah tatangga anu deukeut. Samemehna urang geus nyieun catetan saha wae ngaran-ngaran tatangga nu rek dibagi ngarah henteu aya nu kaliwat.",religion
2424,"Kawijakan para pamingpin Masyarakat Adat dina ngajaga masarakat adat dina mangsa pandémik diangkat jadi téma panalungtikan ku Guru Besar Fakultas Hukum UB (Fakultas Hukum Universitas Brawijaya) Prof. Dr. Moh. Fadli, S.H., M.Hum jeung tim peneliti Fakultas Hukum Universitas Brawijaya.Dina basana, pandémik disebut “salaat” anu lumangsung unggal taun. Sedengkeun tina segi cara, aya sababaraha tahapan dina ngungkulanana, nya éta ku cara ngado’akeun syariat jeung ngagunakeun obat-obatan alami saperti bungbu jeung kalapa héjo dihijikeun jeung mantra kalawan tujuan supaya cageur jeung aman. Dumasar kana data resmi, kabuktian teu aya anu kapangaruhan ku wabah COVID-19. Strategi kawijakan ti tokoh masarakat tradisional parantos aya sareng diwariskeun sacara turun-temurun. Biasana aranjeunna gaduh clue sateuacan kajadian. Kawas ngaliwatan ilham jeung firasat dina ngungkulan masalah bala. Datangna hiji wabah biasana dipikawanoh ngaliwatan firasat jeung ilham anu ditarima ku Puun. Saparantosna, pikeun ngaregepkeunana, salasahiji hal anu dilakukeun ku tokoh adat saperti Puun, Jaro nya éta ngumpulkeun masarakat satempat di Balé Adat pikeun méré informasi kalawan tujuan pikeun ngaronjatkeun kaparigelan jeung ngalaksanakeun kagiatan saperti biasa kalawan tumali jeung batin.",culture & heritage
8818,"Barbel mangrupikeun alat latihan olahraga anu dianggo pikeun latihan beurat sareng angkat beurat. Barbel panjangna rupa-rupa ti 4 suku (1,2 m) nepi ka leuwih 8 suku (2,4 m), tapi biasana aya batang beusi leuwih panjang tibatan 2,2 méter (7,2 ft) anu biasana sok dipaké ku atlit. Bagian tengah batangna diaméterna ti 25 milimeter (0,98 inci) nepi ka 2 inci (51 mm), biasana dibuat pola silang pikeun ngaronjatkeun cekelan. Cakram beurat (piring) diselapkeun ka luar bar pikeun ningkatkeun beban total anu dipikahoyong. Beban ieu diamankeun sareng distabilkeun ku cincin pikeun nyegah ragrag nalika latihan anu tiasa nyababkeun tatu, atanapi barbel ragrag sareng ngalayang ka hawa kusabab beurat anu henteu sami.",sports
904,"Genshin Impact salah sahiji game favorit urang. Ti mimiti di rilis nyaeta taun 2019 urang geus maen, mun diitung-itung mah ayeuna geus 2 taun. Lain tanpa sebab urang maen game ieu salila eta teh, lantaran game ieu nyieun kacanduan pisan, boh dina karakter nu ditampilkeun, cara gelutna, atawa event-event nu disadiakeun tiap patchna. Teu ngan saukur kitu, musik jeung alur ceritana oge alus, jadi puguh arah maen game ieu akhirna kamana ari aya jalan carita mah. Sanajan game santai, tapi urang cukup ka tangtang ku ngalawan tiap musuhna. Dina sakitu loba kaleuwihanna, game ieu mibogaan kakurangan nyaeta teu bisa maen ngalawan batur, lawanna ngan komputer, jadi asa rada monoton.",technology
2767,"Kunaon acara televisi teh ngan ukur diemutan kanggo golongan bawahan??Jawabna kumargi aya persepsi anu salah di kalangan masyarakat, samemeh urang ngartos naha aya salah persepsi dina nganilai program TV, hayu urang telusur ka jaman jaya-jayana acara TV taun 90-an dugi ka 2010-an. nu mikaresep program TV nyaeta boomers ahir jeung millennials awal, alias nu lahir di 70-an nepi ka 90-an, jadi barudak dilahirkeun di jaman éta kiwari heubeul sahenteuna 30 taun jeung maksimum 65 taun. bisa dihontal ku kelas menengah jeung jalma umur produktif, nya éta barudak milenial sarta condong cicing di perkotaan sabab sinyal internét ieu memang leuwih mulus di perkotaan, dina taun 2015 sarta di luhur smartphone beuki affordable ku sakabeh jalma sarta dipaké ku barudak millenial. Samentara éta, Boomers teu acan pindah kana telepon sélulér heubeul, jadi TV mangrupa sarana pilarian informasi jeung hiburan, sedengkeun generasi milenial geus baralik kana smartphone pikeun néangan hiburan jeung informasi.",technology
7468,"Benten sareng kamera DSLR. Sasuai jeung namina, kamera mirrorless mangrupakeun kamera anu teu gaduh eunteung. Janten, gambar atawa cahaya langsung kana asup kana sensor sapertos kamera saku atawa kamera hape biasa. Lensa di kamera mirrorless oge tiasa dileupa pasang sapertos kamera DSLR. Lantaran teu gaduh eunteung, ukuran kamera mirrorless ieu biasana langkung leutik tibatan kamera DSLR. Kamera mirrorless oge biasana gaduh kaleuwihan nyaeta tiasa ngirim poto langsung tina kamera ka hape. Janten lamun urang resep popotoan teras hoyong dikirim ka sosial media tiasa langsung, teu sapertos kamera DSLR anu kedah mindahkeun heula poto nu aya dina kartu memori ka laptop.",technology
5404,"Indonesia mangrupakeun nagara Bhinneka Tunggal Ika nu cukup beragam dina sagala hal, salah sahijina dina agama atawa kayakinan. Sabab kaberagaman agama ieu, ngajadikeun Indonesia gaduh seueur upacara kaagamaan nu beragam jeung nunjukkeun ciri khasna masing-masing. Nu rutin ngayakeun pacara kaagamaan nyaeta umat Hindu di Bali. Upacara kaagamaan diayakeun unggal hari besar agama Hindu. Hal ieu oge jadi salah sahiji daya tarik wisatawan jang ngalakukeun kunjungan ka Bali. Urang salaku masyarakat nu terbiasa ku kebergaman, kedah gaduh rasa toleransi nu tinggi. Ulah dugi ka ngan ngabenerkeun agama mayoritas, sabab agara minoritas eta nu justru ngajadikeun kakayaan kaberagaman di Indonesia. Yuk urang jaga bareng-bareng kakayaan kaberagaman ieu!",religion
7408,"Skateboard mimiti dilakukeun dina pertengahan taun 1940 - 1950 ku Frank Nasworthy tukang selancar ti California, anu dina waktos eta manehna hayang manggihan cara sejen kanggo selancar nalika cai laut teu ombakan. Ti harita keneh skateboard mulai dimaenkeun. Mimitina papan anu dijieun ampir sarua jeung papan selancar, tapi ukuranana rada leutik tur dibere ban roller skate.Tapi bakating ku populer, seeur anu ngadamel model papan skate sapertos jaman kiwari.  Skateboard mimiti asup ka Indonesia dina taun 80-an. Pecinta skate di Indonesia meunang informasi ngeunaan skate ngaliwatan video jeung maca majalah skateboarding ti luar negeri. Oalhraga ieu oge janten salah sahiji cabang olahraga anu ditandingkeun di ASEAN Games. ",sports
5846,Unggal isuk-isuk teh Bapak Andi mah sok nonton berita dina TV. Mun sakali katinggaleun berita teh sok kukulutus bari ngutruk teu pararuguh sabab asa teu update. Jeung Bapak Andi mah nonton berita teh mangrupakeun salah sahiji kawajiban unggal isuk dina ngongsong aktivitas sapopoe. Mun geus nonton berita mah asa reugreug rarasaan na teh. Hiji poe mah mati lampu isuk-isuk teh sabab aya nu konslet tina garduna. Bapak Andi buru-buru neangan tukang koran keliling jang meser koran terbaru. Berita teh wajib pisan ditonton supaya bisa apal situasi terkini tina kaayaan sosial di nagara Indonesia. Hal ieu teh geus jadi kabiasaan Bapak Andi ti basa keur ngora keneh.,technology
996,"Cara ngagunakeun mesin jang nilepan baju otomatis babari, tangtuna urang ngan cukup ngajepit pakean nu anyar rengse diseuseuh dina rak di bagian bolong mesin nu aya di bagian luhur. Tuluy teken sajumlah tombol jang nangtukeun jenis nu bakal ditilep teh. Saenggeus kitu sacara otomatis mesin bakal narik pakean nu geus diasupkeun. Hasilna pakean nu geus disetrika bakal kaluar tina mesin ngaliwatan bolong bagian handap. Proses ieu ngan lumangsung salila sababaraha detik. Pas pakean geus asup, urang langsung bisa ngasupkeunna deui ka jero mesin jang nilepan deui. Jadi pakean nu geus ditilepan teu kudu langsung dicokot, lantaran mesin bakal ngasusun rapih. Proses ieu bakal teterusan saloba pakean nu ku urang pikahayang jang ditilepan.",technology
4105,"Nabi Isa 'alaihis salam nyaeta nabi panungtungan saméméh nabi Muhammad. Ku takdir Allah, anjeunna dilahirkeun ku Maryam binti Imran tanpa bapa. Dina Al Qur'an, Allah ngirimkeun seueur ayat anu ngandung bantahan ngeunaan kayakinan anu salah ngeunaan Isa, sapertos kapercayaan yén anjeunna putra Allah atanapi salaku Gusti. Di antarana dina surat Ali Imran Allah diturunkeun ngeunaan 83 ayat patali Isa bin Maryam jeung rebuttals ngalawan ahli kitab. Allah ogé ngajelaskeun leuwih jéntré ngeunaan prosés kalahiran Isa dina surat Maryam (tingali ayat 16-37). Allah ogé nyaritakeun ngeunaan umat-Na anu satia (hawariyun), carita masakan kadaharan (QS. Al Maidah 112-115), jeung Isa diangkat ka sawarga (QS. Ali Imran 54-55, Nisa '155-159).",religion
5507,"Soto Betawi nyaeta salah sahiji tuangeun khas ti Jakarta. Soto Betawi teh eusina nyaeta kikil, mie telor, toge, bawang daun, kol, jeung dibere keureutan tomat jeung jeruk lemo. Rasana gurih, asin, sedep, seger pisan komo mun dijerukan. Nuang soto betawi teh enakna mah ditambahan sambel jeung saos lada tuluy dibaturan ku kurupuk. Komo mun kikilna loba pisan mah, beuh mantap ngeunahna. Biasana soto Betawi teh dituangna peuting. Soto Betawi teh ayeuna mah sanes di Jakarta hungkul ayana, tapi di daerah sejen ge aya. Ngan emang mun ka kotana langsung mah sok leuwih ngeunah nuangna sabab ngangge racikan bumbu nu original keneh.",culture & heritage
4608,"Lamun keur usum hujan siga kieu dimana urang nyeusehan sok tara garing, karek eunggeus nyeusehan tuluy di poe langsung breg hujan eat teh musingkeun pisan jeung nyieun kesel capek kudu bolak balik. Pusing baju teu garing garing komo lamun baju anu penting anu kudu di pake saperti saragam sakola atawa baju saragam gawe, eta teh ngajieun mikir pisan lamun teu di seuseuh kotor tapi lamun di seuseh ngke teu garing pan barabe lamun rek di pake, jaba baju teu garing teh sok jadi bau lamun kalilaan. Untung na ayeuna aya mesin cuci, ususm hujan mesin cuci teh kapake pisan kusabab aya pengeringna. Jadi ges parat nyeuseuhan langsung di garingkeun nepi ka garing pisan tuluy bisa ngan tinggal di poe angin anginkeun ge baju geus garing jadi teu bau jeung bisa langsung di pake.",technology
5893,"Mun gaduh kasibukan dina padamelan terus teu aya waktos kangge beberesih di imah, ayeuna mah gampil. Kantun meser robot nu bisa ngabantuan dina beberesih imah. Ayeuna mah seueur rupa robot nu siap jadi asisten dina beberesih imah. Jadi, meskipun teu gaduh loba waktos jang beberesih, tinggal aktifkeun wae robot cleaner na, ke ge beresih nyalira. Teu kudu ditungguan atawa dikontrol, sabab tos otomatis bisa ngalakukeun tugas kaberesihan. Jadi, teu aya alasan deui jang teu beberesih. Yuk budayakeun hirup beresih, najan make robot ge! Supaya hirupna beresih jeung ngeunaheun. Komo ku robot cleaner mah kan leuwih efektif jeung efisien dina ngalakukeun pagaweanna.",technology
2737,"Game Shogun 2 ngahususkeun sudut pandangna pikeun perang antara tuan tanah anu disebut Daimyo di Jepang abad pertengahan. Kanyataanna, dina Perang Total saméméhna (Kakaisaran jeung Napoleon), jumlah nagara jeung budaya kalibet dina cukup loba sahingga unit tempur di lapang ogé rupa-rupa wangun jeung fungsi. Dina kaulinan ieu, unit nu tarung lolobana sarua. Bédana, unggal Daimyo miboga unit husus numutkeun kaahlian daérah. Biasana, unit ieu mangrupikeun vérsi anu langkung saé tina unit biasa sareng pungsi anu sami. Kusabab unggal unit tempur dina kaulinan ieu gaduh statistik anu mangaruhan kakuatan tempur na, unit khusus anu gaduh kamampuan anu langkung saé pasti bakal mangpaat pisan di medan perang. Tangtu, kalawan catetan nu Anjeun bisa make eta kalawan strategi katuhu.",technology
7452,"Dina Mei 1975, televisi di Jakarta geus mulai dicobian ditayangkeun televisi warna. Dina mangsa transisi tina televisi hideung-bodas ka televisi bwarna, pangaos televisi warna tilu kali lipat leuwih awis tibatan televisi hideung bodas. Pangaos televisi warna di taun eta diical mulai ti dua ratus opat puluh rebu rupiah kanggo tipi tabung ukuran opat belas inci nepikeun tujuh ratus dua puluh lima rebu rupiah kanggo tipi ukuran dua puluh genep inci. Sairing jeung ayana tipi warna, mulai seeur muncul saluran tipi swasta sapertos RCTI, SCTV, ANTV, jeung saluran tipi nu sajabana. Ku ayana tipi warna, mulai seeur jalmi anu leuwih sering lalajo tipi lantaran leuwih gancang patukeur informasi ti saluruh Indonesia. ",technology
4605,"Radio - hiji sora sajuta Ceuli Sigana mah kalimah ieu téh bener-bener cocog pikeun ngagambarkeun salah sahiji média kontemporer, anu geus aya di Indonésia ti jaman kamerdikaan. Saméméhna radio ngan ukur dijadikeun média pikeun nyebarkeun warta atawa warta ti pamaréntah Indonésia. Malah béja ngeunaan 'runtuhna' Jepang ku sekutu-sekutuna ogé dipikawanoh ku masarakat Indonésia ngaliwatan siaran radio waktu harita. Tapi beuki lila, radio beuki ngepak jangjangna nepi ka ayeuna. Sareng anu langkung saé, ayeuna anjeun henteu kedah nyandak radio fisik dimana-mana. Ngan nganggo smartphone anu anjeun gaduh, anjeun tiasa langsung ngalirkeun radio karesep anjeun. Henteu ngan ukur inpormasi atanapi warta anu disiarkeun. Sanajan kitu, radio kiwari ogé dipaké salaku média hiburan, média informasi sarta tangtu média anu ngadidik pangdéngéna di Indonésia.",technology
973,"Aibo mangrupakeun teknologi robotika nu paling anyar jeung bisa jadi bagian tina transportasi, pendidikan, jeung perawatan kesehatan. Aibo nu versi anyarna dijieun beuki mirip pisan jeung anjing nyaanan. Versi anyar ieu diklaim bisa leumpang siga anjing nyaanan, siga salaman, diuk, ngageolkeun buntutna, ngudag bola, ngalakukeun ces atawa tos, ngiceup, peureum, diuk sabari ngabuka leungeuna, jeung masih loba deui. Aibo mibogaan ceuli anu panjang nu bisa gerak. Robot anjing ieu oge dilengkepan ku kamera di bagian irungna, opat mikrofon sora, jeung alat jang mikawanoh. Kapribadian Aibo bisa dibentuk tina pola asuh nu bogana. Ieu nu nyebabkeun Aibo bisa digunakeun saluyu jeung kabutuhan nu bogana.",technology
8079,"Tragedi Kanjuruhan teh kudu janten tugas urang sarerea. Ulah patunjuk-tunjuk saha nu salah urang sarerea kudu bertanggungjawab ngabereskeun ieu persoalan tur ningkatkeun atanapi ngembangkeun kualitas sepak bola di Indonesia. Seueur nu nyalahkeun PSSI kusabab teu tiasa ngajalankeun regulasi nu tos diatur ku FIFA. Regulasi nu dimaksad didieu nyaeta perkawis penggunaan gas air mata dijero stadion nu dianggo pihak kaamanan dina perkawis ieu nyaeta kepolisian. Salian PSSI,  PT LIB salaku pengelola liga di Indonesia kudu tanggung jawab perkawis teknis di stadion sapertos kapasitas maksimal stadion sareng waktos pertandingan. Para supporter oge kudu daek diajak kerja sama ngarah kaamanan sareng kaselametan di stadion kajamin.",sports
4164,"Upacara kaagamaan dina agama hindu nyaeta aya upacara  odalan, odalan nyaéta odalan atawa Piodalan. Ieu Odalah (Piodalan) bisa ogé disebut pujawali, petoyan atawa Sirattaan. Odalan nyaéta runtuyan upacara Dewa Yadnya anu ditujukeun ka Ida Sang Hyang Widi di hiji pura (tempat ibadah agama Hindu) atawa tempat suci. Biasana upacara ritual ieu dilaksanakeun dumasar kana kalénder Pawukon Bali (210 poé), genep bulan sakali sarta dipingpin ku pandita (jalma suci) atawa pandita. Upacara agama Hindu ieu dilaksanakeun dina poé-poé alus anu geus dipilih jeung ditangtukeun. Poé-poé anu hadé ieu nyaéta Kapat Purnama, Kalima, Kadasa. Anggar sunda Kulantir, Julungwangi, Medangsia, Tambir, Warbakat jeung Dukut. Saniscara Kliwon (Tumpek) Landep, Wariga, Kuningan, Krulut, Uye jeung Wayang. Ukiran Buda Wage, Warigadean, Langkir, Merakih, Menail sareng Klawu, sareng seueur deui dinten anu saé. Prosesi Upacara Odalan umumna lumangsung kira-kira tilu nepi ka tujuh poé atawa leuwih, gumantung kana klasifikasi candi anu dimaksud. Tujuan dilaksanakeunana Upacara Odalan nyaéta pikeun nyiptakeun kahirupan masarakat anu harmonis jeung sejahtera rohani. Istilah Piodalan (Odalan) asalna tina kecap ""wedal"" anu hartina ""kaluar"" atawa ""dilahirkeun"". Ku kituna, saperti hajatan ulang taun, Odalan atawa Piodalan ditangtukeun minangka ulang taun candi atawa tempat suci (gedong).",religion
2652,"Tips sarta kumaha carana diajar ngojay pikeun pamual
Ieu kumaha carana diajar ngojay anu tiasa dicobian pikeun pemula.

1. Biasakeun kana cai kolam renang anu deet
Ngabiasakeun di cai mangrupikeun léngkah munggaran anu kedah dilakukeun nalika anjeun diajar ngojay. Metoda ieu basajan. Anjeun tiasa ngamimitian ku nangtung dina kolam renang anu henteu jero teuing, upami anjeun nangtung, suku anjeun masih tiasa noél handapeun kolam renang sareng sirah anjeun henteu lebet kana cai.

Sanggeus éta, mimitian submerging beungeut anjeun dina cai bari tetep nangtung. Tahan salila lima detik bari exhaling jero cai, teras angkat beungeut anjeun kaluar tina cai deui. Ieu bakal ngidinan Anjeun pikeun ngarasakeun sensasi engapan di jero cai jeung lalaunan meunang dipaké pikeun mahluk di cai.

2. Mimitian diajar ngambang di cai
Pikeun bisa ngojay, anjeun kudu bisa ngambang dina cai. Kanyataanna, awak urang bakal otomatis bisa ngambang dina cai, tapi kadang sieun ngajadikeun jalma teu wani bener ngaleupaskeun cekelan maranéhanana atawa ngalacak suku maranéhanana ti handap kolam renang.

Ku alatan éta, nalika anjeun diajar ngambang, mimitian di kolam renang deet ambéh lamun aya refleks pikeun nangtung sanggeus nyoba ngambang pikeun kahiji kalina, suku anjeun masih bisa ngahontal handap kolam renang.",sports
4239,"Indonesia jeung nu ngabogaan loba suku suku di daerah loba seni budaya tradisional na salian ti tari tarian tradisional indonesia oge boga loba alat musik tradisional nu unik jeung ngahasilkeun sora nu merdu salah sahijina nyaeya Sasando.  Alat musik sasando berasa dari kabupaten Rote ndao nusa tenggara timur (NTT) Sasando nyaéta pakakas senar anu di paenkeun ku cara dipetik. Alat musik ieu ampir sarua jeung kecapi jeung kacapi. Sanajan kitu, Sasando ngabogaan sora has. Pikeun muterkeun alat musik tradisional NTT ieu ngagunakeun dua leungeun ti arah sabalikna, kénca ka katuhu jeung katuhu ka kenca. Leungeun kénca muterkeun melodi jeung bass, sedengkeun leungeun katuhu muterkeun akur.",culture & heritage
7102,"Upacara Tabuik nyaeta hajatan lokal masarakat Minangkabau pikeun mieling pupusna Hussein bin Ali, incu Nabi Muhammad SAW, dina Perang Karbala tanggal 10 Muharam. Salian ti minangka mepeling pupusna putu Kangjeng Nabi Muhammad saw, ieu upacara oge minangka upacara syukuran datangna bulan Muharam. Upacara ieu dilaksanakeun ku masarakat Minangkabau di daerah basisir Kota Pariaman. Ieu upacara teh mangrupa bagian tina cara masarakat ngarayakeun tradisi Tabuik. Pamarentah geus mikawanoh yen upacara adat ieu mangrupa bagian anu berharga di masarakat. Tradisi ieu geus lila lumangsung, cenah hajatan ieu lumangsung ti abad ka-19 Masehi. Perayaan anu tadina ngan ukur tradisi, kiwari geus robah jadi salah sahiji daya tarik para wisatawan anu rek datang ka Sumatra Barat.",religion
7171,"Oleh-oleh anu paling kasohor di Garut nyaeta dodol. Dodol aya seeur pisan jenisna, tapi sadayana gaduh proses nyieun anu sarua.Kahiji, panas cai dina panci nepi ka kulub, lajeng nambahkeun gula jeung uyah kana cai nu ngagolak, aduk nepi ka gula larut. Salajengna, tambahkeun tipung beas jeung aci jagong kana cai, aduk nepi ka rata. Tambahkeun santan, aduk nepi ka sadayana rata. Tambahkeun bumbu bari diaduk nepi ka rata. Masak nepi ka adonan heuras tur robah warna ka warna emas. Angkat jeung tuang campuran kana loyang anu tos diolesan minyak. Pipihkeun adonan tinggalkeun pikeun sababaraha jam sina teuas. Potong dodol nurutkeun ukuran anu dipikahoyong.",culture & heritage
5364,"Khotbah jumah teh salah sahiji rukun ibadah jumah nu dilaksanakeun waktu dzuhur. Salaku jamaah, urang wajib hukumna ngadangukeun jeung ngaregepkeun khotbah jumah. Sabab, eusi nu ditepikeun nana mangrupa mieling urang dina hal kataqwaan jeung oge pangajak ka rang salaku jamaah supaya ningkatkeun kaimanan. Ulah nepi ka sare di masjid pas jumaahan teh, goreng pisan eta kalakuan teh. Mun khotib nuju ngalaksankeun khotbah, kedah diregepkeun sing tartil. Salian meunang elmu, oge urang bakal meunang pahala. Mun aya nu ngobrol atawa kasarean, buru-buru ku urang toel supaya ngaregepkeun deui. Ulah nepi ka ibadahna teu maksimal sabab ngobrol atawa kasarean pas jumahan. Yuk ah persiapkeun diri sing hade jang nyambut ibadah sholat jumahan teh.",religion
7126,"Salah sahiji jenis imah adat Sunda nyaeta Capit Gunting. dingaranan Capit Gunting sabab wangun hateupna sarua jeung hurup X atawa gunting. Hateupna ogéerada luhur kalayan bahan dasar pikeun nyieun wangunan nyaeta daun anu garing, hal ieu ditujukeun sangkan hawa di jero imah salawasna janten tiis. Imah adat Capit Guntingsorangan geus aya salila ratusan taun sarta mangrupakeun salah sahiji nu pangkolotna sarta leuwih hese dipanggihan batan imah adat Sunda lianna.Capit Gunting Imah Adat Sunda seeurna tiasa dipanggihan di Tasikmalaya. Dina budaya Sunda hateup imah disebutna susuhunan. Imah cakar gunting dirancang ku awi salaku bahan utama, sareng hateup imah ieu nganggo daun garing pikeun nyegah panas sareng hujan.",culture & heritage
8910,"Cara nyupiran mobil listrik pikeun pemula, kahiji hurungkeun heula mesinna ku cara mencét tombol start/stop sakaligus mencet pedal rem. Nalika tombol dipencet, tampilan digital bakal otomatis hurung. Lamun layar digital hurung, éta nunjukkeun yén mobil listrik geus siap pikeun ngajalankeun. Saatos mesin dimimitian, leupaskeun rem leungeun saméméh mindahkeun transmisi jeung nyetir. Nyaéta ku nurunkeun tuas rem leungeun, pastikeun pedal rem mobil kudu dina posisi dimana urang nanjak pikeun nyegah mobil teu gerak. Salajengna nyaéta mindahkeun transmisi ka posisi D. Jadi sanggeus rem leungeun dileupaskeun sarta sakabeh parameter siap, tuas transmisi bisa dipindahkeun ka posisi D atawa mencét tombol transmisi dina posisi D sangkan mobil bisa gerak. Nalika mobil listrik jalan, urang kedah ati-ati nalika urang naékeun pedal gas. Kusabab teu aya rasio transmisi anu ngamungkinkeun mobil gaduh akselerasi instan sahingga tiasa gancang kalayan ngan ukur hiji léngkah. Sangkan aman, pedal gas kudu ditincak lalaunan.",technology
7413,"Terjun Payung nyaeta kagiatan luncat tina pesawat ngagunakeun payung sangkan urang tiasa ngapung di langit. Olahraga ieu kaasup olahraga bahaya anu edah dilakukeun ku profesional nganggo alat-alat anu aman. Saha wae anu bade ngalakukeun ieu kedah siap heula mental jeung fisikna, lantaran manehna bakal luncat ti pesawat leutik make parasut anu aya dina tonggongna. Parasut ieu bakal langsung kabuka lamun aya angin badag. Awalna mah kagiatan ieu teh mangrupakeun salah sahiji kagiatan anu dilakukeun janten operasi militer. Tapi mulai taun 1950, terjun payung janten salah sahiji cabang olahraga anu tos diaku di dunya. Sababaraha alat anu kedah dipake nyaeta, helem, kaca panon, jumpsuit, jeung harnes. ",sports
2395,"Angklung mangrupikeun alat musik anu karesep kuring, sabab angklung tina awi, kuring resep kana barang-barang anu didamel tina kayu asli sabab gaduh keunikan masing-masing. Alat musik angklung ngabogaan wangun tabung, anu diwangun ku sababaraha alat ieu. Cara ngagunakeun angklung ku cara ngoyagkeun jeung ngageter, ogé pakakas ieu asalna ti wewengkon Sunda, Jawa Barat. Saterusna, angklung bisa dicoo sacara individu atawa kelompok. Teu paduli sabaraha jalma nu maenkeunana, angklung bakal tetep merdu. Unggal angklung disada hiji nada. Umumna hiji jalma nyekel angklung anu sorana ngan hiji sora. Dibutuhkeun loba jalma pikeun muterkeun hiji lagu sangkan unggal not bisa diwakilan.Utamana dina maén kord, loba jalma anu nyieun harmonisasi akord jeung résonansi. éta kesan tradisional.",culture & heritage
