id,text,label
indolem-train-1014,"Nek ndhuwe niat yo iso""@_tiwi22: Ihhhh pengen kaya Raffi ah neng @TheBlusukan monggo didhelok @RaffiAhmadAgain, langsung FamilyRaffiah17 ",positive
indolem-train-2215,VIDEO: Mobil sing Terparkir ing Kantor DPRD Sulsel iki Nggunakake Plat Palsu http://bit.ly/1actHr7,negative
indolem-train-1985,Mergo Jokowi Siswa ning Bogor Luwih Cepet Mlebu Sekolah http://bitly.com/1Dnrv9I,negative
indolem-train-969,"Tresno pancen iso gawe wong ngenteni suwe banget, mung sok-sok kowe kudu tresno marang awakmu uga, kagem nyadari kapan mesthi lungo.",positive
indolem-train-218,Ameh wae kelalen yen wengi ini acarane... Suwun Gonyaaaaa... DP mu? ? Pesan Cinta dening Afgan (karo Sunnya) ? https://path.com/p/4nD0il,positive
indolem-train-175,Sugeng warsa enggal imlek  2015 Gong Xi Fa Cay #demokrat @Edhie_Baskoro #taunanyarlunar,positive
indolem-train-2575,"Bantal ambek turone teles, tekele wae isek teles, AC-ne ora adem",negative
indolem-train-533,"#Lounge Mangkel diunekke miskin, wong iki tuku mobil larang nganggo dhuwit KRINCING LOGAM http://dlvr.it/8kY06l  #Assadiqulhaq",positive
indolem-train-228,Soke turu nang njero montor pancen luwih apik,positive
indolem-validation-336,Ora ana pancuran panas,negative
indolem-validation-166,"Macak Nambani Kesurupan, Kepala Sekolah Laku Asusila marang SIswi http://dlvr.it/8hlBMS  ",negative
indolem-train-1350,"Sanadyan ono neng ruangan kantor terus lan ora keno sinar srengenge, rambut kowe tetep iso rusak lho http://www.zinc.co.id/active-update/5-jenis-kebiasaan-di-kantor-yang-bikin-rambut-rusak ?",negative
indolem-train-2998,"Tambah Akeh Wong Gendeng ning Makassar kawit Kondang Watu Cincin. Masak Bongkahan Watu Ngalih Nasenter-senter, Kayak Tong ko Ae Dokter THT ",negative
indolem-test-868,"Enthuk jeding jero, nanging angel sinyal HP ne, WiFi lemot tenan kaya urip ing guwa, shower cilik tenan judule, tenanan jadul",negative
indolem-train-1122,"Ngecewake. Banyu anget mung iso dilit wae. Bar kui ora iso. Peteng, pencahayaan kirang...",negative
indolem-test-1003,#JombloKuwiBahagia - luwih becik lunga wae / bertahan tapi nyesek terus ?,negative
indolem-train-1824,Ngedoi ngombe teh sak wise mangan polahe iso garae proteine sing terkandung nag njero panganan dadi ewo dicerna.,negative
indolem-train-2847,"Lokasine oke, Parek supermarket ambek panggon-panggon panganan favorit. cumak kebersihane ambek penerangane kamar perlu ditingkatno.",negative
indolem-test-786,"Andok endut, pelayanan ora sopan, ora nyaman blas.",negative
indolem-test-175,5 milyar iku iso nguwehi mangan 166 ewu anak yatim peng 3,positive
indolem-test-408,"AC ora adhem, kunc kamar ora bisa digawe amarga kentekan tap card saengga saben metu mlebu kamar kudu nyeluk petugas, kamar akeh kewan cilik sing nggawe gatel.",negative
indolem-train-1273,Beda ya yen hp anyar mah wangsuline ceper? biyen mas se....? hahaha anjiir kowe-_- biyen ya biyen mas rausah di omongne....http://ask.fm/a/bmg39d86,negative
indolem-test-363,kulahe kurang resik banyune asin,negative
indolem-train-2917,"gari ngunggahake lan luwih grayak, ndadekake nyaman gawe para tamu matur nuwun",negative
indolem-test-893,"kamar mambu, bantal mambu apek, AC ora adem,,,",negative
indolem-train-1217,Wong sing numpak sepeda motor nag Bandung Mati  keseret Mobil 30 Km   http://bit.ly/1C7CkyN,negative
indolem-train-1104,"Informasi ora cetho lan akurat, alamat angel digoleki. ora ono fasilitas antar jemput bandara. Kamar hotel ora resik/trocoh. Pelayanan neng ngisor standar. Ora ono petugas keamanan.",negative
indolem-test-19,"Ngimpi balik neng sekolah, tondo-tondone kangen wektu-wektu biyen sing dirasake luwih nyaman lan endah. #TafsirMimpi",positive
indolem-train-3267,"Anduke endut, Spreine akeh tembeloke, WC-ne yo endut",negative
indolem-train-3469,Dadi... Mendingan salaman nganggo klambi lucu opo klambi ayu ku??? ?? isih durung ketemu meh nganggo klambi opo,negative
indolem-test-500,"hotel apik, ning banyu anget ora isa",negative
indolem-train-1972,"kamar mambu, bantal e mambu, temboking kaya lembab, jeding e reged",negative
indolem-test-906,"Duwek: ngumpulnoe suwe, ngenteknoe cepete pol | Batu hp: ngecase suwe, enteke cepete pol.",negative
indolem-validation-83,2 wulan Afgan prei seka gawean nyanyi nggo nyepakke konser tunggale. Ra nggumun nek asile saksampurna iku ?,positive
indolem-train-2962,Banyu panas ra ana sih pas aku nginep,negative
indolem-test-206,Syahrini Mung Kenal Feriyani Lim kanthi Jeneng Fransisca: Syahrini ngaku yen dheweke cedhak karo Feriyani? http://goo.gl/fb/hSASfu  #MedanHits,positive
indolem-validation-324,Panggon turu reged..,negative
indolem-train-1809,Kamare ora wangi. endut,negative
indolem-train-1641,mung kamare mambu rokok lan banyu kamar mburi trocoh neng kamar karo AC kurang adem. Ngapurane komplen supoyo dijogo kualitase,negative
indolem-train-960,Ambek Rp 125 ewu wes iso mangan sak pegele nag Shabu Tei! http://ow.ly/JFs7w,positive
indolem-train-714,"MOBIL IRIT ENERGI DAMELAN MAHASISWA UNHAS, 'TAWWA, BISA TONJI': http://goo.gl/ITY0vx  ",positive
indolem-test-173,sadiiisss !!! dadi kelingan pas awakedhewe ketemu neng purwokerto gan ? ? Sadis anggitane Afgan ? https://path.com/p/cn6nR,positive
indolem-train-1488,"Gawe video klip, Syahrini nganggo konsep absurd: Penyanyi sing siji iki lagi garap video kilp nggo singl... http://bit.ly/1vR1Ock ",negative
indolem-train-3026,"Lawang kulah rusak, kaca cendhela rusak, TV ora layak, andhuk cilik lan lethek. sprei lethek. banyu WC",negative
indolem-test-587,"Mergo Kasus Feriyani Lim, Syahrini Kudu Tunda Soting Vidoe Klip http://goo.gl/AuRwgT ",negative
indolem-train-1847,"Kamar nggilani, bleduken, akeh sarang laba-laba ning saben penjuru tembok. Rak jeding ora tau diresiki Tulung tegur bagian resik-resike ben kerjane temen aja asal-asalan Kasur ana bercak getih, sprei ana reged-reged ketok ora diganti tipak tamu sakdurunge 2 dina nginep perkakas adus ora diisi Cemilan lan banyu ngombe uga ora Resepsionis jutek",negative
indolem-test-51,Charles Honoris: Aset Bangsa Paling Gedhe yaiku SDM http://dlvr.it/5FXccx   Poros Muda Golkar Ora Trima marang PM Australia http://bit.ly/1ARREzL,positive
indolem-train-1571,"Menu sarapan kurang reno-reno, tapi enak rasane panganane. Pegawene ramah. Banyu panas nag kamar 105 ora panas... pelayane enake pol",negative
indolem-train-2519,"Kepentingan """"Tokoh Tuwek"""" Dadi Akar Pecahe Golkar http://republika.co.id/r/nkazfi ",negative
indolem-train-3290,"Pengamat: Imbase Konflik Jokowi-PDIP, Demokrat ngincer Posisi - http://www.itoday.co.id/uncategorized/pengamat-imbas-konflik-jokowi-pdip-demokrat-incar-jabatan ? ",negative
indolem-train-337,":) @RaffiAhmadLagi """"@OfficialRCTI: Kado Spesial Saking Raffi Kagem Gigi @dahSyatMusik http://youtu.be/DUiEa61GLgM?a ",positive
indolem-train-799,Hotele strategis. Kamare resik. Nanging hotel prelu didandani amarga temboking sing wis reged banget. Tembok-tembok cet e wis padha ngletheki kayata ora keruwat.,positive
indolem-train-1274,"AC kurang adem mergo wis lawas, sing apik kamare ombo, lan Airy Rooms mesti ngekei cemilan mungkin keresikane kudu ditingkatke nggo hotel iki",negative
indolem-test-215,sawijining sekolah ing Norwegia ora ngewenehi PR gawe muride supaya luwih nduweni wektu karo kaluwarga,positive
indolem-train-2466,"Rame, kurang resik",negative
indolem-train-498,"Klambi gombyor, kudung gombyor. Kaos tangan, stokin. """"Alime. Wuihh."""" Nek jenengen wanita muslin,  klambi kui sing kudu dienggo. Wajib.",positive
indolem-test-748,Penumpang Lion Air Terlantar http://bit.ly/1LlT2Mp  #Golkar #ARB,negative
indolem-test-56,Coba aku iso kencan ambek awake (are27) masio mok 1 wengi. ? ? Knock Me Out teko Afgan ? https://path.com/p/12RWAY,positive
indolem-test-79,nanging sing paling penting yaiku awakku bisa mangan indomie nganggo lombok ditambahi jeruk nipis,positive
indolem-train-462,"Tanpo onone dukungan teko Fans, aku gak mungkin dadi koyok saiki"""" - Raffi Ahmad",positive
indolem-train-1652,"Sahabat longono dolanan Hp nag pas dices yo, soale bakal nyebabno loro endas saitik.",negative
indolem-train-2308,banyu panase kurang berfungsi secara apik,negative
indolem-train-2529,"PDIP Srengen BG Ora sido Dilantik, Manuver opo sing bakal Dilancarno? http://dlvr.it/8g4VXQ ",negative
indolem-test-910,"Ora mulih kantor, ora mulih kuliah, yen mangkel ujunge TA??? qaqa cepet teka? (w/ Neni at @maltamananggrek) ? https://path.com/p/2J4vhr ",negative
indolem-train-2174,#Lounge bocah umur 7 taun iki hobby ngobong mobil gara gara bapak ne http://dlvr.it/8mdY2Z  #Assadiqulhaq,negative
indolem-train-377,Partai Demokrat atur slamer marang Partai Amanat Nasional (PAN) bab kaleksanane Kongres PAN kaping IV lan ... http://bit.ly/1CayO74,positive
indolem-train-2800,Demokrat keweden @republikaonline: Perppu Plt KPK Berisiko Ditolak DPR  http://republika.co.id/r/nk32wo,negative
indolem-train-1198,"kamare lumayan sae, pelayang kirang ramah...",negative
indolem-test-843,"ah rusak pelek teraline mobilku yang :( """"@nabilahJKT48 sayang ngapa ra dipethuk mau lunga malem minggu neng flyover @abdrakibfaisal :(",negative
indolem-train-182,"Ing Korea Selatan rega montor kayata BMW, Mercedes-Benz lan Audi luwih murah tinimbang montor Hyundai.",positive
indolem-train-2587,Fakta Pelajar ra isa pisah karo HP + media sosial !! :D,negative
indolem-test-419,"Pas aku delok meja makan kosong, hampa , ora ono opo-opo, sok neng kono aku ngeroso sedih :')",negative
indolem-train-48,Sugeng tanggap warsa nggo kaping pirane ya @RaffiAhmadLagi @Lady6igi muga tansah entuk sing apik-apik #janjisuciRANS,positive
indolem-train-1208,"Okeh Pebalap Apik ing Finlandia, Nanging Kurang Sponsor  http://goo.gl/OALhb6 ",negative
indolem-train-2188,wifi sing diwenehne ora ana,negative
indolem-test-365,"Alah barang prasaja wae dheweke nggawe tweet. Pendhidhikan islam wiwit sekolah ana sinau """" Kadhangkala barang prasaja kuwi adhewe gampang lali. Aja kumalungkung.",negative
indolem-validation-192,"Pelayan raman, tapi kebersihane kurang karo wifi-ne elek, banyu nag jedinge gelek mati",negative
indolem-train-2487,"Sajrone syuting Fast & Furious 6, ana luwih saka 300 montor sing rusak.",negative
indolem-train-2059,"Panggone cerak karo stasiun KRL, mung sprei isih ono tipak regedan lan ruangane sumpek senadyan AC ngurup.",negative
indolem-train-1859,"Penginapan medeni, mambu, jedinge ora ana banyu panas, ora ana keran ning jeding, lift mati, resepsionis kurang grapyak, ora jumbuh karo deskripsi.",negative
indolem-train-2235,saluran kanal TV dibenake lan Wi-Fine lambat,negative
indolem-train-2747,"Kurang penak merga pancuran nggo kloset lungguh ora ana , kurang resik rasane!",negative
indolem-test-152,#InfoNdoroMoe Demokrat nilai keputusan presiden nguwei kepastian http://bit.ly/17Z0dMC  #BlusukanDuniaMaya,positive
indolem-validation-3,"#Golkar #ARB Akeh anggota """"lulus"""", AKB48 pingin terus jaya http://bit.ly/1vO2FdG ",positive
indolem-train-801,"Pengin busana asli saka merek terkenal kayata H&M, Forever 21, Zara, Mango, diskon nganti 80%. Cek IG: @kenbertshop",positive
indolem-validation-128,kamar mburi reged. seprei lan sarung bantal reged,negative
indolem-validation-82,Demokrat mbiji Jokowi menehi bukti uduk janji http://wp.me/p4M2r4-9MY,positive
indolem-test-597,"Apike: Kamare amba, cerak karo kuliner kanthi macem-macem rega sing komplit. (kambing bang moody-warung tegal). Cerak 2 minimart kolam renang nek duwe wektu .  Ana cemilan gratis Eleke: bangunane lawas, kaya nang pilem 70-80an, rada reged tapi ijik isa ditampa. Banyu ngombe nang njobo kamar. Staf kurang profesional. Tapi kurang luwih rega karo fasilitas mathuk banget",negative
indolem-train-882,"[Nasional] Diskon - Cocog Dinggo Cah Enom, Dompet Levis Gaul Mung Rp 60.000 http://gpon.co/naklm  ",positive
indolem-train-3331,"Risiko #bahaya mok ono nang  lapangan, ruang kantor wae nyimpen risiko #K3. Opo wae? http://bit.ly/1mxlEJA ",negative
indolem-train-2196,tulung digatekne meneh karesikan kolahe merga rada mambu sithik apa maneh klosete .suwun,negative
indolem-train-2456,"Neng kamar 301: AC-ne kurang adem, banyu pancuran neng kamar mburi ngili, Banyu neng kamar mburi ora iso gunake banyu anget sing ono mung banyu panas lan adem tok. Aku percoyo pengelola hotel iso cepet benakne.",negative
indolem-test-919,"PDIP Orah Ngandalkno Figur Jokowi nag Pilkada 2015: INILAHCOM, Jakarta - PDI Perjuangan (PDIP) ora bakal mengand... http://bit.ly/1LpV4ep ",negative
indolem-validation-30,Manuk-manuk gagak menehi hadiah sakwise ana wong wadon sing ngekeki pakan. http://bbc.in/17ABkpE,positive
indolem-train-3604,"Aku ae ora paham opo masalahe kok ewoe pol budal kelas 8 esok kat U ni. Padal biyen jamane sekolah, jam 7 wes siap-siap budal",negative
indolem-train-2418,Syahrini Nganggo Modhel Rame sing Ra Umum http://dlvr.it/8fzLw5,negative
indolem-test-242,"Pelayanan apik, nyaman lan resik, mung wifi sing kerep error. Sakabèhé nyaman tenan lan resik.",positive
indolem-train-3459,"Meneng Omong disalahne? KOPLAK """"@kompascom: """"Lak PDIP Adem Ayem, Artine Ana Deal ning Mburine Penunjukan BH Dadi Kapolri"""" http://kom.ps/AFqKLU ",negative
indolem-test-140,"Montor putih dikira-kira duwe aji adol 5% luwih dhuwur tinimbang montor-montor werna liyane. [Konsultan montor saka Inggris, CAP]",positive
indolem-validation-308,"Panggone enak, adem banget, ning angel sinyal lan ora ono pemanas banyune dadi ora iso adus banyu anget",negative
indolem-test-254,Dompet Dhuafa Sulsel Mbagi Perlengkapane Sekolah http://www.dompetdhuafa.org/post/detail/749/dompet-dhuafa-sulsel-berbagi-perlengkapan-sekolah ?,positive
indolem-train-443,Awake dhewe wong loro diijini bebarengan lan nyawiji sak lawase?? ? Kamulah Takdirku dening Raffi Ahmad & Nagita Slavina ? https://path.com/p/3KO6xT,positive
indolem-train-2488,"parah… pesan 2 kamar, 1 kamare ora anak piranti airy durung disiyapake, amarga ora didetect yen pesen 2 kamar… kamar mambu apeg… ora dianjurake wae",negative
indolem-train-2493,Ora ana banyu panas lan sarapan,negative
indolem-test-1002,"fasilitas reged,AC ora adem,lawang kamar mburi ora iso ditutup,kulkas ora iso dienggo,seprei",negative
indolem-train-1421,panggone ngeri lan pelayanan kurang ramah,negative
indolem-test-660,"Among tamu lan paladen kamar apik, nanging kamar kurang resik lan mambu, anduk wis suwi lan mambu",negative
indolem-train-2354,"Kulah lembab, exhaust/vacuum neng kulah ora isa dinggo mula andhuk lan kain liyane dadi mambu apek. Pelayanan apik Sarapane ora sedhep Karesikan kamar kurang apik Ana nilai lan tanggapan sekian, ora cocok lan nguciwake",negative
indolem-train-350,"muasne banget. Seprei lan anduknya wangi, kamare cukup resik lan nyaman. AC lan banyu panase fungsi apik. Saluran TV radak bermasalah nanging cukup muasne. iki pengalaman kepindo aku ning airy gunung sahari. Matur.suwun",positive
indolem-train-738,Wektu paling bahagia yaiku pas ibu ndulang anak maem RT menawa sameyan sarujuk.,positive
indolem-train-1173,"kamar lumayan penak, nanging sayangé kurang diruwat",negative
indolem-train-3235,Toilet kurang resik lan apik. Kamare uga radak mambu lan pengap,negative
indolem-test-329,"Uwis entek pamor PDIP RR""""@jokowi07: PDI-P Ra Bakal Ngandhalke Popularitas Jokowi pas Pilkada Serentak http://baranews.co/web/read/33671/pdip.tak.akan.andalkan.popularitas.jokowi.saat.pilkada.serentak ?",negative
indolem-validation-335,"apik : keramahan pelayanan, desain yasan sing kepenak ringkih : kebersihan kamar. mester krasa kelet. ac alon nggayuh suhu sing dikarepne",negative
indolem-train-3297,"#Cancer pancen nyenengake. Ya, conthone, mbajak HP kanca. ~ @sepedha",negative
indolem-train-835,"Nolak HAMAS, Jangkah Pamrentah Digunggung PDIP http://bit.ly/1KwhWtq. Kepala Desa kudu dilatih ngolah dhuwit dana desa http://bit.ly/18czMTA",positive
indolem-train-2155,Direlokasi nyang hotel liyane nganggo alesan error sistem dadi kerep kakean pesenan. Nanging fasilitase hotel pengganti ning ngisor hotel sing dipesen awale. Muga-muga ora kebalen meneh,negative
indolem-test-707,"banyu kamar mburi panas ora iso dadi adem, ora ono sing ngeresiki ruangan (aku 2n2d tingale) Wi-Fine ora nyambung senadyan kata sandi wis bener",negative
indolem-validation-111,Ket kapan malam minggu kudu lungo? Ket aku tresno kowe.,positive
indolem-train-201,TNI Antisipasi  Gangguan Keamanan http://bit.ly/1Li5rzc  #Golkar #ARB,positive
indolem-test-196,Purwakarta Duwe Kantor Kecamatan Termegah ing Jawa Barat - http://SINDOnews.com  http://goo.gl/fb/IyC39Y  #Purwakarta,positive
indolem-train-2514,"kanggo kelengkapan kamar tulung dikompliti kayata andhuk lan kemul, maturnuwun",negative
indolem-train-2922,"Malem minggu ujug-ujug adus, nganggo klambi rapi, wangi, tak kira arep yang-yangam, pas ditakoni ameh nendi?  (w/ ubaid) [pic] ? https://path.com/p/3l3OyB ",negative
indolem-train-2702,penjagane kurang grapyak,negative
indolem-train-925,"Kamar resik, sarapan lumayan sebanding karo regone, paladenane ok mung wae wektu mlebu mbutuhke wektu sing suwi",positive
indolem-train-2543,"HP ora tahu dilalekke, yen PR dilalikke",negative
indolem-train-2119,"ACne rusak/ ora apik, sumuk",negative
indolem-train-3589,"Panggon turu atos banget, bantal gedhe lan atos, banyu panas ora berfungsi, AC kirang adem biasane ben aku nginep neng hotel/kos/penginepan sing kerja sama karo Airy Room mesthi entok cemilan & piranti adus, ning kali iki ora 1 pun sing aku entok",negative
indolem-train-2505,"kuciwa banget!! layanan ora grapyak, kanggo sing ngirim nsmung diwenehi kursi baso! lan sawise di deleng kamar yaiku kamar dadakan sing sadurunge pawon!! ora cocog karo ing poto. jedhing ora ana banyu panas, gantungan yo ora ana. malah lampu kamar ora bisa dipateni amarga saklare ora ana ing kamar! nyesel pesen ing kene! nyesel!",negative
indolem-train-2783,RT @VIVA_log: Iki Sebabe Wong Jepang Wegah Tuku Mobil http://dlvr.it/8jMFFG,negative
indolem-train-3317,"banyu panas jedinge mung isa kanggo 5 menit, sabun lan sampo ning jeding entek (ora diisi ulang). Channel TV gambare akeh semut kabeh.",negative
indolem-test-951,"Dadi, mangan, wes, kuwi, """"Saling sayang nanging cukup adewe ae sing weruh"""" Nyesek anyar kerasa uduk pas ning awit. :))",negative
indolem-test-600,Jarene ra bakal lunga ninggalke aku kaya sing liyane. ning kanyatane kowe lunga. Njuk apa bedane kowe karo sing liyane? padha wae. :),negative
indolem-test-826,Patang penumpang ujug-ujug semaput ing njero taksi http://bit.ly/1LiW569  #Golkar,negative
indolem-train-788,"Mangan-mangan RT @Antondutius: Wis, kanggo nembak wong wedok lan kasil :D RT #sheilaon7: Entukna CD orisinil """"Musim Yang Baik"""" ning '507 Management'",positive
indolem-train-359,"#KINGnews Pilkada Sarengan, PDIP Boten Ngandhalaken http://Jokowi-JPNN.com  http://bit.ly/1LpztCT ",positive
indolem-test-821,"kamar mburi ombo ning kamar kondensasi parah neng wiwitane, Wi-Fi ora ngurup blas karo ora ono sinyal telepon nang panggon hotel nanging sisane sae",negative
indolem-train-645,"Ngerti boten Sampeyan, ning Australia basa Indonesia dadi basa populer kepapat. Ana sekitar 500 sekolah ngulang basa Indonesia.",positive
indolem-train-2524,reged lan mambu sithik,negative
indolem-test-275,"Aku ngurmati bujang sing - ngumbah piringe dhewe - nata ambene dhewe - ngumbah lan nglempit sandhangane dhewe. Yen ana, aku pengen pesen siji.",positive
indolem-validation-303,Kiamat kebangsaan wis cedhak RT I Rong Kantor Pamrintah NTT Pasang Gendera Suwek - http://Kompas.com  http://kom.ps/AFqNSq,negative
indolem-train-1817,Petinggi PDIP Kutha Tarakan Digrebeg Nalika Adu Jago - Indopos http://goo.gl/fb/lxyWLo  #tarakan,negative
indolem-train-1682,"Lumayan nyaman. Ac rada kurang adhem, kamare ing lantai 3, ora ana lift.",negative
indolem-train-1081,#Warta: PDIP Wegah Ngandelne Figur Jokowi ing Pilkada 2015 http://bit.ly/1AZKXvB,negative
indolem-train-1455,"Rashid al-Ghannushi, tiyang muslim demokrat, nate urip ing pengasingan nganti 22 tahun (1989-2011) sakdurunge menang pilihanraya #Tribulasi",negative
indolem-train-1573,"Ora rekomen, kamar lembab pengap, kolah reged, pancuran rusak, mati lampu ora ana genset, staf kurang ramah",negative
indolem-test-416,"ACne ora bisa dienggo, ACne bisa wae bocor, panas banget, banyu ing lantai 4 kadang kala ora munggah, banyune loyo",negative
indolem-train-135,Opening promo! Yum utawa Cha chicken mung Rp 10ewu ing Yumzaa! http://ow.ly/JCDIq,positive
indolem-train-702,"Tolak HMAS, Langkah Pemerintah Dipuji PDIP http://bit.ly/1KwhWtq  Ikke Putri gawe video klip dangdut neng Bali http://bit.ly/18aTJuf ",positive
indolem-train-3020,Ya nek jomblo ngene iki :( ? Thank you Love dening Afgan (karo Intan) ? https://path.com/p/28GZIL,negative
indolem-train-5,Biyen jamane awitan lungo award show malese pol nag ganti klambi. saiki wes dadi kepincute pol. Masalae gak oleh pakaian sing nyaman. Mine is nice!,positive
indolem-test-860,"Pas nang kanthong regane oke, rega karo kamar mathuk, siaran TV-ne mung Kompas TV  lan TV dangdut thok.",negative
indolem-train-1883,"Kamare se OK.., tapi ora ono banyu panase, WC-ne gak ono tutupe",negative
indolem-test-988,Banyu panas ora lancar.,negative
indolem-test-442,#Golkar #ARB Dede Yusuf: Laporan sawetara ana keanehan-keanehan http://bit.ly/1F25MUw,negative
indolem-train-3191,"Mbrebegi banget tamu sebelah, aku njaluk kasur jembar malah entuk sing jejer kembar loro (kasur) Tipine cilik banget lan adoh jarake gawe nonton. Isih mangu-mangu yen menawane iki sinebut hotel utawa kosan",negative
indolem-test-816,"Ana wektune sing lunga bakal mulih maneh lan ngomong bab sing marakke getun. Sepurane, ora prelu",negative
indolem-train-3464,Maleem Minggone nang IGD karo Nonton Konser Dari Hati Afgan Episod 01 ??? (ing Rumah Sakit Wirabhakti) [pic] ? https://path.com/p/RY95,negative
indolem-test-30,"Bangunan Kos-kosan, kamare resik, jedinge endut. Suasanae sepi enak gawe istirahat. Ewoe mau",positive
indolem-validation-267,"wifi payah pol, petugas kurang tanggep lak wastafel buntet ditanggepine lagek dina sesuke,, tulung diperhatikne ",negative
indolem-test-358,"Banyu angete murup. Wifi durung nyambung, rada reged sprei kasure, ana sawange.",negative
indolem-train-913,"RT PolresKra: Mobil Patroli Polsek Kebakkramat dialogis karo satpam BRI Nangsri, kahanan aman lan tertib! ",positive
indolem-train-3190,"Ruangane ora podo karo sing nag gambar,  sing jogo bengi rodok judes padal nang ngarep tok tuku sego, deke takok ambek nyentak-nyentak",negative
indolem-train-3330,karesikan e kudu diunggahake maneh,negative
indolem-train-989,"Klambi si kecil nganggo gambar sing lucu tenan saka Torio nembe diskon s/d 30%, lho!  KLIK >http://bit.ly/1zkhwOK  ",positive
indolem-test-796,Nggoleki sejatining tresna ora taktemukke ??? ? Kamu Yang Kutunggu (karo Afgan) anggitane Rossa ? https://path.com/p/3Gqx7s,negative
indolem-test-388,"Jadwal Padet Sampek Ora Sempet Leren, Syahrini: Aku Dadi Wanita Udara: Sosok Syahrini isa diarani dadi... http://bit.ly/1AWvZ9H ",negative
indolem-train-1408,"Sepreine kurang resik, sarapan kirang sae",negative
indolem-train-1090,ora apik. ora grapyak pelayanane,negative
indolem-train-2530,"AC kurang adhem, pirang-pirang lampu ana sing ora murup.",negative
indolem-train-1364,privasi minim banget mergo sworo tetanggo koyo aula utama. saluran TV yo ora ono sing iso dinikmati mergo TV ra cetho. siapke sikil sing waras nggo mungah lantai 4 kanggo kamar Airy mergo hotel ora duwe lift.,negative
indolem-test-150,Maturnuwun mau teka pas sesi 3??aku nganggo klambi kebaya??kepiye~??,positive
indolem-test-947,"Teko segi fasilitase saiki, jedinge kurang shower ora ono taline. Teko pelayanane luwih ditingkatno sak itik engkas. ",negative
indolem-train-2464,bbm e kok ora kekirim-kirim? ngopo? iya rusak hp dinda:( http://ask.fm/a/bn9d5p0m,negative
indolem-train-3347,"Charles Honoris: Ngerusak Pilkada Langsung, KMP Ngianati Rakyat http://bit.ly/1y125zo  #Pilkada Drugmaker Valeant? http://dlvr.it/8fTfcw ",negative
indolem-test-304,"Pengamat: Dhampak Konflik Jokowi-PDIP, Demokrat Ngincer Jabatan - http://www.itoday.co.id/uncategorized/pengamat-imbas-konflik-jokowi-pdip-demokrat-incar-jabatan ? ",negative
indolem-train-2106,Aku paling males nag goleki pengganti gawe deweke kabeh sing wes mereh,negative
indolem-train-67,[Nasional] Diskon - ali-ali perak motif nogo Rp 300.000 http://gpon.co/vfe72,positive
indolem-train-2357,"cukup penak nggo kaluwarga, strategis tenan karo objek wisata . karesikan kudu dibenaki meneh. kamar sing tak panggoni ana sithik ambu ra enak seka kulah...",negative
indolem-test-266,"Pegawene cepet tanggep lan ramah, rasa panganan lumayan, lokasi cerak mall gedhe, desain hotel antik, mung emane tegel kamar mburi kurang didesain apik, nek adus banyi ora iso ngalir neng pembuagan, banyu adus kurang panas.",positive
indolem-train-178,Sregem Madhang Iwak Dijamin Awet Enom & Ora Kelemon http://dlvr.it/8mzmSq  (HalloRiau),positive
indolem-train-2884,"Kisruh APBD DKI, Anggaran Rp 6 Miliar kanggo UPS Sak Sekolah http://bit.ly/1LM2PcU ",negative
indolem-train-3592,@Denshu_: MALAIKAT MAUT. Iki sing kapisan lan pungkasan dheweke methuk anake nang sekolah.,negative
indolem-test-852,Sedhih wae ujug-ujug? Untukmu Aku Bertahan dening Afgan ? https://path.com/p/4iWi0G,negative
indolem-train-3172,"Mangan didulang, turu didodoi, turu didodoi, nanges dipujuk. Yen wis gedhe, awake dhewe wani ngangkat swara karo ibu lan bapak? Kita bocah apa? ?",negative
indolem-train-301,SMS saka uwong sing ditresnani iku mesthi bisa nggawe awakmu lungguh anteng karo mesam-mesem dhewe ndeleng hp. Hihi,positive
indolem-train-1697,banyune sempet mati.. ladene kurang profesional,negative
indolem-train-2426,Didaskaleinophobia yaiku fobia utawa rasa wedi kanggo menyang ing sekolah.,negative
indolem-train-642,"Iling banget karo perintah kowe. Sing ngekon aku maem. Sing ngekon aku ojo lali sholat. Iyo sih, kui biyen. :')",positive
indolem-train-1933,Eman ora ana tisu neng kamar lan kulahe rada mambu,negative
indolem-train-3528,"Aja muni sayang nek mengko lunga, aja muni tresna nek mengko nglarani ~",negative
