id,text,label
1073,"Nuaeng molo adong hamagoan HP nunga adong be sada alat na boi mambantu lao mangalului sude. Boi ma tabukka sian aplikasi. Nuaeng nga adong be aplikasi di HP naboi mangalului idia do HP na magoi. Nunga hea songoni dung sae ma marbola hami i lapangan, HP on peut ma sian saluar, alana gelleng do sakku ni saluar on gabe mura ma madabu. Adong ma napaboahon boi mangalului HP nuaeng sian aplikasi. Dipagalak ibana ma aplikasi sian HP naon, dipamasuk ibana ma aha merek ni HP on dohot nomor na. Dung i boi ma tarboto idia titik na madabu. Lao ma hami mangalului mangihuti dalan na sian aplikasi on",happy
283,"Sude diwajibhon mamahe masker, jala mangan pe pahe nasi kotak. Sude meja dibahen marjarak, ndang boi adong penumpukan. Manjalang mempelai pe pahe sesi asa unang mardosakan. Acara mardalan ransar dohot mansam ni tarian khas Minangkabau na urdotna so i nama hissa na, diboan penari-penari na profesional huhut suping na mangerbang. Ndang terasa, acara pe nungga sae na ditutup pahe suara emas sian Dhilla, sang mempelai borua. Ujungna, selamat marlasnirihama tu kedua mempelai. Sai anggiat gabe keluarga sakinah mawaddah wa rahmah jala dilehon sundut na saleh dohot salehah. Sai anggiat tontong rap tu dolok tu toruan mangayuh bahtera rumah tangga ja rappak laho menuju surgaNa.",happy
1919,"Jotjot do minum tuak si Marasi dohot dongan-donganna di lapo dung botari nai. Dung sae halaki karejo sian parkarejoanna be, marpungu ma halaki di lapo. Nunga sahat halaki di lapo jam onom botari, alana molo borgin jam pitu halaki sahat olo do nunga suda. Di jalo halaki ma tuak, dipataru ma tu jolo na be. Olo ma dijalo halaki tambul asa adong dongan ni tuak on. Dung jam sampulu borngin mulak be ma akka dongan-donganna on, ditogihon ma si Marisi mulak ndang olo be ibana. Sai naeng minum ma torus ibana, hape ibana na nunga hatagian sian najolo inum tuak. Ndang olo be ibana mulak, molo so tenggen dope.",fear
1512,"Molo jotjot do dalan na tabolus on maccet ikkon godang ma sara na tabahen asa unang gabe tarlambat hita di pardalananta. Naparjolo ikkon tabahen hian tahi ni pardalananta. Molo somal do hita lao jam onom manogot nai, tapatibu ma borhat gabe jam lima. Alana molo nunga um tibu hita, asa unang gabe tarlambat hita sahat, nunga um leleng hita di dalan, jala ndang pola godang dope akka mobil di dalan. Napaduahon, boi ma tabereng akka barita na adong di dalan, somalna adong do di dalan manang sian HP taboto idia ma akka dalan na mansai godang akka mobil. Molo nunga taboto gabe ndang taihuti be dalan na tusi.",angry
3556,"Doppak au kehe tu kobun ni hami rap halak umak ku rap ayah ku na adong di huta, hami kehe tu kobun i giot manolong ayah ku na giot manyabi. Pas au giot marmayam di padang-padang na adong di donok ni kobun ni hami i, pas giot marmayam i au, na bahatan hu ligin di si te ni horbo. Magigi au mangaligin te nai na bahatan rap na bauan. Hampir di satiop rumput i adong di si te ni lombu i rap te ni horbo i na bahatan di rumput i marpayakan. Harana magigi au mangaligin na makana inda jadi au marmayam di padang-padang i.",disgusted
222,"Ujungna dimulai ma parjuangan 2 taon laho papunguhon 350 juta. Nungga hu simulasihon pahe excel. Hami ndang manuhor manang aha saleleng 2 taon i, holan mangan dohot baju lebaran. Kondisi nami ndang pun ag elleng dope jadi oke dope laho marhemat. Ndang ading na spesial saleleng 2 taon i. Na penting ingkon boi manaon nafsu laho manuhor. Marlaba ma tingki i ndang booming dope online shop. Dua taon dung i, hami bom KPR. Alana palunasan diperjanjian ingkon2 taon jolo asa boi di bom. Sabotulna hurang dope alai ditambai hami ma hasil panjualan mas, motro ninja hu dohot marsali 50 jt na hu lunasi 3 bulan dung i.",happy
3371,"Doppak au manginap di huta di bagas ni oppung ku, inda sangajo au madabuon vas bunga na adong di bagas ni oppung ku i. Pas do waktu i au marmayam rap dohot anak ni udak ku. Harana di bagas ni oppung ku i adong do i ruang tamu na tar jarang di pake, di ruang tamu i na bahatan guci, vas bunga, rap dohot kristal-kristal hiasan ni oppung ku. Pas do waktu i au rap anak ni udak ku i marmayam mardakan-dakan, hami pake ma sude barang-barang na adong di si. Pas do giot mambuat galas na adong di ginjang ni lamari, inda sangajo au padabuon vas bunga na donok galas i. Tarsonggot hami harana na matapor i vas bunga na. Harana mabiar hami hona siari oppung ku, vas bunga nai hamu buni on di bagasan ni lamari. Inda hami paboa tu oppung ku harana mabiar hami hona siari. ",fear
3138,"Adong do hu ligin  waktu i di sosial media, adong sada merek make up na mambaen undian gratis. Au mangikuti undian i harana hadiah na i produk na baru sian merek i. Pas waktu di umumkon pemenang ni undian nai tarsonggot au harana au na monang na mandapotkon sapaket produk ni halai na baru i. sonang doma hu raso inda manyangka au harana au na dohot i sebenarna inda marharap monang harana na bahatan halak na dohot undian i. makana doppak diumumkon au manjadi pemenang na sonang doma hu raso, pas do waktu i lagi butuh au produk na on. ",surprise
251,"Nusa Penida ima sala sada pulo di Inodnesia na puna panatapan alam na sun ulina. Godang patai-pantai na uli n ading di pulo na di sabola tenggara Bali on. Salah sada na puna panatapan alam na sun ulina ima Diamond Beach. Inganan na sahira 45 menit pardalanan naek kendaraan sian pelabuhan Banjar Nyuh na ima pintu masuk dohot pintu haruar pulo on. Tingki na dumenggan laho ro tu Diamond Beach ima pukul 18.00 WITA. Asing ni i manikmati panatapan pantena, boi do tong hamuna mandapot godang spot foto mulai sian di tangga tagan mardalan tu pantai sahat tu topi pantaina. ",happy
1493,"Tontu molo nganeng marsitutu lao mangoli manang muli ikkon godang do dalan na ikkon didalani asa boi marumah tanngga, naparjolo molo dung marsihaholongan patandahon ma tu sisolhot asa ditanda, si bawa patandahon tu sisolhotna songoni tong siboru, dungi porlu do manjumpangi tulangna , tulangni si bawa manang siboru asa dilehon pasu-pasu tu halaki, dungi diboan ma jo tu huria asa dipasu-pasu.. Dung parmisi tu akka sisolhot dohot di pasu-pasu di gareja baruma dibahen paradaton. Songon paradaton ni Si Gading dohot si Gisel, alai nuaeng nga sirang halaki ala marroha-roha si Gisel dohot bawa naasing laos mangamuk ma si Gading gabe disirangkon ma Si Gisel.",angry
3624,"Au rap dongan-dongan ku kehe ru plaza giot manabusi kado tu dongan ku na giot ulang tahun. Jadi hami kehe tu toko parfum giot manabusi na. Pas hami sedang mamilih-milih parfum, di semprot kon dongan ku i ma parfum nai giot manganggo ia. tiba-tiba ro pagawai ni toko nai mandokkon tu hami aso ulang be disemprot parfum nai harana inda tola. Maila au rap dongan ku, harana i mangido moop hami tu pagawai nai. Adong do di si bacaan na inda tola manyemprotkon parfum nai. Tai harana inda hami ida bacaan nai, makana di semprotkon dongan ku ma parfum nai. Makana maila au rap dongan ku, kehe hami sian toko i, inda jadi hami manabusi parfum di toko i.",shame
4145,"Ise na inda boto  Albert Einstein? Halak na fisikawan teoritis na dipandang sebagai ilmuan nagodang dan tarkenal di abad ke 20. Teori relativitas sangat manempel dohot sosok Einsten. Selain teori relativitas na manjadi tarkenal di seluruh belahan bumi, Einsten juo mangemukahon beberapa teori diantarana mekanika kuantum, mekanika statistik dan kosmologi. Tai dibalik kejeniusanna, ternyata  di bangku sikolah Einstein dikenal sangat lambat dalam mata pelajaran Sains dohot Matematika. Selain i ia juo mampunai kepribadian na cenderung parsip dohot parila . Inda adong sada manusia pun na bersih sian kesalahan, meski ia adongma halak na sejenius Albert Einstein. Ia juo halak manusia biasa na inda luput sian salah, bahkan ia sompat dicap oto dohot rintik. Marbagai percobaan na dilakuhonna beberapa kali mangalami kegagalan semisal kesalahanna dalam manafsirkon prinsip mahc serta na paling tersohor adongma kesalahan pertamana ketika malakuhon parcobaan pada teori relativitas umum.
Namun songon dikutip sian Life Idntimes, Einstein mandongkon bahwa Ulang mabiar marbuat salah. Kesalahan bukan kegagalan. Kesalahan dapot mambuat hamu lobih kuat, lobih pandai dan lobih copat.",fear
697,"Tingki mareman disada jabu kososng di Pennsylvania, piga-piga gelleng lokal manomuhon koin tua di jonok sada dinding. Tingki diboto natoras ni halak i, halai i pe mamoncahon dinding i jala ratusan koin madabu sian i. Adong pe angka koin na ditomuhon i kisaran argana US$ 8.500 jala piga-piga koin langka argana US$ 200.000. Dung i adong ma muse sahalak pangula lokal sian Australia na mangalului saesuatu pahe detektor logam di humaliang tano di jabuna tingki i sesara ndang sangaja ibanan manomuhon piga-piga bongkaha emas. Ibana toru manggali jala manomuhon sapotong emas na boratna 5,5 kg mararga ma i US$ 315.000.",surprise
754,"Muruk ima emosi normal na dipuna manang ise pe. Alai, adong tingki amarah ro ndang boi dikendalihon. Muruk alai ndnag adong alana, mura hansit roha tarnata boi dipicu godang faktor jala sude tarjadi di bagas diri sandiri. Sabotulna, muruk ndang sada gangguan mental. Alai, hamurukan na ro toppu boi do i ala gangguan mental. Boi do tong alani hamu ndang puna sukup tingki laho mangalatih diri mangadopi emosi na ro sopola adong alana. Namambahen boi muruk ndang adong alana dipicu godang faktor songon; stres, on ma pemicu na um balga na dialami godangan jolma ima memuncakna kadar stres dibagas daging. Stres dohot halomosan na marlobi boi mamengaruhi hasehatan ni daging jala mood pe. Molo ndang diatasi, hamuna boi mangalami perubahan suasana ni roha mansai drastis",angry
4415,"Saat berada di tempat umum, hamu pasti jungada marasoi hasrat  buang aek menek atau godang secara tiba-tiba. Na adong di bagasan pikiranmu saat i, tentu sajo manjalaki toilet umum tardonok agar hasrat arus bawah dapot segera tartunai dan kembali malakuhon aktivitas dohot nyaman.Di beberapa toilet umum songon bioskop, pasar, mall, dan beberapa tempat na jotjot dikunjungi bahat halak, hamu harus marsabar mamente antrean meski madung kebelet giot buang aek. Parahna, saat mangantre, akan selalu sajo adong halak na manyerobot mamasuki toilet dohot langkah gesit dan lincah. Pameliharaan toilet umum na sekadarna atau halak-halak na jorok dan inda martanggung jawab na mambuang sarop sembarangan biasana mambuat saluran WC tarsumbat. Hamu pasti akan merasa was-was sesaat setelah manggunahon toilet umum na WC-na mampet, sementara di luar toilet antrean halak-halak madung mengular hingga pintu kaluar.",shame
2888,"Doppak au menek, au rap dongan ku marmayam-mayam. Hami kehe tu kobun-kobun ni halak. Di kobun ni halak i tiba-tiba ma ro babi hutan mangkojar hami. langsung ma marlojong hami, di kobun i hami ligin do adong do di si batang ni jambu. Jadi au rap dongaan-dongan ku mandakkit batang di jambu i. Harana sangkin mabiar na au tu babi i, tiba-tiba ma madabu au tu toru, pas di donok ni babi i. langsung ma tangis au hu tunjang ma babi i. Untung na adong ma halak na mangaramban babi i sian bolakang. Kehe ma babi i, doppak giot bakkit au atcit hu arso tangan ku. Rupana tangan ku madung matipul, harani i ma sampe sannari au paling mabiar molo giot kehe tu kobun sanga pe mangaligin babi. ",sad
2103,"Marpinahan ma halak si Mula di pudi jabu nai, adong ma dipiaro inongna manuk dohot akka na asingna. Saonari nunga mansai godang pinahannai, olo ma digais inongna tu onan akka tolor ni manuk dohot manuk nai. Ganup ari torus ma dilehon mangan, tarlumobi molo manogot ni ari, ikkon godang do dilehon tu manuk i, asa martolor arian nai. Ale olo ma disuru inongna si Mula tu handang ni manuk lao mambuat tolor ni manuk, alai sipata ndang olo ibana ala godang inna te ni pinahan i disi. Olo ma sipata ikkon sampe muruk inongna manuru ibana asa lao ibana mambuat tolor ni manuk i",disgusted
1894,"Molo i dalan adong tajumpangi biang na mansai jingar, boha do baeononta. Godang do sara na boi tabahen asa unang gabe dilumba biang i hita. Naparjolo, unang tabereng mata ni biang i, paula so tabereng ma. Alana  olo tabereng lam jingar do annon biang i lao mangalumba hita. Napaduahon, na boi tabahen unang marikkati hita, molo marikkati do hita ikkon dapot do hita dibahen biang i. Alana ndang boi hita um hatop marikkat sian biang i, na tumagon so do hita asa unang torus hita dilumba biang i. Manang na boi tabahen nenget hita mardalan, molo dibereng biang i songoni gabe ndang olo be biang i mangalumba torus.",fear
1780,"Adong do dakdanak na gelleng mansai mabiar molo kaluar borngin, porlu do tapaso molo nunga tabereng na songoni. Sabotulna ndang sibaenon akka na songoni, tarlumobi tu dakdanak. Songon naeng koncing do tu pudi ikkon sae maos ma nidonganan, molo sae tapasombu sampe leleng ndang marna boi be ibana kalaur sian habiaronna i. Songoni ma hita unang sai tapasombu be molo nunga tabereng songoni, ndang sai binoto annon sahalakna ma di jabu, mabiar ma annon ibana tu pudi alana so adong donganna. Ikkon boi do tatanom dibagasan rohana asa gabe na parbarani ibana sian mulai tagelleng. Dung balga ndang gabe manusahi be tu jolma.",fear
2910,"Doppak sampe au di stasuin kereta au mandapot kabar sian ayakku anggo oppung ku di rawat di rumah sakit harana oppung ku pas waktu I madung kritis. Di dokkon ayakku do madabu oppung ku tarsilandit di kamar mandi. Jadi, ayakku rap halak udak ku di rmah sakit margonti halai na manjago oppung ku. Harana loja au sian mardalanan mar kareta, au sian sikola mambuat izajah Mts ku, au langsung mulak tu bagas giot modom. Atcogot nau di ajak umakku ko au kehe tu rumah sakit giot mangaligin oppung ku. Tai pas waktu I matcit sude pamatang ku malosok au giot kehe tu rumah sakit. Marniat au kehe tu rumah sakit i potang. Hu dokkon tu umakku potang au kehe tu rumah sakit. Rupana pas siang ro ma telepon sian umakku mandokkon rupana oppung ku madung maninggal. Langsung ma perasaan ku pas i inda be tardokkon sanga bia, tangis au, marsak au, inda u boto sanga songon bia au. Manyosal au harana inda ra au mangaligin oppung ku manyogot i. ",sad
2152,"Ikkon boi do tapauba, hata-hata ni jolma na mandokkon habiason lao mambolongkon rapan i nunga adong sian tagelleng hita, umbahen i nunga mansai maol be i dipauba nuaeng. Molo adong mandokkon songoni, ikkon boi do ta alusi ndang sintong na idokkon nai. Alana sude akka naso denggan boi doi dipauba, asal ma akka halak na boi marsitutu lao mambahen na um denggan. Gabe molo adong tabereng akka halak na mambolongkon lomo-lomona pintor hita lagai jala tadokkon ma idia do na um suman lao inganan ni akka rapan. Ndang boi holan sahalak na mambahen on, ikkon sude do rampak marsiurupan be.",disgusted
2879,"Au sampe sannari paling mabiar mangaligin kudo. Harana doppak menek, doppak kehe au rap halak umakku tu salah sada tempat wisata na adong di kota ku. Doppak di tempat wisata i au rap halak umakku marmayam-mayam. Hami mangaligin kudo. Marniat ma au mancubo manaek kudo i. Harana molo hu ligi halak na manaek kudo i idaan do tagi na manaek kudo nai. Hu pangido ma tu umakku au giot manaek kudo, awalna inda di patola umakku, harana saotik marbahaya do i. Tai au inda ra molo inda manai kudo, Akhirna manaik kudo i ma au, Au manai kudo na marwarna na bottar harana au mamilih kudo i. Awal mardalan kudo nai denggan do, dipandu na puna kudo i, tai di tonga dalan giot mulak mangamuk kudo nai di sipak ia kudo na lain na lewat. Madabu ma au sian kudo i hampir ma di dege kudo i au, manyokkir au tangis harana mabiar, langsung ma di angkat halak na lewat i au. Tangan ku mabarbar, tarsilpuk tangan ku. Langsung ma mulak hami sian i dioban au marubat. Makana sampe sannari mabiar au mangaligin kudo. ",sad
732,"Tingki gelleng ahu jotjot dimuruki jala digosa omahu, sagelleng aha pe hasalahanhu pintor dimuruki. Dilotak, dijanggola, didok bodat, oto, begu, loak, narittik jala mansam dope. Bahkan hea omahu serita tu hombar jabu dohot sanaina molo omahu hea manggosok pathu pahe setrikaan. Ya, hamuna ndang sala manjaha, tingki i ahu marumur 2 taon, tingki omahu manggosok ahu holan na mamolus jala marmeam di jonok ni oma dung i di setrika ma pat hu sampe malala. Dung mulak bapa karejo disungkun mahua pathu i ninna omahu ahu marmeam setrika. Saonari ahu nungga gabe natua-tua, gellenghu 2 jala au marasa memang omakhu asing ndang lomo rohana tu dakdanak. Anakhu jotjot dilotak dohot disonggaki.",angry
2182,"Alai molo tung pe godang na mambahen hita gabe magigi, ikkon boi ma ta alo sian bagas rohanta manang dirinta. Alana ndang sai binoto sadi ari hita adong di inganan naso denggan gabe ndang boi be hita mian. Ndang na boi pintor lao nian na mambahen gabe magigi hita, alai ikkon torus ma ta alo asa lam somal hita. Tarlumobi molo akka jolma na adong di luat ta boi mambahen na denggan tu hita, ndang gabe maos dibahen akka naso denggan tu hita, alana manang songon dia pe idokkon akka jolma na sai olo mambahen na so suman tu hita ido gabe leleng kaluar hita sian habiaron na adong dibagasan dirinta.",disgusted
1543,"Tikki di parsikkolaan tarsonggot do nakkin au alana donganku Si Gonggom dohot si Alex dijou tu inganan ni akka pangajar dung husukkun dongan na asing, hape na masilesengan do halaki inna taringot tu haporseon ni halaki na marimbar jai sai manganggap haporseaon ni naasing sala, jai ido alana gabe dijou halaki tu inganan ni pangajar. Jai unang ma nian hita sai manalahon haporseaon ni halak, alai taanggap ma haporseaon ta na toho alai unang pola tapatudu sian hata-hata alai tapatudu ma sian akka parangeta, asa boi dihilala akka jolma holong sian diri niba. Jai dang gabe parbadaihon antong nang pe marimbar haporseaon ni.",angry
4383,"Pedagang juhut in puna trik mamotong juhut na inda biasa. Alih-alih tarpesona dohot kecepatanna mamotong juhut, beberapa halak mungkin sajo justru merasa jijik dohot carana mamotong juhut songon berikut i. Sian akun TikTok @mrplay2much, sebuah video manunjukkon pedagang juhut na tongah mamotong-motong juhut untuk pelangganna. Tarligin begitu santai, pedagang juhut i tarnyata manggunahon piso na diselipkon di antara jari patna.Pada video tersebut tarligin halak pedagang duduk di ginjang meja, tempat sarupo na juo digunahon untuk maletakkon juhut-juhutna. Sebuah piso menek na cukup tajom juo tarligin diselipkon antara jempol dan telunjuk patna. Video pedagang na mamotong juhut dohot pat i diketahui marlokasi di sala sada pasar di Pakistan.",disgusted
1865,"Naboi muse tabahen, ikkon boi do hita mangalului dalan kaluar sian hasalaon ta i. Unang sai torus hita hot disi, gabe ndang hita boto be mambahen na denggan tu hita. Ikkon boi ma tapakke tikkita na denggan, unang gabe bolong annon akka tikki i hape hita ndang adong mangulahon akka aha dope. Molo tabereng godang halak naso dope, ikkon boi ma hita karejo disi. Molo nunga denggan dibahen jolma, tabahen ma muse na um denggan sian i. Alana ndang taboto sadihari adong tikkina, boi hita gabe hasea akka na taula. Ima na mambahen porlu na hita mamakke tikkita na denggan.",fear
2190,"Molo tung pe adong maribak paheanta tikki jongjong di jolo ni akka jolma manang mardalan di tonga-tonga di jolma unang ma pintor hatop hita bilolangon bohinta. Alana pintor tanda do annon molo na lomos hita, gabe ndang boi hita mangulahon na denggan. Hotma tabo pardalanonnta, unang pola gabe mabiar hita mangulahon akka ulaonta annon. Jala adong do labana hita tibu ro molo adong akka ulaonta manang idia petaho hita, alana molo adong annon akka hajadian naso tapikkirhon, boima pintor hatop annon tapalekket. Molo tarlambat do hita ro tu sada ulaon, ndang sai taboto annon adong hajadian naso talomohon ro tu hita, ndang sanga be hita anno palekkethon.",shame
4056,"Hampir sude halak mangalami ketakutan terhadap sesuatu, baik i hewan, benda-benda, keadaan golap dan lain-lain. Phobia adongma gangguan kecemasan dan rasa ketakutan na marlebihan terhadap sesuatu benda atau fenomena. Phobia dapot dikatakan dapot manghambat kehidupan seseorang na mangidapna. Bagi sebagian halak, perasaan mabiar halak mangidap phobia sulit dimengerti. Itu sebabna, pangidap tersebut jotjot dijadihon bulanan oleh dongan sakitarna.Adong parbedaan bahasa antara pangamat phobia dohot pangidap phobia. Pangamat phobia manggunahon bahasa logika, sementara pangidap phobia manggunahon bahasa rasa. Bagi pangamat dirasa lucu anggo halak mabiar dohot hewan na dirasa inda mambahayaon. Sementara di bayangan mental halak pangidap phobia, subjek tersebut manjadi benda na sangat godang, berwarna, sangat menjijikkon ataupun menakutkan.",fear
684,"Tingki i ahu mandok  halungunangu ala ulang tahun sahalakhu di isolasi, dung i mangaiti siadopan ma ahu, ai ndang adong rencanan na mangalehon surprise. Dialusi ibana ma ""daong ah, ho kan lagi isolasi"". lungun muse rohangku, muse ndang mangharop be ahu tu siadopan alana ibana molo lao manang tu dia torus do mamboan hepeng paspasan ala hepeng diau do sude. Singkatna, borngin hira jam 20.00 di ari i, HP ku mangkuling. Telpon sian WA suami mandok ahu asa haruar, hu buka ma pintu jala mamereng siadopan nungga di ruar pintu pagar huhut mamboan kue na gelleng goombar beruang diginjangna adong lilin, suping ma ibana mandok ""selamat ulang tahun hasias, maap holan boi manuhor on"" (huhut manudu kue na gelleng i). ",surprise
1872,"Sabotulna boha do molo dipangido hita gabe saksi di sada hajadian na tabereng. Molo na takkas do tabereng unang pola mabiar hita gabe saksi, parjolo sahali pasti adong do biar di bagas dirinta alana ndang taboto dope akka aha na disukkun tu hita. Alai molo tung pe hita saut gabe saksi tapatorang ma aha hajadian na sasintongna, unang annon gabe mabiar hita mandokkon na sintong. Alai molo nunga gabe saksi hita unang gabe adong na ta orui akka barita i manang ta tambai. Songon dia hajadian na tabereng ikkon i ma tapatorang. Asa na marsala mandapot uhuman na tudo nibahenna.",fear
4339,"Nyamuk memang kadang jadi salah sada hal na sangat mangganggu aktivitas. Selain i, serangga na sada i juo dapot mangakibatkon panyakit songon demam berdarah atau malaria. Harana i, untuk malindungi diri sian nyamuk i, hamu porlu manjago kebersihan lingkungan sekitar agar inda jadi sarang nyamuk.Selain i, langkah untuk mangusir nyamuk juo dapot dilakuhon dohot manyemprot obat nyamuk, fogging atau dohot  manggunahon obat nyamuk tartentu songon obat nyamuk bakar. Namun baru-baru i maredar sebuah video na diunggah akun TikTok @kuloindah2 i manunjukkon bahat nyamuk di bagasan bagas. Saking bahatna, nyamuk i sukses mambuat warganet marinding. Pasukan nyamuk na manyerang bagas pangunggah video i bukan hanya dua atau tolu, tai mungkin mancapai ribuan ekor. Nyamuk tersebut tampak mamenuhi bagian plafon na donok dohot lampu. Dalam video mardurasi 19 detik, tampak di plafon bagasna bahat tardapot titik-titik lomlom songon noda. Inda hanya di bagian plafon, titik lomlom mirip noda tarsebut juo bahat manempel di dinding bagas.Setelah diamati, tarnyata titik-titik lomlom mirip noda marjumlah ribuan i adongma pasukan nyamuk. Bak ribuan nyamuk na hinggap di dinding dan plafon bagas, mungkin adong halak na akan marpikir apakah bagas i adong peternakan nyamuk atau bagiamana.""Liat ges, nyamok i gesss. Nyamuk sebanyak i enaknya diapain ya?"" tulis pangunggah video.Namun inda, nyamuk-nyamuk i ro dohot sendirina. ",disgusted
2126,"Adong ma bona ni rambutan disuan di lambung ni jabu nisi Josua on, nunga mansai balga akka dakka ni rambutan on hape mansai jonok tu kamar nisi Josua. Hape ndang diingot ibana lao mamonggol akka dakka na nunga ganjang-ganjang hape nunga naeng hona tu jandela ni kamar nai. Lao ma ibana manogot nai sikkola, mulak ma ibana botari nai. Holan masuk ibana dibereng ibana nunga gabe marmasukan akka porngis tu kamar na. Marsogot nai disuru ibana ma abangna asa diponggol akka dakka na jenek tu jandela kamar nai, asa unang masuk be akka porngis. Ikkon diponggoli do akka dakka na ganjang-ganjang i.",disgusted
1047,"Manimbil do tu anggina na mansai ringgas lao manabung, molo abangna si Benget mansai maol do lao manabung. Rampak manjalo do halakon molo dijalang angka tondongna tingki mulak. Somalna tor digora ma angka anak na on, disuru ma marbaris di jolo. Dijalang ma halakon sada-sada. Molo si Benget on holan dijalang, ndang olo ibana lao manabung, hape nunga rade dibahen natorasna halaki sada-sada be lao inganan panimpanan ni hepengna, alai mansai maol do ibana lao manabung. Holan sae dilean lao ma ibana tu kode lao manuhor angka jajan na lomo rohana. Ndang pintor suda i tingki nian, ale apala saotik ndang adong na lao itabung ibana",happy
1831,"Si Uli markareta ma lao tu sikkola nattoari sada, somal do ibana nian lao markareta alani dao sikkola sian jabuna. Hape ditikki i doras ma udan, nungga marsigorgor nian dibagasan rohana asa unang pola markareta alana dalan landit dibahen udan i. Hape hot ma ibana lao markareta, di parsitongaan ni dalan mamolus ma biang pas di jolona, ndang tar remna be kareta on madabu ma ibana. Pintor dipataru akka jolma na mamereng disi ma ibana tu ruma sakkit. Sahat di rumah sakkit nunga mansai mabiar hian ibana alana ikkon dilapa saotik patna i, mambuat batu na masuk tu bagas na tikki madabu nakkin.",fear
3184,"Au di bagas tolu mar saudara. Sada akkang ku, rap adong anggikku. Akkang ku on madung karejo di luar kota. Satiop minggu akkang ku mulak tu bagas harana ia libur karejo. Satiop ia mulak inda do lupa ia maroban sanga aha sajo pe tu anggikku na di torukku i. mulai sian tas, baju, sipatu, solop. Satiop minggu adong sajo di oban ia na baru tu anggikku. Sedangkan tu au, dioban ia di au barang bekas nia na so di pake ia be. Inda jungada di oban ia tu au barang na baru. Sakali inda ra au manarimo barang na di lehen akkang ku i tu au. Hu ambukkon barang na dilehen ia tu au, goyak rohakku harana inda adil ia tu anggi nia. Padahal na jolo doppak adong porlu nia sanga aha pe tu au do ia mangido tolong. Tai songoni ma diban ia tu au. Atcit roha ku, ina ra au pakulikkon akkang ku be harana i. ",angry
