id,text,label
indolem-validation-212,"#InfoNdoroMoe Jadwal Padhet Nganti Ora Isa Leren, Syahrini: Aku Dadi Wanita Udara http://bit.ly/1vQMAEc  #BlusukanDuniaMaya",negative
indolem-train-2257,Urung bisa turu gara-gara ngowah-owah HP sing nembe bermasalah akhire uwis bisa dienggo manaeh nanging piye carane? (at SpideRed Room) ? https://path.com/p/4ch21N ,negative
indolem-train-368,Ono akeh lagu nag hp sing ngilingne aku karo awakmu ambek kabeh sing tau kedaden karo awak dewek :'),positive
indolem-test-762,"Jadwal Padet Sampek Ora Sempet Leren, Syahrini: Aku Dadi Wanita Udara: Sosok Syahrini isa diarani dadi... http://bit.ly/1AWvZ9H ",negative
indolem-test-1,#Olahraga Para wanita ing Golkar Makassar diwenehi bekel ngelmu keprotokoleran http://dlvr.it/8g0jXf  #Assadiqulhaq,positive
indolem-train-706,Dina iki ana promo diskon 25% gawe mangan ing restoran Collage Hotel Pullman! http://ow.ly/JF5Y3,positive
indolem-train-821,Demokrat siap kerja bareng karo PAN http://antaranews.com/482654,positive
indolem-train-2419,"kamare peteng, kemule kuning, kamar Airy ing lantai 3 ora anak lift, sarapan apa anane, wifi ora ana sinyal nang kamar, ora nginep kene maneh,, kuciwa",negative
indolem-train-32,"Antara #tekno | Bos Snapchat ngelirik musik dadi 'kalodhangan"""" http://bit.ly/1BcEnlp  | http://goo.gl/16Qox ",positive
indolem-test-481,keramahan pegawe hotel ditingkatke meneh,negative
indolem-train-85,Demokrat mbiji kaputusaning presiden weneh kepasten http://wp.me/p3qn90-9kk,positive
indolem-test-510,"Panggonan strategis ing tengah kutha, nanging kok ora bisa njaluk cemilan? Banjur ana ambune keluking rokok",negative
indolem-train-3526,panggon parkir mobil kurang amba...ora ana klethikan...piranti adus lagi diwenehi sakwise komplain kulah kurang resik,negative
indolem-validation-156,Pirang-pirang Komponen Mobil Rawan Rusak Bar Ngajar Bolongan http://otomotif.kompas.com/read/2015/02/25/140000515/Beberapa.Komponen.Mobil.Rawan.Rusak.Usai.Hajar.Lubang ?,negative
indolem-train-223,"Uwong mangan kanthi syukur padha derajate karo wong pasa kang sabar."""" [HR Bukhari]",positive
indolem-train-2104,"Ing Nigeria, isih ana kapercayan yen bocah mangan endhog, dheweke mbesok bisa dadi maling.",negative
indolem-train-959,[Nasional] Diskon - Cute And Sexy Kimono sing enak digawe mok Rp 56.000 /set http://gpon.co/6zxwm,positive
indolem-train-2139,"Jam check in ketate nemen, kamar sing disediakno akeh endute/tembelong, pegawene yo kurang ramah.",negative
indolem-train-1029,Wangun sih konsere Afgan neng Trans7 ??enom?han harapanku 1 opo 2 taun meneh @FatinSL iso gawe konser tunggal sing gedhe @SonyMusicID,positive
indolem-train-425,Demokrat nilai keputsan presiden ngewhi kepastian http://dlvr.it/8dXyWR  #politik,positive
indolem-train-945,"ana kolam renang sanajan mung kanggo wong diwasa wae, AC adhem, tv kabel oke, bisa ngombe lan ngemil, lan ubarampe adus ditambahi jungkat, sayangé jedhing rada mambu, lan kamar ora kedap swara, fasilitas ana mushola, lift lan kolam renang biji luwihe, sakabèhé oke, matur nuwun airy",positive
indolem-train-3150,"karesikan kamar lan rega oke mung tulung didandani: 1. AC kamar bocor yen wis murup sawetara itungan jam, turu keganggu merga ujug-ujug AC panas ra murup merga bocor kuwi mau. 2. Banyu ngombe sing diwenehke rasane rada asin, jalaran udu nang njero kemasan plastik segelan tapi nganggo teko. Muga iki digatekake kareben iso diapikne. matur nuwun",negative
indolem-train-1850,"nggo budget hotel termasuk nyaman, ning isih kurang resik..Ono sisa sampah neng ngisor kasur Lan andhuk bekas uwong isih gantung neng buri lawang. Seprei ono nodane, mboh diganti opo ora",negative
indolem-train-1525,"Duwit: ngumpulkene suwe,ngenteke cepet banget | Batu HP: ngecase suwe,batune meh entek cepet banget.",negative
indolem-train-657,"Ngomongo ora marang selingkuh, ngomongo ora marang mendua ??? ? Katakan tidak dening Afgan ? https://path.com/p/2LMpC ",positive
indolem-test-987,Syahrini kudu lilo pepanas nalika nggawe video lagu sing paling anyare. Kaya kuwi http://bit.ly/18aCusX ,negative
indolem-train-793,"Menawa aku lunga, muga awakmu bungah.",positive
indolem-train-2754,kamare apik..nanging banyu anget ora ana gawe adus lan jajan saka airyne ora ana,negative
indolem-train-2462,"Uwis cukup apik, ning fasilitas kamar isih kurang, kaya TV, kulah, ac ora adhem, lan meja sing keciliken,",negative
indolem-test-55,"kangen banget koy ngene .. nganggo baju coklat-coklat, mangan bareng-bareng, senior-junior dadi siji :') http://instagram.com/p/zXM3VFSzYQ/ ",positive
indolem-train-2113,Netizen ngritik Syahrini Pose Syur ing Ndhuwur Bathub.... http://bit.ly/1LK8ZMI,negative
indolem-train-2760,"Nemen. Closet bejat, banyu panase ora ono, Shower cewoke bejat ambek ora iso digawe. Kemule ora diwei nag ora njaluk. Kunci lawang bejat. Kekunci teko njobo ambek ora iso dibuka. Kepekso nyelok tukang teko njobo terus jam 00.00 lagek iso mlebu kamar. kenemenen",negative
indolem-train-797,#Warta Jokowi Miwit Wani Nabok PDIP. Sapa sing bisa Dikter Presiden Jokowi? Ora ana! Http://dlvr.it/8fm203 #Assadiqulhaq,positive
indolem-train-1648,AC kurang adem. Nanging lumayan lah.,negative
indolem-train-1582,"Aku rodok kesinggung padal waktu check out jam 12, tapi sakdurunge iku barangku wes ditokno",negative
indolem-train-2880,Wifi ra tekan tingkat dhuwur,negative
indolem-train-1305,"halo sederek, iki @N_AurelJKT48, ngapurone yo ora ono kabar, hpku isih lara kih :( huhuhu ngapuro yo :( tekan ketemu sesok laflafu??????",negative
indolem-train-2709,"Jedinge ambu, banyune ambu",negative
indolem-train-1658,"Hotele sae, ning wifine alon, lawang kulah uga ana sing risak, sabun lan sikat untu uga sok-sok wonten sok-sok boten wonten",negative
indolem-test-1000,"http://www.tabloidbintang.com/articles/berita/polah/18527-wah-berat-badan-afgan-turun-19-kilogram ? Weh, Bobote Afgan Mudun 19 Kilogram",negative
indolem-train-493,Elloookkk!! ?? Kudune nonton neng konser langsung ya! ? ? Sadis anggitane Afgan ? https://path.com/p/3U39Kt,positive
indolem-train-185,"Sekolah ing Jepang kulina nglakokake reresik kelas, dadi saben murid wajib ngresiki sekolahe saben dina nggo 15 menit.",positive
indolem-train-1136,Ujung ujungne ora sido jogging polahe udan ? ? Knock Me Out teko Afgan (karo Tania Desriza) ? https://path.com/p/G8TaK,negative
indolem-train-637,Ngarep-ngarap suatu saat mengko @Ify_blink @ifyalyssa iso ngadake konser koyo Afgan,positive
indolem-test-622,"Aja nganti ninggalke sing apik nggo diganti sing paling apik. Pas sing apik lunga, kowe bakal sadhar nek dheweke kuwi sing paling apik.",negative
indolem-test-160,"Nag awakmu bener-bener tresno karo uwong, masio ono akeh alesan gawe mere. Awakmu tetep bakal nemokno siji alasan gawe mbetahno. :')  ?",positive
indolem-train-599,kanggo apalah susah-suah golek rono rene ? ? Kamulah Takdirku dening Raffi Ahmad & Nagita Slavina (karo afni & alvira) ? https://path.com/p/25AgPK,positive
indolem-validation-246,"Bolah Paling Apik >> Sak umur uripe, wong lanang iki nyetir mobil mung nganggo sikil! http://bit.ly/18b84GS  #ForumKaskus @kaskus",negative
indolem-train-940,Mangan dina iki gratis kabeh :3 (ning Pondok Laras) ? https://path.com/p/425GSx,positive
indolem-train-1239,Keresikane kurang dijaga.,negative
indolem-test-113,Matur nuwun kanggo baju kurung iki!! Lan selamet @ehyelcah pisan maneh :) Aku melu seneng nggo kowe ! http://instagram.com/p/zXhHf0Bk1l/,positive
indolem-validation-213,"sprei reged, ora ana panggon khusus solat (jerene syariah), ",negative
indolem-train-3126,Salah iku yo nag jam semene mangan indomie goreng 2.. Padahal isek pengen diet.,negative
indolem-train-130,"Wiwit meteng, @Lady6igi samsaya nyunar aura ayune? *alami tanpa pemanis gawean...;) @RaffiAhmadLagi",positive
indolem-train-1128,"Nag PDIP Adem Ayem, Artine Ono Kesepakatan nag Mburine Penunjukan Badrodin Dadi Kapolri"""" http://kom.ps/AFqKLU  > Di situ kadang saya merasa sedih",negative
indolem-train-2358,Tibae @Bellaudya829 tau gelek mimisen pas sekolah. @SarahSechan_NET,negative
indolem-train-2047,"Lagi ping telu tampil, nanging uwis menehi loro gol lan siji assist:http://goo.gl/UKa0Er Bakal lunga saka Chelsea kanggo salawase?",negative
indolem-train-39,Mobil Indonesia Paling Irit 2015 #JktOtomotif http://ow.ly/JCESj,positive
indolem-train-589,"Syahrini kudu lila panas-panasan sajrone gawe video musike sing paling anyar, Kayata? http://goo.gl/fb/IPCknU ",positive
indolem-train-682,Syahrini Janji bakal teko nag  dicelok Mabes Polri maneh http://dlvr.it/8g2CC2,positive
indolem-train-3018,Ngantuk apa maneh turu sakwise mangan minangka tandha anane syok biokimia sing gawe ambegan dadi abot.,negative
indolem-train-2102,"Aliran banyu kulahe mampet, dadi bar dinggo banyu ngecembong lan mambu",negative
indolem-train-1397,"Kamare ombo ambek rapi, tapi eman TV ketepakan elek sinyale ambek jaluk ganti nang kamar liyane sing duwe sinyal apik ora oleh soaleh pesan teko Airy room ambek ora ono wifi",negative
indolem-train-267,#Golkar #ARB Situs iklan otomotif Carmudi oleh dana 25 yuta dolar http://bit.ly/1AWXm3l,positive
indolem-train-2025,"Salah kamar, ora ana anduk, ciduk, airy pack, kasur ora nganggo sprei, lemari uga reged. Kasur kanggo turu nggawe dadaku lara, mula aku pindhah menyang papan liya. Diwenehi airy pack e wis jam 12 awan. Ora dianjurake",negative
indolem-train-3496,Kulah rada mambu merga trocohan banyu AC.,negative
indolem-validation-176,"Awakdhewe ora prelu, klambi ulh kewan sing kasiksa. Kejem :'(",negative
indolem-train-895,"Saiki isa kanthi gampang ing Apps HP android, Para kanca isa isi ulang #dhuwitelektronik lho. Ora perlu bingung maneh :)",positive
indolem-test-346,"1. Among tamune ora grapyak babar blas, malah kaya ngremehke tamu (wedok krudungan) 2. Kamar reged 3. Sprei lethek 4. Kasur ambles 5. Banyu ngobe ora dicepakki padahal jarene dicepakke 2 botol, positife mung ana banyu panas wae",negative
indolem-train-1400,"Angkat Badrodin, Bamsoet Curiga Jokowi Urusan karo PDIP: Yen PDIP tenang, jelasake de... http://bit.ly/1AX8VaJ #fb",negative
indolem-train-503,"Andhuk klambi multiguna kanggo nggaringke awak, uga bisa dadi pakean santai, lan sak liyo-liyane . Klik http://ow.ly/JF3Rn ",positive
indolem-train-1308,"hotele sempit, ACne panas, lan listirike ngerti-ngerti mati dadi gelem ra gelem kudu ganti kamar.",negative
indolem-test-436,"Nalika lagi seneng/sayang-sayange karo uwong, pesthi wedi banget yen uwong kuwi ngadoh, apa maneh lunga ninggalne awakdhewe",negative
indolem-train-3091,"Kamare podo mbek gambare mok lampune ora ono sing terang sing ono mok lampu surem, AC-ne kurang adem malah ora adem blas, banyu panase ora makan",negative
indolem-train-1594,"Pangonan apik, mok pelayanane luwih ditingkatno maneh. Aku mrono bareng keluarga, anak-anakku senenge pol karo kolam renange.",negative
indolem-train-2233,Syahrini Katut Kasus Feriyani Lim? - Silet 21 Pebruari 2015: http://youtu.be/7KxGOaN4RqA?a  liwat @YouTube,negative
indolem-test-339,Pas HP muni-muni!! Ngertine pemberitahuan grup Line MCI #NengKonoAkuSokNgrosoSedih,negative
indolem-validation-89,Ono waktune sing endi awak dewek kudu ngelelakno opo sing awak dewek tresnani iku mereh.. Yo ancene loro! Tapi iku gawe keapikane awak dewek dewe. :),positive
indolem-test-912,"Saking fasilitas, kula kuciwa merga wifi sing boten saged dingge. Lan layanan sarapan sing boten dipunkabari bates wektunipun, mula kula boten saged entuk merga layanan mung ngantos jam 9.00",negative
indolem-train-1935,"Wahh!(v)@kompascom """"Nek PDIP Adem Ayem, Artine Ono Kesepatan neng Walik Penunjukan Badrodin Dadi Kapolri"""". #GK15 http://kom.ps/AFqKLU ",negative
indolem-train-212,Arep ngirim paket tapi males metu saka ngomah utawa kantor? Ora usah kuwatir hubungi KIKI MARS CARGO 0811455123 http://goo.gl/hl1eAV  #CAR,positive
indolem-test-520,"Jadwal Padhet Nganti Ora Isa Leren, Syahrini: Aku Dadi Wanita Udara: Syahrini isa diarani dadi... http://bit.ly/1vQMAEc ",negative
indolem-train-2532,"Politisi Golkar Curiga Ana ""Kesepakatan"" Jokowi karo PDIP Ngenani Badrodin http://bit.ly/19OfeBw #PawartaJambi",negative
indolem-train-594,Iki kiii TIM J!! Kompak tenann pas latian konser kabeh nganggo klambi sing padha!! Nuwun ya ! Desain mantaap!! ?,positive
indolem-train-342,Hadiah ulang taun saka AXA..? Bubar iku jaluk kado saka kantor mamane..? (w/ Petronella at @kotakasablanka) [pic] ? https://path.com/p/4hNqUZ,positive
indolem-train-2463,"Ora digatekake, ora ana kabar, HPne lanangane rame/mati, wangsulane suwi/cekak. Bab-bab kasebut kuwi sing ndadekake cah wadon ing swasana ati ala.",negative
indolem-train-473,"Ora nggawe bayangane, tanpa nganggo kupon diskon wae properti iki ndemenakke tenan, kamare resik tenan lan mening, jembar, jangkep, nganthi kompor elektrik wae dicepakki ing kamar, cocok gawe nginep jangka suwe, swasanane penak tenan, jenjem, paladenane apik banget, mung duct buangan ing jero jeding reged banget okeh ampas sabun lan rambut",positive
indolem-train-2611,Sabarr din da ceuk afgan ya sabarr!! ? Sabar anggitane Afgan (karo Amaliah neng Jl. Kayu Agung I) ? https://path.com/p/4FOZXH,negative
indolem-train-1338,"sinyale teka lunga kaya si dhe'e, si anu, si kuwi lan.si kae",negative
indolem-train-2833,ACne kurang adhem,negative
indolem-train-586,"pancen emejing nginep neng airy Sutoyo hotel dewarna, wis murah panggon ya penak nggo leren, apa meneh sarapane ya enak ora sak-sake kanthi rega murah kualitas ora murahan. ning sing perlu didandani mung karesikan kamar kurang resik nek ngepel, kabehane rekomen tenan ",positive
indolem-validation-160,"Kamar resik banget, jeding resik, piranthi adus komplit. ning kurang puas mergo hordeng jendelo ora iso ditutup rapet dadi ketok seko jobo, ra entik air mineral dadi kudu tuku nang jobo, lan sing parah ora iso dienggo Wi-Fine",negative
indolem-train-2865,#Golkar #ARB polisi ringkus lanang pelaku penusukan http://bit.ly/186RNTw,negative
indolem-train-2448,"Nemen.. -Banyu panase mati terus, bakal makan nag dibutuhno tok. -Banyu mineral bakal dikei nag dibutuhno  tok. -Kamar wes njalok ben direseki, tapi ora diresiki - Lemarine endute pol, ketok gak keramot ambek wes dipangan rayap. Aku ora bakal gawe maneh",negative
indolem-test-131,"Kamare resik, aminities lengkap, pertugas ramah. Mung kamar mburi rodo mambu. Sing liya apik nggo rego semurah kui.",positive
indolem-validation-39,"aja keseringen lunga menyang masa dhisik, supaya pas masa ngarep ndodok lawangmu, kow ana ing kana mbagekake dhewekke",positive
indolem-train-501,Nuwun Mas mergo tuku klambi merek iki! Ya Gusti ora nyongkooo,positive
indolem-train-1028,Anies Bawesdan: Sekolah Kudu Dadi Taman sing Nyenengake http://dlvr.it/8kz15H,positive
indolem-test-278,@JANJISUCI_TTV: waah @Lady6igi manis banget ndulang bojo tercinta @RaffiAhmadLagi  dening @thiaa_13,positive
indolem-train-3348,"cetho ? """"@ignharyanto: Penting banget--> @VIVA_log: Tas Hermes Rp1,5 Miliar Dienggo Belonjo Sayur karo Syahrini  ",negative
indolem-test-583,"neng Video Klip teaser B2ST - I knew It, detik nang 1:35 Dongwoon ngelempar HP nganggo tangan kiwo, nang detik 01:36, nganggo tangan tengen #FKpop",negative
indolem-train-1770,Isuk-isuk kesusu menyang kantor. Dadine sarapan indomie ing kantor. Mulih awan menyang omah ora ana panganan. Mung anane indomie?? https://path.com/p/13qzgb,negative
indolem-train-397,"Kawitane, kancing klambi di geleh nag petite bahu, supoyo bahune klambi ora di gawe ngelap rai",positive
indolem-train-1716,"Kamar no. 6 pancuran banyu anget ora isa dinggo, akeh rambut neng kemul.",negative
indolem-train-1619,AC-ne ora adem,negative
indolem-train-2035,Pas-pas ae. Penempatan ruange kurang enak. TV-ne ketutupan lemari.,negative
indolem-train-3372,Wifine lemot nanging sakadoh iki puas lah,negative
indolem-train-341,Poros Muda Golkar Mbiji Jokowi Bisa Kendalikan Swasana Sakiki - BeritaSatu http://gpon.co/cz91n  http://gpon.co/b,positive
indolem-train-2401,"lumayan, mung banyu panase ra ngurup",negative
indolem-validation-235,Andhuke tipis..lan lawas Kemule gur siji Kuwi wae kemul cilik,negative
indolem-train-2749,"Miturut survei, rata2 uwong Indonesia dolan menyang Mal dudu kanggo blanja, nanging kanggo gaya, gawe klambi lan perhiasan sing apik. [tempo]",negative
indolem-train-3445,Kamare mambu rokok. Lan seprei ora disalin nggo tamu anyar mergo isih ono bekas awu rokoke.,negative
indolem-train-2984,#Warta (Bongkar Hambalang) Demokrat Protes Pimpinan KPK Usulaning SBY Ora Bakal Dipilih Jokowi http://dlvr.it/8dYkN0 #Assadiqulhaq,negative
indolem-test-850,"#Selebriti: Jadwal Padet Tekan Ora Sempet Leren, Syahrini: Aku Dadi Wanita Udara http://bit.ly/1Llofh1 ",negative
indolem-train-3490,kamar cukup nyaman senadyan entok kamar lantai 5 lan oro ono lift... petugas sing lanang rodojutek..konfirmasi awal mlebu tapi tekan penginepan jebul ora iso,negative
indolem-test-695,pemanas banyune ora isa dinggo lan suwe nunggoni panase.. lumayan nyaman cocok karo regane,negative
indolem-train-43,"kamar resik, ac ra kurang adhem.. kabehane apik",positive
indolem-test-237,"Rejeki anak soleh ki mangan bengi karo Romo? (karo Aryo, Julius, & 2 liyone neng Nasi Goreng Sapi Kantor Notaris) ? https://path.com/p/XwqPL ",positive
indolem-train-3304,"jambane rusak kamar mburi ora resik lemari wes jamuren, ora resik alas nggon turu reged akeh nyamuk",negative
indolem-train-3334,"Ojo nginep nag kene yo.. palang golek hotel liyane.. Kelas deluxe tapi koyok ekonomi seseke pol, WC ambu, colokan listrik ora ono. Ate nge cas Hp ora iso. Ngentekno duwek ae..ngecewakno pol",negative
indolem-train-507,"Nduwe kendaraan apa ae? ? Ana mobil, ana motor vespa, ana sepeda, lan ana motor honda http://ask.fm/a/bo03keji ",positive
indolem-validation-307,"Padha """"@bear_passion: malam minggune neng kosan wae. dhewean. nonton afgan.  yawislah ",negative
indolem-train-2302,Kedua kaline nonton film iki lan kedua kaline aku nangis.. My Idiot Brother ???? ? Untukmu Aku Bertahan saking Afgan ? https://path.com/p/429oIB,negative
indolem-train-1553,mambu. Reged akeh semut,negative
indolem-train-2976,"Pimpinan KPK Usulan SBY Mboten Dipilih Jokowi, Demokrat Protes - Sriwijaya Post http://bit.ly/1EVNxA3  #Indonesia",negative
indolem-train-2450,"Ditubruk Badai Sajrone 2 Dina, Palestina Katutup Salju: OKEH toko lan kantor ing Gisik Kulon, P... http://bit.ly/18bCmJM",negative
indolem-train-106,Demokrat ndelok keputusan presiden ngewei kepastian http://antaranews.com/480952,positive
indolem-train-1625,"gapurane tansah dikunci dadi yen arep metu utawa mlebu rada angel dene dudu kos-kosan sing kudu dienteni 24 jam lan petugas sing njaga omah ora grapyak, lan layanan ora apik.",negative
indolem-train-288,"hahaha.. dheweke kancaku lhoo RT @harie_kecew: afgan sing mirip kak io""""@GintangNisyam_F: @mariokacang ka mario iki mirip afgan",positive
indolem-train-2825,"Wi-Fi lagi ono ganguan, senadyan sinya data neng kono elek",negative
indolem-train-2429,"Kamare reged tenan jubine, sprei akeh regedan, kulahe medeni, andhuke lethek lan karyawane ora grapyak.",negative
indolem-test-580,"Ora iso tuku x""""@kompascom: Kalih Kantor Pemerintah NTT Pasang Bendera Sobek http://kom.ps/AFqNSq ",negative
indolem-test-619,"Sepurane, pelayanane kurang maremke. Saka awal ora disebutke ana biaya parkir nginep nanging jebule ana. kamar ora ana gantungane. sinyal wifi undlap undlup.",negative
indolem-train-3244,"Jokowi Yes, PDIP No ! """"@PartaiSocmed: Isek ono sing percoyo kata-kata iki? *Yo/Ora* ",negative
indolem-train-474,Dina iki ana promo diskon 25% kanggo ngiras ing restoran Collage Hotel Pullman! http://ow.ly/JCkw9,positive
indolem-validation-183,#PAWARTA--> Demokrat Protes Pimpinan KPK Usulan SBY Ora Dipilih Jokowi: Fraksi Partai Demokrat gela langka... http://bit.ly/1vIWd81,negative
indolem-train-665,"Iku pasti Amiiinn""""@lifda_62991: FamilyRaffiah17mogo-mogo awakmu kabeh kompak terus. Dukung terus aa @RaffiAhmadLagi piye wae keadaane",positive
indolem-train-2055,Politisi Golkar: Mundhake rega beras wagu http://nasional.kontan.co.id/news/politisi-golkar-kenaikan-harga-beras-janggal ?,negative
indolem-test-289,DISKON! BEST SELLER BGT! DIOR SYAHRINI  rego normal Rp145.000 Diskon dadi Rp125.000 KWALITAS SUPER banjur entuk HARDCASE & LAP,positive
indolem-train-1583,"Tambahi guling, pemanas banyune mati, tapi dikei roti mater suwun",negative
indolem-train-1030,asik neng kamar ono cemilan gratis ono toyo ombe kamere resik nyaman mung banyu angete wae sok ono sok ora dadi ora iso dipasteke nek meh ngaggo banyu anget .  nuwun,positive
indolem-train-1371,"Sarung bantal reged awit pisanan mlebu, tapi isa diganti. Lan bantale kerasa lembab",negative
indolem-test-471,"Murah, nyaman, sinyal RVne kurang apik, Wi-Fi isih durung stabil, ora ono keset, remote ACne sok macet",negative
indolem-test-745,Aku saka jam 9 esuk uwis diusir kanggo checkout. Kanthi alesan ana dayoh maneh.,negative
indolem-train-2242,PDIP Gerem Budi Gunawan Ora Bakal Dilantik: Amukan banteng irung putih diprediksi njalari manungsa... http://bit.ly/19NP9CF,negative
indolem-train-3315,Anduk sing disediani mung siji,negative
indolem-validation-282,jedinge reged lan kran rusak..,negative
indolem-validation-58,Omongo ora nyang selingkuh... Omongo ora nyang mendua... Omongo ora nyang kabeh... Sing? ? Katakan Tidak dening Afgan ? https://path.com/p/1QIWmE,positive
indolem-train-3012,"Apa tenan  ?, ayo tunggu jawaban ketum PDIP """"@CNNindonesia: PDIP Nesu Budi Gunawan Ora Sida Dilantik http://cnn.id/33754 ",negative
indolem-train-1129,kamar apik .... sing kurang mung resiking jeding,negative
indolem-train-1864,"Menyang kelas lambat, kelas mulai awal.  Menyang kelas awal, kelas mulai lambat. Semangat menyang kelas, kelas batal. Ora teko kelas, ono tes dadakan.",negative
indolem-train-2248,Tanggal 9 Juni 2018 aku nginep neng salah siji kamar neng tingkat 2 (lali nomer kamare) lan kuciwa tenan merga AC sing blas ora adhem marakke turu ra penak merga manas lan sentoran kloset sing rusak (ora isa nyentor). Payah lan ora pantes,negative
indolem-train-380,seneng banget karo kamare resik banget banyu panganan pepak ning eman tv ora satelit tur rapapa kabehane apik,positive
indolem-test-633,"Pelayanane apik, mok AC-ne kurang adem karo banyune ora ono banyu panase",negative
indolem-train-2124,"@andi_chairil Panggung Afgan, kok, ketok cilik lan sesak, yo?",negative
indolem-test-484,"resepsionise ora cepak-cepak 24 jam. Aku mlebu jam 4, oro ono resepsionise. Bar nelpon lan ngenteni lagi dee metu. Pas metu yo aku kudu ngenteni 30 menit luwih nggo dilayani. Sekitar panggon resepsionis akeh kucing lan mambu busuk. kahanan ngarep penginepan ora koyo sing di internet.",negative
indolem-train-2659,"Check in cukup gampang ambek cepet tapi sing awitan oleh kamar AC-ne ora adem blas, tapi pas komplain langsung dieleh, pelayanan petugase cukup ramah tapi ruangane rodok endut saitik (mejo tekel bleduken).",negative
indolem-train-329,Slamet @aan_war90 @HafizAndelas @Ariyan_94 @ElvinaRya @EzaHooli33 @A_Fathoni_ | DM jeneng lan no.HP mu ya #PulsaAkhirWulan,positive
indolem-test-682,"Ing taun 1962, sekolah ing Tanganyika ditutup amarga ana kedadeyan, yaiku wabah tawa (ngguyu nular) sing suwene 6 wulan.",negative
indolem-train-3516,"Panggone strategis, mung ono jam wengi. dalan ning portal jam 10 bengi. Iki nginep sing sekian kali. Mung sing terakhir rada ngecewake. Mergo AC mati, dadi panas banget. Andhuk lan piranti adus mung siji, senadyan kudune loro. kudu jaluk disik lagi diwehi. Wi-Fine mati. Remot TV mati, ganti kanal ora iso, mergo TV ora ono tombol manuale. sadurunge apik-apik wae neng kono. ning pengalaman terakhir ngecewake.",negative
indolem-train-1959,Pemanas banyune ora berfungsi,negative
indolem-test-437,"Wifi gelek ora anjok kamar, banyu cilik",negative
indolem-test-53,"Iki sopo ngerti ono sing nggoleki (geer),, trisa ne lagi topo (maca : nonton yayank afgan lagi konser).. ? [pic] ? https://path.com/p/2pRqC3 ",positive
indolem-test-370,"Karesikan kurang, kamar ana ambu pengap, & jedhing uga isih rodok mambu. Kaluwihane cedhak karo pusat kuliner.",negative
indolem-train-1584,#10TaunLepas kotak mlebu HP kebak sms Nek aku dadi air mata. aku pengen lahir seko mripat Kowe urip neng popo Lang gambar beruang.,negative
indolem-train-987,aku seneng video @YouTube http://youtu.be/67cjoHv_iqE?a  Raditya dika Vs Syahrini kocak banget rugi yen ora nonton @Mata Najwa,positive
indolem-train-3246,Yaampun mbak syahrini iku kacamata apa wajan ta mbak??? [pic] ? https://path.com/p/8gTy2,negative
indolem-train-1401,Syahrini Ngakoni Lara Nalika Diundang Polisi: NAMA biduan lan sosialita Syahrini kegeret neng kasus Fe... http://bit.ly/1Lo54Fh,negative
indolem-train-1491,"apik, mung petugase kurang ramah",negative
indolem-train-518,Iki klambi sing digawe pas salaman wau. Apik ta ????,positive
indolem-train-605,#Golkar #ARB Lion Air klaim finansial maskapai isih stabil http://bit.ly/1vRPzMG,positive
indolem-train-389,Lak fans wis biasaaa wani Gendeng kanggo Idolane lan saiki kuwalik. Idolane sing wani GENDENG kanggo fanse.. Salut karo @RaffiAhmadLagi,positive
indolem-train-62,"Ngadepi Pilkada Bareng-bareng, PDIP Ora Meneh Manfaatne Imbas Jokowi: PDIP wis nekane nyang saben kadere... http://bit.ly/1vSdAmF ",positive
indolem-train-2380,kurang disiapke & kurang resik,negative
indolem-train-2160,"Aja egois. Wong lanang sing mbok tuntut lan mbok posisikke ora minangka pasanganmu, isa kesel lan luwih milih lunga. Mengko nyesel ",negative
indolem-train-2461,"dina jengkelke yaiku kentekan pulsa, kentekan batre hp, tur ora ana colokan sisan (???)",negative
indolem-test-601,tivinee bruwettt,negative
indolem-validation-50,"#Narasa_nganga :D #hahahaha ? menikmati Somay+Ice Cream+liyan-liyane nag Lapangan Vatulemo, Ngarepe Kantor Walikota Palu. http://fb.me/3hhQPHaXa ",positive
indolem-validation-272,"Saran gawe preinan keluarga, kekurangane sakwise bolak-balik nginep banyu aduse/shower ora iso panas...",negative
indolem-train-1530,"Panggone kurang bagus, bantale mambu, ora ono cemilan, sambutane ra ramah",negative
