id,text,label
3096,"Doppak au mangarayaon ulang tahun ku na 17 taon. Au mandapotkon kejutan ulang tahun sian dongan sakalas ku.  Doppak waktu i sonang doma hu raso harana ulang tahun ku di rayaon dongan-dongan ku. Pas hari i inda hu boto halai na giot mangalehen kejutan tu au. Sadari i heran au asi bahat dongan-dongan ku na ra mangecet rap au. Rupana pas doppak mulak sikola, dongan-dongan ku sude markumpul di kalas, di tutup halai ma mata ku, habis i di lehen halai au kejutan, tarsonggot doma hu raso, tarharu au harana diingot halai do ulang tahun ku. Dilehen halai do di au kue ulang tahun rap kado. Sonang doma hu raso waktu i.   ",surprise
228,"Adong godang hian sara asa boi manabung manuhor jabu, Sabotulna pilihanna holan dua m olo komitmenta nungga bulat laho manuhor jabu. Piga fasilitas manabung sabotulna nungga adong. Pilihanna ima paketathon pengeluaran manang manamba pamasukan. MAnabung sabotulna songon ""obat hansit ulu"" di panahit demam thypoid. Holan mangobati gejalana sajo laai ndang mangubati alana. Porsi parhepengon na denggan ima: 1. 10% proteksi parhepengon + dana darurat (asuransi na mangalinggomi hita sian aha pen a masa di joloan ni ari songon marsahit, kecelakaan dohot na asingna. Ingkon paradeon ta do dana darurat molo adong na tarjadi na so ditanggung asuransi jala hamuna ingkon paharuarhon hepeng)",happy
636,"Dung gabe buron piga-piga ari, Ferdian ujungna tarciduk di Tol Jakarta - Merak Jumat manogot. Tingki ditangkap, Ferdian lagi rap dohot dua donganna ima Aidil na tarlibat di bagas video prank i dohot Jamaludin, tulang ni si Ferdian. ""Saonari angka tersangka sementara diboan tu Ditreskrimum Polda Jakbar,"" ninna Kasat Reskrim Poltabes Bandung, AKBP Galih Indragiri tu detikcom, Jumat (8/5). Uhuman 12 taon penjara dung i gabe gabjaran tu Ferdian polisi maneraphon pasal marlapis tu angka pelaku, ima Pasal 45 ayat 3 huruf e, dohot pasal 51 ayat 2, UU Nomor 11 Taon 2008 ima tarhait tu Informasi dan Transaksi Elektronik (UU ITE)",surprise
1469,"Si Desi naeng mambuat hepeng ma di ATM, alana ndnag pola piga inganan lao mambuat hepeng di hutana, dibahen i mansai godang do torus halak na antre molo mambuat hepeng. Hape lao ma ibana arian nai tu ATM alana naeng manggarar parkuliaonna ibana. Sabotulna boi hian do ibana manggarar si HP alai tikki i sega gabe ndang boi dipakke. Sahat ma ibana di ATM on nunga mansai godang halak, sampe sampulu menit ma ibana antre. Alai adong tompu ro halak sian pudi alana naeng hatop inna ibana, ndang olo si Desi paloashon ibana alana nunga mansai leleng tong ibana paimahon. Sian i gabe sude ma mangalagai na naeng mambuat naso barisanna.",angry
2189,"Andorang so mangulahon akka karejonta hita tu luar mansai rikkot do hita mamparateatehon dirinta, tarlumobi molo hita gabe sada pamimpin di sada kantor. Alana molo nunga denggan hita mar pahean akka parkarejo na adong di torunta pe gabe boima lao mambahen na denggan. Molo ndang denggan hita mar pahean, akka na adong ditorunta pe annon gabe ndang boi be lao mambahen na denggan. Alana molo ndang boi denggan hita mamparatehon aha na tapakke, ndang boi be annon hita gabe sada sitiruon di akka jolma tarlumobi akka naposo. Mansai rikkot do boi hita ture andorang so kaluar hita manang tudia petaho.",shame
2825,"Doppak au SMA, sikola ni hami mangadaon study tour tu dua negara ima tu Singapura dohot tu Malaysia. Di sadun hami mangabiskon waktu sampe 4 hari 3 borngin. Rombongan na sian sikolah ki adong 50 halak. Madung tarmasuk ma i guru pendamping dohot pihak travel na. Doppak di pardalanan i sonang doma hu raso harana ima pertama kali na au mar pesawat kehe tu luar negeri. Au rap dongan-dongan ku mangabiskon waktu di si kehe markunjung tu beberapa universitas,habis I kehe ma hami marmayam tu tempat-tempat na bahat di kunjungi halak na marwisata tu negara i. marfoto-foto ma hami sude, manabusi silua ma hami na bahatan. Pokonan doppak i sonang doma hu raso.  ",happy
1526,"Nunga sadarian si Togar karejo di hauma ni jolma. Mansai jotjot do ibana digorahon asa mangula alana ibana jolma na ringgas do jala mansai gogo do ibana marulahaon. Imbahen i lomo ma roha ni jolma mamereng ibana, sai maos ma ibana digorahon. Hape di sada tikki muruk ma ibana tu nampuna hauma na manuru ibana karejo on. Muruk ibana alana mansai ndang suman upa na dilehonnna tu ibana. Nunga mansai leleng ibana na karejo on sadari, alai upa na dilehon tu ibana ndang suman tu na karejo sadari. Marjanji ma ibana dibagasan rohana ndang olo be ibana karejo molo ditogihon saulak nai.",angry
317,"5. Boi ma muse meditasi manang latihan relaksasi boi mangurupi hamuna pamenakhon pikiran dohot mangorui stres. 6. Mangalului pangurupion profesional, songon terapis, boi mangurupi hamuna mangelola perasaan muna jala mangalehon cara na lobi efektif laho mangadopi duka cita. 7. Maratangiang. Jala nion ma na um ringkot sian sasude. Alana sianTuhan i do apul-apul dohot hagogoon. Hatahon sude lomos ni rohamu dohot arsakmu tu Tuhan boi mangorui ponjit ni rohamu tingki marhabot ni roha. Ingot ma bahwa mangalami habot ni roha ima proses na normal dohot ganup jolma ingkon mamolus habot ni roha do alai marasing dalanna. Jadi unang lomos roha muna laho mangalului sara na dumenggan tu hamuna jala manguhuti insting.",sad
4416,"Selain WC tarsumbat, hamu pun pasti jungada marasoi situasi di dia kran sada-sadana na berada di toilet umum mate dan hanya manyisahon tetes demi tetes aek na kaluar malu-malu. Lebih sial lagi ketika hamu maligin ember menek tempat biasa manampung aek tarligin kosong dan horing, harana madung habis dipakai oleh halak bahat. Harna tarburu-buru saat masuk toilet umum, halak biasana inda maligin sada per sada parlengkapan toilet di bagsanna. Aek mangalir doras sian kran, ember madung tarisi penuh, tak akan bararti sama sekali anggo inda adong gayung. Biasana gayung di bagasan toilet umum jotjot manghilang atau marpindah tempat sian sada toilet tu toilet na lain.",shame
2883,"Na jolo doppak marsipeda au rap dongan-dongan ku, jungada do na jolo di dogo motor au harana marsipeda i. Au rap dongan-dongan ku marsipeda di pinggir dalan di donok gang bagas ni hami. Pas ma marsipeda hami giot manyiborang, au rap dongan ku tiba-tiba di dogo motor. Langsung ma au rap dongan ku madabu, hami di timpa sipeda ni hami i, mabar-bar pat dohot tangan ku tarsilpuk harana targappit di sitang ni sepeda i. langsung ma tangis au na gogoan harana atcit na hu raso, dioban  ma rap dongan ku i tu rumah sakit. Doppak saat i sampe saat on mabiar ma au marsepeda.",sad
1486,"Sada boru-boru dohot sada doli-doli marhallet sian SMA, borua i margoar si Uli molo si Doli margoar si Ali, sian mulai kalas sada SMA nunga marhallet halaki, ale naparjolo marlomo niroha si Uli do, alai lam leleng dung jotjot halaki rap marmeam gabe tongma lomo roha ni si Ali tu borua i. Alani i sian kalas sada sahat tu kalas tolu rupma halaki torus, di nalao tu sikkola, tu kattin, manang na tudia rup torus. Alai dung nganeng mangalanjut halaki tu parkuliahon gabe pisa ma halaki ala marimbar do sikkolana. Dung marimbar halaki gabe moru do holong rohani si Uli ala adong si bawadi namanjonoki imana disan. Ala adong do dongan nisi Ali sada sikkola dohot si Uli dipaboa barita i laos mohop ma rohani si Ali laos digotaphon ma parbogason i ala adong jolma ketiga.",angry
316,"Palaohon arsak dohot pikiran dung ditadingkon na ni haholongan ndang mura, jala ndang boi sahatop i. Alai adong do piga-piga sara na boi mangurupi hamuna laho mamolus i: 1. Manghatai tu dongan manang keluarga na mangalehon dukungan emosional. 2. Manurat sude na diroha muna boi mangurupi hamuna mangalapati jala mangorui aha na dirasahon hamuna saonari. 3. Marpartisipasi di bagas kegiatan na mambahen las roha manang na manghibur, songon olahraga manang manonton film hasoloman muna. 4. Pasudahon tingki tu jolma haholongan muna jala na jonok tu hamuna boi mangurupi hamu merasa lobi marisi ari-ari muna jala ndang sahalak mu lungun lungunan.",sad
3357,"Pas hami rap halak ayah ku rap akkang ku kehe tu kobun ni hami na adong di kobun i tobat na. Hami kehe tu tobat i giot manjala ikan akkang ku di tobat, tobat ni hami i tar bagas saotik, tano na adong di bagasan ni tobat i pe na landitan do i. Pas do mardalan akkang ku giot manjala ikan i, tarsilandit ia di pinggir ni tobat i, langsung ma madabu ia tu bagasan ni tobat i. Harana akkang ku inda malo marlange, tangis ia manyokkir mangido tolong. Langsung ma di tolong ayah ku akkang ku na tarbonom i di tobat i. sian i ma molo giot maridi-maridi mabiar ia tarbonom",fear
2814,"Adong do sada barang na memang madung leleng au manjalaki barang nai. Hampir ma satiop hari au kehe tu sada toko giot mangaligin sanga madung adong barang na hu jalaki i. Madung sabulan lobih au kehe tu toko i inda jungada adong hu ida barang nai be. Pas ma sadari i au madung pasrah madung marniat ma au molo inda be adong barang nai, inda be ra au manajalakina. Pas ma waktu i au kehe tu toko na biasa hu jojori i, hu ligin ma na bahatan barang na baru ro tu toko i, Pas ma hu ligin pagawai na i giot mamajang barang na hu jalaki i, sonang doma hu raso, langsung marlojong au tu toko i langsung ma hu tabusi barang nai. Madung leleng ma au manjalaki sipatu na songon i. Sonang doma hu raso akhirna dapot au sipatu na hagiot ku i.",happy
3144,Doppak au mengikuti jalan santai na di laksanaon kantor ku. Rupana adong do acara undian na diadaon kantor ku i. Di lehen ma di hami kupon nomor. Kupon in di payakkon pas di garis finis na jalan santai i. Hu pamasuk ma kupon ku i tu bagasan ni kotak na madung di pasiap halai panitia na. Pas ma acara na di pette-pette ima pembagian ni hadiah na nomor na monang na di undi. Hadiah utama ni acara i ima tv led. Salain tv bahat juo do hadiah na lain. Rupana au monang undian i mandapot kon hadiah kipas angin. Sonang doma hu raso harana au tar pilih na monang sian bahat na peserta na dohot i.,surprise
4386,"Hemm inda dapot didongkon resto. Dongkon sajo depot. Nah depot manuk geprek, lumayan tarkonal pulau jawa. Waktu i au mangan songon biasa, mardua dohot donganku . Pas manukna ro, au margontian mambuat indahan dohot donganku. Harana indahanna prasmanan gitu, jadi mambuat sendiri. Pertama au na mambuat. Abis i dongan ku. Pas au sampe meja, au maligin belatung diujung meja :( au positif thinking mungkin sian lap na inda bersih pas mba na bersihin meja. Trus au lap tuh meja pake tisu. Trus pas au dohot dongan ku mangan diawal suapan belatungnya adong 2 nai di ginjang meja. Au langsung nyuruh dongan ku  berhenti mangan. Au suruhia cek pinggan manuk nia. hita ngecek pinggan masing2. Eh botul, di piringna ia adong belatung na :( belatungna sian lasiak sepertina, harana warnana inda nabontar polos, adong rara na dibadanna, jadi kemungkinan godang sian lasiak. Harana suasana depotna lagi rame juo (jam mangan borngin ), pas mba na lewat langsung au panggil sambil au bisikon adong belatungna. Trus panganon hita digonti gengs plus ditambahkon milkshake  padahal mentok2 hita mesenna es teh wkwk. Pas mbakna nganter panganon hita, sempet au bisikon tolong lasiakna dibasu sebelum digunain, ulang lupa rebus sebentar. Trus di bilang ""iya mba, hami mangido maaf untuk ketidak nyamananna dll"". Btw abis i hita lanjut mangan lagi, tanpa rasa jijik apa gimana  emang ya, isi dompet mangalahkon segalana haha. Ngga ding becanda. hami totop mangan biasa aja. hita anggap i kesalahan pertama halai, kejadian sada per sekian juta panjualan. Dan alhamdulillah aman aman aja sampe sonnari.",disgusted
2775,"Doppak au na giot manyambung sikola pas madung tammat sikola SMA, awalna inda do marniat au na manyambung sikola i, harana au tinggal rap akkang ku, akkang ku na sedang kuliah, makana inda marniat au kuliah. Tai sebenarna na por an do rohakku au giot kuliah, hu cubo ma mandaftar tu salah sada universitas na adong di kota ni ku i. Madung pasrah do au molo inda di tarimo, tai inda hu sangka sonang doma hu raso au masuk tu parguruan tinggi na i, au masuk mar beasiswa jadi inda be porlu mabiar au masalah biaya ni kuliah ku saulakon. ",happy
3167,"Doppak au SMP na jolo, au tar masuk halak na momo an mar jerawat. Na jolo na bahatan jerawat ku, madung bahat, godang-godang dope. Sanga maila au sanga giot kehe sanga tudia pe. Pas ma waktu i pesta ma akkang ku, bahat halak na mangaligin muko ku. Goyak hu raso harana panatap ni halak i tu au. Adong ma umak-umak na mandokkon tu au, au na paling joko do bagas ni ami i harana au na marjerawat na lain nai mulus-mulus do muko na. Tangis au langsung, inda barani be au kehe tu halak na bahat i harana atcit roha ku di baen umak-umak i.  ",angry
2255,"Sai jotjot ma mago hepeng ni inong si Bastian sian sakku ni salaoar na. Alana saleleng on ndang pola sai olo mago, alana disi do torus dibahen inongna. Dung i gabe marpikkir ma inongna on, asa dihunsi ma sautna kamar on asa unang sai adong na masuk. Dung dibahen inongna songoni, gabe ndang adong be na mago. Hea ma di sada tikki, lao inongna on karejo holan halaki nadua nama di jabu. Na lao on inongna on masuk ma si Bastian tu kamar, hape mulak ma inongna on tu jabu lao mambuat adong na hatinggalan. Gabe tardapot ma si Bastian na di kamar, saleleng ibana do hape na mambuat hepeng on. Maila jala manajalo maap ma ibana disi.",shame
3367,"Doppak au giot kehe rap dongan ku marmayam, au maminjam tas ni akkang ku. Awalna inda do ra ia maminjam kon tas nai tu au, tai harana tangis au maminjam na, akhirna dilehen ia ma tas nai. Pas do kehe au rap dongan ku tu pantai, hami mar foto-foto di pantai i. Harana madung loja hami na foto-foto i, hami istirahat giot mangan si sada parmanganan. Mangan ma hami, pas madung siap hami mangan pas giot mambayar, hu buat ma tas ku na adong di bangku na di lambung ku. Rupana di bangku i adon paku, sakkot ma tas ku di bangku i, masubak tas nai. Langsung ma tar sip au, tarsonggot au harana na masubak i tas nai. Mabiar au hona siari akkang ku. ",fear
3389,"Doppak au giot pataru dongan ku tu bagas nia sian bagas ku, pas do di dalan hami, dalan na hami lewati i memang dalan na tar longon do i, kareta pe na lewat saotik,  tiba-tiba kareta na di jolo ni hami i martumbur dohot motor. Pas do na martumbur i langsung ma hami tolong halai. Pas madung hami tolong, bahat juo halak na lain na manolong na. Harana madung bahat halak na manolong na, au rap dongan ku langsung kehe sian tempat kejadian nai, harana mabia hami di jadion saksi, harana hami parjolo na mangida kejadian nai. Makana langsung kehe hami mulak, madung sidung hami tolong na martumbur i. ",fear
4073,"Berdasarkan riset YouGov, hampir satongah halak Amerika Serikat porcaya kalau setan i nyata. Kepercayaan itulah na mambuat pikiran halai manjadi liar ketika mendengar suara langkah atau lantai berdenyit dan perasaan merinding.Halak na porcaya (setan) lebih mungkin marasoi sensasi na inda wajar dan cenderung manyimpulkon bahwa sensasi i adongma tanda kehadiran hantu, kata kepala Penelitian Psikologi Anomalistik di Goldsmiths, Universitas London.Fenomena berprasangka i disebut dengan pareidolia. Hal on biasana dilakuon pada suara rekaman begu. Anggo halak pamburu begu atau paranormal manginstruksikan untuk mandengarkon suara atau frasa tertentu, maka otak hita akan marusaho sekuat tenaga untuk mandengarkon sehingga suara tersebut jadi nyata.",fear
4355,"Video tumpukan sampah na targulung aliran Sungai Cisunggala di Kecamatan Solokanjeruk, Kabupaten Bandung ramai di media sosial (medsos) Instagram. Video bedurasi 51 detik i diupload oleh akun Instagram @inisibudicilok dan direpost akun Instagram @adalahkabbandung. Dalam video itu, mamparlihatkon sampah maragam jenis dan didominasi oleh kemasan panganon seterofoam tergerus oleh aliran sungai. ""Pemandangan inda biasa, tumpukan sampah terbawa oleh aliran aek. Dalam tumpukan sampah i didominasi oleh sterofoam, plastik dan maragam sampah lainna. Dari informasi na dihimpun, kejadian i tarjadi, Senin, Tanggal 29 Oktober 2018. Sedangkon untuk saluran aek tersebut adong di wilayah Desa Panyadap, Kecamatan Solokanjeruk,"" tulis caption postingan tersebut.",disgusted
3174,"Na jolo doppak au kuliah, au mandalani hubungan rap abang tingkat ku na adong di kampus ku. Hami madung margandak madung adong hampir 2 taon. Pas ma ia madung wisuda pajolo sian au, harana ia madung wisuda jadi ia karejo di salah sada perusahaan na adong di kota. Pas doppak i madung adong ia 3 bulan na karejo i, inda hu sangka manjalin hubungan ia rap dongan sa kantor nia. Atcit doma rohakku harana na salingkuh i ia. Inda hu sangka ra ia songoni. Harana madung leleng i hami rap. Goyak doma rohakku mangaligin ia. Sude komunikasi na marhubungan rap ia hu putuskon. ",angry
621,"Dung pe akhirna, Nita Thalia mansoba mamaresohon dirina tu dokter lima taon na salpu jala dapot ma hasegaan saraf otak i. Ibana tarsonggot ala panahit i nunga di level 2. Sian hasil pamaresoon tingki i, Nita Thalia mulai dijalo mandohoti terapi jala malanjut pangubatan dung 6 hali terapi. ""Hu rimpu nungga malum, ndang adong be berasa kan,""ninna Nita Thalia. Sian in kondisi hasegaan saraf otak Nita Thalia lamu parah gabe mangambat ulaonna siapari. ""Sanga piga hali tingki mulak syuting ahu sampe pingsan. Ujungna bah nungga, didok dokter asa istirahat total, ndang adong ulaon manang aha pe. Alai ingkon terapi rutin sahat tu malum situtu,"" ninna Nita Thalia.",surprise
1086,"Mansai las do roha nisi Togap nuaeng, alana ibana manjalo penghargaan sian sikkola. Penghargaan on boi dijalo ibana ala hea ibana i taon i monang Olimpiade Matematika antar sikkola sa Kabupaten. Gabe andorang ndang so mambagi rapot, digora ba ibana tu langgatan lao manjalo penghargaan i. Tingki dijou ibana tu jolo, martopak tangan ma sude angka donganna na baris i lapangan. songon i tong angka guru na mangajari ibana mansai las rohana mamereng si Togap alana boi ibana mambahen angur goar ni sikkola i tingkat Kabupaten. Dung tinjang ibana di langgatan mandok mauliate ma ibana tu angka dongan dohot guru na nunga mangajari jala mandukung ibana",happy
637,"Pada dasarna aksi prank diulahon laho tu unsur humor manang halusuan. Alai di perkembanganna, maradakan di media sosial soal ndang saotik  aksi prank na diahap mangalewati batas wajar. Parpudi on, tindakan on lamumandapot opini negatif sian masyarakat, tarlumobi tu aksi na diahap ndang lobi sian holan na usil, ndang marlapatan, jala manggugai hatertiban masyarakat. Manang hata kerenna ndang marfaedah. Hombar tu Cyntia Gendrich, profesor akting jala sutradara di Wake Forest University, prank ima sada hal na mangabunghon godang teori na marpotensi manumbulhon ekkel. Superioritas, kejutan, halegaan, manang hategangan, sude mamainhon peran di bagas sada aksi prank jala tindakan i diulahon dibagas batas wajar.",surprise
1794,"Ala adong ma habiaron di bagasan dirina, gabe ndang barani be ibana di jabuna sandiri. Songoni ma si Laurana, nunga kalas tolu SMA ibana nuaeng, sabotulna nunga boi be ibana manjae sahalakna di jabu. Ale on daong, naeng lao ma natorasna kaluar borngin nai, adong naeng sijumpangonna, lak so barani ma si Laura on ditinggalhon sahalakna di jabu, tor naeng mangihut ma ibana. Hape sabotulna molo nibereng sian balgana, ndang pola mabiar be nian iba molo sahalakna di jabu. Hape sian kalas sada mansai jotjot ibana dipabiar-biar akka donganna, gabe ima torus diingot-ingot ibana. Sai torus ma nuaeng natorasna mangalatik asa barani sahalakna di jabu.",fear
1039,"Ndang holan sikkola na gabe panontuan hamujoun ni sada sikkola i, ale adong muse angka guru na mangajari angka dakdanak na adong disi. Molo guru on mansai ringkot do i sada sikkola. Tarlumobi sikkola nunga balga jala torus mandapot angka juara na adong i lumbahon. Guru ma na mangaleon angka hata sipasingot tu muridna, alana sipasingot on mansai ringkot do tuhalaki. Boha ma sada dakdanak molo ndang boi dipasingot, holan na lomona, pasti do ndang boi annon maju sikkola. Ikkon boi ma guru na gabe pamerengan tu angka dakdanak na marsikkola disi. Alana guru i do na gabe tiruan tu sude ",happy
1414,"Na um porlu unang ma sampe pailahon akka donganta hita molo tung mambahen prank alana ndang sude jolma i boi manjalo molo tabahen prank tu ibana. Ikkon boi do hita mambahen akka na denggan asa unang gabe maila dongan tai annon. Ido umbahen molo tung pe hita mambahen prank tu ibana ikkon tabereng ma aha habiasaonna. Molo parmuruk do ibana unang ma sampe tabahen tu ibana akka prank na mambahen maila ibana, alana molo mangamuk ibana ndang boi be annon ta anju. Molo dongantai ndang pola parmuruk boi ma tabahen tu ibana prank, alai hot ma tabahen naso pola parohon mara.",surprise
1532,"Molo mandapot akka pambahenan naso sintong hita sian uluanta boha ma hita marpambahenan alana sai adong do songoni akka pambahenan tu hita, gabe ndang boi tasalahon manang ise pe dison. Saonari ikkon sian dirinta ma na mangalehan jala mangulahon akka na sintong manang idia pe hita maringanan. Ikkon marpikkir do muse hita alana ndang sude jolma boi lao mambahen na denggan, tarbatas do akka jolma i. Ndang boi ibana mangulahon sarupa songon na idokkon uluan ta i. Gabe hita pe ikkon boi do mambahen sada pamikkiron ndang boi pasonanghon halak hita sude manang idia pe hita. Alai hot ma tabahen na denggan.",angry
3134,"Doppak au kehe tu toko kue giot manabusi kue, pas mamilih-milih kue au, rupana di sabolakku dongan ku inda manyodar  au adong ia di samping ku. Tarsonggot au harana tiba-tiba di jottik ia au, hu sangka sanga ise halak na manjottik au i, rupana dongan ku dopak SMA. Ia pe giot manabusi kue, madung leleng hami inda pasuo, mangecet-ngecet hami satokkin manyapai sanga ma bia kabar nia. Inda hu sangka bisa au marsuo rap ia di son. Sonang doma hu raso harana hami pasuo di son inda di sangajo. Ia na jolo dongan sabangku ku doppak sikola. Au rap ia na kompak kan i.",surprise
2772,"Doppak au SMA, madung job do roha ku marmasak. Au marniat molo giot manyambung kuliah mangambil jurusan Tatat Boga, harana jurusan i sajalur dohot hoby ku. Jadi au mangikuti ujian masuk perguruan tinggi mambuat 3 pilihan jurusan. Jurusan na hu pili pertama ima jurusan Tata Boga, jurusan na ka dua ima jurusan Tata Busana dohot jurusan na katiga ima jurusan Sastra. Au mangikuti ujian i, manjawab sude soal na dapot au. Marharop au bisa au lulus ujian i aso bisa au masuk tu jurusan na madung manjadi hagiot ku. Doppak pas pengumuman rupana au lulus dui tarimo masuk universitas dohot jurusan na pilihan pertama, sonang doma hu raso harana au masuk tu jurusan na manjadi hagiot ku. ",happy
279,"Deni manceritahon, tingki i ibana nekat lao tu Pelabuhan Lembar naek sepeda sahalakna. Hape, Deni holan mamboan hepeng Rp. 5000. Tujuanna, naneng mamereng langsung pertandingan Persebaya Surabaya dohot asa pajumpang tu idolana Irfan Jaya. Ndang diboto natorasna, Deni menyebrang sian pelabuhan Lembar, Lombok tu pulau Bali pahe kapal penyebrangan. Deni dipaloas naek kapal manyebrang dung mangaku marasal sian Bali. Sahat di Pelabuhan Padangbai Bali, Deni mulak muse mangayuh sepedana sahat tu Klungkung. Jarak na dao hian tu dakdanak saumur Deni. Sampe Deni dilaporhon tu polisi alana tujuan Deni na sabotulna ima tu Surabaya. Ujungna Deni pe dialap natorasna ala aksi nekatna i.",happy
224,"Tu aha ma sabotulna ahu heppot hian manabung tingki kuliah? Alana naeng ganti HP. Soalna hapeku nungga roa hian, kamera na pe nungga sega, layar na nungga eror sipata, nungga lemot tong :(. Jadi dung i ujungna ahu mambulathon tekad laho manabung manuhor hp na imbaru. Jala dung manabung sataon, tarpapungu ma hepeng 1,5 juta, pintor hu dok ma tu bapa asa manaruhon ahu manuhor HP, ima Xiaomi Redmi 4A. Las hian rohangku jala puas hian tu HP i, sahat saonari pe awet dope jala setia mandongani ahu ganup ari laho manjaha quora, webtoon, chatting di WA, mangirim email tu dosen, mamesan sipanganon, marsiajar bahasa Korea, manonton drama di Viu dohot Youtube.",happy
1466,"Ari minggu borhat ma muse si Tiopan tu pangarantoan alana nunga suda be tingkina libur, ikkon masuk nama ibana air senen karejo. Borhat ma ibana tu bandara borngin nai alana marholang lima jom do daoni jabuna tu bandara na adong. Hape rame ni i dalan mambahen gabe naeng tarlambat ma ibana, maringkati ma ibana tu bagian tikket dibereng ibana sian na dao nunga gok be jolma na udur disi. Dohot ma ibana tong udur sian pudi, hape songgot ma diida ibana sian pudi lao tu jolo, mangamuk ma ibana. Idokkon ibana ma asa sian pudi tong, alana sarupa na naeng lao do hita sude inna si Tiopan.",angry
795,"Dibagas pernataan resmi ni halak i, Emirates mambenarhon adongna insiden penumpang mangamuk i. Usut di usut borua i hatinggalan pesawat ala tarlambat ro laho check in. Lobi parahna muse, ibana mansoba terbang pahe pasport na nungga kadaluarsa masa berlakuna "" Hami boi manginformasihon, di ari Selasa (1/11) sada inseiden masa di jolo konter check in nami di Bandara Internasional Mexico City, didia adong sada penumpang na tarlambat mangalapor tu konter check in jala tarnata ibana mamahe paspor na nungga kadaluarsa. Penumpang i dijua ma laho terbang jala laos gabe liar dohot abusif tu staff darat nami,"" ima dipatangkas perwakilan Emirates.",angry
