id,text,label
5838,"Salah sahiji laptop asus harga tilu jutaan anu hade pisan jang dibeuli nyaeta laptop Asus Vivobook E410MA. Laptop ieu tos dibekelan ku layar saluas 14 inci. Prosessor na sorangan geus make Intel Celeron N4020 nu bakal ngabandungan selancar dina laptop kalayan tereh jeunh sat set. RAM na geus 4 GB, nu didukung ku penyimpanan internal 128 GB/256 GB/320 GB. Desain laptop na ge ipis jeung kesanna elegan. Dukungan software nu hade bakal maturan muka sababaraha aplikasi ge pasti lancar tanpa aya hamnatan, komo ngelag atawa loading mah. Laptop ieu cocok pisan jeung aktivitas sapopoe sabab desainna nu ipis cocok dibabawa ka mana-mana.",technology
5509,"Saha nu teu wawuh kana pasakan nu namina rendang. Hampir sadaya masyarakat resep pisan kana rendang sabab rasana nu ngeunah jeung khas. Rendang nyaeta tuangeun khas Minangkabau, Padang. Rendang nyaeta daging sapi nu dikeureut jeing diolah make rempah-rempah khas Padang. Rasa rendang boga khasan sorangan sabab dina ngolahna teh teu make uyah, ngan make sari asin tina santen kalapana. Biasana rendang dipasak jeung kentang laleutik. Rendang aya di unggal daerah jeung bisa dipanggihan na di warung nasi padang. Tah, rendang ieu teh dinobatkeun jadi pasakan pangeunahna nomor hiji di dunia. Wah, prestasi pisan yeuh kekayaan rempah-rempah dina kuliner Indonesia teh.",culture & heritage
4114,"Bulan rajab ieu bulan anu pinih berkah, salah sahiji bulan anu diantara sababaraha bulan anu istimewa. di bulan rajab urang di titah ngalakukeun sagala amalan bageur anu pahala di ganjar ku Allah berkali kali lipat. Di bulan ieu tatangga sabelah nyieun salametan jeung babagi ka anak yatim. Perbuatan nu kieu teh anu ku Allah di pikaresep, padahal lamun nominalna teu gede tapi Allah nyaho kumaha hate manusa kumaha niat na, anu insyaalah jadi pahala pikeun jelema anu ngayakaeun babagi jeung sayang ka anak yatim. Saking nyaahna Allah ka anak anak yatim, Allah nyebutkeun di suat an nisa ayat 36. Alah ngajangjikeun ka saha saha wae anu nyaah ka anak yatim bakal meunang pahala gede jeung menagkeun surgana Allah asal niatna ikhlas ridho ngan ka Allah SWT.",religion
7213,"Menu dahareun anu populer pisan di Indonesia nyaeta Sangu koneng. Kadaharan anu dijieun tina beas anu dicampur koneng ieu biasana disuguhkeun sareng lauk sapertos orek tempe, endog dadar anu dipotong-potong panjang, bihun, perdekel jeung hayam goreng. Aya oge sayuran sapertos bonteng, salada jeung urab. Biasana kurupuk anu disuguhkeun sareng nasi koneng, nyaeta kurupuk oren. Sangu koneng gaduh rasa anu leuwih gurih ti sangu bodas lantaran dijieun nganggo koneng jeung santen. Sangu koneng biasana disuguhkeun sareng sambel cabe. Sangu koneng oge katelah Nasi kunyit di Malaysia sareng Singapura. Sangu koneng mineng disajikeun pas ulang taun, syukuran khitanan, atawa acara anu sanesna.",culture & heritage
897,"Cara nongton di stadion ayeuna mah geus praktis, lantaran geus serba online. Jadi urang teu kudu ngantri meuli tiket. Carana urang meuli ti website resmi, mun geus kitu kari pilih pertandingan naon nu rek ditongton, misalna mun badminton mah aya 6 poe pelaksanaanna teh, tah urang rek nongton mu poe ka sabaraha hiji. Ieu perlu sabab nangtukeun hargana, tiap poe bakal beda oge hargana. Komo harga final mah bisa dua kali lipat ti harga mimiti maen sanajan nu maenna teh ngan saukur 5 pertandingan. Geus nepi stadion mah tinggal scan tuluy asup. Usahakeun beuteung geus dieusian ulah nepikeun ka lapar sabab engke bakal kaganggu pas urang nongton pertandinganana. ",sports
8888,"Dua minggu ka tukang bapa kuring kakara meuli rakét reungit sabab di imah keur loba reungit. Biasana mah anggeus make raket reungit mah sok disimpen deui di tempat asalna.  Tapi poé éta kuring poho pikeun nyimpen deui eta raket sabab bari masak, abdi nempatkeun dina hareupeun televisi. Teu kanyahoan ku kuring, adi kuring teh keur muterkeun sarta teu kahaja mencet tombol on. Adi kuring nu teu nyaho rakétna aya sétruman listrik, nempelkeun kana bagéan nu aya listrikan, lantaran reuwas jeung nyeuri, adi kuring langsung ceurik.  Saprak kina kajadian éta kuring diajar hiji hal, nayeta ulah ninggalkeun pagawean anu teu acan beres, sarta salawasna nyimpen barang berbahaya sangkan barudak leutik teu bisa nyoo.",technology
2797,"Stand Blénder, multifungsi pikeun sagala rupa kaperluan dapur anjeun Stand Blénder, multifungsi pikeun sagala rupa kaperluan dapur anjeun id.sharp A stand Blénder nyaéta wangun Blénder konvensional anu loba medar di pasar. Stand Blénder ngabogaan awak kuat, boga tutup, sarta ogé dilengkepan sababaraha pilihan speed. Kapasitas Blénder nangtung langkung seueur tibatan jinis Blénder sanés. Janten, anjeun tiasa nyayogikeun tuangeun dina jumlah ageung pikeun anggota kulawarga. Ayeuna, téknologi stand blender ngembang. Salian ti blender stand biasa, anjeun ogé bakal mendakan blender vakum anu tiasa ngaminimalkeun prosés oksidasi nalika pulverizing dahareun. Hasilna, kandungan gizi dina kadaharan ieu leuwih jagjag jeung teu gampang robah warna. Blénder leungeun, gampang ngahaluskeun bahan-bahan leutik
Blénder leungeun, gampang ngahaluskeun bahan-bahan leutik
Lamun hayang pulverize dahareun dina jumlah leutik, pilihan mangrupa Blénder leungeun. Bentuk sareng cara ngagunakeun Blénder ieu sami sareng mixer, tapi bilahna béda. Bentuk gagang ergonomis mangrupikeun kauntungan tina Blénder ie",technology
2419,"Lrangan jeung pamali ogé ditepikeun ku sesepuh adat di Désa Kanekes, Kabupatén Lebak, Banten, Jaro Saija. Nurutkeun manéhna, lahan adat Baduy ngabogaan legana 1.101,85 héktar anu kacatet dina Peraturan Daerah Nomor 32 Tahun 2001. Salian ti alam, urang luar anu nganjang ka Baduy Dalam ogé dipénta ulah nyokot gambar dina sagala rupa, kaasup poto. , kaasup video tina sagala rupa recorder. Anu ngadatangan dilarang ngalanggar aturan anu geus ditetepkeun ku masarakat adat sangkan henteu ngarugikeun loba pihak. Sawatara wewengkon padumukan anu bisa jadi teu diabadikan nyaéta Kampung Cibeo, Kampung Cikeusik jeung Kampung Cikawartana. Ceuk bapana Mursyid, upama ieu aturan téh geus dijieun jeung kudu diturut ku sakumna unsur masarakat.",culture & heritage
5725,"Jogging mangrupakeun salah sahiji olahraga ringan nu alus jang kasehatan. Jogging teh bisa dilakukeun ku saha wae dina sagala rentang usia. Jogging teh cocok pisan jadi olahraga jang pemula sabab dilakukeunna nyantai jeung make gerakan nu simpel. Tah, abdi unggal poe pasti jogging isuk-isuk dilapangan maen bola, tuluy sorena mah sakapeung. Pokokna jogging teh jadi salah sahiji rutinitas wajib abdi dina ngajalankeun kahirupan sapopoe. Mun beres jogging teh awak sok asa hampang jadi ngeunaheun jang memulai aktivitasna. Mun nu karek mulai olahraga ge pasti dianjurkeunna jogging, sabab teu merlukeun alat. Mun teu jogging sadinten teh asa teu geunaheun dina aktivitas teh.",sports
501,"Upacara adat nyangku mangrupakeun upacara adat nu geus aya ti baheula keneh di Kabupaten Ciamis. Istilah Nyangku asalna tina kecap yanko nu dina bahasa Arab mah mibogaan harti ngaberesihkeun. Upacara adat Nyangku dilaksanakeun dina poe Senen atawa Kemis akhir di bulan Mulud anu maksudna mah mieling poean babar Nabi Muhammad SAW jeung mieling Prabu Sanghyang Borosngora salaku Raja Panjalu, jalmi nu nyebarkeun agama Islam di Ciamis. Proses upacara adat Nyangku dimimitian ku nyokot cai keramat dina tuju titik mata cai patilasan Prabu Sanghyang Borosngora jang meresihkeun benda pusaka. Cai nu geus dicokot tuluy disimpen di tempat khusus salila 40 poe nepikeun poe ngalaksanakeun Upacara Adat Nyangku.",culture & heritage
7461,"Kanggo ngajagi mesin cuci tetep awet, aya sababaraha hal anu kedah diperhatikeun yen teu sadaya barang tiasa asup kana mesin cuci, salah sahijina nyeta koin atawa duit receh. Koin anu asup kana mesin cuci bakal ngarusak sirip pompa pembuangan mesin cuci. Koin oge aya kamungkinan nyangked dina pipa pembuangan jeung ngajadikeun saluran cai mangpet. Di mesin hiji tabung anu bukaanna dijieun tina kaca oge koin tiasa mepeuskeun bukaan kaca eta. Karusakan-karusakan eta bakal ngaluarkeun ongkos anu gede kanggo ngabenerkeunna lamun nepikeun rusak. Teu heran lamun mesin cuci biaya ngabenerkeunna gede lantaran komponen-komponen anu aya di mesin cuci teh teu mirah pangaosna. ",technology
8905,"Kamari kuring ningali TV sareng aya warta ngeunaan datangna mesin pencuci piring otomatis. Mesin pencuci piring mangrupikeun alat mékanis pikeun ngabersihkeun alat makan sareng alat makan sacara otomatis. Teu kawas dishwashers manual, nu beurat ngandelkeun scrubbing fisik pikeun miceun kokotor, dishwashers mékanis ngabersihan ku nyemprot cai panas, ilaharna antara 45 jeung 75 °C (110 jeung 170 °F), kalawan suhu handap dipaké pikeun barang rupa. Campuran cai sareng sabun cuci piring dipompa ku sprayer puteran.  Saatos cai lemes, mandi cai panas ngaliwatan muka klep solenoid elektro-mékanis, sarta siklus kontinyu dimimitian. Siklus bilas ngagunakeun bahan kimia, sareng saatos cai dikuringkeun, piring dikeringkeun nganggo salah sahiji tina sababaraha metode pengeringan.",technology
2257,"Kacaritakeun Khidir teh saurang prajurit anu hirup dina jaman Prabu Dzulkarnain, raja anu kacida hade jeung wijaksana. Raja Dzulkarnain dipercaya mangrupa jalma anu geus nyieun benteng/wates antara kahirupan manusa jeung Ya’juj jeung Ma’juj kalawan idin Alloh SWT. Balik deui kana carita Khidir a.s, dina lalampahan kalawan rombongan tentara Prabu Dzulkarnain pikeun manggihan cai ainul hayat (Musim semi hirup langgeng). Dina hiji guha di jalan, khidir dipingpin ku kersa Alloh pikeun misahkeun dirina tina golongan tuluy manéhna anu meunang cinyusu hirup langgeng. Anjeunna nginum eta, sarta hirup langgeng nepi ka poé anu geus ditangtukeun ku pangaweruh Allah SWT. Anjeunna diajarkeun langsung ku Alloh SWT elmu-elmu anu luar biasa anu umumna kaharti ku manusa.Dina carita Musa a.s, khidir jadi guru Nabi Musa, anjeunna ngajarkeun ngeunaan kasabaran sangkan bisa nuturkeun jeung meunang pangaweruh leuwih ti Khidir. Dina carita-carita séjénna loba carita Khidir papanggih jeung para Nabi, Wali, jeung jalma-jalma soleh. Dina pendak sareng Khidir a.s gaduh makna sareng hikmah anu jero. Nepi ka ayeuna Khidir dipercaya masih hirup, sarta masih terus mawa risalah Ilahi.

Wallahu 'a'lam bishowab....",religion
5909,"Kahadiran sapeda listrik jadi salah sahiji alternatif berkendara nu santai jeung hemat oge sehat. Pasalna, sapeda listrik teh bisa ngagunakeun mode manual jiga sapeda biasa nu digowes, bisa oge make mode otomatis nu tinggal di gas. Sapeda listrik teh kabilang masih jarang digunakeun ku masyarakat, sabab masih aya kandaraan motor nu dipandang leuwih efisien dina sagala hal. Padahal, sapeda listrik teh boga dampa positif, jiga ngurangan polusi, ngahemat pengeluaran, teu ngahasilkeun emisi tina bahan bakar, jeung sajabana. Dina seueur nu make na ge cenderung di kota besar, mun di kapung mah masih keneh jarang nu ngagunakeun, sabab minim sosialisasi tea janten teu ngarti perkembangan teknologi.",technology
4134,"Dina agama budha aya nu ngarana hari kanitha, teu loba batur anu apaleun bahwa hari besar anu ngarana hari kanitha kusabab hari kanitha teu di asupkeun ka kalender masehi jeung teu di jadileun hari besar nasional jadi eweh cuti bersama. Hari kanitha mangrupakeun salah sahiji hari besar dina agama Budha. Kanitha teh nyaeta dilaksanakeun minangka ekspresi jeung rasa sukur pikeun umat Budha ka anggota sangha atawa bikhu anu geus lulus tina massa vassa tilu bulan di daerahna. Hari kanitha di rayakeun umat buddha ku merekeun hadiah dina bentuk barang anu diperlukeun ku sangha saperti jubah, tuangeun, ubar atawa imah (kuti) bisa oge lamun rek nyumbang dina bentuk duit ka anggota Sangha.Pokona mah mere kabutuhan kabutusan pokok ka sangha, kusabab sangha teu bisa di gawe saperti biasana jeung kudu ngabdi.",religion
483,"Idul Adha biasana rame ku acara meuncit sato, nu dipeuncit mindengna domba jeung sapi. Di tiap kampung sok aya nu meuncit, jadi sok rame. Saenggeus meuncit sok milu motongan daging kurban make bedog anu saacanna geus diseukeutan heula. Geus kitu biasana daging-daging nu dikeureutan tuluy ditimbang jang dipindahkeun kana plastik-plastik leutik nu satuluyna mah dibagikeun ka imah warga. Peutingna sok loba nu nyate tiap imah teh diburuan, atawa mun pas zaman urang ngakost mah sok babarengan jeung tatangga kost sejen jang meuleum daging hewan kurban, aya nu bagian nyolokan dagingna kana awi, aya nu ngabumbuan, aya oge bagian nu ngipasan sate kanu alat nu geus aya arengna.",religion
473,"Gerakan takbirotul ihram anu bener. Nyaeta ngankat dua leungeun, tuluy dua leungeun diarahkeun ka kiblat posisina rada nyerong. Kaayaan ramo-ramo leungeun diantepkeun anggang siga biasana. Leungeun diangkat nepikeun ka juru ramo sajajar jeung ceuli bagian luhur, indung ramo sajajar jeung ceuli bagian handap jeung talapak leungeun sajajar jeung punduk. Saenggeus eta teundeun dua leungeun dibagian kenca antara bujal jeung dada, posisina lengeun katuhu numpakan leungeun kenca, indung ramo, jariji, jeung cingir leungeun katuhu nyepengan pigeulang leungeun sabeulah kenca. Curuk jeung jajangkung nu bagian leungeun katuhu dipanjangkeun dina luhur leungeun kenca. Saenggeus kitu tinggal maca doa iftitah. Tuluy cicing heula sakeudeung.",religion
962,"Salah sahiji jenis kulkas nyaeta kulkas showcase, bentukna kotak jeung mibogaan kaca transparan, beda jeung kulkas nu sejenna. Kulkas ieu biasana mindeng aya di tukang jualan eceran, siga di warung atawa di mini market. Bentuk transparan ieu emang berguna ngameh nu rek meuli bisa apal aya naon wae barang di jerona. Di jero kulkas aya rak-rak khusus nu bisa digunakeun jang ngentepkeun kadaharan atawa inuman dina sababaraha baris. Kapasitasna oge cukup loba biasana mun keur jualeun mah khusus nendeun inuman kaleng. Bentuk kulkasna anu gede jadi ngabutuhkeun tempat nu lega. Kulkas ieu ge teu boga tempat khusus paranti neundeun endog teu kawas kulkas nu sejenna, anu tempat neundeunna teh dina pantona.",technology
493,"Ti kajauhan Masjid Al jabbar katinggali ngapung di luhur cai. Tapi lamun ninggali leuwih deukeut mah masjid ieu sabenerna henteu ngapung. Tempat ibadah ieu ayana di tengah-tengah leuwi jadi katinggalina ngapung dina cai. Masjid ieu teu make kubah, jeung boga ornamen atap numpuk ngabentuk kerucut. Engkena masjid ieu bakal dilengkepan kaca anu warna-warni. Sanajan pembangunanna acan rengse, tapi kamegahan bangunan ieu langsung katinggali ti luar. Bentukna nu beda ti mesjid nu umumna nepikeun ka masjid ieu mindeng disumpingan ku para wisastawan. Lantai nu kahiji bakal dibangun museum sajarah nabi. Tuluy lantai nu kadua jeung tilu dijadikeun tempat ibadah nu bisa nampung jemaah. Salian ti eta geus dilengkepan oge ku fasilitas jang mondok, pelatihan, perpustakaan, jeung sajabana.",religion
5365,"Peuting ayeuna Ganjar bakal tampil dina acara Muludan. Biasana sok digelar di mesjid jamie. Ganjar kabagean tampil maca puisi jeung hafalan surat pendek. Muludan na teh sok diayakeun meriah, sok ngondang penceramah ti luar desa atawa luar kota. Ganjar tampilna teh ka lima, beres penampilan pidato ti babaturan nana. Beres tampil, Ganjar sok jajan heula ka luar, meser jajanan sosis bakar. Geus jajan sok langsung diuk deui di hareupeun panggung kangge ngadangukeun ceramah. Ganjar biasana sok bareng jeung babaturan ngajina mun ngumpul dariuk teh. Mun acara geus beres, nembe Ganjar jeung babaturanna sok mulang pangheulana da hoream pasedek-sedek dina gerbang kaluarna.",religion
4158,"Urang salaku manusia biasa anu loba dosa kudu na ayeuna jadi sering instrospeksi diri ningali diri urang the kumaha fokus ka diri urang tong sok riweh nguruskeun batur, komo lamun ngomongkeun batur di tukang eta ngarana munafik. munafik atawa nu biasa di sebut pura-pura Munafik disebut oge jalma anu omonganana teu saluyu jeung laku lampah atawa kanyataan. Allah SWT teu resep ka jelema anu munafik, Allah SWT ngadawuh dina surat An-Nisa ayat 145 yén jalma-jalma munafik bakal ditempatkeun dina tingkatan naraka nu panghandapna. Jelema munafik nyaeta jelema anu bahaya jelema anu bisa ngaruksak silaturahmi, nagjieun adu domba jeung nu pasti pinyieun nyeri hateun batur.",religion
2363,"Dangdut mangrupa harta budaya atawa husus genre musik asli Indonésia. Sanajan akarna dina musik pop Malayu anu dipangaruhan ku unsur India (utamana pamakéan tabla) jeung Arab (harmonisasi), dangdut kiwari geus mekar sarta dipangaruhan ku rupa-rupa musik daerah atawa sub-genre. Sebutna musik dangdut anu dipangaruhan ku musik daerah Sunda (pongdut/jaipong-dangdut, cadut/calung dangdut, kendang rampak, bajidoran), Cerbonan/Dermayon (tarling/gitar-suling), Jawa/Pantura (koplo, congdut/keroncong dangdut). , campursari ), Banyuwangian/ Jawa Timur (koplo, jaranan), Bugis (éléktron), nepi ka Batak (gondang). Musik dangdut mainstream sorangan lain deui musik daerah, tapi musik nasional anu dipikawanoh oge di nagara tatangga, saperti Malaysia, Singapura, Brunei, Timor Leste, Thailand, nepi ka Filipina. D'Academy Asia malah geus jadi program kontes dangdut televisi anu nampung bakat ti sagala rupa nagara di Asia Tenggara.",culture & heritage
943,"Mesin cuci aya nu bisa nempel dina tembok? Ieu kadengena aneh tapi ayeuna mah aya mesin cuci nu bisa nempel kana tembok. Mesin cuci ieu nempel dina tembok geus kawas AC, ngaranna teh Mini Drum. Tangtuna ukuran mesin cuci mini drum ieu teu siga lolobana mesin nu sejenna nu ukuranna gede. Mini Drum ieu diciptakeun nu kapasitasna teh tilu kilo. Lila waktu nyeuseuhna teh nyaeta sakitar 29 menit jang proses nyeuseuh di mini drum ieu. Mesin cuci ieu aya dua warna, nyaeta warna kayas jeung biru langit. Mini Drum ieu bisa ngurangan pamakean cai saloba 80 persen. Ukuranna anu leutik jeung bisa ditempel jadi hiji pilihan lamun imahna leutik ngarah teu heurin.",technology
8817,"Treadmill mangrupakeun alat olahraga anu dipaké pikeun jalan sarta leumpang tanpa kudu gerak. Aya dua rupa treadmill, nyaéta manual jeung listrik. Bagian anu urang napak disebut alas treadmill, dina treadmill manual lamun urang gerak, mangka asal treadmill ogé bakal gerak nurutkeun laju urang. Samentara éta, treadmill listrik ngagunakeun motor salaku penggerakna. Janten urang tiasa nyetél laju, jarak sareng mode nanjak sorangan dumasar kana kahoyong urang. Treadmill listrik gaduh sababaraha tombol pikeun nyaluyukeun laju. Modél treadmill ieu ogé dilengkepan monitor pikeun ngawas denyut jantung urang. Dina bagian motor urang kudu rutin mariksa jeung melumasi supaya teu gancang ruksak, jadi teu anéh lamun harga treadmill listrik leuwih mahal sabab ti mesinna ogé leuwih canggih.",sports
2745,"Kuring ngawitan nganggo HP Poco F4 dinten Senen ping 9 Juli 2022 sakitar jam 08.00 WIB, teu lami dugi ka Bandara Husen Satranegara Bandung. Dina waktos éta, batréna 98 persén dicas sareng siap pikeun pindah. Kira-kira leuwih ti saratus poto, puluhan vidéo, jeung puluhan rekaman audio dicokot dina kurang leuwih 2,5 jam. Telepon sélulér rada haneut tapi henteu ngaganggu kinerja pisan. Kagiatan tetep lancar sareng telepon sélulér henteu nunjukkeun tanda-tanda katinggaleun atanapi ngalambatkeun nalika dioperasikeun. Sanggeus ninggalkeun pabrik perakitan tempat kuring digawé, kagiatan dituluykeun ku dahar beurang sarta nganjang ka sababaraha lokasi di Batam nepi ka soré geus kitu kuring ogé balik pikeun nguji kaméra ponsel pikeun nyandak gambar di sabudeureun.",technology
5795,"Basa nuju janten mahasiswa baru mah abdi teh sok hoream olahraga sabab ku tugas kuliah ge sok kateteran keneh. Badan teh sok asa teu ngeunaheun, asa loyo jeung kurang semangat. Tuluy taun kadua kuliah abdi mulai ngabiasakeun jeung olahraga. Biasana saminggu ngan dua kali atawa tilu kali, eta ge olahraga nu ringan we jiga jogging jeung jalan-jalan. Ti saprak ngabiasakeun olahraga, awak teh jadi asa ngeunaheun, asa hampang, jeung asa sumanget ngajalani aktivitas teh. Berat badan ge jadi stabil, normal, jeung cenderung stagnan di angka 53. Tah pas tos karasa perbedaan nana, abdi mutuskeun jang berusaha samaksimal mungkin supaya konsisten kana olahraga, minimal jogging.",sports
842,"Eskul karate mangrupakeun salah sahiji eskul olahraga nu aya di sakolaan. Eskul karate ieu biasana jang ngembangkeun hobi atawa minat jeung bakat khususna dina bidang olahraga beladiri. Tujuanna mah nyaeta keur pembinaan prestasi di bidang non akademik sarta keur ngalatih siswa jang mibogaan karakter disiplin oge tanggung waler. Biasana dina eskul karate, siswa diwajibkeun jang ngagunakeun baju khusus keur dipake pas latihan. Baju karate boga ciri khas nyaeta calana warna bodas, jeung baju warna bodas. Baju na mun lalaki mah terbuka katinggali belahan dadana. Tuluy jang nangtukeun siswa geus ditingkatan pemula, menengah, atawa mahir biasana dibedakeunna dina sabuk. Aya sabuk bodas, koneng, hejo, biru, coklat, jeung hideung. Biasana siswa bakal make sabuk bodas heula, nyaeta tingkatan pemula.",sports
4611,"Mesin cuci mangrupikeun salah sahiji alat éléktronik rumah tangga. Fungsi mesin cuci ieu tangtuna pikeun mantuan nyeuseuh anjeung meresihan baju tapi teu ngan baju mesi cuci bisa mersihan sagala bahan bisa horden, selimut nepi ka boneka. Ieu anu ngajadikeun mesin cuci salah sahiji produk produk éléktronik anu payu jeung di pikahayang ku loba jelema utama na ku ibu ibu,  kumargi dirasakeun bisa ngagampangkeun pagawean jadi leuwih gampang jeung gancang ti pada ngumbah sacara tradisional atanapi manual. Mesin cuci modern sorangan fungsina henteu ngan ukur nyeuseuh sareng ngabersihan. Sababaraha mesin cuci modéren ogé dilengkepan ku fungsi pengering sareng fitur modéren sanés pikeun nyeuseuh baju dumasar kana bahan sareng jinis baju anu badé dikumbah.",technology
923,"Desktop replacement nyaeta salah sahiji tipe laptop nu didesain sacara khusus jang tujuan nga akomodir kamampuan hiji PC dina bentuk laptop. Khususna lamun ngabutuhkeun laptop jang pagawean nu beurat, misalna edit jeung render video, animasi, sarta pagawean beurat sejen nu merlukeun performa nu leuwih. Sanajan kitu, bentuk laptop tipe ieu leuwih gede jeung leuwih beurat lamun dibandingkeun jeung laptop dina umumna. Bodi nu beurat ieu ngamungkinkeun supaya laptop bisa tetep tiis sanajan digunakeun dina durasi anu lila. Salian ti eta, laptop ieu oge umumna dilengkepan ku ukuran layar nu leuwih ti 14 inci jeung ngamungkinkeun jang dipake ku laluasa jeung nyaman.",technology
555,"Ngajual oleh-oleh khas daerah ayeuna mah bisa ngaliwatan online nyaeta ku cara ngajualkeunna di aplikasi e-commerce tibatan ngajual manual mah. Sabab mun ngajual manual urang kudu nungguan nu meuli, komo deui lamun produk nu dijual teh oleh-oleh khas daerah. Tangtuna kudu nungguan nu meuli nu keur liburan, bari jeung henteu tiap waktu aya pengunjung ti luar kota teh. Jarang oge mun nu meuli ti daerah nu sarua da pastina oge geus bosen. Ari dijual online mah jangkauan nu meulina leuwih lega, bisa ti daerah mana wae ngan aya hiji syarat nyaeta calon nu meulina kudu boga internet jang ngaksesna. Tapi di jaman ayeuna mah geus loba nu ngarti kana internet.",culture & heritage
4153,"Istiqomah mangrupikeun salah sahiji istilah Arab anu sering diucapkeun ku masarakat muslim. Sifat istiqomah ngagambarkeun konsisten dina kayakinan. Istiqomah dina Al Qur'an ngan saukur bisa dihartikeun saluyu atawa saluyu jeung akad anu geus disepakati, eta dianggap wajib sabab bakal nungtun urang kana jalan anu lempeng ka surga. Konsisten intina nya urang salaku umat islam kudu teges nyokot ngalaksanakeun nu geus di pilih. Misalna urang geus milih bahwasana urang erek make hijab jeung cadar. Tah sikep jeung kata istiqomah eta nu di pake, istiqomah ngakakukeun nu ges di pilih jeung berharap karidhoan Allah SWT. Sikepistiqomah ieu penting pisan dina kahirupan matakna Allh geus ngatur ieu dina sababaraha surah surah nu aya di Al-Quran. ",religion
2734,"Sedengkeun tragedi anu nyéépkeun nyawa panglobana dina sajarah maén bal lumangsung di Lima, Peru, dina taun 1964. Dina waktu éta, 328 suporter leuwih maot. Tragedi ieu asalna ti rasa Kuciwa fans Peru ka wasit nalika laga ngalawan Argentina dina babak penyisihan Olimpiade Tokyo 1964. Waktu éta, Peru, anu tertinggal hiji titik ti Argentina, nyitak gul dina menit ahir. Tapi hanjakal wasit Angel Eduardo Pazos ti Uruguay ngabolaykeun gawang. Sarupa jeung tragedi Kanjuruhan sorangan, lumangsung alatan sikep represif aparatur, nalika suporter ngadorong deui anu asup ka lapang sanggeus pertandingan Arema vs Persebaya. Puncakna nyaéta nalika gas cimata ditembakkeun ka sakuliah stadion. Gas anu beracun ngageterkeun para suporter, buru-buru kaluar ti stadion, tungtungna seueur anu maot kusabab rame sareng sesak napas. Tragedi Kanjuruhan anu matak pikareuwaseun manah, mawa Indonésia jadi perhatian dunya.",sports
7061,"Jalmi anu pang muliana di hareupeun Alloh teh bisa wae jalmi anu paling seeur ujian dina hirupna. Diuji ku ditinggalkeun ku jalmi anu dipikanyaah dina hirupna, diuji ku teu gaduh pagawean, dipasihan musibah panyawat, dipasihan ujian nyaeta dirugikeun dina daganganna. Matak urang tong sedih lamun ngalaman salah sahiji ujian eta lantaran eta teh artina Alloh nuju masihan urang kasempetan kangggo ngarasakeun paitna hirup jalmi anu dipikanyaah ku Alloh, nyaeta paitna hirup anu dialaman ku para Nabi jeung jalmi anu saroleh, anu tos dijamin asup kana surga. Eta oge janten tanda yen Alloh teh nuju merhatikeun urang. Di dunya mah urang ngarasa sengsara, tapi di akhirat engke urang bakal dipasihan ganjaran anu sae ti Alloh lantaran kasabaran urang. ",religion
