id,ind_text,tgt_text
indolem-train-1683,"Tapi Om, aku takut sukses, gimana? - Tidak ingin seperti Kak Afgan? Masih muda, sukses, rendah hati. ???","Tapi mang,uku sabên sukses,awêi ipê?-coa mungkin awêi bang Afgan?gi u ai, sukses,su uk.???"
emot-train-2937,"Intinya sih.. Kamu jadi siapapun, aku tetep sayang kamu. Kita udh 6 tahun bersama (?) meskipun harus ngitung dari awal lagi smpe akhirnya skrg udh 3 bulanan wkwk.","Intinê ba ..ko jijai api bae,uku têp sayang ko.itê bi num taun spok(?) kadêak harus mitung kuni pertamo igai sapêi akhirnê uyo bi têlau bulên wkwk."
indolem-train-308,Agar dia tahu bahwa kini aku Jatuh Cinta ! ? Pesan Cinta by Afgan ? https://path.com/p/2uk74d,Supayo si namên uyo uku gidong cito !? Pesan Cinta kuni Afgan ? https://path.com/p/2uk74d 
indolem-train-54,"Dapat Bonus Raja Rp 384 Triliun, Warga Arab Saudi Ganti HP Hingga Kawin Lagi http://tinyurl.com/oem5tvp","Dapêt bonus Rajo Rp 384 Triliun, Wargo Arab Saudi gitêi HP sapêi nikêak igai http://tinyurl.com/oem5tvp "
emot-train-1386,"Itu tersesat bgt. Yang seharusnya kamu belajar berbagai macam teori tentang sosial, di sini kamu dikasih berbagai macam angka dan rumus yg bikin gak nyaman, dan jatuhnya malah jadi orang paling tertinggal di kelas.","Do o salêak nyên.dê mêstai nê ko mlajêa kêdau mêcêm teori masalah sosial.nak pyo ko nêlêi mêmêcêm ako ngen rumus dê mênêa coa nyaman,jijainê ko ijai tun paling bodong nak klas."
emot-train-826,cihe zayn malik alay selamat ya wkwk iya pi memang jadi kaya anak punk (cont),Cihe zayn malik alay slamat au wkwk au pi memang jijai awêi anok punk (cont) 
emot-train-1929,"lah Ken dimana?' -- pertanyaan paling gokil, apalagi pas ketemu itu diulang2, mbok ya kalau kangen doi chat, ya aku mana selalu tau Ken ngapa2in :(( ya kalau aku cemburu kami chat, itu hakku, tapi kalau kamu mau chat juga hakmu.","La Ken moi ipê?’—tanyê paling gilo,ipê igai pas têmau nê cet igê,makonê amên indau ngen si chatt.uku ipê namên gên ulêak Ken   :(( amên uku nyêbu au keme chatt,do o hok ku,tapi amên ko lok chatt do o hok nu."
emot-test-118,"Meskipun raganya telah tiada tapi jujur salah satu orang yg bikin penasaran dalam hidup Mas Tyoo. WHY? Krn gak pernah lihat Bung Besar ini di Televisi, beda sama Pak Soeharto. Namun.. Bendera MERAH PUTIH yang selalu berkibar adalah salah satu bukti NYATA PERJUANGAN BUNG BESAR","Walau tunnê bi cigai tapi jujur do tun  dê mênêa penasaran lêm idup bang Tyoo.Gêntai?kerno coa pêrnêak kêmliak Bung lai yo nak Televisi,luyên ngen pak Soeharto.tapi..Mdira MILÊAK PUTIAK dê slalu bekibar adeba do bukti NYATO PERJUANGAN BUNG BESAR"
indolem-train-1014,"Klo ada niat, pasti bisa""""@_tiwi22: Ihhhh pngn kya raffiah yang ada di @TheBlusukan pgn liat aa @RaffiAhmadLagi langsung,,, FamilyRaffiah17","amên ade niat, pasti nam""""@_tiwi22: Ihhhh lok awêi raffiah dê adê nak @TheBlusukan lok kêmliak abang @RaffiAhmadigai langsung,,, FamilyRaffiah17"
emot-train-2168,"Soal jln Jatibaru,polisi tdk bs GERTAK gubernur .Emangny polisi tdk ikut pmbhasan? Jgn berpolitik. Pengaturan wilayah,hak gubernur. Persoalan Tn Abang soal turun temurun.Pelik.Perlu kesabaran. [USERNAME] [USERNAME] [URL]","Masalah dalên Jatibaru,plisi coa nam GêMTAK Gubernur.memangnê plisi coa milêm pembahasan?mêak berpolitik.matur wilayah,hok Gubernur.Masalah Tanah Abang bi tu un têmu un.Kacau.perlu sabar.[USERNAME] [USERNAME] [URL]"
indolem-train-1227,"menurut berita, #kacauLionAir akibatkan calon penumpang marah, ngrusak kantor kkrn tak ada kepastian  penerbangan dari maskapai singa merah","Menurut brita, #kacau Lion Air mênêa calon pnupang mêngiak,musak kantor kerno coa ade kepastian kuni maskapai singo milêak"
indolem-train-3479,Kamar terlihat tidak terawat dan kurang bersih.,Bilik kêtennê coa tekurus ku ang bersih.
emot-train-1429,[USERNAME] [USERNAME] [USERNAME] [USERNAME] [USERNAME] .... AHY pasangan siapapun Pasti Kalah..... Nilai Jual AHY bukan Rendah tapi TIDAK ADA....!!!,[USERNAME] [USERNAME] [USERNAME] [USERNAME] [USERNAME]....AHY pasangan api bae pasti alêak.....nilai juwoa AHY coa si têmêak tapi coa si....!!!
indolem-train-2745,tv nya kurang gede + renyek semua,Tvnê ku ang lai + kabur kutê
indolem-train-2404,PRFM News | HARGA PREMIUM NAIK RP 200 MULAI 1 MARET Harga bahan bakar minyak (BBM) j... http://on.fb.me/1EzMDLW  - http://goo.gl/IJfGp5,PRFM News | GO PREMIUM Kênek Duai otos ( RP 200) MULOI 1 MARET Go minyok  (BBM) j... http://on.fb.me/1EzMDLW - http://goo.gl/IJfGp5
indolem-validation-11,"#Golkar #ARB Usulan pemerintah, biaya haji 2015 turun http://bit.ly/1LnTeLc","#Golkar #ARB Usulan pemritêak, biayo ajai 2015 tu un http://bit.ly/1LnTeLc"
indolem-train-366,"resepsionisnya ramah, kamarnya juga nyaman, bersih, cuma lemarinya aja yg kotor. pelayanan OK lah","Resepsionisnê ramah,bbilik kulo nyaman,bersih,Cuma lemarinê agok ngêi,playanan jijai ba"
indolem-validation-237,Syahrini Tantang KPK:   Klaim polisi dan KPK tak memiliki bukti kedekatannya dengan Fransisca alias Feriyani. http://bit.ly/18aGn0T,Syahrini tmatang KPK: Klaim polis ngen KPK coa temuan bukti kêpa ok nê ngen Fransisca gen luyên Feriyani. http://bit.ly/18aGn0T 
indolem-train-3465,"Raffi Ahmad karo Yuni Shara ae iso pedot, padahal wes janji 50 tahun ngkas. Mosok awakmu karo pacarmu gak iso? :'D #asudahlah #dinggopean","Raffi Ahmad ngen Yuni Shara bae nam putus,padahal bi janjai lêmo puluak taun (50) pêndoknê.maso ko ngen pêdiak nu coa nam? :'D #asudahlah #dinggopean "
indolem-train-1745,Didaskaleinophobia adalah takut akan pergi ke sekolah dan Scolionophobia adalah takut akan sekolah.,Didaskaleinophobia do o ba sabên lok lalau moi sekulah ngen Scolionophobia do o sabên sekulah.
emot-train-2258,"Dari sekian banyak thread yang aku baca, thread ini paling aneh sih dalam penulisan. Sumpah aneh bgt, mau ngatain ""lebay"" aja segala bikin thread hadeh. Aku juga ga jago nulis, tapi tulisan aku ga seberantakan thread mbaknya.","Kuni kékédau thread dé uku mbaco,thread yo paling aneh ba lém penulisan.Supéak aneh nyén,lok madeak “lebay” bae lajau ménéa thread aduh.uku kulo coa jago nulis,tapi tulisanku coa sebrantakan gakné"
indolem-train-2949,"Bikin Video Klip, Syahrini Pakai Konsep Absurd: Penyanyi yang satu ini sedang menggarap video klip untuk singl... http://bit.ly/1vR1Ock ","Mênêa Video Klip, Syahrini Makêi Konsep Absurd: Penyanyi dê do yo gidong gmarap video klip utuk sing l... http://bit.ly/1vR1Ock"
emot-train-1643,"Yuk, akhirnya msk minggu awal bln Juni 2018. Ga terasa udh setengah thn aj. Ternyata bnyak target yg blm terealisasi sampai skr. Hrs belajar displin &amp","Ba, akhirné masuk mingau awal bulén Juni 2018.coa ngéding bi téngéak taun bae.Ternyato dau target dé ati nanéu sapéi uyo.Harus bélajéa disiplin ngen amp"
indolem-train-1299,"Shower buat air panasnya nggk jalan,jdi mandi air dingin.. Ada kecoa, semut n tikus. Jadi, berisik","Shower biyoa panêsnê coa panêu,menai biyoa sêngok..Ade lepes,semut ngen tikus.ijai gu ok"
emot-train-1475,"Sudah survey ke beberapa cewek yang bilang ""cowok itu kata katanya ga bsa di pegang"" ternyata mitos gaes!! dan sekarang si cewek itulah yang begitu. Jadi, yang tidak bisa di pegang omongannya siapa? Coba kita survey untuk yang ini . Apakah sama atau berbeda? Ku rasa pasti sama",Bi survey moi slawêlawêi dê madêak “smanêi o keceknê coa nam mêgong”ternyato ngike kwat!!uyo slawêi o ba dê barêak o.ijai dê coa nam mêgong keceknê api?cubo itê servey dê dio.srai jano luyên?asaiku pasti srai
indolem-train-607,Aminnn 100x RT @RealMesha_17: ya Allah kabulkan & Aamiini smua Doa Harapan @Lady6igi thd suaminya @RaffiAhmadLagi #janjisuciRANS,Aminnn 100x RT @RealMesha_17: ya Allah knabul ba & Aamiini kutê  Du’o Harapan @Lady6igi magêa  aduknê @RaffiAhmadigai #janjisuciRANS
indolem-train-989,"Baju si kecil dengan design super cute dari Torio lagi diskon s/d 30%, lho!  KLIK >http://bit.ly/1zkhwOK",Bajau anok titik ngen design baês nyên kuni Torio igai diskon sapêi têlau puluak persen ba!  KLIK >http://bit.ly/1zkhwOK 
indolem-train-91,Bidang Perempuan Golkar Makassar Dibekali Ilmu Keprotokoleran - Fajar http://goo.gl/fb/hmuL3U,Bidang slawêi Golkar Makasar nêlêi lêmau Keprotokoleran – Fajar http://goo.gl/fb/hmuL3U
indolem-train-628,"overall oke, hanya AC kurang dingin, banyak cat sudab lapuk perlu cat ulang, pegawai ramah Deket  kemana mana","Kutênê bi jijai ba, Cuma ac ku ang sêngok, dau cet bi kidek perlu nêcet igai. Pegawai ramah pa ok moi ipê-ipê"
emot-train-2949,"Pernah pada saat itu punya tipe cewe yg harus gua pacarin. Tapi, lagi lagi kandas ditengah jalan. Setelah itu, mulai berfikir kalo cinta yah cinta aja tanpa alesan & syarat","Pernêak waktau o temuan model slawêi dê harus uku mêdiak. Tapi putus têngêak dalêan. Sudo o,muloi peker amên cito cito o ba coa pakêi alasan ngen syarat"
indolem-train-2366,Gadis yang memerankan Carol dalam film 'Poltergeist' meninggal di usia 12 dan skrg dipercaya menjadi hantu di kantor the Paramount Pictures.,Smulên dê ijai pran Carol lêm pilem ‘Poltergeist’ mêningêa omor duai blas taun uyo jijai atau nak kantor the Paramount Pictures.
indolem-validation-302,"Pelayanan tidak memuaskan, makanan habis pas sahur, kamar 2 hari tidak dibersihkan, receptionist tidak sopan dan menjangkelkan","Pelayanan coa mênyatuk,kêmuk abis pas nyaua,bilik duai bilai coa si nêsrih,recepsionis coa sopan ngen mlai inoa kemliaknê"
emot-train-3105,"Seneng banget bisa berbagi kebahagiaan bersama pengguna jalan & juga saudara kita yang menjalankan ibadah puasa Tidak hanya bagi-bagi tajil & makanan untuk berbuka saja,tapi ada juga penampilan dari JNE Idol serta Freestyle bola untuk menghibur para penggunajalan saat lampu merah [URL]","Snang niên nam bêbagiak kêsnangan ngen dê mlitas i o kulo ngen sêpasuak tê dê gidong puaso coa si Cuma magiak snok ngen kmuk utuk buko puaso bae,tapi ade kulo penampilan kuni JNE Idol serto freestyle bal utuk menghibur dê mlitas pas lapu milêak [URL]"
indolem-train-993,"35 siswa, 9 sekolah, 3 kecamatan mewakili #Bima!! Road to beasiswa 5 tahun belajar di SMP-SMA @smartekselensia! ?",Têlau puluak lêmo murid. Smilan skulah. Têlau Kecamatan jijai wakea #Bima!!bakêa dapêt Beasiswa lêmo taun bêlajêa nak SMP-SMA @smartekselensia! ?
indolem-train-2808,"Di Montana, wanita yang telah menikah dilarang untuk pergi memancing seorang diri pada hari Minggu.","Nak Montana, slawêi dê bi nikêak coa buliak utuk lalau ngewea su ang bilai mingau."
emot-train-3008,"Kasihan karyawan bapakku ini, mau lebaran malah jatuh sakit dan masuk rumah. Dan sekarang mudik terlalu cepat ke kampung halaman. Gusti Allah kadang memberikan hal yang tidak terpikirkan oleh manusia. Sebagai manusia ya cuma bisa menerima.","Slen pgawai bakku,lok rayo si dêmêm trus masuk umêak.uyo mudik gacang igê moi msadêi.Allah têtiko mlêi hal dêo têpeker manusio.jijai manusio ba Cuma nam têmimo."
indolem-test-488,"PDIP gitoloh """"@fadreee: Mentri koplak RT @rmolco: Terbukti Secara Meyakinkan Menteri Yasona Intervensi Konflik PPP http://dlvr.it/8kTkZ0","PDIP i o ba """"@fadreee: Mentri koplak RT @rmolco: Tebukti Seca o Meyakinkan Menteri Yasona Intervensi Konflik PPP http://dlvr.it/8kTkZ0 "
emot-train-657,"Sebagai dokter gue punya kelegaan tersendiri kalau pasien, terutama yang menengah ke bawah, punya BPJS. Karena itu artinya seandainya mereka harus dirujuk, misalnya, gue ga perlu stres sama pertimbangan keuangan.","Jijai dokter uku mêding tenang dewek amên pasien, terutamo dê mênêngêak mimêak, têmuan BPJS. Kerno do o tainê amên têbo o harus nêrujuk, misalnê, uku coa perlu stress ngen têmimbang masalah keuangan"
emot-train-2449,"Rencana : mau bagi makanan ke para tetangga karena mendekati hari raya. Oke, tradisi ""ater - ater"" (kalo dirumah) Realita : katanya ""disini, nggak ada kebiasaan kayak begitu......"" Krik krik Berakhir dengan, *yaudah kasih ke yang mau aja deh ntar kalo mau buka puasa*","Rencano : lok bagiak kmuk ngen tetanggo kerno bi ma ok bilai rayo.Oke,tradisi “bagiak kmuk”(amê nak dasêi)  Nyatonê (Realita) : “nak pyo,coa ade kebiasaon awêi o......”Krik Krik berahir ngen,*sudo ba nlêi ngen dê lok bae ba be amên bi lok buko*"
indolem-train-2836,"kamar bau, furniture sdh sangat tua","Bilik kêmon, prabotan bi tuai nyên"
indolem-test-978,"air panas gadak, 2x nginap 2 2 nya bertemu kasurnya",Biyoa panês coa si.duai kilai têmalêm duai duai nê têmau kasuanê
emot-validation-233,"Hah? Yg kemarin dipermasalahkan di kasus Gitasav kan bukan bagian sexual harrasment Gitasav ke Tristan, itu sih udah bener. Yg dipermasalahkan kan cara dia merespon Helmi. Those are two different cases. Kayaknya banyak ya yg salah paham kmrn yg kontra sm Gitasav di case mana.","Hah? Dê lêbêak ijai masalah nak kasus Gitasav o iso si plecehan seksual Gitasav ngen Tristan, do o ba bi bênêa. dê jijai masalah ba ca o si tmanggêp Helmi. Do o duai kasus luyên.awêinê dau gi dê salêak paham lêbêak dê coa tujau ngen Gitasav nak kasus ipê."
indolem-train-2119,"ac tidak berfungsi dengan baik, gerah","Ac coa bêpungsi normal,panês"
emot-train-83,kamu apa kabar sayang,Gen kabarnu sayang
emot-train-732,"produce 48 versi indonesia pelatih Dance : agnes monica, bisma smash, cinta laura Vocal : bertha, mas anang, bunda maya Rap : younglex, soimah Mc : irfan hakim, gilang, ramzi, ayu dewi EXCITED NEH GUE WKWKKWKWK","Produce 48 versi indonesia pelatih Dance : Agnes Monica, bisma smash, cinta laura Vocal : bertha, mas anang, bunda maya Rap : younglex, soimah Mc : irfan hakim, gilang, ramzi, ayu dewi SNANG NYEN UKU WKWKKWKWK"
indolem-train-2116,"fasilitas seperti makanan, minum, dan bantal airy tidak tersedia di hotel ini","Fasilitas awêi makanan, menem, ngen batêa aury coa si nak hotel yo"
emot-train-1553,Aku tidak membenci hujan sore itu. Aku hanya kecewa dia pergi saat mentari bersinar. Lenyap. Seperti kisahku dan kamu~ #masihtentangJuni #ceritaKaa,Uku coa jêmngik ujên pêlbêak yo.uku kêciwo si lalau pas matai bilai mcêlik.nyêp.awêi kisahku ngen ko~#masiakmasalahJuni#critoKaa
indolem-train-2291,Kebersihan kamar perlu lebih diperhatikan.,Kebersihan bilik perlu perhatian lêbiak. 
indolem-test-68,Minum 2 gelas air sebelum makan membantu Anda menurunkan berat badan dan melawan obesitas. [American Chemical Society],Muk duai gelas biyoa ayok mukmêi têmulung udi têmu un bênêk awok ngen milok awok gmuk. [American Chemical Society]
emot-train-1261,"Lebih asik kl ngomongin keberhasilan pemerataan pembangunan, pencapaian ekonomi, dibandingkan ngomongin keburukan calon sebelah ataupun keburukan si gubernur A atau B..","Lêbiak asik madêak keberhasilan pemeratoan pembangunan,asea ekonomi,nêbanding madêak kidek calon dêpêak o jani kidek Gubernur A jano B"
emot-train-1374,"Ternyata aku msh terjebak di ujian yg sama, ujian merindukanmu yg bukan siapa2. Kerinduan yg menguji karena tak bisa bertindak apa2. Perlu kau tau, dlm hal ini (yg ku maksud kamu) cukup menguras hati","Ternyato uku gi masiak têjêbak nak ujian dê srai,ujian indau ngen ko dê iso si jano2.indau dê mtes kerno coa nam jêjano. Perlu ko namên.lêm masalah yo (ko dêmasudku) cukup mayêak atêi"
indolem-validation-77,"Udah lengkap ber6, pake koreo kek SMASH 2010, pake baju couple pula.. wuihh, hati SB jedaarrr jedaarrr :v #SMASHatGFIdolJunior","Bi lengkap ber6, pakêi koreo awêi SMASH 2010, pakêi bajau couple kulo.. wuihh, atêi SB jedaarrr jedaarrr :v #SMASHatGFIdolJunior"
emot-train-1556,"Goblok amat si :( Nemu wrp jaman dulu, dah di seduh trs di tambahi susu coklat. Dah di minun smpe abis. Iseng liat sachetannya eh pas di liat wrpnya dah EXPIRED. Wth, are u fucking kidding me?!","Padêak kbodong seh : (têmau wrp bi an,bi npek biyoa panês bi tnambêak susu coklat.bi nenem sapêi abis.cmubo kêmliak bukusnê eh pas kêmliak wrpnê bi kadaluarsa.jano ko bragam"
emot-train-1497,[USERNAME] Kasihan tuh PKS uda ngemis-ngemis sodorin nama-nama cawapres kalau ga di pilih....... Apalagi kalau menit-menit terakhir pilih cawapresnya.......TAMAT CAWAPRES PKS PILIHANNYE....,[USERNAME] Slen ba PKS bi békinoi bi méléi gen2 cawapres amén coa niliak....ipé gai menit2 terakhir miliak cawapres........TAMAT CAWAPRES PKS PILIHANE....
indolem-train-483,Satnite nonton Konser Dari Hati Afgan beuuuhhh ????? ? Knock Me Out by Afgan ? https://path.com/p/3NGuhR,Malêm mingau noton konser Kuni Atêi Afgan woiii ????? ? Knock Me Out kuni Afgan ?
emot-train-151,"Bagian terseram, caraka malam ditengah hutan belantara. Udah gausah dibayangin, asli serem. Disuruh jalan, disuruh apalin sandi panjang banget, ditengah dikasih masalah, ditengah sama akhir ada pocong2an, belum lewatin parit, tanpa penerangan apapun. Kacau asli. [URL]","Bagian dé ménéa nyébakok, Caraka kélmém nak téngéak imbo lém.sudo jibéak mbayang, nyébakok nyén. Néluak panéu, néluak mapéa sandi panjang nién, nak téngéak néléi masalah, nak téngéak ngen akhir ade pacong2an, ati mlitas paret,coa ade penerangan jéjano.kacau nyén. [URL] "
emot-train-1111,"Jinhyuk menunduk, menatap sepatunya. Merasa takut untuk membalas permintaan sang puan. ""M-maaf, saya tidak membawa alat lukis saat ini..."" [URL]","Jinhyuk mênunduk,têmatap spatunê.mngêding sabên utuk smimêt kinoi saang puan.”M-maaf,uku coa min alat lukis uyo...” [URL] "
indolem-train-1229,"Resiko punya pacar cantik ??? ? Seperti Itu? by Syahrini (with Fitria, Kaneka Putri, and 2 others) ? https://path.com/p/47C75r","Resiko temuan mete calak ??? ? Seperti Itu? kuni Syahrini (with Fitria, Kaneka Putri, and 2 others) ? https://path.com/p/47C75r"
emot-test-100,Kereta ke arah Rangkas pasti ini wkwkwkw..I feel banget sih perjalanan sejauh ini berdiri...tapi semoga kedepannya bisa disiplin lagi,Spur moi arah Rangkas pasti dio wkwkwkw..ngêding nyên perjalanan kê uak yo je...tapi smugo moi mukonê nam disiplin igai
indolem-train-464,"Penyaluran Beasiswa untuk 38 anak yatim dan dhuafa di Jayapura Wilayah Abepura, bantu biaya sekolah sang juara.","Penyaluran Beasiswa utuk télau puluak anok yatim ngen dhuafa nak Jayapura Wilayah Abepura, témulung biaya skulah sang juaro."
indolem-validation-393,"Pelayanan kurang ramah dan cuek ,swower ga berpungsih dg baik kamar mandi licin dan hampir mau jatuh trus","Pelayanan ku ang ramah ngen coa gle, shower coa pungsi nyen,kamar mêndai liut gesea lok us trus"
emot-train-13,tapi ngeri sih ya emang akun gede dengan followers ribuan tuh kalo ngetweet yg jelek atau salah dikit yg hujat langsung banyak AKU TAKUT KALIAN UNFOLLOW AKU AJA PLEASE,Tapi sabên gi akun lai ngen followers bêribau o amên ngetweet dê kidek atau salêak didik dê mêngiak langsung dau Uku sabên udi cigai fallow uku igai 
emot-train-672,"Dengan apa kuharus meminta syafaatmu Ya sayyidi Ya Rasullullah? Jika dengan cinta,aku akan mencintai layaknya kau mencintai Dengan apa kuharus mencari Ridhamu Ya sayyidi Ya Rasullullah? Jika dengan akhlaq,aku akan menjaga Budi pekerti layaknya kau berbudi pekerti terhadap umatmu","Ngen jano uku harus minoi syafaatnu Ya Sayydi Ya Rasulullah? Amên ngen cito.uku bakêa cêmito awêi Ko cêmito ngen jano uku harus mêsoa RidhaMu Ya sayyidi ya Rasulullah”amên ngen akhlaq,uku bakêa jmago Budi pekerti awêi Ko berbudi pekerti ngen umatNu"
indolem-train-3535,tenang cumah agak kpanasan dikit AC kurang stabil,Tnang Cuma agok panês didik AC ku ang stabil
emot-test-55,"kenangan SMA, tiap pulang sekolah sebelum pulang minta uang ke temen2 cewek masing2 seribu bilangnya buat bensin, tapi malah nyasar ke warung nongki beli udud hahahahah :(","Kenangan SMA, tip belek skulah minoy caci ngen kêkuat slawêi dikup tun seribau alasanê utu bensin, tapi kilok moi warung bêkopoa têmukua rokok hahahahah :("
emot-train-3092,# CONGRATULATIONS # Mengucapkan selamat untuk ibu Dini Mildawati yang meraih New Silver Leader semoga semakin lancar & sukses bersama Paytren,# SLAMAT # Mucêp slamat utuk ibu Dini Mildawati dê dapêt Jijai pemipin bêlau (New Silver Leader ) smugo tambêak lacêa ngen sukses bêsamo Paytren
emot-test-161,belajar agama yg tuntas jd nga ngarang dalam hidup. Isa saja disebut2 dialquran trus lu mau jelek2in Isa?? Bisa baca alquran ga? [URL],Bêlajêa agamo ngut sêlêsêi jijai coa mngarang lêm idupnu.Isa as bae lêm Alquran galok madêak trus ko kêmidek Isa as?? Nam ngajai coa? [URL]
indolem-test-712,"mantap, tapi. tolong lebih di jaga kebersihannya yah...","Jijai ba ,tapi.tulung jênago kebersihannê au... "
emot-train-257,"Tbh, aku rasa aku jatuh cinta dengan someone tanpa aku sedar bcs my heart beats faster when i think of her. Jangan tanya siapa. Aku takkan beritahu.","Sabar, asainê uku bi cito ngen do tun coa ku sadar bcs jatungku bêdêbar lêbiak gacang pas uku meker si. Mêak têmnai api. Coa ku gi madêak. "
indolem-train-600,"Tahukah Anda, di Jepang ada lowongan pekerjaan sbg Tamu Pernikahan Palsu, selain mendapat gaji sbesar Rp. 1,6 juta/hari jg dpt makan gratis.","Namên coa ko,nak Jepang ade lowongan kêrjo jijai tamu acara nikêak palsu,luyên kuni dapêt gajai lai Rp. 1,6 juta/bilai dapêt kulo mukmêi gratis"
emot-test-298,"Kalo aku sendiri waktu pertama kali sampe ke guest house-nya emang agak takut. Tapi kalo aku sih bukan ke arah karena bisa ngedeteksi ada apa2, cuma karena orangnya memang penakut wkwk. Apalagi guest house-nya dalam keadaan sepi dan kosong.","Amên uku waktau pertamo skilai sapêi moi guest house-nê memang agok sabên. Tapi coa si uku nam ndeteksi ade jano2,Cuma kerno tunnê memnag pênyabên wkwk.ipê igai guest house nê dong sunyai ngen kosong."
emot-train-2228,"ganteng juga enggak, ih kesel banget liatnya. Katanya ekspresi dingin nya karena bawaan dari karakter di drama but helloo we're in REAL LIFE, di presscon harusnya profesional dong ya. Mau nunjukin karakter di drama, salah lapak bro. kasian Seohyun, poor my baby","Calak nyén coa ,ah coa ku as kémliakné,nadéakné kten diém o bi kmin kuni karakter nak drama Halo keme lém idup nyato, nak mcit tombol harusné profesional gi. lok kémten karakter nak drama, saléak pnan kwat.slén Seohyun, malang cupikku"
emot-train-161,"[USERNAME] [USERNAME] Kaya gini mau nyaleg..? Uda dapet korupsi berapa M, masih kurang.....?? Jadi inget ama yg nyolong ampli mushola... Sebanding ga harga ampli ama yg di korupsi TAUFIK...? Kalau mencuri ampli yg harganya ga seberapa di BAKAR HID","[USERNAME] [USERNAME] awêi yo lok nyaleg..? bi dapêt korupsi kêdau M,Gi ku ang....?? jijai tingêt ngen maling ampli musholla...sbanding coa go ampli ngen korupsi TAUFIK...? Amên maling ampli dê go nê coa sbrapo nêmbêm idup2"
indolem-train-2150,"Tempatnya terlalu jauh, jangkauan wiifi tidak sampai kamar, air panas di kamar mandi tidak berfungsi dengan baik.","Pnan nê uak igê,jangkauan wifi cao sapêi bilik,biyoa panês nak kamar mêndai coa stabil."
emot-train-764,saya tdk setuju jokowi disamain umar bin khatab sebab Umar bin khatab : - tidak lempar hadiah ke umat - bacaan al qur'an nya fasih - tau kapan harus keras dan keras dan tau kapan harus berlemah lembut - mempersatukan bukan memecah belah Jokowi jauh,Uku coa stuju Jokowi sênrai ngen Umar Bin Khatab sebab Umar Bin Khatab :- Coa mêluk hadiah moi umat-baco Qur’annê fasih-namên harus lêbiak tegas ngen namên tngen harus berlemah lembut-jêmijai do coa si cêm êi Jokowi uak
indolem-train-1989,Sprayx kasar dan berbulu.ac nya ribut,Sprai nê kasar ngen agok bulau.ac nê mêkok
emot-train-591,"Wajah yang terkasih dipuja lagi. Pipi yang sedikit tirus diusap lagi. Mata yang terpejam itu dikecup lagi. Ia membenarkan orang bahwa, ""Cinta itu buta.""","Papêa dê cnito nujai igai,Papêa dê agok lucuk nusêp igai.matai dê bi mêjêm o sên yum igai.si mbênêa nadêak tun,”Cito o buto.”"
indolem-train-1105,"Dihantam Badai Besar Selama 2 Hari, Palestina Tertutup Salju: SEJUMLAH toko dan kantor di daerah Tepi Barat, P... http://bit.ly/1LmvTHT","Nagas badai lai sélamo duai bilai, palestina tutup salju: kékédau toko ngen kantor nak Tepi Barat, P...http://bit.ly/1LmvTHT"
emot-train-2568,Muka itu enggak usah dicari bakalan dapat muka kok buktikan dengan kinerja .... Lahhh yang onoh cari muka nya sama yang tua2 doang .... [URL],Muko o jibéak msoa bakéa dapét ba  nébukti ngen asea kerjo...laa dé nak di mésoa muko ngen dé tétuai bae.... [URL] 
indolem-train-491,Hanya kau dan aku yang tahu Arti cinta yang tlah kita punya *eakk=))?? ? Untukmu Aku Bertahan by Afgan ? https://path.com/p/464y1W,Cuma ko ngen uku dê namên tai cito dê itê têmuan * eakk=))?? ? Untukmu Aku Bertahan kuni Afgan ? https://path.com/p/464y1W
emot-train-1289,"sayang banget, bangga banget. besok giliran saya yang pamerin ijazah kelulusan ya dan banggain kalian walau gak secara langsung :') sukses terus ya mas-mas ayo berjuang bareng! [URL]","Sayang nyên,bangga nyên.mên gilia ku dê sminiak ijazah kelulusan au ngen sêmnang udi walaupun coa cao langsung :’) sukses trus au abang-abang maroba bêjuang spok! [URL]"
emot-validation-26,"Bahagia itu dekat, seperti I cinta the way you say Good Morning. So, say it every single day to me ya.. Cm mau ngingetin, jika satu org sdh mulai pudar kepeduliannya, jgn pernah takut, krna diluar sana akan ada org yg lbh peduli sama km, as long as you do something good jg.","Snang o pa ok,awêi do cito co o ko madêak slamat pagi.ijai nadêak tip pueng ngen uku au..Cuma lok mingêt,kalau tun do bi cigai dulai,jibêak sabên.kerno nak luwêa di ade tun dê lêbiak dulai ngen ko.slamo ko mênêa sesuatu kulo."
