id,text,label
indolem-train-1940,Syahrini kesal dikaikan jo kasus Feriyani-Samad http://goo.gl/w61buF,negative
indolem-train-2209,Paralu salimuik dan tambahan papan namo di tapi jalan supayo indak binguang cari tempek iko,negative
indolem-train-3346,Eh? Jokkowi nio nyalon Walikota lai? RT @FAJARonline: PDIP Tolak Libatkan Jokowi di Pilkada 2015 : http://fajar.co.id/headline/2015/02/22/pdip-tolak-libatkan-jokowi-di-pilkada-2015.html ?,negative
indolem-train-2181,#BaritoMahasiswa - Aia Mato Sang Ibu Iriangan Pamakaman Mahasiswa UPI nan Tewas Diseret Oto 30 Km Mahasiswa Unive? http://ift.tt/1LUgkcG,negative
indolem-train-954,"RT @BeasiswaS1: http://beasiswaindo.com/5239  Beasiswa Panuah, SPP & BPP Pokok STMT Trisakti, nio? :) ~0228",positive
indolem-train-3066,"Toilet kumuah dan jorok, ndak ado aia mineral, camilan dan perlengkapan mandi saparti nan diiklanan..buruak..",negative
indolem-train-2050,tampek yang rancak dan nyaman untuak istirahat tapi tolong tynyo paralu di perbaiki channelnyo karanan banyak samuiknyo di gambar dan  water heaternyo ndak bisa jadi mandi ayia dingin taruih.....,negative
indolem-train-1423,"bacakak mamparabuikan isu jokowi: Oto Proton, Oto Nasional - Chirpstory http://chirpstory.com/li/253117  via @chirpstory",negative
indolem-train-2656,"Acnyo kurang dingin, wifi ndak lo ado:(",negative
indolem-train-796,"(Calon) artis tu buliah caper, tapi jan manyakiti parasaan urang lain. Apolai banyak urang. Syahrini bisa dijadian contoh yang elok.",positive
indolem-train-587,"Sosok Syahrini bisa dikecekan manjadi salah satu panyanyi paliang laris di Indonesia. Ndak heran, Syahrini pun ha... http://bit.ly/1vQNUXR ",positive
indolem-train-3273,#Jokowi #PDIP Ndak Semestinyo Kader PDIP Suduikan Jokowi soal Calon Kapolri - http://JPNN.com  http://bit.ly/1LnWLcw  @PDI_Perjuangan,negative
indolem-train-2075,"Palayanan ramah customer service ramah. Cuma banta ketek agak baun jo salimuiknyo juo, pintu biliak",negative
indolem-train-622,biliak rancak rapi barasiah tanang lah pokoknyo .. tapi aia angek lamo kaluanyo. sacaro kasadoe ancak lah..,positive
indolem-train-1978,"Kamar indak sasuai jo foto, sangaik sampik ac babunyi bisiang bana",negative
indolem-test-604,kamar cukuik lueh.. kamar mandi kumuah,negative
indolem-train-1998,"PDIP Dinilai Aneh jikok Tarimo Badrodin Kapolri : INILAHCOM, Jakarta - Anggota Komisi III DPR Fraksi Golkar, Bam... http://bit,ly/1Lp73ZP",negative
indolem-train-52,"cc @RaffiAhmadLagi & @Lady6igi """"@melly_goeslaw: Mokasiiiiih yo tadi malam lah tibo di 40 hariannyo mama ?? http://instagram.com/p/zT2KmhAx_4/",positive
indolem-train-3265,"sajauah ko lumayan lah untuk hargo hotel. Tapi palayanan nyo agak kurang mah, wifi indak konek, tu kalau nio barasiah an kamar, kunci di gantuang an kayak tu se di pintu biliak, indak di simpang di resepsionis liak doh.",negative
indolem-test-159,Syahrini janji ka tibo Jikok Dipanggia Baliak Ka Mabes Polri http://bit.ly/1LmlRqj via @tribunnews,positive
indolem-train-1742,"resepsionisnyo baru jago. palayanan kurang ramah, sampai disinan pun kamar alun disiapan, padahal alah jauah bana dari jam check in, tu AC nyo ndak iduik dan harus nunggu liak, wakatu check out mangecewakan lo.. ambo indak nio manginap dihotel iko lai do..",negative
indolem-train-1715,Putuihan Mahkamah Partai Golkar Ditundo Pakan Muko http://dlvr.it/8kvpMm,negative
indolem-test-674,untuak AC di arok bisa labiah baiak dan bisa di kondisian baliak... takadang AC indak bisa di remot.. untuak aia angek supayo di aktifan...,negative
indolem-train-3167,Mahasiswa AS Ajak Dunia Makan Kapuyuak http://dunia.news.viva.co.id/news/read/595687-mahasiswa-as-ajak-dunia-makan-kapuyuak ?,negative
indolem-train-2686,palayanan ancak tapi 1 biliak nan di pasan ac ndak dingin dan kamar mandi baun,negative
indolem-train-526,"Mode kini, jiwako seakan alah pai dari badanko. Taragak adalah caro awak untuak batahan.  #TentangTaragak",positive
indolem-train-273,Caelah nan di agiah kado oto... ndak manggarik dari tadi otonyo di caliak an taruih :v [pic] ? https://path.com/p/2ZCadE ,positive
indolem-train-2018,"Bonus makanan hanyo disisoan biskuit, minuman ndak ado lo.",negative
indolem-train-1839,"Waduuh """"@interMALEM: Putri Indonesia barasal dari provinsi basisnya PDIP. Curiga ado konspirasi ko. ??? | @mantriss @budimandjatmiko",negative
indolem-train-1025,Tips Siaik Makan Fast Food Jo Caro Siaik. #JktHealth http://ow.ly/JFHrj,positive
indolem-train-2167,"Hotel dan suasana sadonyo cukuik ancak, staf elok. Hari patamo dapek biliak di lantai ateh ndak ado wifi tapi aie angek lancar, abu cukuik taba dimeja dll. Pindah ka biliak balkon wifi lumayan lai koneksi tapi ndak ado aie angek. Housekeeping labiah acok malap furniture nyo se supayo biliak labiah baik.",negative
indolem-train-112,"Anggotanyo ramah, tampeknyo barasiah tapi aia angeknyo ndak iduik",positive
indolem-train-1366,"Lai ndak baa wak""""  """"Yo, ambo ndak baa.."""" """"Buliah ambo manelpon?"""" """"pai telpon padusi nan pakai baju nan samo jo ang duduak sabalah ang ambiak foto tadi!!",negative
indolem-train-1326,Aktivis Hong Kong Khawatirkan Peningkatan Sensor Internet: Di Hongkong dima protes pro demokrasi tahun lalu... http://bit.ly/18aIfGS,negative
indolem-train-2458,ac nyo susah di nyaloan,negative
indolem-train-2952,"Biliak batue2 indak layak ditampati. Ambo pasan 2 hari hanyo ambo tampati 1 hari dek batue2 indak nyaman. Kasuenyo mamakak, lampu kamar mandi mati, ada lipeh dibiliak & tampek sarok dimuko kamar indak dibarasiahan. Kecewaaa....",negative
indolem-validation-124,kumuah bana,negative
indolem-validation-327,Golkar Ndak nio Sewaan Kandaraan Politik di Pilkada - Republika Online http://bit.ly/1AZ4vjK,negative
indolem-validation-90,Kito bisa manyegakkan panyakik laki laki http://www.klinikwienarto.com  (0291)3332855 / HP. 08122893709 / PIN 29E22f2f,positive
indolem-train-2467,wifinyo ndak tahubuang,negative
indolem-train-1708,#AngBana Baraja di Rumah cuma 10 minik- Pacik HP bajam-jam? :|,negative
indolem-test-91,[Nasional] Diskon - Rayoan Hari Rayo Imlek Anda Jo Lampion Bantuak Hanyo Lotus Rp... http://gpon.co/gic65,positive
indolem-train-2723,"Lokasi hotel ngeri banyak preman, aia asin, kasua busa indak springbed, biliak baun apek, indak di sadioan paragaik mandi indak kayak hotel airyroom nan pernah den pasan di tampek lain.",negative
indolem-train-2275,"??? BUNGO  UNTUAK AMA ??? Katiko Suatu pagi, saurang pangusaho mudo  sadang tasasak-sasak barangkek ka kantua.? ? https://path.com/p/JvJEG ",negative
indolem-train-168,Oto dengan persneling manual labiah hemat bahan baka dibandiang oto dengan persneling otomatis.,positive
indolem-train-2623,"jadi jadi, palayanan nyo kurang ramah pulo, yo lumayan lah untuak sagi harago",negative
indolem-test-236,Ado restauran banamo 'Heart Attack Grill' di Las Vegas manawaran makan perai sapuehnyo ka pambali nan punyo barek badan labiah dari 160kg.,positive
indolem-train-2182,Channel tv nyo kurang janiah dan  kurang banyak,negative
indolem-train-3024,"Kalamahan game di HTML5 kadang-kadang ndak aluih kalau dimainan di handphone, tagantuang seri hp-nyo -Aditya Anwar",negative
indolem-train-1670,"wifi payah untuak koneksi loginnyo, dan kamar 221 boco ac nyo.",negative
indolem-train-3468,"Indak ado housekeeping, wifi lambek sadonyo sasuai jo fasilitas alah ado kayak di pamasanan",negative
indolem-train-211,Demokrat nilai keputusan presiden agiah kapastian http://goo.gl/fb/WEKaJ7,positive
indolem-train-2435,Sadiah wifi samo TV ndak bisa. Tu kamar mandi kurang barasiah. Cuman untuak hargo sagitu itu alah baik lah yo.,negative
indolem-test-170,Nan on retweet Jumlah Panumpang nan mambaliak an pitih Tiket di Kantua Lion Air Manyusuik http://dlvr.it/8g5ykr  #openfollow,positive
indolem-validation-212,"#InfoNdoroMoe Jadwal Padek Sampai Indak Sempat Istirahat, Syahrini: Ambo Jadi Wanita Udara http://bit.ly/1vQMAEc #BlusukanDuniaMaya",negative
indolem-train-2257,"Alun bisa lalok gara-gara mautak atik Hp yang sadang bamasalah,akhianyo lah bisa digunoan baliak tapi baa caronyo? (at SpideRed Room) ? https://path.com/p/4ch21N",negative
indolem-train-368,Ado banyak lagu di hp nan mangingekan ambo tentang awak dan sadoe nan pernah tajadi diantaro kito :'),positive
indolem-test-762,"Jadwal Padek Hinggo Ndak Sempat Istirahat, Syahrini: Aden Jadi Padusi Udaro: Sosok Syahrini bisa dikecekan manjad... http://bit.ly/1AWvZ9H",negative
indolem-test-1,#Sports Padusi Golkar Makassar Dibekali Ilmu Keprotokoleran http://dlvr.it/8g0jXf  #Assadiqulhaq,positive
indolem-train-706,Hari iko ado promo diskon 25% untuak makan di restoran Collage Hotel Pullman! http://ow.ly/JF5Y3,positive
indolem-train-821,Demokrat siap bakarajosamo dengan PAN http://antaranews.com/482653,positive
indolem-train-2419,"biliaknyo galok, salimuik kuniang, biliak Airy di lantai 3 ndak ado lift, sarapan apo adonyo, wifi ndak ado koneksi di biliak, ndak nginap disiko lai,,kecewa",negative
indolem-train-32,"Antara #tekno | Bos Snapchat lirik musik sabagai 'kasempatan"""" http://bit.ly/1BcEnlp  | http://goo.gl/16Qox ",positive
indolem-test-481,karamahan staf hotel ditingkekan lai,negative
indolem-train-85,Demokrat nilai kaputusan presiden agiah kapastian http://wp.me/p3qn90-9kk,positive
indolem-test-510,"Tampek strategis di pusek kota, Tapi kok ndak dapek minun kopi yo? Tu baun asok rokok.",negative
indolem-train-3526,parkir oto lueh... indak ado camilan... perlengkapan mandi baru disadoaan saat ado komplain kamar mandi kurang barasiah,negative
indolem-validation-156,Babarapo Komponen Oto Rawan Rusak Usai Hajar Lubang http://otomotif.kompas.com/read/2015/02/25/140000515/Beberapa.Komponen.Mobil.Rawan.Rusak.Usai.Hajar.Lubang ?,negative
indolem-train-223,"Urang makan yang basyukur setara jo urang bapuaso yang basaba."""" [HR Bukhari]",positive
indolem-train-2104,"Di Nigeria, masih ado kepercayaan kalau surang anak makan talue, inyo akan jadi pancilok bekonyo.",negative
indolem-train-959,[Nasional] Diskon - Lucu Dan Seksi Kimono Nan Nyaman Dipakai Hanyo Rp 56.000 /set http://gpon.co/6zxwm,positive
indolem-train-2139,"Jam check in talampau ketat, kamar nan disadioan banyak noda/bacak, staf kurang ramah lo.",negative
indolem-train-1029,segeh oy kosnsernyo afgan di trans7 ??? untuang-untuang den baharok 1 atau 2 tahun lai @FatinSL bisa buek konser tunggal yang gadang @SonyMusicID,positive
indolem-train-425,Demokrat nilai keputusan presiden agiah kapastian http://dlvr.it/8dXyWR  #politik,positive
indolem-train-945,"ado kolam ranang meskipun hanyo untuak dewasa se, ac dingin, tv kabel oke, dapek minum dan snack, dan alaik mandi plus sikek, sayang kamar mandi agak baun, dan kamar ndak kedap suaro, fasilitas ado musola, lift dan kolam ranang nilai plusnyo, overall oke sih, terimokasih airy",positive
indolem-train-3150,"kabarasiahan biliak jo harago ok HANYO mohon pabaiki: 1. AC kamar tirih jiko alah hiduik babarapo jam, lalok taganggu karano tibo-tibo ac angek indak bafungsi karna bocor tsb. 2. aie minum nan diagiahan rasonyo agak asin, karano bukan dalam kemasan boto palastik basegel tapi dengan teko. samoga iko diparatian untuak dipabaiki. tarimo kasih",negative
indolem-train-1850,"untuak hargo hotel tamasuak nyaman, tapi masih kurang barasiah..Ado siso sampah di bawah kasua jo anduak bekas urang masih manggantuang dibalakang pintu. seprai kumuah, antah diganti atau indak",negative
indolem-train-1525,"Pitih: ngumpuaannyo lamo, maahihannyo capek bana | Batrai hp: mancasnyo lamo, lowbetnyo capek bana.",negative
indolem-train-657,"Katoan indak pado salingkuah, katokan indak pado manduo ??? ? Katakan Tidak oleh Afgan ? https://path.com/p/2LMpC",positive
indolem-test-987,"Syahrini harus rela bapaneh-paneh salamo proses buek video musik terbarunyo, kaya itu. http://bit.ly/18aCusX",negative
indolem-train-793,"Bilo ambo pai, harap kau sanang.",positive
indolem-train-2754,Biliaknyo rancak..tapi aie mandi angeknyo ndak ado dan minumkopi dari airy ndak ado,negative
indolem-train-2462,"Alah cukuik baiak, tapi fasilitas kamar masih kurang, bantuak TV, kamar mandi, ac ndak dingin, jo meja ketek bana",negative
indolem-test-55,"taragak bana kaya iko... pakai baju coklat-coklat, makan samo-samo, senio-junior jadi ciek ;')? http://instagram.com/p/zXM3VFSzYQ/ ",positive
indolem-train-2113,Netizen Kritik Syahrini Bapose Syur di Ateh Bathtub http://bit.ly/1LK8ZMI,negative
indolem-train-2760,"Parah. Jamban rusak, aia angek ndak ado, shower cebok rusak dan indak bisa digunoan. Salimuik indak diagiah bilo ndak dimintak. Pintu kunci rusak. takunci dari lua dan ndak bisa dibukakk. Tapaso panggia tukang dari lua dan jam 00.00 baru bisa masuak kamar. Manyadiahan",negative
indolem-train-797,#News Jokowi Mulai Bagak Tampa PDIP. Sia nan bisa Dikte Presiden Jokowi? Ndak Ado! http://dlvr.it/8fm203 #Assadiqulhaq,positive
indolem-train-1648,AC kurang dingin. Tapi lumayan lah,negative
indolem-train-1582,"aden agak tasingguang padahal wakatu checkout jam 12, tapi sabalun itu barang den alah dikaluaan",negative
indolem-train-2880,Wifi ndak sampai lantai ateh,negative
indolem-train-1305,"halo sadonyo , iko @N_AurelJKT48 , maaf yo ndak ado kaba , hp ambo masih sakih ha :( huhuhu maaf yoo :( sampai basuo bisuak laflafu??????",negative
indolem-train-2709,"Kamar mandi baun, aienyo baun",negative
indolem-train-1658,"Hotelnyo rancak, tapi wifinyo lamah, pintu kamar mandi nyo ado yang rusak, sabun jo sikek gigi kadang-kadang ado kadang-kadang indak ado",negative
indolem-test-1000,"http://www.tabloidbintang.com/articles/berita/polah/18527-wah-berat-badan-afgan-turun-19-kilogram ? Wah, Barek Badan Afgan Turun 19 Kilogram",negative
indolem-train-493,Ranccaaakkk!! ?? Saharusnyo mancaliak di konser langsuang yo! ? ? Sadis dari Afgan ? https://path.com/p/3U39Kt,positive
indolem-train-185,"Sakolah di japang biasonyo salalu manerapan ruang kaleh barasiah, jadi satiok murdi wajib mambarasiahan sakolahnyo satiok harinyo salamo 15 minik.",positive
indolem-train-1136,Ujuang ujuangnyo ndak jadi jogging dek hujan ? ? Knock Me Out olehAfgan (with Tania Desriza) ? https://path.com/p/G8TaK,negative
indolem-train-637,Baarok suatu saaik nanti @ify_blink @ifialyssa bisa maadoan konser bantuak Afgan,positive
indolem-test-622,"Jan pernah maninggiaan nan elok demi nan tabaiak. Disaat nan elok pai, kau baru sadar kalau inyo lah nan tabaiak",negative
indolem-test-160,"Kalau sanak sabana sayang jo seseurang, maskipun ado banyak alasan untuak pai.sanak tetap akan manamukan ciek alasan untuak batahan. :')  ?",positive
indolem-train-599,buek apolah susah cari kian kamari? ? Anglah takdir ambo oleh Raffi Ahmad & Nagita Slavina (w/ afni & Alvira) ? https://path.com/p/25AgPK,positive
indolem-validation-246,"Thread Tabaik >> Saumua hidup nyo, pria ko manyetir oto cuma jo kaki! http://bit.ly/18b84GS  #ForumKaskus @kaskus",negative
indolem-train-940,makan hari ko perai sadonyo :3 (di Pondok Laras) ? https://path.com/p/425GSx,positive
indolem-train-1239,Kabersihannyo kurang di jago,negative
indolem-test-113,Mokasi untuak baju kuruang ko yo!! Dan salamaik @ehyelcah sakali lai :) Ambo sanang untuak ang ! http://instagram.com/p/zXhHf0Bk1l/,positive
indolem-validation-213,"Aleh kasua kumuah, indak ado tampek sholat (keceknyo sariah),",negative
indolem-train-3126,Salah tu yo jam sagiko makan indomie goreng 2.. Padohal sadang nio diet,negative
indolem-train-130,"Samenjak hamil,@Lady6igi makin tapancar AURA KECANTIKANNYO! ? *alami tanpa pamanih buatan.. ;) @RaffiAhmadLagi",positive
indolem-train-1128,"Kalau PDIP Adem Ayem, Artinyo Ado Deal di Baliak Panunjukan Badrodin Jadi Kapolri"""" http://kom.ps/AFqKLU  > Di situ kadang ambo maraso sadiah",negative
indolem-train-2358,Kironyo @Bellaudya829 pernah acok mimisan pas sakolah. @SarahSechan_NET,negative
indolem-train-2047,"Baru tigo kali tampil, tapi alah manyumbang duo gol dan ciek assist: http://goo.gl/UKa0Er Ka pai dari chelsea untuak salamonyo?",negative
indolem-train-39,Oto Indonesia Paliang Ekonomis 2015 #JktOtomotif http://ow.ly/JCESj,positive
indolem-train-589,"Syahrini harus rela bapaneh-paneh salamo proses pambuekan video musik tabarunyo, Seperti? http://goo.gl/fb/IPCknU ",positive
indolem-train-682,Syahrini Janji Ka Datang Jikok Kambali Dipanggie Mabes Polri http://dlvr.it/8g2CC2,positive
indolem-train-3018,Mangantuak bahkan takalok sasudah makan adolah tando-tando tajadinyo syok biokimia yang mabuek panapasan manjadi barek.,negative
indolem-train-2102,"Aliran aia Kamar mandinyo tasumbek, jadi siap dipakai aia mangganang dan babaun",negative
indolem-train-1397,"biliak lueh dan segeh, tapi sayang untuak tv kebetulan sadang buruak sinyalnyo dan mintak ganti biliak nan lain nan punyo sinyal ancak ndak dibuliahan karno pasan dari airy rooms dan ndak tasadio wifi",negative
indolem-train-267,#Golkar #ARB Situs iklan otomotif Carmudi dapek dana 25 juta dolar http://bit.ly/1AWXm3l,positive
indolem-train-2025,"Aden salah diagiah kamar, ndak ado anduak, gayuang, airy pack, kasua ndak pakai seprai, lamari kumuah pulo. Kasuanyo buek lalok buek sakik dado, jadi den pindah ka tampek lain. Diagiah airy pack alah jam 12 siang lewaik. Indak direkomendasian.",negative
indolem-train-3496,Kamar mandi agak baun karano aia tetesan AC.,negative
indolem-validation-176,"Kami ndak paralu pun , baju bulu binatang nan tasiksa . Kajam :'(",negative
indolem-train-895,"Kini bisa jo mudahnyo di Apps hp android, sahabaik dapek maisi ulang #emoney mah. Ndak paralu binguang lai doh :)",positive
indolem-test-346,"1. Resepsionisnyo ndak ramah samo sakali, malahan kasannyo maremehan tamu (padusi bajilbab) 2. Kamar kumuah 3. seprai lato 4. Kasua tambin 5. Aia kamasan ndak disadioan padohal katonyo di sadioan 2 boto positifnyo hanyo aia angek sajo",negative
indolem-train-1400,"Tunjuak Badrodin, Bamsoet Mangiro ado Persetuuan Jokowi jo PDIP: Kalau PDIP anok se, manjalehan bahwa de... http://bit.ly1AX8VaJ  #fb",negative
indolem-train-503,"Anduak baju multifungsi untuak mangariangan badan, bisa lo dijadian pakaian santai,dll . Klik http://ow.ly/JF3Rn ",positive
indolem-train-1308,"Hotelnyo sampik, Ac nyo angek, jo listrik ndak tau mati jadi nio ndak nio harus ganti kamar.",negative
indolem-test-436,"Kalau sadang suko/sayang-sayangnyo jo urang, pasti takuik bana kalau urang tu manjauah, apolai pai ninggaan awak.",negative
indolem-train-3091,"kamarnyo sasuai gambar cuma lampu ndak ado lampu tarang yg ado cuma lampu redup, ac nyo kurang dingin bahkan ndak dingin, aia angek nyo ndak iduik",negative
indolem-train-1594,"tampek ancak, cuman pelayannnyo labiah ditingkekan liak. den kasinan jo keluarga, anak-anak den sanang bana jo kolam rananngnyo",negative
indolem-train-2233,Syahrini Terlibat Kasus Feriyani Lim? - Silet 21 Februari 2015: http://youtu.be/7KxGOaN4RqA?a  via @YouTube,negative
indolem-test-339,"Di saat hp bunyi""""!! Taunyo pamberitahuan grup line MCI #DisaatItuKadangAmboMarasoSadiah",negative
indolem-validation-89,Ado saat nyo dima kito harus marelaan sasuatu nan kito sayang untuak pai.. Yo emang sakik! Tapi itu demi kaelokan diri kito surang. :),positive
indolem-test-912,"Dari fasilitas,awak kecewa karano wifi nan ndak bisa diakses. Dan layanan breakfast nan ndak dikonfirmasikan bateh wakatu,sehinggo ndak bisa dapek karano layanan hanyo sampai jam 9.00",negative
indolem-train-1935,"Wahh!(v)@kompascom """"Kalau PDIP Adem Ayem, Artinyo Ado Deal di Baliak Panunjuakan Badrodin Jadi Kapolri"""" #GK15 http://kom.ps/AFqKLU",negative
indolem-train-212,Nio kirim paket tapi maleh kalua rumah atau kantue? Jan khawatir hubuangi KIKI MARS CARGO 0811455123 http://goo.gl/hl1eAV  #CAR,positive
indolem-test-520,"Jadwal Padek Hinggo ndak Sempat Istirahat, Syahrini: Aden Jadi Padusi Udaro: Sosok Syahrini bisa dikecekan manjad... http://bit.ly/1vQMAEc ",negative
indolem-train-2532,"Politisi Golkar Manduga Ado """"Deal"""" antaro Jokowi dan PDIP Takaik Badrodin http://bit.ly/19OfeBw  #BeritaJambi",negative
indolem-train-594,Iko haaa TIM J!! Kompak bana pas latihan konser sadonyo pakai baju yang samo!! Makasi yo ! Design nyo mantapp!! ?,positive
indolem-train-342,kado ulang tahun dari AXA..?? siap tu mintak kado lo dari kantua amak nyo..? (w/Petronella di @kotakasablanka) [pic] ? http://path.com/p/4hNqUZ,positive
indolem-train-2463,"Dicuekan, indak diagiah kaba, hp cowoknyo sibuk/mati, dibaleh lamo/singkek-singkek. Hal-hal itu yang buek cewek badmood.",negative
indolem-train-473,"diluar ekspektasi, tanpa manggunoan kupon diskon pun properi ko sangaik satimpal, kamar sangaik barasiah dan rapih, lueh, langkok, sampai kompor elektrik pun tasadio di kamar, cocok untuak nginap lamo, suasana sangaik nyaman, tanang, palayanan sangaik rancak, hanyo duck pambuangan di kamar mandi kumuah bana banyak bakeh siso sabun jo rambuik",positive
indolem-train-2611,Saba dinda acuah afgan saba lo!! Sabar dari afgan (jo Amaliah di Jl. Kayu Agung I) ? https://path.com/p/4FOZXH,negative
indolem-train-1338,"sinyalnyo tibo dan pai bantuak si inyo, si anu, si itu dan.si ono",negative
indolem-train-2833,ACnyo kurang dingin,negative
indolem-train-586,"sangaik lua biaso manginap di airy sutoyo hotel dewarna, alah murah tampek jo nyaman untuak marangah, apolagi makan pagi nyo lamak ndak sumbarang-sumbarang samo hargo murah kualitas indah murahan. tapi nan paralu di pelokan cuma kabarasiahan biliak kurang barasiah kalo di pel, saluruahnyo rekomen bana",positive
indolem-validation-160,"Kamar sabana barasiah, kamar mandi barasiah, alaik mandi lengkap. tapi kurang pueh dek gorden jendela ndak bisa di tutuik rapek sampai nampak dari lua, ndak dapek aia mineral tu paralu bali di lua, dan yang parahnyo wifi nyo ndak bisa di pakai",negative
indolem-train-2865,#Golkar #ARB polisi manangkok pria palaku penusuakan http://bit.ly/186RNTw,negative
indolem-train-2448,"Payah.. -Aia angek salalu mati, hanyo akan iduik jiko dimintak. -Aia mineral juo hanyo ka diagiah jiko dimintak. -Biliak alah mintak dibarasiahan, tapi indak dibarasiahan -lamari sangaik kumuah, nampak ndak tarawat jo dimakan rayok. Aden indak ka manggu",negative
indolem-test-131,"Kamarnyo barasiah, paragek2 cukuik, petugas elok. Cm km mandi agak baun. Nan lain rancak untuak hargo samurah ko.",positive
indolem-validation-39,"jan talampau acok pai ka maso lalu, supayo pas maso depan mangatuak pintu ang, ang hadir disitu untuak manyambuiknyo",positive
indolem-train-501,makasi abang karano balanjo baju jenama ko! astaga ndak nyangkooo,positive
indolem-train-1028,anies Baswedan: Sakolah Harus Jadi Taman nan Manyanangan http://dlvr.it/8kz15H,positive
indolem-test-278,@JANJISUCI_TTV: waah @Lady6igi soswit bana lah nyuok an suami tercinta @RaffiAhmadLagi  oleh @thiaa_13,positive
indolem-train-3348,"jelas ? """"@ignharyanto: Penting bgt--> @VIVA_log: Tas Hermes Rp1,5 Miliar Dipakai Belanja Sayur oleh Syahrini  ",negative
indolem-test-583,"di MV teaser B2ST - den tau tu,datiak ka 1:35 Dongwoon melempar Hp mamakai tangan kida, di datiak 01:36, mamakai tangan suok #FKpop",negative
indolem-train-1770,Pagi takaja-kaja ka kantua. Jadinyo makan pagi indomie di kantua. Pulang siang ka rumah. Ndak ado makanan. adonyo indomie.? ? https://path.com/p/13qzgb,negative
indolem-train-397,"Mulonyo, kanciang baju diposisian di ujuang langan, supayo langan baju indak untuak malap muko.",positive
indolem-train-1716,"Kamar no. 6 shower aia angek indak bafungsi dengan elok, banyak rambuik di salimuik.",negative
indolem-train-1619,AC indak dingin,negative
indolem-train-2035,Pas pas se. Panampatan ruang kurang lamak. Tv nyo tahalang lamari.,negative
indolem-train-3372,Wifinyo lemot tapi sajauah ko pueh lah,negative
indolem-train-341,Poros Mudo Golkar Nilai Jokowi Bisa Kandalian Situasi Saat Iko - BeritaSatu http://gpon.co/cz91n  http://gpon.co/b,positive
indolem-train-2401,"Lumayan, tapi aie angek nyo ndak iduik",negative
indolem-validation-235,handuak nyo tipih dan lah lamo salimuik nyo ciek itupun salimuik ketek,negative
indolem-train-2749,"Manuruik survei, rato-rato urang Indonesia bapergian ka Mal bukan untuak babalanjo, tetapi untuak bagaya, pakai baju dan parhiasan nan rancak-rancak. [tempo]",negative
indolem-train-3445,Biliaknyo baun rokok. Dan aleh kasue indak diganti untuak tamu baru dek masih ado bekas abu rokoknyo.,negative
indolem-train-2984,#Berita (Bongkar Hambalang) Demokrat Protes Pimpinan KPK Usulan SBY Ndak Dipiliah Jokowi http://dlvr.it/8dYkN0  #Assadiqulhaq,negative
indolem-test-850,"#Celebrities: Jadwal Padek Hinggo Ndak Sempat Istirahat, Syahrini: Aden Jadi Padusi Udaro http://bit.ly/1Llofh1",negative
indolem-train-3490,kamar cukuik nyaman walaupun dapek kamar lantai 5 dan ndak ado lift... petugas nan laki-laki agak manyambok.. konfirmasi cek in labiah capek tapi sampai di panginapan nyatonyo ndak bisa,negative
indolem-test-695,pamaneh aienyo ndak bisa dipakai dan lamo manunggu angek aienyo.. lumayan nyaman sasuai harago,negative
indolem-train-43,"Kamar barasiah, Ac agak kurang dingin.. jadi lumayan ancak",positive
indolem-test-237,"Rajaki anak soleh ko makan malam samo Romo? (w/ Aryo, Julius, & 2 lainnyo di Nasi Goreng Sapi Kantor Notaris) ? https://path.com/p/XwqPL ",positive
indolem-train-3304,"closet nyo rusak kamar mandi ndak barasiah lamari alah bajamua, ndak barasiah aleh tampek lalok kumuah banyak rangik",negative
indolem-train-3334,"Jan manginap disiko lah.. Ancak cari hotel lain.. Kelas deluxe tapi bantuak ekonomi SAMPIK BANA, WC BAUN, COLOK AN LISTRIK NDAK ADO. NIO MANCAS HP NDAK BISA. MAHABIHAN PITIH SE...SABANA KECEWA",negative
indolem-train-507,"Punyo kendaraan apo se? ? Ado oto, ado honda vespa, ado sapeda, dan ado honda  http://ask.fm/a/bo03keji",positive
indolem-validation-307,"Idem """"@bear_passion: malam minggunyo dikosan se. surang. nonton afgan. yaudahlah",negative
indolem-train-2302,Kaduo kalinyo nonton film iko dan kaduo kalinyo den nangih.. My idiot brother ???? ? Untukmu Aku Bertahan oleh Afgan ? https://path.com/p/429oIB,negative
indolem-train-1553,Baun. Kumuah banyak samuik,negative
