id,text,label
5902,"Sairing jeung berkembangna teknologi, kahirupan manusa ge saeutik-saetik robah. Salah sahiji contona nyaeta penggunaan dompet digital nu ngaganti penyimpanan uang konvensional. Tah tilu dompet digital anu jadi pilihan masyarakat teh nyaeta nu kahiji Dana. Aplikasi ieu teh katelah ku kaamanan nana anu mumpuni jeung deuih biaya adminna anu gratis, mantak seueur masyarakat leuwih milih nyimpen tabungan didieu daripada di bank. Nu kadua nyaeta Shopeepay. Tah dinya dompet digital ieu mah bisa dipake jang balanja ongkoh dina marketplacena, jadi teu kudu riweuh isi saldo deui. Nu katilu nyaeta Flip. Aplikasi ieu teh perantara dompet digital supaya bisa bebas admin mun rek ngalakukeun transaksi teh.",technology
5777,"Arung jeram teh mangrupakeun salah sahiji olahraga ekstrem anu paling loba diminati ku masyarakat. Arung jeram gampang dikunjungi atawa dicobian sabab ayeuna mah tos aya di unggal tempat wisata nu ngabogaan wahangan. Saparahu teh bakal bisa dieusi ku genep tamu jeing saurang guide atawa pemandu. Lila pengarungan teh tergantung paketan nana, biasana panglilana durasi sajam atawa dua jam dina jarak hampir sapuluh kiloan. Aya oge jarak pendek anu ngarungna sakitar tilu puluh menitan dina jarak opat kiloan. Mun keur pengarungan teh pengunjung wajib make palampung jeung helm, oge wajib dipandu ku guide nu professional nu bakal ngarahkeun laju parahu salila pengarungan.",sports
5460,"Keris nyaeta senjata tradisional suku Jawa nu dikenal ka mana-mana. Keris bentukna teu simetris sabab memang dijieun ngareol ti ujung ka handap. Ujungna lancip tuluy handapna aya penyangga jeung gagang. Keris jaman baheula dipake jang senjata ngalawan musuh, mun ayeuna mah sering dipake jang minuhan fungsi estetika jeung simbol dina pakean atawa acara adat. Fungsi keris oge nyaeta jang sasajen ka karuhun nu mangrupakeun simbol kahormata jeung kakuatan. Unggal aya pernikahan adat Jawa, mempelaina kedah mamawa keris nu mangrupa simbol adat Jawa. Kadang aya upacara tertentu nu digelar jang ngaberesihan atawa nyucikeun keris pusaka di Jawa nyaeta dina malam satu suro.",culture & heritage
2798,"Blénder biasana dianggo pikeun ngadamel jus sareng tuangeun puree. Alat ieu cukup populer sareng sering dianggo salaku bantosan masak. Rupa-rupa merek sareng modél blender tiasa gampang dipendakan di pasar, mimitian ti Cosmos, Philips, Oxone, Sharp, sareng anu sanésna. Kusabab jumlah pilihan anu ageung, anjeun kedah langkung ati-ati nalika milih hiji. Pikeun ngagampangkeun anjeun ngadamel pilihan, kami bakal ngajelaskeun kumaha milih Blénder anu saé, terang jinis-jinis Blénder, sareng kumaha bédana sareng produk anu sami. Anjeun meureun geus katempo Blénder, processor dahareun, sarta juicer. Parabot ieu katingalina sami, tapi saleresna gaduh fungsi atanapi kagunaan anu béda. Blénder mangrupikeun alat anu tiasa dianggo pikeun motong tuangeun sapertos buah sareng sayuran kana ukuran anu alit. Buah atawa sayuran anu keur dipotong diaduk maké tanaga rotasi nepi ka téksturna jadi lemes.",technology
512,"Imah adat Tagog Anjing salaku salah sahiji imah adat Sunda nu ngaranna dicokot tina ngaran hewan. Naha bet disebut kitu sabab ceuk masarakat Sunda, bentuk imahna ngahaja dijieun mirip jeung anjing nu keur diuk atawa cingogo. Lamun dibandingkeun jeung imah adat Sunda sejenna, imah adat Tagog Anjing mibogaan bentuk imah panggung anu posisina leuwih handap. Ciri khasna sorangan aya tina wangunan nu bentukna pasagi panjang jeung manjang ka arah tukang. Dina bagian hareup imahna oge aya hateup nu nyarambung jang ngajaga bagian imah tina panon poe sacara langsung. Imah adat Sunda Tagog Anjing bisa babari dipanggihan lamun pas keur ka daerah Garut.",culture & heritage
2345,"Joglo nyaéta imah adat di Jawa Tengah anu hateupna ngawangun piramid anu ngarujuk kana wangun gunung. Sacara umum aya opat bagian imah Joglo, nya éta pendopo atawa ruang tamu, pringgitan atawa rohangan samping, rohangan dalem atawa rohangan utama, jeung séntong minangka gudang. Joglo tiasa janten inspirasi anjeun dina ngawangun imah, sabab ngagaduhan bentuk hateup anu unik sareng éndah. Salah sahiji anu tiasa diadopsi nyaéta pendopo anu diadopsi pikeun teras. Tangtos aya panyesuaian ukuran, sabab pendopo aslina lega. Tapi, lamun hayang manggihan imah di Jawa Tengah, tangtu bisa jadi pilihan pangalusna. Ieu imah adat béda jeung imah adat Joglo di Jawa Tengah, sanajan aya saeutik sasaruaanana. Imah adat Jawa Timur wangunna piramida atawa dara gepak. Sakumaha ngaranna, imah adat ieu bisa kapanggih di wewengkon Situbondo, Jawa Timur. Sacara umum, bahan wangunan imah tradisional ieu mangrupa kai jati murni. Hal ieu dipercaya alatan kai jati boga kakuatan hébat sarta durability panjang. Panto utama aya hiasan anu biasa disebut makara atawa gulungan seluru. Makara biasana dijadikeun gapura lawang samemeh asup ka rohangan utama.",culture & heritage
5438,"Lagu daerah Jawa Barat teh aya seueur pisan, salah sahiji nu menarik jang dibahas nyaeta lagu Bubuy Bulan. Lagu Bubuy Bulan diciptakeun ku Benny Corda, salah sahiji seniman Jawa Barat. Lagu ieu dirilis tahun 1988 jeung dipopulerkeun ku Nining Meida dina album Kalangkan. Lagu ieu nyaritakeun kaayaan hate nu rindu ka pasangan nu keur jauh kaayaan nana. rarasaan rindu atawa sono ieu teh muncul sabab lila teu panggih jeung deuih hampir unggal poe di deukeut Situ Ciburuy pendak wae jeung jalma nu sorot matana sami jeung pasangan nana. Hal ieu nyieun rasa sono eta makin karasa. Lagu Bubuy Bulan saolah jadi lagu nu wajib diapalkeun ku orang Sunda, sabab ti mimiti SD dugi ka SMA pasti diajarkeun wae nembangkeun ieu lagu.",culture & heritage
2335,"Pangalaman pribadi dina kelompok atawa dina hiji organisasi miluan upacara adat, upacara adat di dieu mangrupa upacara has Kabupaten Lebak (Banten) dina ngayakeun pelepasan atawa perpisahan pikeun barudak SD, SMP jeung SMK. Abdi pribadi henteu terang upami abdi ditaros perkawis carita upacara adat ieu, tapi tadina abdi ngahadiran upacara adat ieu waktos abdi SMP.  Basa kuring kelas 1 SMP, kuring masih inget yen poe kemis kira-kira jam 9 isuk-isuk kuring keur latihan komputer di lab. Dina waktos éta guru seni budaya mah nuju peryogi murid-murid kanggo ngiring ilubiung dina ieu upacara adat kanggo ngalajengkeun pelepasan upacara adat kelas 3. teras ujug-ujug ditelepon sareng kalebet. Satemenna ti leuleutik kuring geus resep kana kasenian, boh seni lukis, silat, tari jeung sajabana. tapi panginten dina waktos éta, kuring rada males milu dina acara éta kusabab sieun ngaganggu kagiatan diajar, tapi kusabab guru kuring peryogi pisan murid anu cocog, kuring resep milu. harita kuring diangkat jadi payung adat, ku alesan kuring rada jangkung.",culture & heritage
4481,"Squat jump mangrupikeun gerakan latihan anu sederhana anu ngagaduhan loba mangpaat kaséhatan. Salian ti kaleungitan beurat, mangpaat squat jumps anu anjeun tiasa nikmati nyaéta ngawangun otot pikeun ngajaga mobilitas sareng kasaimbangan awak. Salah sahiji kauntungan utama latihan squat jump nyaéta leungitna beurat. Alesanana, gerakan ieu dianggap ngabantosan anjeun ngaduruk kalori. Ngalakukeun squat jumps pikeun ngan 30 kali dipercaya ngaduruk 100 kalori. Tapi, jumlah ieu gumantung kana beurat awak anjeun sareng inténsitas gerakan. Aya sabaraha fungsi squad jump nyaeta nukahiji ngawangun otot awak gerakan squat jump mangrupa latihan pikeun nguatkeun otot imbit, suku jeung beuteung ngalakukeunana sacara teratur tiasa ngabantosan anjeun ngawangun otot dina bagian awak éta nukadua nyaeta ngajaga mobilitas jeung kasaimbangan gerakan squat jump ngalatih otot suku sangkan dianggap mangpaat dina ngajaga mobilitas jeung kasaimbangan awak.",sports
5391,"Sholat sunah taraweh nyaeta sholat sunah nu dilaksanakeunna di bulan ramadhan. Tatacara sholat sunah taraweh teh nyaeta mimiti laksanakeun sholat fadhu isya. Tos sholat fardhu isya teh dilaksanakeun kultum. Beres kultum nembe dilaksanakeun sholat sunah taraweh saloba dalapan rokaat atawa dua puluh rokaat, pokokna kedah genap. Beres sholat sunah taraweh, tuluy doa kamilin. Beres doa kailin nembe laksanakeun sholat sunah witir saloba tilu rokaat. Mun tos beres, nembe ngadoa deui. Jumlah rokaat sholat taraweh sareng witir teh aya nu 11 aya oge nu 23, disasuaikeun jeung ajaran nana. Di antara dua rokaat sholat taraweh, bilal ngabaca doa taradhdhi nu ditembal ku jamaah.",religion
7033,"Sacara umum Wali Songo hartina salapan Wali anu deukeut ka Allah SWT. Wali Songo di Nusantara katelah salapan panyebar agama Islam. Perjalanan dakwah Wali Songo parantos kacatet dina sajarah sumebarna agama Islam di Indonesia. Maranehna geus ninggalkeun loba tapak dina da’wah. Wali Songo mawa parobahan anu seeur ka masarakat Jawa, nu baheulana lolobana Hindu-Budha. Salah sahiji anu katelah nyaeta Sunan Kalijaga. Dina da'wah, Sunan Kalijaga ngawanohkeun wangun wayang nu dijieun tina kulit embe atawa nu biasa disebut wayang kulit. Sabab, dina waktu harita wayang geus populer dicet dina kertas atawa wayang beber. Dina seni sora, manehna ngarang lagu nyaeta Dandanggula.",religion
4139,"Kabeh agama ngajarkeun kabeneran jeung kabijakan kabeh agama bageur ngajarkeun kasih sayang silih asak ilih asuh agama anu di aku di indonsia aya genep nyaeta, islam, kristen protestan, kristen katolik, hindu, budha jeung konghucu. Kabeh agama boga kitab sucina masing masing. Islam kitab suci na Al Quran, kristen protestan jeung kristen katolik kitab sucina al kitab, hindu kitab sucina weda, budha Tripitaka jeung terakhir kitab suci umat konghucu nyaeta Si Shu. Indonesia teh negara demokrasi jeung toleransi ka umat beragama, urang kabeh sarua teu mandang agama na. Boga babaturan nu salian ti slam ge basa wae da urang biasa hidup berdampingan asal ulah saling ribut kudu saling jaga jeung  toleransi supaya hirup tenang.",religion
8103,"iPhone 13 mangrupikeun telepon seluler panganyarna ti Apple anu bakal diluncurkeun taun 2021. IPhone 13 gaduh desain anu sami sareng anu miheulaanna, nyaeta iPhone 12, kalayan pigura stainless steel sareng kaca di payun sareng tukang. Nanging, iPhone 13 ngagaduhan notch anu langkung alit dibandingkeun sareng iPhone 12, janten layarna langkung ageung. IPhone 13 ngagaduhan sistem kamera ganda dina tonggong, kalayan sensor kamera utama 12MP sareng sensor kamera ultra-wide 12MP. Kamera hareup oge dilengkepan sensor TrueDepth 12MP anu ngadukung fitur Face ID sareng ngamungkinkeun nyandak poto selfie anu kualitasna sae. iPhone 13 dikuatkeun ku chip A15 Bionic anu gancang pisan sareng efisien, ku kituna tiasa ngajalankeun sababaraha aplikasi kalayan lancar. Telepon oge dilengkepan 4GB RAM sareng 128GB, 256GB atanapi 512GB panyimpenan internal.",technology
4086,"Jumaah nyaéta poé mulya dina Islam. Awal sholat Jum'at dasarna dituduhkeun nalika Nabi Muhammad keur di Mekah  rek hijrah ka Madinah jeung  sababaraha sahabat hijrah munggaran ka Madinah, Rasulullah ngutus Mus'ab bin 'Umair pikeun ngajarkeun Islam ka urang Madinah. Mush'ab ogé dipenta pikeun ngumpulkeun jalma dina poé Jumaah pikeun ngalaksanakeun solat dua rakaat. Ieu kumaha sababaraha ulama siirah nyimpulkeun yén jalma anu mimiti ngalaksanakeun solat Jumaah nyaéta Mus'ab bin 'Umai. Sholat Jum’at diwajibkeun pikeun satiap umat Islam anu mandiri, sehat, sareng cerdas. Kalayan dalil Al-Qur'an surat Jumu'ah ayat 3. Hadits séjénna anu nuduhkeun pentingna solat Jumaah diriwayatkeun ku Imam Tirmidzi jeung Ibnu Majah ti Aus bin Aus Ats-Tsaqafiy. Nyaéta pikeun jalma anu datang awal pikeun solat Jumaah dina kaayaan wajib mandi, tuluy ngadangukeun khutbah. Maka Allah ngaganjar saban léngkahna nuju ka masjid kalayan pahala sataun.",religion
8793,"Baheula waktu kuring umur tujuh taun, bapa kuring sok ngajakan kuring jogging ngurilingan komplek. Ampir unggal isuk kuring sok jogging jeung bapa, ceunah jogging teh alus pikeun kasehatan jantung jeung pernapasan urang. Sanajan kuring tunduh keneh oge ai di gugahkeun isuk-suk teh, kuring bungah, margi samemeh lumpat pun bapa sok ngagandong ka payuneun gapura. Nalika kuring lumpat, nu karasa ku kuring nyaeta awak janten seger, sareng pikiran oge janten tenang kusabab kuring ngahirup hawa isuk. Bari lumpat, urang oge bisa ngobrol jeung jalma sabudeureun komplek, salam jeung nanya kumaha aranjeunna, sanajan ngan ukur nanyakeun kabar. Seunggeus jogging, bapa biasana sok pangmeserkeun kuring bubur keur sarapan , jeung teh amis panas salaku inuman. Saprak harita, jogging geus jadi olahraga nu dipikaresep ku kuring, jeung nalika kuring dewasa impian kuring pikeun jadi atlit nasional. ",sports
2319,"Tahlilan dina harti maca tahlil sacara berjamaah, biasana dilakukeun pikeun ngadoakeun almarhum (almarhum) anu dibacana toyibah jeung ditungtungan ku ngadoakeun almarhum. Teu jarang kulawarga almarhum ogé ngondang tatangga atawa ngayakeun jamaah sanggeus salat berjamaah di mushola ku kituna loba jalma ogé solat. Jaman Nabi teu aya kagiatan tahlilan. Di jaman para sahabat Nabi ogé henteu ngalaksanakeun kagiatan tahlilan ieu. Sabab tahlilan, mangrupa ijtihad ulama Jawa ku cara nyusun kalimah toyibah, sholat berjamaah, ngadoakeun jalma nu geus maot. Ku kituna sabagéan ulama nganggap yén sagala lampah anu henteu dilampahkeun ku nabi téh bid'ah, sarta sabagéan ulama ngajalankeun éta acara minangka kagiatan dumasar kana sababaraha hadits pikeun maca kalimah toyibah, ngado'a pikeun mayit jeung ibadah. Jadi kacindekanana tahlilan teh mangrupa tradisi anu sifatna diprakarsai ku ulama Jawa ku cara ngumpulkeun dasar hadits. Biasana dilakukeun pikeun ngirim doa ka jalma anu tos maot.",religion
8142,"Salah sahiji ciri revolusi 4.0 teh nyaeta penggunaan robot nu makin seueur. Babaraha sektor padamelan ayeuna tos digentos ku robot. Robot dianggo kusabab leuwih efisien, teliti, sareng tiasa dianggo sapanjang waktos. Robot teh lain saukur nu bentukanna siga jelema hirup nanging sagalah alat mekanik nu tiasa ngalakukeun tigas fisik nu ngagunakeun program disebatna robot. Wajar wae upami seueur pabrik atanapi industri nu mulai ngagentos pegawaina make robot kusabab robot mah teu tiasa ngeluh janten teu ngahariwangkeun nuntut-nuntut hak. Kusabab teu tiasa ngaraskeun nu ngarana cape robot teh tiasa dianggo sapanjang waktos, paling-paling rusak atanapi lemot nanging eta mah gampil sareng gancang dibenerkeun.",technology
4506," Samsak tinju nyaeta salah sahiji laat ani bisa di pake latihan dina olahraga tinju téh mindeng dieusianku gandum, keusik, rags, atawa bahan séjén, sarta biasana ditunda siling atawa napel na stand. Desain kantong ngamungkinkeun pikeun nyiksa fisik terus-terusan sareng terus-terusan tanpa pegat. Ogé, éta kedah nyerep dampak tina niup tanpa ngarugikeun pangguna. Samsak sorangan geus dipaké dina seni béladiri jeung swordplay pikeun sakabéh sajarah ditulis latihan militér. Dina beladiri sareng olahraga tarung, sapertos Karate, Sanda, Taekwondo sareng Muay Thai, kantong sareng alat-alat anu sami parantos diadaptasi pikeun latihan najong sareng manuver nyerang sanésna ogé pikeun ngembangkeun téknik punching. Kantong éta janten alat olahraga anu tiasa ningkatkeun tingkat kabugaran sareng kaséhatan anjeun. Nalika anjeun kotak ngalawan punch atanapi jalma nyata, anjeun ngalatih otot anjeun sareng ningkatkeun kakuatan awak luhur sareng kakuatan ngawangun tulang. ",sports
5785,"Poe ayeuna abdi bade jogging ngurilingan Unpad tuluy beresna bakal ka Pasar Unpad. Isuk keneh ngahaja abdi mandi tuluy siap-siap jang indit jogging. Abdi indit jam genep kurang, tuluy nepi ka gerbang Unpad teh jam genep leuwih lima belas menit. Barang nepi ka Unpad, langsung we abdi pemanasan kangge jogging supaya teu keram otot. Geus sapuluh menit jogging, abdi nembe ngurilingan sabagean leutik tina target jarak. Gaue tuluy satengah jam jogging, jol turun hujan girimis. Abdi mimitina mah nuluykeun jogging da hujannaa ge leutik, eh di tengah jalan teh hujanna ngagedean pisan. Kapaksa we abdi eureun heula jogging na tuluy ngiuhan di gazebo nu aya di sisi jalan. Geus hujan na rada raat, nembe we abdi nuluykeun jogging jeung uih ka kostan.",sports
4229,"Babaturan urang kamari karek balik ti lemburna di Medan datang jeung mere oleh-oleh Bika Ambon, ehh ngarana bika ambon tapi lain ti ambon nya. Bika ambon ieu ka asup kue atawa jajanan anu bisa di jadikeun pikeun oleh oleh ti Medan Sumatera Utara. Rasa Bika ambon amu enak, hipu jeung amis loba di pikaresep ku batur. Bika ambon cocok di jadikeun cemilan lamun sore kitu bari ngopi atawa nginum cai teh. Cocok jad batur ngerjakeun tugas atawa batur ngobrol. Kue Bika ambon di jieun tina tipung. Kue Bika ambon ieu bisa tahan lila matakna bisa di jadikeun oleh oleh keur dulur atawa babaturan.",culture & heritage
8061,"Ekskul teh tiasa janten kagiatan nu mere manfaat pikeun barudak sakola. Ekskul teh tiasa ngembangkeun minat sareng bakat barudak janten barudak teh sanes diajar akademik di kelas hungkul nanging dibidang nu sejen oge sapertos bidang olahraga. Tos seueur ekskul-ekskul nu disayogikeun ku pihak sakola, sapertos basket, futsal, badminton, renang, atletik, jeung sajabana. Ngiluan ekskul moal ngaganggu ka pembelajaran akademis barudak sakola, malahan tiasa ngabantos budak supados fokus diajar di kelasna. Ekskul di sakola ge janten jadi alat pikeun nyaring tunas-tunas atanapi calon-calon atlit di Indonesia. Upami tos katempo bakatna budak teh tiasa diarahkeun supados teras dilatih nika keun hade tur jago.",sports
952,"Kamera polaroid salah sahiji kamera anu unik. Beda jeung kamera DSLR anu fungsina jang moto gambar nu kualitasna profesional, kamera polaroid mah tujuanna leuwih ka nu hayang foto-fotona fun. Bentuk kamera polaroidna oge lucu, desain dina kamera ieu aya rupa-rupa mulai ti bentuk jeung warna anu beda-beda. Salian eta bisa oge dilengkepan ku rupa-rupa aksesoris anu unik, siga hardcase anu bisa hurung pas keur dinu poek atawa bisa make kantong kulit. Salian ti eta, refill filmna oge aya dina rupa-rupa desain. Warna kamerana oge mibogaan warna nu nyentrik, beda jeung kamera nu sejen nu rata-rata warnana hideung. Mun kamera polaroid mah aya nu warna biru, hejo, kayas, koneng, jeung sajabana.  ",technology
4571,"Dina games Hay Day lamun tingkat level games na naek, pamaén tiasa muka fitur lingkungan, mancing  , pertambangan, ngatur kota, parahu walungan, jeung sajabana. Grup pamaén tiasa ngabentuk lingkungan dimana aranjeunna tiasa silih mantuan dina permainan, sareng bersaing dina derby sareng lingkungan anu sanés. Salian ti tiasa berinteraksi sareng pamaén sanés ngalangkungan lingkungan éta, Hay Day ogé nyayogikeun fitur dimana pamaén tiasa ngiklankeun barang dagangan di toko sisi jalan. Lamun urang muka hiji iklan jeung hayang meuli hiji hal dina iklan, pamaén bakal dibawa nganjang ka tegalan pamaén anu nyieun iklan. Teras ku kunjungan ieu pamaén tiasa silih tambahkeun salaku réréncangan sareng ngabantosan ngeusian kargo parahu walungan atanapi pepelakan cai.",technology
5864,"Mesin cuci teh salah sahiji alat nu sering digunakeun sabab bisa ngabantuan pagawean nyeuseuh pakean. Tah, biasana mesin cuci dipake hampir unggal poe. Kasering make mesin cuci teh kudu diimbangan ku ngaberesihkeun mesinna. Ulah nepi ka terus-terusan dipake tapi teu pernah daek ngaberesihkeun mesinna, engkena bakalan tereh rusak. Jadi, mesin cuci teh kudu rutin diberesihan mesinna supaya performana alus wae, heg teu gampang ruksak. Idealna mah dua minggu sakali atawa sabulan sakali, bari miceun sesa kotoran tina pakean jeung sesa detergen nu ngerak. Tong hilap oge diberesihan bagian luar nu osok kana cai supaya teu lumutan. Yuk urang rutin malihara kaberesihan mesin cuci supaya bisa awet!",technology
4161,"Upacara Melasti nyaéta upacara nyucikeun diri boh barang-barang suci milik candi. Dina kapercayaan agama Hindu, sumber cai saperti situ, laut jeung mata air mangrupa sumber kahirupan atawa tirta amerta. Dina acara ieu, jalma-jalma ngariung ka laut atawa sumber cai dibaju bodas jeung mawa parabot solat sarta biasana mawa pratimah, barang-barang suci atawa arca pikeun diberesihan ku cara sekala jeung niskala. Tujuan tina upacara ieu nyaéta pikeun ningkatkeun katakwaan ka Déwa sareng manifestasi Gusti sareng ningkatkeun kasadaran Hindu pikeun mulangkeun kalestarian lingkungan. Upami anjeun hoyong nyaksian upacara adat ieu, sumping 3 atanapi 4 dinten sateuacan perayaan Nyepi dilaksanakeun sareng cicing di hotél anu caket sareng candi Hindu ageung sapertos di Kuta atanapi Uluwatu.",religion
4573,"Hay Day dikaluarkeun ku pamekar Supercell (aranjeunna ogé ngembangkeun Clash of Clans) dina 2012. Kaulinan ieu kalayan rating ESRB T (Teens) sareng rating PEGI 12. ngeunaan kabosenan kuring waktos éta.. Padahal kuring geus maen 2-3 taun, kuring kakara nepi ka level 42, sabab kuring mah teu pati pinter maen game. Mimitina Hay Day ngan dirilis pikeun platform ios. Tapi teras Supercell ogé ngaluarkeun versi Android. Dina Google Play Store, urang tiasa ngaunduh di dieu. Games ieu ges diunduh ku langkung ti 9 juta jalma sareng gaduh rating 4.5 / 5 dina Google Playstore kalayan sakitar 7 juta jalma masihan rating bintang 5. Common Sense Media sareng Gamezebo masing-masing dipeunteun Hay Day 4/5, sedengkeun Pocket Gamer masihan éta 7/10.",technology
5737,"Salah sahiji atlet arung jeram favorite abdi nyaeta Taufik Hidayatullah. Anjeunna lahir di Cisameng tahun 2000. Taufik Hidayatulloh atawa nu sering dikenal ku sebutan Opik, mangrupakeun salah sahiji atlet arung jeram nu asalna ti Citarum. Anjeunna teh mangrupakeun anggota club Kapinis. Anjeunna diajar arung jeram teh ti usia SD keneh dugi ka ayeuna. Prestasi nu tos diraih na oge tos dugi ka tingkat internasional. Ayeuna Opik ge masih aktif sebagai atlet arung jeram nu rajin ngikuti sababaraha pertandingan unggal taun na teh. Opik tos ngiribgan ratusan kali pertandingan di tingkat nasional, dugi ka internasional nu sadayana pasti mawa uih medali. Anjeunna layak kenging apresiasi ti pamarentah sabab prestasina nu tos ngaharumkeun nama bangsa Indonesia.",sports
2307,"Puasa dina basa hartina nahan diri, sedengkeun dina istilah hartina ibadah ka Alloh SWT ku cara nahan diri tina dahar, nginum, kalakuan nu goreng, jeung puasa nu ngabatalkeun sejenna, ti mimiti panon poe nepi ka surup. Puasa dina Islam mangrupa salah sahiji ibadah wajib anu geus dicontokeun ku Rosuluallah SAW minangka wujud kataatan ka umat Islam dina ngalaksanakeun parentah Alloh, puasa anu dilaksanakeun dina bulan suci Ramadhan biasana jumlahna 29 nepi ka 30 poé. Puasa dina sasih Ramadhan tiasa mupus kasalahan atanapi dosa anu parantos dilakukeun ku umat Islam salami dilaksanakeun kalayan iman sareng leres-leres ngarepkeun pahala sareng ridho ti Allah SWT.",religion
5479,"Alat musik tradisional jadi salah sahiji warisan budaya nu kedah dilestarikeun jeung dijaga eksistensina. Salah sahiji warisan budaya dina bentuk alat musik tradisional nyaeta gamelan. Gamelan mangrupakeun alat musik gabungan tina gong, kenong, gambang, saron, celempung, jeung alat musik sejenna. Ti tahun 2014, gamelan geus diakui UNESCO jadi warisan budaya dunia ti Indonesia. Hal ieu nunjukkeun bahwa gamelan bisa jeung berhasil ngarepresentasikeun kaunikan jeung kakayaan nana. Gamelan disimbolkeun tina kaselarasan hirup. Gamelan biasana dipake jang ngiringan karawitan. Alat musik ieu teh mangrupakeun paduan kaselarasan ti Sunda, Jawa, jeung Bali. Mantak teu aneh mun gamelan jadi simbol kaselarasan jeung eksistensina oge bisa tembus ka kancah internasional.",culture & heritage
564,"Geus kuduna urang ngamumule alat musik tradisional di daerah sewang-sewangan. Sabab alat musik ieu mangrupakeun warisan budaya nu kudu dijaga. Ngameh alat musik tradisional ieu teu kagerus ku arus globalisasi sarta perkembangan modern sejenna, bisa dicobaan ku cara diajar ngamaenkeun alat musikna oge susunan nadana. Tuluy ku urang bisa direkam proses diajar ieu jeung diunggah ka media sosial, siga Instagram, Youtube, atawa Twitter, supaya alat musik ieu beuki dipikawanoh, teu ngan ukur ku warga Indonesia tapi oge ku mancanegara. Bisa oge ku cara ngarawat alat musikna, misalna mindeng diberesihan ngameh alatna teu babari ruksak jeung digunakeun di acara-acara tradisional ngameh alatna teu babari karatan.",culture & heritage
4190,"Ngauningaan budaya hiji suku, bisa ogé ngaliwatan pangaweruh ngeunaan imah adatna. Imah adat khas Jawa disebutna imah Joglo. Imah adat ieu baheulana ngan dipiboga ku bangsawan, raja jeung jalma nu dipihormat. Imah Joglo miboga kaunikan sorangan dibandingkeun jeung imah adat séjénna. Ngadugikeun jurnal Humaniora karya Djono, salah sahiji ajén kearifan lokal aya dina imah adat Jawa. Ieu katémbong dina rupa-rupa kaéndahan kabudayaan jeung kasenian anu dihijikeun jeung kahirupan masarakat. Rupa-rupa kasenian, tradisi jeung budaya anu aya dina karya warisan masarakat Jawa, saperti batik, imah Joglo, keris jeung gamelan. Imah Joglo mangrupa wangun imah adat Jawa anu strukturna panglengkep, ku kituna ajén-inajén kawijaksanaan anu dikandungna henteu nepi ka ayeuna dijelaskeun sacara lengkep.",culture & heritage
4606,"Televisi memang miboga mangpaat jeung unsur positip anu mangpaat pikeun pamiarsa, boh mangpaat afektif kognitif boh mangpaat psikomotor. Nanging, éta gumantung kana program anu disiarkeun dina televisi. Mangpaat anu Kognitif patali jeung pangaweruh atawa informasi jeung Kaahlian. Kajadian kognitif ngawengku warta, dialog, wawancara jeung sajabana. Mangpaat anu kadua nyaéta mangpaat afektif, nyaéta patali jeung sikep jeung émosi. Kajadian-kajadian anu biasana ngababarkeun Mangpaat afektif ieu mangrupa kajadian-kajadian anu ngajurung panyawang dina raragaboga sensitipitas sosial, perhatian ka sasama jeung sajabana. Sedengkeun pikeun kauntungan katilu nyaéta mangpaat psikomotorik, anu patali kalayan lampah sareng paripolah anu positif. Kabeh mangfaat eta bisa kawujud gumantung naon acara televisi anu di tongtona.",technology
