id,text,label
1901,"Nunga leleng si Gisel ndang mardalan molo naeng lao tu jabuni tulangna. Saleleng on ibana markareta do molo naeng lo tusi. Sabotulna ndang pola na dao, alai dibahen si Gisel on ndang lomo mardalan gabe markareta do ibana jotjot. Alai tikki manogot ni ari lao ma ibana mardalan pat, tikki na mardalan on ibana tabo dope dihilala ibana alana ndang godang dope akka mobil na mamolus. Hape dung mamokus ibana sian kode, adong ma akka doli-doli manggora ibana, hape dung dibereng ndang ditanda ibana ise na manggora i. Sautna gabe marikkati ma ibana, alani biarna. Saulak nai gabe ndang olo be ibana mardalan.",fear
1467,"Songoni tong pas mangisi miak i pom bensin, mansai rame do jolma na naeng mangisi miak alana mabiar suda annon dibahen gok ni akka mobil i. Udur ma tong mobil nisi Bornok sian pudi, alana dibereng ibana nunga marganjang mobil on. Sabotulna boi do tong lao manoro uduran, alai ndang tabo dibahen godang ni mobil i, tarlumobi parhuta i do halaki ndang gabe sitiruon annon. Adong ma mobil na ro sian kota ra on lao marlibur di huta, disoro ibana ma uduran on. Turun ma si Bornok sian mobil na, ijumpangi ibana par mobil manuru asa mulak muse tu pudi ibana mangihuthon akka na nunga marganjang on.",angry
1171,"Godang do akka sakkap na denggan sian natorasna tusi Linda asa boi masuk tu universitas negeri dung kulia, alana molo nunga di negeri ibana markulia ndang pola timbo lao manggarar uang kuliahna. Hape saleleng sikkola di kalas tolu si Linda on, ndang hea marsitutu sai lalap so ibana marmeam-meam. Dibahen i sai marsak ma natorasna mamereng ibana, alana so adong karejona di jabu. Jumpang ma tikkina lao ujian ibana, mansai borat ma dialusi ibana sukkun-sukkun na adong di soal i. Sautna ndang masuk ibana tu parguruan tinggi negeri dibahen mansai maol dapotna lao mangalusi akka soal na nunga adong dibahen.",sad
1054,"Mansai godang do labana molo sian mulai tagelleng tapabiasa laho manabung. Tarlumobi hita angka natorasna, ingkon boi ma taajari angka dakdanak i lao marpangalaho manabung. Molo manabung ta mulai sian na gelleng jo, manabung i celenganan na gelleng, molo lam balga ibana boi ma taajari asa manabung i bank, tabukka ma rekening na. Asa iboto ibana mansai ringkot do na manabung on. Annon lam leleng adong ma tubu hasadaron ibagasan ni dakdanak i lao manabung, ndang ala na dipaksa-paksa natorasna be. Sian na gelleng ibana nga tarbiasa lao manabung jala torus boi marpangalaho songon i, mansai godang ma haduan labana tu ibana",happy
3555,"Pas kehe au tu bagas ni dongan ku, inda sangajo au tardege au te ni manuk. Memang di jolo teras ni dongan ku i adong di si bara ni manuk. Harana na bahatan manuk ni dongan ku i makana bahat marpayakan te ni manuk i di teras  bagas ni dongan ku i. Pas giot masuk au tu bagasan ni bagas dongan ku i pas ma di jolo ni pittu nai tardege au ma te ni manuk i. Magigi au mangaligin te nai na dalkop tu pat ku. Inda sanga bia be giot hu baen. Hu basu doma pat ku na hona te ni manuk nai.",disgusted
2802,"Doppak ma nonton tv au, adong sada iklan na manarik perhatian ku, ima iklan ni kopi bukkus. harana iklan i mangadaon undian na manarik. Harana hadiah utama nai mandapotkon hepeng saratus juta. Syarat na molo giot dohot undian i akkon manabusi kopi na marbukkus i 5 bukkus. Dikumpul kon ma sude lappak ni kopi i. Molo madung tarkumpul 5 bukkus lappak ni kopi i, di kirim ma lappak nai tu alamat na madung di tontuon dohot ma lengkapi data diri ni halak na dohot undian i. Pangumuman na i di kirim kon tu alamat na monang i. Inda hu sangka au dohot monang undian i, au manjadi juara 3 hadiah na hu dapotkon hepeng 10 juta. Sonang doma hu rasa, harana inda do adong harapan ku giot monang. Nyatona au do dohot na monang i.",happy
243,"4. Laneige lip mask. Nion ma kunsi utamana na mambahen bibir pink alami. Ritik ma bagak hian. Ahu na uju i mansoba ukuran na gelleng do parjolo argana 50 ribu an do. Dung i bibir gabe taboan jala sossok hu tuhor ma na balga. Versi lokalna adong do Emina na ninna bagak tong. 5. Sunscreen. Ahu mambahen sunscreen do tong tu bibir. Alana na mambahen bibir birong ima hona las ni ari so adong proteksi sian sinar UV. PS: ala adong komentar mandok hu edit foto tagan dohot hasilan, hu soba ma mambuat foto di tingki borngin pahe lampu ndang adong cahaya matani ari.",happy
4069,"Adong anggapan bahwa apabila halak malingin halak na mate atau begu maka hal tersebut adongma partanda bahwa ia tongkin nai maninggal dunia dalam jangka waktu dekat.
Bahkan di beberapa negara di dunion adong mitos bahwa ketika halak maligin  penampakan begu maka umurna di dunion madung tarpangkas.Fenomena halak kesurupan memang jotjot tarjadi inda hanya di Indonesia sajo, namun juo bahat di negaraon. Habiaran halak  akan begu juo sala sadana disebabkon akan hal i. Halak na mabiar dohot begu harana 'sesuatu' i dapot mamasuki ragana dan melakukan sesuatu hal na inda ia sadari dan inginkon. Dalam artian bahwa tubuhna inda lagi dalam kontrolna.Walaupun napodo jungada maligin ataupun pasuo dohot begu secara langsung, namun adong beberapa halak na  mandongkon bahwa halai mabiar begu harana dalam imajinasi halai muko dohot bentuk  performa sian 'sesuatu' tersebut ama na jorbut dohot manakutkon.",fear
3150,"Doppak hari minggu manyogot au ngot langsung kehe tu dapur mangaligin halak umakku. Sonang doma hu raso harana sadarion topet hari ulang tahun ku. Pas sampe au di dapur halai sip sajo inda adong na mangalehen sanga pe mangucapkon selamat ulang tahun tu au. Sip sajo au waktu i, siap mangan langsung kehe au tu kamar ku, dangol hu raso harana inda adong na mangingot sadarion au na ulang tahun. Pas dikamar au, inda leleng sian i masuk ma halak umakku rap akkang ku tu kamar ku sambil maroban kue sambil marende lagu selamat ulang tahun. Tangis au langsung harana hu sangka inda adong halak na manngingot ulang tahun ku. Langsung hu kaluk halak umakku rap akang ku. ",surprise
1110,"Adong do jolma na mandokhon ingkon balga do hepeng asa boi mambahen pesta na denggan. Sabotulna targantung tu hita do sude i. Boi do tabahen mansai denggan asara i ale ndang pola godang hepeng na kaluar. Hita ma naboi patongonhon sadia hepeng na naeng hita pakaluar. Songon na naeng i godung na balga hian tabahen boi ma tapatoru gabe tu godung na um gelleng asa boi otik angka ongkos na ta pakaluar. Ndang ala ni balga ni inganan i asa boi mardalan denggan, sipata godang mambahen i holan ala ni tois ni sasahalak do. Asa tarbereng ibana i huta i, tabahen ma di inganan na balga. Hape ndang dipingkiri hepeng na dipakaluar pe gabe balga",happy
208,"Dung hu boto sian pengumuman pukul 15.00 nakkin na mandok ahu lulus. Mansai las ma rohangku, marlaba do hape ganup borngin sahat tu jom 4 manang 5 manogot ahu marsiajar, marlatik soal. Mauliate ma di Tuhan. Nion do na hu bahen selama ahu paradehon diri laho mangihuti ujian SNMPTN. Tagan so mandaftar ahu, hu baen aha na gabe tujuan jala ambisiku. Dung i hu analisis ma aha hagogoan na hu puna, jala aha do sidalianna ahu naeng kuliah. Hu jalo saran sian natua-tuaku dohot keluargaku tarsingot tu jurusan na naeng hu buat dohot perguruan tinggi na hu pillit. Ndang lupa tong boi do hita manjalo saran sian guru di sikola, alana sesara akademik nasida do lobi mamboto hita. ",happy
715,"Ganup ari nungga tarbisa ahu dijou pahe goar na asing na dibahen tu ahi. ""Hey kariting!"" ""Hey mie instan!"" ""Hey bodat!"" ""Hey hutu!"" jala hey hey na asing. Nata pe sabotulna sogo rohangku alai nungga ma lok ma halak i na mangulahon aha na dihalomoi alai i. Sajujurna mansai hansit do rohakngku boasa halak i tega mandok songon i, ndang na marpikir adong roha na dihansiti halak i? Ai ndang dipikiri songon dia ilana ahu tingki diinsahi pahe hata na songoni? Dihalak i i holan gait do, alai mansai ndang geok. Jotjot do ahu lunguanan molo hu ingot angka hata i mansai kejam, olo hu pingkiri andigan ma naeng halak i so manginsahi ahu?",angry
2095,"Mansai muruk ma inong nisi Lambas alana mansai magigi ma ibana mangida kamar mandi di jabuna na mansai dorsun hian. Nunga sabulan na lao inongni si Lambas tu jabu ni abangna alana adong ulaonna disan. Nunga ditonahan tusi Lambas asa torus ias dibahen jabu tarlumobi kamar mandi, alana molo naeng ro halak pintor tu kamar mandi do sipata halaki. Alai saleleng naso disi inongna, lalap ma torus si Lambas ndang hea dipaias ibana kamar mandi on sampe taktahon ma dingding dohot lantena. Ido umbahen mansai muruk inongna holan sahat di jabu, alana gabe magigi do molo mangida kamar mandi jabu boi songoni dorsun na",disgusted
1206,"Adong hian do dua halak dongan nisi Agam na mansai jonok molo marmeam di huta. Mang tudia pe halaki lao marmeam ikkon rampak ma nibereng, alana jabu ni halakon  marsijonokan do. Ido umbahen molo naeng kaluar halaki, pintor ro ma tu jabuna lao mangalap. Molo tung pe ndang tu ruar marmean, di jabu nisi Agam ma halaki jotjot marmeam alana godang akka parmeaman na adong di jabuna. Hape ndang piga leleng nai pinda nama dongan nai tu kota na asing alana natorasna pinda karejo. Pintor lungun ma dihilala si Agam alana ndang adong be donnganna na mansai jonok lao marmeam di huta.",sad
225,"Hombar tu ahu, molo naeng traveling usaha hon ndang puna cicilan manang aha pe. Jadi bebas sian hutang. Sara manabung laho traveling, ganup hali mandapot pamasukan papulik 30% langsung tu tabungan khusus. Molo pahe jenius i dumenggan alana boi langsung dibaen tu dream saver. Etong budget na di porluhon hamu jala andingan hamu naeng lao tu san, dung i baen timeline. Jadi ganup bulan hamuna puna target bilangan na ingkon di papungu hamuna. Baen target bulanan, didia hamuna holan pakaluarhon tu habutuan dasar songon transport, kuota internet, mangan molo boi mangalompa lobi hemat. Disamping i boi do hamuna manamba panghasilan sampingan na sude hepengna masuk tu budget traveling.",happy
1056,"Mansai sonang do saonari rohani nisi Poltak, alana minggu na salpu mandapot undian ibana sian sada Bank na balga na adong di hutana. Boi ibana mandapot siupa alana ni ringgas do manabung di Bank. Di sada tingki pas di parkerejoanna ibana, adong ma ro telepon tu HP na. Tingki masuk panggilan tu telepon na on, ndang tor olo ibana mangangkat alana marpikkir ibana mangangkat tu angka nomor-nomor na imbaru, mabiar ibana angka panelepon na so tangkas. Pas mangkuling naparjolo ndang diangkat ibana, hape dihubungi ma muse ibana lao paduahon baru pe diangkat ibana. Dung diangkat ibana, hape na sian bank do telepon on. Mangkatai ma ibana, dipaboa ma tu ibana monang mandapot undian sian bank i. Mansai las hian ma rohana i tingki i",happy
1383,"Tu hita nuaeng akka na nunga balga be, unang be sai tapabiar-biar angka dakdanak i. Alana mansai taringot do ibana molo nunga hea tarsonggot mamereng begu-begu na hea tabahen. Songon molo lao modom ibana ndang barani be annon sahalakna alani biarna. Molo tu hita tupa mekkel do hita molo tabereng halaki tarsonggot jala sampe tangis olo sipoata halaki alani biarna. Hape di joloan ni ari mansai balaga do parhorhon na tu halaki. Olo do ndang holan barani modom, ale sahat tu kamar mandi be olo sipata ndnag barani be ibana. Umbahen i unang sai tabahen be akka tangis tu dakdanak i.",surprise
2277,"Sude na adong dibagasan portibion on martikki do, ndang boi tabahen lomo ni rohanta. Alana molo tabahen do songon lomo ni rohanta maol do hita mangulahon akka parkarejoanta. Dibahen i denggan ma hita mangulahon akka ulaonta nuaeng on, alana martikki do sude. Molo adong pe dibagasan dirinta na mansai borat tahilala, ikkon boi ma tasalpuhon sude nai, alana suda do annon sude nai. Hita ma nuaeng na ikkon mambahen akka na denggan asa boi akka naung salpu i boi ma gabe na denggan tu joloan ni ari on. Alana nunga denggan hita marsiajar mangulahon akka na denggan. Ido do dengganna hita marsiajar torus tu na denggan.",shame
2248,"Godang do sara naboi tabahen asa boi malua hita sian akka utang. Naparjolo ikkon boi majo denggan hita marpikkir, tabereng ma aha na nunga tabahen di ari na parpudi, na um godang do hita pakaluarhon hepeng tu akka naso porlu manang daong. Na um godang do hita marjuji manang daong. Naum um godang do hita manuhor akka naso rikkot hape adong dope barang na di hita. Ima tapikkiri denggan, molo toho do um godang tapakke tu akka naso porlu, tu joloan ni ari boi ma huta muba, ndang taulakkon be akka hasalaon na nunga hea tabahen. Alana molo taulakkon muse, gabe halak naso marbisuk ma hita.",shame
2185,"Si Benget kalas dua SD ma nuaeng, molo di sikkolana mamakke saragam na uarna rara dohot na bottar ma halaki. Andorang so lao si Benget sikkola nunga dipareso inongna pahean ni halaki na lao pakkeonna. Hatop-hatop do lao si Benget on tu sikkola, alana maila ibana molo sai tarlambat. Hape di ari kamis, hatop ma lao inongna karejo tu kantor gabe ndang sanga be dipareso pahaean nisi Benget on. Lao si Benget sikkola, dibuat ibana ma salaoar na sian lamari, ndang diboto ibana na dibuatna on nunga maribak. Lak i ma dipakke ibana, ditonga dalan adong pa mandokkon tu ibana asa diganti salaoar nai, alana maribak. Maila hian ma ibana disi, marikkati ma mulak tu jabu.",shame
2124,"Mangan ma borngin nai si Bangun dohot akka anggi iboto na di dapur, adong ma dilompa halaki mie goreng, sampai bosur ma halaki mangallang ndang suda ni halaki sude. Alai holan sae mangan, ndang pintor dipaias halaki akka sipanganon na on, gabe disi ma sude purguk. Adong ma na pintor modom, adong ma na manonton. Dung dungo manogot nai inong ni halaki lao mangalompa, muruk jala magigi ma mamereng na di ginjang meja on alana nunga mansai godang be akka porngis lao mangallangi akka lobi ni sipanganon i. Muruk ma inongna tu halaki asa unang dipasomal be mambahen songoni, maninggalhon sipanganon",disgusted
3316,"Satreskrim Polres Kuningan marhasil manakkup dua palaku panodongan tu opat santri salah sada pondok pesantren di kuningan, na tarjadi tanggal 6 januari 2023 pukul 01.00 WIB. Kadua palaku na manaek kareta i tiba-tiba manghambat santri na sedang adong di Tamcir, habis i halai mangdio hepeng secara paksa sambil mangancam santri i mar cara manodongkon piso rap dohot pistol. Inda hanya mangalakuon ancaman rap dohot ucapan, palaku i juo soppat mamukul benda na songon pistol i tu bagian tulang pipi sabolah siambirang tu salah sada korban i, na mangakibatkon luka rap dohot bongkak. Harana mabiar, korban nai langsung mangalehen hepeng tu halai, harana i halai kehe mangadu tu kantor polisi",fear
1756,"Sabulan naung salpu adong ma dibahen di sikkola nisi Jogi lumba marende. Molo ende na naeng endehononna ikkon ende Batak, alana sikkolana adong di Toba do. Nunga mansai leleng si Jogi on marlatik, alana ndang hea dope ibana marende ende Batak. Jumpang ma tikkina lao mar lumba marende, nakkok ma sada-sada tu langgatan na naeng marende on. Jumpang ma tikkini si Jogi digorahon ma ibana asa marende. Dipungka ibana ma merende, satongkin dope ibana marende nunga lomos be rohana, alana ndang somal ibana marende dibereng halak na godang. Mabiar ma ibana sautna gabe ndang olo be ibana marende tikki i",fear
2169,"Asa unang magigi hita mangida akka sipanganon na dorun, ikkon sian hita do parjolo mambahen asa boi ias sude. Alana ndang boi ias sandiri i, molo ndang hita na mambahen. Molo boi hita mambahen na ias, lam denggan ma tong tu dagingta, alana sian hita do sude i marmula. Andorang so mangan hita naparjolo tabahen, ikkon  ias ma ta suksi tanganta, alana ndang sai taboto manjama aha hita andorang so mangan, hape pintor tajama sipanganon i. Molo na dorun hian do tangan ta manjama akka naso ias di luar, gabe olo ma annon hona tu sipanganon i. Ido umbahen porlu hita manunsi tangan ta manang idia pe hita.",disgusted
1050,"Molo boi sian mulai dakdanak hita marsiajar manabung nunga mansai denggan i. Boi tapasisi hepeng ta saotik molo adong na mangalehon tu hita apala denggan hian ma i. Alana molo nunga tapasomal lao manabung, i sada ulaon na mansai denggan doi. Nunga tarbiasa hita lao manabung sian dakdanak gabe boi ma annon i sada ulaon na tarboan sahat tu na balga. Boi tapasisi saotik hepengta lao tatabung, mansai marguna do annon i. Gabe molo nunga boi hita manuhor angka barang na hinalomohon ni rohatta sian parbue ni tabunganta, apala las hian ma rohatta. Boi tapakke barang i, gabe adong ma sada halomoan ni roha lao manabung tu joloan ni ari muse",happy
1399,"Jotjot do binega maccam-maccam ni sahit na adong, adong do sahit luar adong do tong sahit bagas inna, molo na para inna sahit bagas ma alana akka organ bagas ni daging on do inna na dihanciti. Alai holan sada do sahit na hea binege jala mabiar hian do iba mambege sahit on,  alana hea do oppung niba diponnis marsahit songonon mancai tarsonggot do iba dohot sisolhot mambege on. Ai sahit on goarna kanker, ai boasa nidokkon biar hian iba molo mambege sahit on alana soadong ubat na, jai sadia godang pe hepeng niba dang adong ubat naboi tuhoron dohot manang tudia pe boanon namarsahit dang boi be hipas alana soadong naboi mangubati.",surprise
782,"Annon dung dapot client ibana deal-dealan harga dung i na mangihut ima dikarejohon tim kreatif manang designer sian agency. Dison trikna molo hamu pajumpang tu client, sahali gus ma manawarhon pricelist sian client. Hamuna pe boi manawarhon pricelist puna dongan muna na karejo gabe freelance. Manang boi ma hamu sambilan gabe freelancer, tawarhon ma jasamu. Dokma tu client i molo pa arga hu dihilala boi pahe jasa ni dongan muna. Boi adong arga na spesial. Malo kan? Jadi tu bos muna, hamu attar manghatai molo client ndang tombus ala alasan A, B, C. Hape aslina client nungga tombus tu kantongmu jadi hamu boi tong mandapot laba.",angry
326,"Godang do remaja na mangadopi hagagalan, songon gagal masuk universitas impian, gagal gabe juara kelas jala godang nai dope. Sebagai orang tua aha ma na boi di baen asa boi tontong mangarahon nipi ni gelleng marhite dalan na asing. Umpamana halak i tong do boi kuliah di FK jala gabe dokter alai kuliah di kampus swasta. Dung i natua-tua boi mangalehon contoh kasuk keberhasilan sian hagagalon. Nata pe gagal gelleng boi do marcerita tong tarsingot tu hagagalon na hea dialami seorang natoras jala mangalehon sada contoh keberhasilan sebagai motivasi. Dung i mangalehon contoh bahwa kegagalan boimambuha pintu hasuksesan na asing. ",sad
4327,"Beberapa hal na inda disangka dapot jadi panyebab ingus bau. Pernahkah mancium bau inda tabo sian ingus atau lendir na dihasilkon igung? Pada beberapa kondisi, ingus bau adongma hal na normal anggo tarjadi sasakali. Namun, i juo dapot jadi tanda masalah kesehatan serius na porlu pananganan. Tarmasuk na malibatkon sinus, saluran igung, dan mulut. Ya, masalah pada mulut juo dapot mamangaruhi bau inda sedap pada lendir di igung, lho. Sebagian godang kondisi na manyebabkon bau inda sedap di igung inda mangancam jiwa. Namun, anggo bauna kronis, hal i dapot mardampak negatif pada kualitas hidup halak dan mungkin mamorluhon parhatian medis. Adong beberapa hal na dapot jadi panyebab ingus bau. Berikut i di antarana: 1. Sinusitis Akut atau Kronis, Sala sada panyebab umum sian ingus bau adongma sinusitis, baik akut maupun kronis. Sinusitis marupahon kondisi na dapot manyebabkon gejala songon paradangan sinus dan hidung tarsumbat. Kondisi i juo dapot manyebabkon bau mulut dan kaluarna cairan keruh dan marbau inda sedap di igung dan belakang tenggorokan. i sude dapot manimbulkon bau inda sedap pada ingus di igung. Sinusitis akut biasana marlangsung selama sakitar 3-8 minggu, sedangkon sinusitis kronis dapot marlangsung lobih sian 8 minggu.
Kondisi i umumna disebabkon oleh infeksi bakteri, tetapi virus dan jamur juo dapot manyebabkonna.",disgusted
2122,"Tu joloan ni ari ikkon lam denggan ma hita lao mangulahon akka aha na hurang suman na adong di humaliangta. Unang losok tong rohanta lao mambahen akka na denggan, alana molo sai na denggan tabahen, lam denggan ma tong akka na taulahon i. Sian saonari sai boi ma hita mambahen akka na ias na adong di jabunta, manang songon dia pe jabunta ikkon boi do ias tabahen, alana disi do hita mian. Molo ndang boi do hita bahen akka na ias songon dia ma boi sonang hita dibagasan jabu i. Alana jabu na ias, sonang ma akka jolma na adong dibagasanna.",disgusted
3587,"Doppak au giot kehe rap dongan ku tu pantai giot marmayam. Di tonga dalan hami maradian giot mangan. Hami maradian di salah sada kafe. Kafe i inda do pola godang, pas hami madung mamesan panganon ni hami, dongan ku giot tu kamar mandi. Kehe ma ia tu kamar mandi. Kamar mandi ni kafe i di bolakang ni kafe i. Pas ma masuk dongan ku tu kamar mandi nai, tarsonggot ia mangaligin na bahatan sisa-sisa ni panganon na madung busuk di kamar mandi i marpayakan. Madung adong sanga ulok-ulok ni panganon nai. Inda jadi dongan ku tu kamar mandi nai harana magigi ia mangaligin na. ",disgusted
1067,"Si Poltak na ganup ari tu balian, di sada tingki hamagoan panggu ma ibana. Panggu on mansai ringkot do pakkeonna, alana tu balian do ibana torus lao mangombak. Apala nuaeng nunga jumpang tingki lao marsuan, gabe ingkon ombakon ma balian on. Hape tingki naeng lao ibana mangombak, ndang jumpang na be panggu on. Dilului ibana ma tu sude tu suhi-suhi ni hauma ndang marna dapot. Dung parpudi ro ma ibotona lao pataruhon sipanganon na tu arian. Sarita ma ibana tu anginna, na mago panggu na somal dipangke ibana. Roma ibotona on, idokhon ibana na adong do maminjam panggu on, ale dang dipaboa tu ibana. Sanga do muruk si Poltak on, ale marsampur mekkel ma ala nunga diboto saonari panggu i idia",happy
2837,"Doppak SMA au mangikuti kontes marlagu. Rupana au dinyataon lolos tu babak selanjutna. Doppak marlatih hami di sada ruangan. Tiba-tiba ro ma halak tu rungan ni hami i tarsonggot au mangaligin na harana na ro i si Judika. Ia ma alasan au mangikuti audisi on giot marsuo dohot ia. Sonang doma hu raso harana marsuo au rap ia, di lehen ia tu hami sanga bia cara-cara vokal na deges. Sonang doma hu raso harana au madung jungada pasuo dohot idola ku. Bope inda lolos au tu babak selanjutna, tai bope songoni inda do dangol hu raso harana madung marsuo au rap idola ku. ",happy
2087,"Adong do jolma na magigi lao paiashon mutauta sandiri, ikkon halak ma inna na paiashon. Adong do na hurang disi, molo ibana sandiri pe magigi lao paiashon ba lam ma halak na asing. Asing majo molo dakdanak dope ibana, ndang diboto ibana dope lao paiashon. Ale molo nunga balga do ingkon barani do ibana mambahen na um denggan. Muta ma jo ibana di mobil umum, hape nunga godang jolma on na naeng lao tu pardalananna be sampe so majo leleng lao paiashon. Ikkon hita sandiri nama na lao paiashon, ndang tarbahen be i molo jolma na paiashon. Alana hita sandiri do na mambahen ",disgusted
4389,"I serius. Dan aua trauma mamangan panganon i hingga saat i.Songon biasa, satiop pagi umak ku selalu manabusi gorengan di tukang sayur donok bagas. Sala sadana ialah tahu isi, sangat suka tahu isi. Tai, i adongma kali terakhir saya mamangan tahu isi. Saat mamangan tahu na, inda adongna na aneh, sampe merasa adong na keras di bagasan mulut , dan bulat, au fikir i batu, tai kenapa batu adong di bagasan tahu isi ? dan ukuranna pun godang. Setelah i merasa aneh, au kaluarkon lah batu tersebut, dan ternyata i adongma ipon!!. iya ipon manusia na godang. Haduh,  manulis i masih geli jijay, dan eneg bayangina. Seketika, au mangaluarkon isi tahu na hu pangan, dan kumur-kumur. Botul-botul i kali terakhir hu pangan tahu isi. Kok adong gitu, ipon ni manusia adong di bagasan tahu isi. Ketika au manceritahon hal tersebut pada umak, ia inda porcaya. Ia bahkan mangira hu inda masuk akal, dan hanya keliru maligin. Sakali nai, i botul-botul ipon manusia. YaAllah.",disgusted
612,"Baoa na tinggal di Perumahan Nogotirto Trihanggo Sleman Yogya i gabe  pamonang utama undian marhadiah Tabungan Istimewa na dibahen mamparingoti ulang tahun bank pemerintah Kota Yogya, Bank Jogja pa-58. Penyerahan mobil Ayla seri D/MT haruaran taon 2019 i diulahon langsung Wali Kota Yogya Haryadi Suyuti tu Wahyu didongani parsondukna, Endang Cahyanigsih, ima sahalak guru SMP Negeri 8 Yogya. "" Mulana ndang huboto molo ahu monang di undian on, alai ala tingki diumumhon pas acara jalan sehat akhir Juni i habotulan ahu dohot siadopanhu ndang dohot alana adong tamu dijabu,"" nina opung 5 pahompu i. Sadari dung diumumhon goarna, Wahyu mandapot konfirmasi sian bank Yogya molo ibana gabe pamonang utama undian i sian telepon.",surprise
1416,"Mansai dao do huta nisi Timbo, jala ndang piga mobil na mamolus sian huta nai. Ido umbahen molo naeng borhat ibana tu sikkola ikkon hatop do asa sanga tarlumba mobil nai. Alana holan dua hali do sadari adong mobil i tu akka parsikkola, manogot dohot botari. Molo naeng borhat ibana ndang hea tarlambat nian, sai pas do torus akka tikkina. Alai na mulak sian sikkola di sada tikki, lalap ma ibana marbola dohot dongan-dongan na di lapangan sikkola ndang dibereng ibana be nunga naeng borngin. Sahat ma ibana di terminal tarsonggot ma, dibereng ibana ndang adong be mobil lao tu hutana. Gabe marborngin di jabu donganna ma ibana.",surprise
4126,"Kondisi anak na jotjot dimarahi juo dapot lebih mamburuk, sala sada anggo anak madung mulai manyalahkon diri sendiri secara terus menerus. Anak merasa lingkungan dan orang tua inda dapot manerima dirina. Dampakna sangat buruk harana dapot manyebabkon anak marusaho mancari kesalahanna. Anak juo dapot merasakan hal i terhadap dongan-donganna, guru atau bahkan lingkungan. Kondisi i anggo inda ditangani maka dapot mambuat anak manyakiti diri sendiri. Anak-anak na jotjot disiari juo cenderung jotjot manjalaki pelampiasan. Anak dapot manjalaki sude pelampiasan na buruk dan halai manganggap hal i sangat baik. Misalna ketika anak disiari maka anak akan merasa lebih bebas, giot mangan dalam jumlah na sangat bahat, ingin inda mangan  dalam waktu na lolot dan berbagai jenis parubahan na lain. Kondisi i dapot manyebabkon partumbuhan anak mengalami gangguan, sistem organ tubuh na vital inda sehat dan juga masalah lemahna otot tubuh.",fear
