id,text,label
emot-train-3497,"Enga', Hepatitis a potensi nimbul aghin dampak morbiditas ban moralitas. Termasok penyaket kronis ban share tengghi. Mrenges, kan...?",fear
emot-train-1509,"dunnya ruwa padena bajhangnga bhadhan, mun ba'na tabeng paste jeriya majhauh, Mun ba'na majhauh ye jeriya tade' peleyan lain salaen noro'e ba'na. - Ibnu Qayyim ",sadness
emot-train-525,"Pokok'eng deiyyeh bhein, adek se ngancaen senikmat ben sesetia kopi riyah, sekelangkong le selalu hadir ngedamaiaghi ateh riyah. Dek hedeh.... Engkok abangga. Hehehe [USERNAME] [URL]",happy
emot-train-2411,Woww toduhan pole Rujughan nah nyo'on tolong sapah se ngocak mas ?,anger
emot-train-1610,[USERNAME] [USERNAME] Yaelah.. sabbher ye Vid. sampe' lebbaran kettang ta' kerah e tanggeppih ceppet riyah mon ta' sering eserrang bi' follow up se tajhem. Langsong ka plasa telkom otabeh telepon 147. Pengalaman la sering sarah soallaj riyah la #telkom,anger
emot-train-2184,Edimma'a kalian nengenneng. Pgghun sesse'e dhuwa kaangghuy para pongghaba Super Elja. Happy #PSSare ! [USERNAME] ALE !!,happy
emot-train-3014,"neka bendher sarah lamba' wal-awwal masok lakoh, ghaji ghilok seberempah perasaan ngerasah kop cokop bein kabutoannah. samangken napah ghi' korang bein",sadness
emot-validation-19,"duh... mak sedi ye, ngunggahagi beratah abek sosah sarah mon toronagi gempang sarah apasah semingguh toron 6kg lebih, apapoleh setiah mareh apasah se20an.seleber mbolorot kebih. Ya Allah tang duah mugih mareh telasan degik engkok e berik lempo engak ajem negri...Aminnn... #RecehkanTwiter #kapan gemuk",sadness
emot-train-3466,"Pas atennah sampeyan terlaloh ngarep dha' salah settong oreng, maka Allah tempa'aghi kaattas be'eh peddinnah pangarabbhan,Sopajha sampeyan oneng melana Allah ce' cemburuan dha' ate se ngarep dha' selaen sakobesah. Melanah Allah ngalangen sampeyan dhari perkarah paneka sopajha sampeyan abelih ngarep dha' Ajunan",sadness
emot-validation-221,"Mesem bhein make kepaksah teppak hedeh e khianatin sahabat atas jhenjhih ben sompa setianah, polanah hedeh teppak e petaoh betapa bangsatteh ajiah ben e pajheu atenah hedeh deri aberrik rassah sayang dek ajiah",sadness
emot-train-275,"Ghun ngoca' kerrong tapeh Benni p saph, ngoca' tambhuruen Benni pa sampah kiyah. lakar onggu Mon Benni pa sampah ye ta' bisa pa apah",sadness
emot-train-1938,Jhe' ghun noles edinna'. Acaca so se colo' sampah [USERNAME],anger
emot-train-1039,"Bisa nyeom bauna tana kerreng se mare eseram aeng ojhan rowa aropaaghi definisi kaghumbhiraan laen. Alhamdulillah ojhan, se magghi coma sakejjha' are setiya.",happy
emot-train-875,ngabessaghi bede kelompok islam se magagghar kelompok nasional.. #2019pagghunjokowi #jokowi_2_periode #jokowiabharangrakyat,sadness
emot-train-869,"Tolong min [USERNAME] jaringan WiFi Telkom ma' lemmot Sarah. padahal ghi'  saroma ghun bhideh lantai beih atas so bhebe, arapah sinyal lah lang-elangan maloloh",anger
emot-train-2836,"Mator sekelangkong, mator sekelangkong abik benyak. dek pengeran, dek kabbhi crew, dancers, sponsor, media patner ben kabbhi se a dukung suksesseh acaranah kami. ben mator sekelangkong dek kabbhi audience se deteng",happy
emot-train-3140,"Atemmoh bik reng-oreng se terro ""ngebhebhet alat"", se lok males mecah, ben berusaha-dhibik-ghellun-bik-panduen-se-bedeh-mon-mentok-baru-atanyah ajiah sittong keberuntungan yeh. Jarang sarah saestu.",happy
emot-train-1442,Salamet are teddha tahu bungkol tang versi korea. Exols eman kake lebbi dari se kake kataoe hu tahu bungkol,love
emot-train-148,[USERNAME] Ghila me' bada se bini' pekkeranna mala ngenynyi'. Bannya' la kasus korban paleceyan seksual ta' bangal ngoca' se aherra mate'e aba'en dhibi'.,anger
emot-train-2349,"kabannya'an bini' peleyan nyare pacar terro se lucu, padahal mun ca'na bini', gateng= lucu. dhaddhi arte lucu ediye iye riya ganteng. ba'na kabbhi se jhube' ben malarat tolong pahami riya... ",sadness
emot-validation-173,"Sukses ben keren onggu bik no 1 kualitas, berengah alakoh, ajiah pengarepanah engkok makle werisen dele depak ke nak potoh, sukses tim bbpjn6 barokah se rajeh der eparingnah",happy
emot-train-486,"oh riya wa, oh pera' sariya bhai wa. abe' adukung [USERNAME] RI. Benni kpk palsu, ruwa ye se e merdeka lao', se bede tape enga' tade'. [URL]",anger
emot-train-3485,Lagu areh riyah Engkok lakar sala Engkok lakar hina Seporaaghi ghebey kabbhi Polanah hedeh lakar lok pantes E sakek'en pole Polanah engkok lebethin betes Ngelokaen pole ben pole Ben engkok lok bisa ghebey ngakheren #polebenpole #andraandthebackbone,sadness
emot-train-1448,"Self Titled - Bin Idris (2016) Abdhina oneng mas haikal cs ce' jago nah ngebey suasana daddhi nada e Sigmun, neng album neka abdhina takerjhet soallah lagu-lagunnah sareng soasanannah neng  MV nah lakar persis sareng apah se abdhina bayangaghin pas ngeding lagunah. Keren. Abdhina senneng lagu Dalam Wangi, Calm Water, Rebahan [URL]",happy
emot-validation-211,"deddih iyeh, eyator kesiapan be'en andik anak benni comak derih mental, tapeh pole kesiapan gebei ben arenah. Kodus padeh kek. Engkok seh pertajeh, taneman se derih kabidnah e rawat kelaben begus laen kualitas  bik se torot odik deyyeh beih.",happy
emot-test-108,"banne soal seekasennengnge se loppa, banne soal lebbay se artis. reya soal paleceyan seksual se eghabay komentar ghaja' ban eyangghep biyasa bhai. ah. ewwes la. samogha banne kake, otaba oreng se kale kennal se ekaparlo da'iya ghallu, bhuru kake enga'.",anger
emot-test-223,"areya sala settong sabab arapa engko' tembhang ta' osa andi' ana'. Coma senneng na'-kana' kene' mon ghi' loco bhai. Ya tape mon eberro' ngakan, na'-kana' kene' paste dhaddhi ana' raja kan ya...",fear
emot-train-656,"Yeeeaaayyy.. siap2 ghebey tellasen ghebey mamak klaten. Alhamdulillah.. (@ Swiss-Belboutique Yogyakarta neng Gondokusuman, Daerah Istimewa Yogyakarta)",happy
emot-train-1972,"Alhamdulillah wa syukurillah, pojhi sokkor de' bedena Allah SWT atas limpahan rahmat ben hidayahNa abe'dhibi' eberro' bakto ben kesempatan ghebey abagi abharang ca-kanca yatim piatu e bulan Ramadhan dalem acara #KerrongbogorERamadhan se a langsung e are minggu bha'ari'. [URL] ",happy
emot-validation-407,[USERNAME] tape apa se malebur sara engko' ka blink reya polana mowana mereka bhidha bhidha ban ghampang e hapal + kabannya'an dari mereka lulusan idola cilik.,happy
emot-test-94,"cinta pandangan ate iye riya anugerah. cinta se tombu dari ate atenggallaghi rasa sayang se ce' dalemma. bile oreng bisa arassa cinta se tombu dari ate, ruwalah se e sebbhut cinta sejati. ",love
emot-train-2682,ENGKOK ODIK E JEMANNAH PRESIDEN HEBAT YERUAH SOEHARTO.. Seleranah agebei aman ben tenang gebei Masyarakat... Tapeh tak tenang gebei: Kaum PKI Kaum maleng Kaum bigel Kaum se terro deddi pejabat negereh tapeh otakkah kosong. Karo kaum aruahlah se tak lebur pak SOEHARTO [URL],anger
emot-train-137,SOAL MAHAR AJIAH URUSEN PARTAI BAPAK JHEK BE-NGIBEH ISLAM PAK....ISLAM JIAH AGHEMAH SE BECCEK BEN CINTA DAMAI. PARTAI BAPAK NYAREH MAHAR ?,anger
emot-train-611,Dear [USERNAME] arapa statussa da'iya ya? Mala saabiddha reya messen dari marketplace kasbbhut alamat ghenna' sara paste dapa'. reya sala edimma ya? [URL],fear
emot-train-1626,"Gik bingung bik rengoreng se ngocak 2019 agente presiden. mon monggu engkok ajiah begus selama pajet bede calon se lebbi mapan deri Jokowi. Keng nyataan gik tadek. ben lucunah pole, reng oreng se amain politik golongan pas ngebeh Prabowo se lasjelas sekuler :))",anger
emot-train-1529,Tang keinginan ghebey melleh ariyah ajuah seketika ambu polanah 1 kalimat,sadness
emot-train-685,#HappyJendeukieDay selmat ulang tahun ye se caen cek mirippah bik engkok mander mogeh sajen raddinben lanjeng omor ben jek neser eoni eonnie yhe! engkok senneng ke kakeh,happy
emot-validation-252,"Akherrah kaula moterren nekah thamrin sampe' nyelloh tang cetak neh, kaulah nengale. Ban sampeyan oneng napah ? Bannyak sarah rasaghan kemeja koko bomber jacket kaos teng-ghanteng sarah ghabay reng lanceng ban mantannah kaula.",happy
emot-train-378,"Seminar Proposal Koduh tetep positif, alakoh pagiat, ben lakonih Sakalangkong, ca-kancah kabbhi. kehadiranh kalian lebbhi deri cokop. Semangat ",happy
emot-train-2485,La terro congocowa pole agher.....Insya Allah ! #KoPi_NuSanTara #kopiindonesia #Arabika #arabika #Mandheling #mandailingkopi #mandailing #sumaterakopi @ South Jakarta,happy
emot-train-942,"begellek bede pemberitahuan twitterrah engkok tak ambu se amonyih , Padahal engkok tedunggah, eyeccek bik engkok ternyata sekabbihnah pemberitahuan deri BMKG se bgaberi mon LEnduh LEnduh sosolan se bede E lombok. Engkok Asli cek seddinah ben engkok aduah mander moger kuleh sareng ajunan sedejeh olleah tetolongan deri se kabesah . Amin",sadness
emot-train-738,"Ango'an e soro ngakan taleh kopling apa olle pesse 100 miliar? manabi kaula ango'an olle pesse 100 miliar. Nyaman, pessennah ghabay melleh tale kopling. Daddhi kaula bisa ngakan tale kopling sapuassah",happy
emot-train-3446,"Christine Lagarde abegiaghi momen ka Pasar Tanah Abang kiyah e akun Twitterrah. Tapeh badha se locoh, jiyah sala noles oca' 'blusukan' deddih 'blukusan'.#JokowiSekalenAghi'",happy
emot-train-853,"[USERNAME] tang Narasumber rutin ngenom obettah. toman ambu setaon tak ngenom obet,  polannah bekto juah aromangsah hat sehat beinpas ambu tak nginom obet, orengah abeli pole bik tok kotok, mala lebbi sarah. mon nginom obettah terkontrol, orengah ngocak ajalank",sadness
emot-train-1644,"5 jam lebih engkok se editah vidio riah polanah been. ariah ka effort se bisah engkok gebei sampek been ulang taunah tin [USERNAME] .. derih kenalanah abeen dibik sampek setiah, kesoon la setia e sediken engkok mase been taoh engkok benyak kurangah. engkok seneng ke been tin bik selamet olang taun fatin",love
emot-train-100,acaca asal ngajiplak bein o metaoh sarah seh (e kamar sos wism lantae 7),anger
emot-test-303,[USERNAME] [USERNAME] wah ongghu riya pak dhaddhi contoh jhalan kampongnga engko' dari simpang parmonangan tello' balata ka bosar / bhandhar jhaba luar biasa rosakka PaRAH,anger
emot-train-1726,"duh rasulullah, ajunan ampon odik ka'dintoh bedih saleng mengasihi abdinah tanemagih edelem ateh abdinah amal agih mulaeh gik kenik ajunan nabi se abektah cinta ajunan abimbing ka cinta.",love
emot-train-351,"Neng kasus Via Vallen riyah engkok kadheng mekker, mereka2 penikmat dangdut, koplo panturaan ben se semisal, se biasa e soghuin biduan2 penampilannah lok genna ben goyangan maut. MEREKA BEDEH E PIHAK DIMMAH?? [URL]",anger
emot-train-1554,"Rowa dhibi' lakina OB e sakola se ekaandi' Yayasan ne'-kenne'an, Maaan, reya rowa mon ejhelling bagiyan se wajib olle zakat bhai ghi' pes-tepes maso' apa enja' gda'iya",sadness
emot-train-1274,"Alhamdulillah mandher, riyah momen se cek tepatteh ghebey pak [USERNAME] [USERNAME] [USERNAME] [USERNAME] [USERNAME] [USERNAME] ghebey bisa merrikaghi conto dek bhangsa riyah ben umat Islam, jhek nyambhung ajalin nguataghi taleh silaturahim ajiah merrik keberokaan",happy
emot-test-138,"Ejhuwal kaangghuy melle rubicon otaba hummer anyar, pendhanan kaangghuy aset ban modal nyapres. Otaba melle tana pole se lebar kaangghuy ""koca'en"" parjhuwangan ghuli. Jamaanna coma wa-rowa bhai, nyare lako man-da'emman. Otaba arampas THR dari oreng Cena. Hadeuh Bhudhu",anger
emot-validation-435,[USERNAME] [USERNAME] jhalanna pameleyan direksi ben komisarissa bi' cara beremma ye? Korang ajhar kan pesse rakyat eangghuy ghebey gaji BOD ben BOC se model riya....,anger
emot-validation-339,"ENJHEEEEEEE`. POLANA SAYANG RUWA TA` NGABES OMOR. POLANA ENGKO` BHAKAL MABUNGGEN CINTANA PASANGANNA ENGKO`, DHADDI TA` TUA OTABE NGODENA JERIYA BHAKAL ENGKO` PANORO` TERROSD",love
emot-train-3259,"Budhajaaghi nyare ban maca sabellun atanya ya. La eterrangaghi li-bali la. Mon ta' eyator/tada' katantowan hosos, angghui bhai",anger
emot-train-2633,"Satpam komplek pajhet perhatian sara bi` para` ta` pernah atanya ""Pak, Mole jhe`?"" Pas jam mare e attas kol 1 malem bi` motor ta` dhulli bede e teras",happy
emot-train-483,"Lastarennah bhejengaghin badha sasoatoh se naddheg e dissah, ngamadhin sampeyan. jellas ritual nekah se ngibeh makhlok neka dha' dinnak, namong kaula sama sakaleh lok ngerteh apah se terjadi bhakto neka. tang pekkeran terlalu pol sareng rassah. bingong ban takok.",fear
emot-test-168,"Yeh mangkanah e ghenteh bik unsur ""setiap oreng"" male sekabbhinah e kenneng. Kocak'eng terro ngekriminalisasi kabbhi kelakoan cabul... [URL]",anger
emot-train-1291,"[USERNAME] Tambe raja oreng tambe sadar mun cinta benni pera` sakadhar lan-jhalanan ka smb ben malem minggu, bede bannya` se kodhu epersiapaghi ka ade`na, ruwa mun terro dhaddhi ""kanca odi`"".",love
emot-train-526,"Terro gudeg mbarek Bu' Ajjhi. Amad Foto dari google, sangaja, ma'le ca-kanca jhughan abayangaghi. Aberri' jiya Endha.",happy
emot-train-2788,"Manabi dunnya kero' daddhi sasosok makhluk, manabi sasosok makhluk maluas ban sampe ngajangkau Sa kobasah, Paneka esebbut cinta.",love
emot-train-1824,"Spesial sakalangkong ka sampeyan,... Ghi' tettep ngangghep kulah daddhi alek, lok toman sakeh nyake'en kulah, ghi' ngarghai kulah sareng apah se kualah lakoneh...",happy
emot-train-2042,"[USERNAME] [USERNAME] Ceretah satinah sittong riyah kadikeng lakar 'bhidheh' yehh.. Parak kabbhi belesen ngocak padeh, degdegen, sampe lok bengal make keng ajheling. Sampe setiah bhein engkok lok bengal nyeling ghembereh .-.",fear
emot-train-1317,[USERNAME] Ridiella raddhin sara! Ghiren sakalangkong sayang,love
emot-test-212,"Ragara negguh Pak, Anom ben sepoponah ben areh sabtoh negguh bal abereng, Nayla dedi seneng bal kiyah, sekunnik tambah semangat pas negguh lagunah [USERNAME] ([URL] ngangui [USERNAME] #DEDDIBISAH#MERAMMIH BAL abereng ajuah [URL]",happy
emot-train-1025,careta nako'e engko' malem riya. huehehe. dhaddhi engko' terro tedunga. dhaddhi engko' mandi (?) ma'le cellep salemotan langsung tedung. lah nga'ruwa. la mandi ye. engko' semprot muwa kan ngangghuy aeng mawar,fear
emot-train-224,"[USERNAME] Oppa kennal se kyungle chairan njek? Lok kenal maka lok sayang, mangkannah kannak a kennalan sareng kyurge ban asagessa sareng kyungle. Paste kita cocok, kyungle bhakal ngalakone se paleng se sabisa kyunglemanabi ka verif. Mangkannah oppa verif kyungle )",happy
emot-train-2375,"[askMF] pas engkok gik buru pacaran berik, keng tadek ber kaber pole edimah apak demaah. chat bein tawor kiyah.pas engkok se kabarah jiah kir mikir kiyah takok aganggu jiah. pantes pa njek?",fear
emot-train-279,Riyah pole bapak kos belkotteh setenga mateh. Mejeh lok toman e angghuy nongkrong bhein e pentah pole. Yaelah pak..ngerteh dhiddhik rapah kita pesse pas-pasen?!,anger
emot-train-566,O2. Selamed lagguh - Kassy LOK GELLEM AOH POKO'ENG NEKA CEK NYAMANNAH. KULAH TRESNA KASSY. SADHAJANA LAGU KASSY NYAMAN NYAMAN GUYS TOREH MERENGIN [URL],love
emot-train-564,"Caretanah semalem la bhuber, eh jiyeh benya' tugas, terro katemmoah samarenah jiyeh eh motor eghibeh sapopoh Ben akherrah katemmoh pokol satenga 2 matah la Mera, muwah lessoh, ngantok, niser sengko' skalangkong",happy
emot-train-2054,"[USSERNAME] Sabenderreh manabi oreng kepala disah daddhi presiden otba wapres, neka artennah olle amanah lebbhi rajeh. Tapeh bideh sareng Jokowi. Sabelum Jokowi maju e 2014, PDIP ban Gerindra sepakat dhukung Jokowi lebhat parjhanjien Betoh Toles. daddhi majunnah JKW",anger
emot-test-34,"[USERNAME} jujur iye engkok takok, soallah engkoktakok pas etemmoh prepaen ongge/toron deri montor e kenengan ;))) nom supir ojek online takoken orengah ngabesin :)))",fear
emot-train-3269,Salanjutteh ka kaodhi'nah keluarga Ario Bayu ben komandan Tim Alha se genteng akacamatah celleng ben viral e medsos jiyah. Yeh keluarga se cokop bahagia so gadis keni'en bapa'.,happy
emot-train-1479,"bhjaeren ghaji PKT Ds Madurejo Pasirian Lomajhang, masy asenynyom bhunga #PadatKaryaTunai # tppijatim #tppilumajang [USERNAME] [USERNAME] [URL]",happy
emot-train-599,"eung . . engko' reya tamaso' bhudhu ban krecek ppl , engko' andi' atosan ghmbhar se aslina unfaedah tape bisa aghabay oreng laen senneng heh. engko' keya mon ngoca' aberta , caremi , eman-able /./ ..) engko' bisa loco bisa enja' keya, ongghuwan engko' ta' aghaja'.ht ",happy
emot-train-837,"mon konteks seneng dekyeh gik bisa ngangguy alessan kengain yeh engkok riyah seneng ke nak kanak jiah polanah ajiah gentheng keng mon delem konteks niser, tak parloh alessan pole, apa bein se [USeRNAMe] lakonin ajuah se agebei abeen dibik jatuh cinta ka oreng kabbi tampa alesan aekunnik bein",love
emot-train-89,"Sabban, ajyah acorak kadhi' reng lakek se loros, polos, bhagus, tape kaula ampon ketipu adhe'  sobab ampon butah sareng perasaan tresna ban sayang dha ajyah :(",sadness
emot-train-1814,[USERNAME] [USERNAME] Apah nankeb teroris mosteh ngangghuy keddeng Ambon? Sampeyan mek selalu abela mereka. Badha napah neka? Bahkan osos se pon aurai sobab leddhuk'eng epon sampeyan ngocak kampanye pangoasah. Senteng !!!,anger
emot-train-1727,"Collab [USERNAME] x [USERNAME] riyah mesteh ngebey kagum, ngalak buh-rombuh neng tase' ghebey e daur ulang jiah ongghu langkah kennek tapeh rajeh ghebey nyelametaghi odik neng delem tase'. Apah pole daur ulang jiah e terapaghi neng klambih otabeh sepatu.",happy
emot-validation-112,"[USERNAME] Tolong ngerteh, tang modal lok sebennyak jiah ahaha. Teros kepekkeran kocak'eng Kak Zha ""nabung ghebey encore neng Korea"". Engkok galaoooo T_T",sadness
emot-train-1169,neng luar dissah nek-binek ghik sibok nyeleksi calon pendamping odik'eng ben hedeh ghik ngarep dek se lok pasteh?? bhudhuh sampe dek DNA seh? yeh deemmah yeh~,sadness
emot-train-1057,Kammah se kuat nyegeh arghe diri ben kammah se santai arghe dirinah e lecehaghi. Adhet temor jhek epepadeh bik se kelebethen santai e lecehaghi. Hedeh reng binek dhi-deddhien? [URL],anger
emot-train-2178,"Teppak kaula e ghuda morid kaula, ""ibu raddhin kyah bu,"" teros kaulasala tengka ban kaula adhabu sampeyan raddhin kyah kok.. Lalu kaula.. e koca' ghik ngodha ban kaula sajhen ngabungha..",happy
emot-validation-355,"[USERNAME] sakalangkong se bennnya' [USERNAME] atas kerja kerasseh, ta' papah EXO ta' deddih kadinna' samoge'eh EXO Planet #5 EXO bisah kadinna' amin, sakalangkong se bennya' [USERNAME] :')",happy
emot-train-1834,dhang-kadhang peduli ban aberri' motivasi se berlebihen neka lebbhi sakek ateh. sakerannah lok narema ghi oke. tersera. manabi ampon kecewa bhakkal bodo amat. ongghu. ator dhibi',sadness
emot-train-2263,"Persahabatan abe'dhibi' meste bhagus Bile salah pade maenga' , mun bhender meste e dukung, tape bile salah settong ghegger abe'dhibi' pade agelle'en",love
emot-train-9,kasarrah neka adhabu manabi ngangghuy ghi' ngedingin musik se kaloar salaloh musiggeh Shinhwa. Maghabay terro a joget wkwk xD. neka nyamannah auto reaksi seih xD [URL],happy
emot-train-1385,"Ngatresnae sampeyan satolos ateh, ngaronge tasek ghabay olle tresna socceh. Lok bhakal toman ngaduwe'in sampeyan makeh epon a pesa jarak ban perbidha'an.",love
emot-train-3160,Mereka se ghrighi'en hebat sara rowa ta' tao ngara ya jha' nyeksa ajham-jham bhan minggu e Kennengngan konsultasi nyaretae hal-hal se paleng matako' kami sanajjan coma kaangghuy nenggha'aghi soko kalowar roma.,anger
emot-train-3429,"[USERNAME] Pelanggan Setia, tagi'nah ba'an bhulen MEI Rp 17.751. Bhejer sabelum jatuh tempo tgl 18-06-2018. Abai aghi Mon la Majer. CS Twitter: [USERNAME] Riyah tagihen apah??? [SENSITIF-ENJE']",anger
emot-train-1368,"Lamba' tang soko coma ngangghuy alas sadhapa' tana Tang cethak bhai coma aghabhak langngi' celleng Neser sajhate bhai coma kaseppeyan, E dalem kapettengngan se ekaterro.",sadness
emot-validation-232,"Permulaan cinta jih madeddih oreng se ba'an cintai deddih abe'en dhibi', ben ta' ngobe deddih ghembernah se ba'an terro. Mon nje', ba'an ghun mencintai pantolnah ba'an dhibi'b se ba'an temmonih e delem abe'en jiyeh.",love
emot-validation-295,"jiyah pessen masok en la gangguan sexual sih, ben jiyah sesuatu se ta' bisah ekoca' biasa beih. e budaya se paham Patriarki nah teggih lakar hal jiyeh corak ta' penting, tapeh coba se epadha'yeh tretannah ba'an,kancah, otabeh pacar? - tettep semangat Gita Ben via",sadness
emot-test-264,ariyah se enyamaaghi ide se pelekase acorak [USERNAME] [USERNAME] ngangguy progra unggulan oke acaca Alobataghi benyak oreng kaangguy ngesseen tong kasrakas makle kasrakas Jakarta arassah Kasrakas Jerman #PolannahKasrakasJakartabidehKasrakasJerman,anger
emot-train-2084,"jhek loppaen jegeh kasehaten, jhek ring-sering begadang, ngakan sayur, mon le mareh kuliah/sekolah, langsong mole, jhek ampo keluyuren, ebok kebeter.",fear
emot-train-2232,Banne tipe oreng samacem apa se bada e cethak langsong epakaluar pas awar-koar e sosial media ban banne keya enga' tere Liye otaba mario teguh se bisa makalowar ca'-oca' bijak ban manginspirasi bakto rekong otaba bhunga. tape aongghunna terro awar-kowarra keya la,anger
emot-train-367,Liga bangke onnguen ariah liga indonesia alasnya benyak oreng ebudien layar benyak se mentingagi kepentingna dibik ye la rasaagi lah paling ye tadek efekah ke timnas mon liga deiyeh meloloh,anger
emot-train-2669,"Looh, ma' arende'agi semangat dheri perlindungan Reng bine'? Justru deddih reng bine' jiye koduh tegas ben gellek ka ke' lake' nga' jiye! block beih la. . arapa'ah ma' e gi-begi sampe' sa Indonesia taoh.",anger
emot-validation-148,engko' rela nyingla lagghu ghebey katemmu ba'na engko' rela mole malem ghebey ngancani ba'na jhe' tanya alasanna kabbhi dateng mu-temmu abe' dhibi' jhalani bhai se penting sayang cintana engko' pera' ghebey ba'na (dhina-se penting jhalan) [URL],love
emot-train-334,"kake arapa ma' posang:( kake mon posang bannya' diyem, mon teppa'en bhunga ta' bisa diyem. Somangat la ka' nanas senneng rowa bisa norone ka reng-oreng loh:( wkwk",sadness
emot-test-146,"acinta ka been tak mlarat, se mlarat ariyah ngempet paggun acinta ka been se la jelas seneng ka oreng lainnah. Se malarat ngikhlasaghi cinta sejati makle bisa bunga ben tak koduh abebani abeen dibik ben keluarganah abeen dibik",sadness
emot-train-3015,"[USERNAME] Bhender, final keputusennah 15 juni riyah. Ben engkok parloh extra tengateh ngangghuy aplikasi ajhelenan/hotel, maklum dana terbetes, nyessek mon bedeh masala.",sadness
emot-test-218,"10 are ebudi pasa, bada 1 malem se sanget molja dari saebu bulan, salamet dateng Lailatul Qadar, kami oreng se iman ce' kerronga kadatenganna...",love
emot-train-726,Latorot mereka ngoca'e. Bada settong hal se terro engko' tanyaaghi. Bha' badaa raja dhusa se lessi. Se la Nyake'e manossa kaangghuy nyalamettaghi kaparcjaanna.,sadness
emot-train-2039,Mate lampu e bengko mara se wat-kuwatan kaluar kamar ghebey ngodi'i saklar wq. Ojeng. Tape asal demi liga la familia-se-ta`-betah-panas-kodhu-toron-ngodi'i-saklar-teng pettengngan. ,sadness
emot-train-2696,"InshaaAllah awwal juli thal, dhuwaghi ya. Kake, maya, maso dinda kodhu dateng poko'en! Coma kalian tang ca-kanca SMP se akare, pada diana keya. Seddhi ongghu ya",sadness
emot-train-943,"[USERNAME] mun ghebey bharang elektronik nga`ruwa beremma? kadhang tako` mun muwang headset ben baterai ka kennengan rombu. soalla kan bahaya...terros ben bhutol semprot, ca`na bisa leddhu` e suhu se tengghi..",fear
emot-train-1304,"Amargha ngeding adhan Maghrib, pihak Panpel Persija vs Persebaya beri'segera mabhattalaghin pertandingan #recehaghintwiter #receaghinpssi #recehaghinsepakbola",happy
emot-train-2215,engko` la arelaaghi. salepas ruwa ye bharang keikhlasan otabe benni. engko` la bisa mesem ngabes ba`na ben oreng laen. benni suatu se nyake`e pole enga` lambe` ruwa engko` ngabes ba`na ben oreng laen,sadness
emot-train-1692,"Engko' sama sakale ta' tao awalla enga' apa. Se paste bakto rowa,sajan abit engko' sajan neser ka kake. Engko' ngoca', engko' neser kake rowa dhaddhi kanca semma'. Pas,mare eker-pekker, engko' rowa neser ka kake lebbi dari kanca.",love
emot-train-730,"Wah iyeh sarah riyah mas, sengko' e tempat lakoh sering sarah olle hal se ta'' nyaman. Mereka (ke'-lake') nganggeppeh agheje', se reng bini' nganggeppeh sengko' se sala arapah ma' dha'yeh arapah ma' dha'yeh",sadness
emot-train-2922,Bede bhasa ta-kanta`an pole wa antara tang ucha ben tang rin. Tang rin. Engko` wa pole etaksir bi` tang Joni ben tang bowo ye cha! Ca`na ba`na kemma se lebbih gege` cha? Tang ucha. Ye... jelas engko` la rin! He..he..,happy
emot-train-440,dhulli beres sayangnga engko` ma`le abe`dhibi` bisa maen pole bi` mimi mimo ma` abe` bisa lan-jhalanan pole engko` cinta ka ba`na boo :* @_kangdaniel96,love
emot-test-87,"Malemmah cek randommah melleh tiket dek Makassar. Padahal marenah melleh tiket ghik bhuruh ker-pekkeran, alakoah apah yeh dek Makassar?. Kerrong ajhelen se-random lambek pole.",happy
emot-train-791,"banyya` kiya se nepeleaghi bi` kalimat, ""Halah ba`na pera` epenga` jeriya, engko` malah lebbi. Engko` bhai biasa, ba`na arapa bi-lebbi sara ra. ta` usah nyare muwa ra."" areya ruwa arapa banyya` lalake` ghampang gebey alakoni kekerasan seksual bannya` lecekan se gi` esempen nengenneng ben pagghun mekker se positif.",anger
emot-test-187,"Pasteh benya' se mekker "" apa sih bel ma' sok2 e update pole, Makle noro' viral kan?"" HM, ta' rapah ba'an kabbi e dhinna' ta' retweet otabeh abeles ompan ryah, ghun terro mataoah bheih Mon makeh kita artis otabeh  oreng biasah kek sapa'ah beih beih kek ye lakar  andi'hak aghighir Mon eleceh aghi.",anger
emot-train-755,"Pesse reya candhu. Ma senneng mon teppa'en andi' bannya', tape sabannya' apaa bhai ta' tomanmaromasa cokop. Polana sajan bannya' pesse kita, pangaterrona kita dhaddhi lebbi bannya' ban lebbi larang.",fear
emot-train-2476,"dilema sarah anjir terro kentok tape takok se kaloar lok coman gas, terro boker tapeh lok moles",fear
emot-train-1656,"Mon setiah atenah hedeh kenneng cabik-cabik bik kelakoannah oreng laen, deddhi bisa jadi.. jiah cara Allah negghiin hedeh semarenah hedeh ngelepasen kabbhi sombong ben ngakoen salanah hedeh. Lok parloh nyeporaaghi mereka, tapeh seporaaghi ghellun abe'eng dhibik",sadness
